title,content,source,published_at,url,collected_at,sentiment
CRWV stock jumps 14% as CoreWeave lands $14.2B Meta AI deal powering next-gen cloud with Nvidia GB300,"CoreWeaves stock jumped sharply after the company announced a landmark $14.2 billion deal with Meta Platforms. This deal will last until December 14, 2031, with an option to extend into 2032. CoreWea… [+7410 chars]",The Times of India,2025-09-30T14:30:16Z,https://economictimes.indiatimes.com/news/international/us/crwv-stock-jumps-14-as-coreweave-lands-14-2b-meta-ai-deal-powering-next-gen-cloud-with-nvidia-gb300-coreweave-stock-surged-strongly-today-september-30-2025-rising-about-14-27-and-closing-near-140-per-share-on-nasdaq/articleshow/124237400.cms,2025-10-01 22:30:56.991285,
Are We Alone? NASA’s Habitable Worlds Observatory Aims to Find Out,"The Habitable Worlds Observatory is poised to tell us whether Earth-like planets are common—if it can get off the ground

It’s a sweltering Tuesday in Washington, D.C., the kind of day that stretches the definition of Earth as a “habitable” planet. But on an eighth-floor terrace near the U.S. Capitol building, dozens of people are outside anyway, talking and watching as passersby dart between pools of shade on the sticky streets below. Besides the heat, the onlookers are sweating something else, too—an audacious project to learn, at last, whether we have any neighbors living on Earth-like planets in our neck of the Milky Way.

Back inside, a boisterous reception is underway. Hundreds of scientists and engineers, NASA leaders, lobbyists, congressional staffers and Senator Mark Kelly of Ariz",Scientific American,2025-09-30T14:30:00Z,https://www.scientificamerican.com/article/are-we-alone-nasas-habitable-worlds-observatory-aims-to-find-out/,2025-10-01 22:30:57.974939,
Correction: Kalmar changes its regional reporting structure and restates geographical area information based on the new regional structure,"KALMAR CORPORATION, STOCK EXCHANGE RELEASE, 30 SEPTEMBER 2025 AT 5:30 PM (EEST) Correction: Kalmar changes its regional reporting structure and restates geographical area information based on the ne… [+2981 chars]",GlobeNewswire,2025-09-30T14:30:00Z,https://www.globenewswire.com/news-release/2025/09/30/3158799/0/en/Correction-Kalmar-changes-its-regional-reporting-structure-and-restates-geographical-area-information-based-on-the-new-regional-structure.html,2025-10-01 22:30:57.975014,
"INVESTOR DEADLINE APPROACHING: Faruqi & Faruqi, LLP Investigates Claims on Behalf of Investors of LifeMD","Faruqi Faruqi, LLP Securities Litigation Partner James (Josh) Wilson Encourages Investors Who Suffered Losses In LifeMD To Contact Him Directly To Discuss Their Options If you suffered losses … [+3438 chars]",GlobeNewswire,2025-09-30T14:30:00Z,https://www.globenewswire.com/news-release/2025/09/30/3158803/683/en/INVESTOR-DEADLINE-APPROACHING-Faruqi-Faruqi-LLP-Investigates-Claims-on-Behalf-of-Investors-of-LifeMD.html,2025-10-01 22:30:57.975057,
Giorgio Armani’s will shocked the fashion world — here’s why your final wishes should never be a surprise,"Iconic Italian fashion designer Giorgio Armani kept tight control of the brand he founded 50 years ago. He never took the company public and remained the sole major shareholder until his death on Sept. 4 at the age of 91.

Some parts of his will were run-of-the-mill: Pantaleo Dell'Orco, Armani’s life partner of five decades, will retain a 40% stake in his company, Reuters reports.

Must Read

But other parts of his final wishes came as a shock to the fashion world. The will stipulates that Armani’s heirs must either sell their stakes in the company in stages, or seek to list the company on the stock market.

The will is very specific. Within 18 months of Armani’s death, his heirs must sell an initial 15% stake of the company to one of a small group of luxury conglomerates: LVMH (the parent",Yahoo Entertainment,2025-09-30T14:30:00Z,https://finance.yahoo.com/news/giorgio-armani-shocked-fashion-world-143000249.html,2025-10-01 22:31:00.173882,
"People are chasing AI stocks like 'dogs chase cars' — and a crash looks certain, veteran investor Bill Smead says","Bill SmeadChristopher Goodney/Bloomberg via Getty Images The AI boom is being fueled by ""momentum"" as investors chase huge stock gains, Bill Smead said. The value investor said surgi… [+3090 chars]",Business Insider,2025-09-30T14:29:23Z,https://www.businessinsider.com/ai-stocks-bubble-crash-smead-market-outlook-nvidia-openai-tech-2025-9,2025-10-01 22:31:02.208620,
Gold Continues Hitting Record Highs—These Are The Key Price Levels to Monitor,"Key Takeaways Gold hit another record high Tuesday morning as investors turn to the traditional safe haven amid a weakening in the U.S. dollar and concerns over a potential government shutdown.

After breaking out from a four-month consolidation period in early September, the price of gold has continued to trend strongly higher in recent weeks.

Bars pattern analysis forecasts a potential bullish target of around $4,365. Investors should also watch key support levels on gold's chart around $3,450, $3,120 and $2,790.

Gold (XAUUSD) remains in focus after setting a fresh record high Tuesday, as the precious metal is on track for its seventh consecutive week of gains.

Recent buying in the commodity has been fueled by a softer U.S. dollar ahead of an expected interest rate cut by the Federal ",Investopedia,2025-09-30T14:29:04Z,https://www.investopedia.com/gold-record-high-key-price-levels-to-monitor-11821169,2025-10-01 22:31:03.711719,
"Financial crime agency's search linked to toll road deal, not forex: Reliance Infrastructure","Investment Ideas Grow your wealth with stock ideas sectoral trends. Stock Reports Plus Buy low sell high with access to Stock Score, Upside potential more. BigBull Portfolio G… [+439 chars]",The Times of India,2025-09-30T14:28:44Z,https://economictimes.indiatimes.com/industry/indl-goods/svs/construction/financial-crime-agencys-search-linked-to-toll-road-deal-not-forex-reliance-infrastructure/articleshow/124237702.cms,2025-10-01 22:31:04.971031,
"INVESTOR ALERT: Investigation of MoonLake Immunotherapeutics (MLTX) Announced by Holzer & Holzer, LLC","ATLANTA, Sept. 30, 2025 (GLOBE NEWSWIRE) -- Holzer Holzer, LLC is investigating whether MoonLake Immunotherapeutics (MoonLake or the Company) (NASDAQE: MLTX) complied with federal securities la… [+1527 chars]",GlobeNewswire,2025-09-30T14:27:00Z,https://www.globenewswire.com/news-release/2025/09/30/3158797/0/en/INVESTOR-ALERT-Investigation-of-MoonLake-Immunotherapeutics-MLTX-Announced-by-Holzer-Holzer-LLC.html,2025-10-01 22:31:04.971167,
CoreWeave Stock Jumps On Expanded Meta Cloud Computing Agreement,CoreWeave stock jumped amid an expanded artificial intelligence cloud computing agreement with Meta Platforms.The post CoreWeave Stock Jumps On Expanded Meta Cloud Computing Agreement appeared first … [+88 chars],Biztoc.com,2025-09-30T14:25:12Z,https://biztoc.com/x/c25883eacc119ffb,2025-10-01 22:31:04.971276,
CoreWeave stock climbs 10% after company lands $14 billion deal with Meta,Shares of CoreWeave popped more than 13% on Tuesday after the company announced it has agreed to provide Meta with $14.2 billion of artificial intelligence cloud infrastructure.CoreWeave has been on … [+142 chars],Biztoc.com,2025-09-30T14:25:12Z,https://biztoc.com/x/8a11956e63e99fb1,2025-10-01 22:31:04.971370,
IBM Says Quantum Computing Could Redefine Finance. This Analyst Isn’t Convinced,", 200); return false;"" How will the US government shutdown affect markets? , 200); return false;"" Why is Electronic Art… [+741 chars]",Biztoc.com,2025-09-30T14:25:08Z,https://biztoc.com/x/6ae552b194efecc5,2025-10-01 22:31:04.971439,
"INVESTOR DEADLINE APPROACHING: Faruqi & Faruqi, LLP Investigates Claims on Behalf of Investors of Charter Communications","Faruqi Faruqi, LLP Securities Litigation Partner James (Josh) Wilson Encourages Investors Who Suffered Losses In Charter To Contact Him Directly To Discuss Their Options If you suffered losses… [+3985 chars]",GlobeNewswire,2025-09-30T14:25:00Z,https://www.globenewswire.com/news-release/2025/09/30/3158795/683/en/INVESTOR-DEADLINE-APPROACHING-Faruqi-Faruqi-LLP-Investigates-Claims-on-Behalf-of-Investors-of-Charter-Communications.html,2025-10-01 22:31:04.971549,
CoreWeave stock surges as reported $14 billion Meta deal signals 'limitless' AI demand,"CoreWeave (CRWV) stock jumped nearly 12% Tuesday after the company said it had inked a $14.2 billion long-term cloud deal with Meta (META).

CoreWeave, an Nvidia-backed (NVDA) AI data center operator, will provide Meta access to Nvidia's GB300 server racks, according to Bloomberg, which first reported news of the deal. Each of those server racks contains 72 of the chipmaker's Blackwell AI GPUs (graphics processing units).

NasdaqGS - Nasdaq Real Time Price • USD (CRWV) View Quote Details 135.70 -1.15 (-0.84%) As of 10:31:07 AM EDT. Market Open. Advanced Chart

""They loved our infrastructure in earlier contracts and came back for more,"" CoreWeave CEO Michael Intrator told Bloomberg in an interview.

Meta did not immediately respond to Yahoo Finance's requests for comment.

Read more about C",Yahoo Entertainment,2025-09-30T14:23:56Z,https://finance.yahoo.com/news/coreweave-stock-surges-as-reported-14-billion-meta-deal-signals-limitless-ai-demand-142356584.html,2025-10-01 22:31:06.695894,
Husband of woman fatally electrocuted while using phone in bath calls for better warnings on electronic devices,Calls for prominent warning notices to be placed on all electronic devices about the risk of using them near water have been made following the death of a Dublin woman who was fatally electrocuted wh… [+6711 chars],Independent.ie,2025-09-30T14:23:19Z,https://www.independent.ie/irish-news/husband-of-woman-fatally-electrocuted-while-using-phone-in-bath-calls-for-better-warnings-on-electronic-devices/a299785197.html,2025-10-01 22:31:10.588283,
Paychex CEO Confident In Future Growth As Paycor Deal Shows Early Success,"Payroll services company Paychex (NASDAQ:PAYX) stock slid after it reported mixed fiscal first-quarter 2026 results on Tuesday.

The company reported sales growth of 17% year-over-year (Y/Y) to $1.540 billion, topping the analyst consensus estimate of $1.538 billion.

Management Solutions’ revenue rose 21% Y/Y to $1.2 billion, primarily driven by an increase in the number of clients served. This growth was led by the acquisition of Paycor and a higher number of client worksite employees for HR Solutions.

Also Read: Paychex Faces Growth Gap: Can It Deliver On 2026 Targets?

Higher revenue per client also contributed to the growth, driven by Paycor’s upmarket client base, price realization, and increased product penetration, including HR Solutions and Retirement.

Professional Employer Orga",Yahoo Entertainment,2025-09-30T14:23:00Z,https://finance.yahoo.com/news/paychex-ceo-confident-future-growth-142300752.html,2025-10-01 22:31:13.036079,
"INVESTOR DEADLINE APPROACHING: Faruqi & Faruqi, LLP Investigates Claims on Behalf of Investors of V.F. Corporation","Faruqi Faruqi, LLP Securities Litigation Partner James (Josh) Wilson Encourages Investors Who Suffered Losses In VFC To Contact Him Directly To Discuss Their Options If you suffered losses in … [+3982 chars]",GlobeNewswire,2025-09-30T14:23:00Z,https://www.globenewswire.com/news-release/2025/09/30/3158792/683/en/INVESTOR-DEADLINE-APPROACHING-Faruqi-Faruqi-LLP-Investigates-Claims-on-Behalf-of-Investors-of-V-F-Corporation.html,2025-10-01 22:31:13.036146,
"INVESTOR DEADLINE APPROACHING: Faruqi & Faruqi, LLP Investigates Claims on Behalf of Investors of Altimmune","Faruqi Faruqi, LLP Securities Litigation Partner James (Josh) Wilson Encourages Investors Who Suffered Losses In Altimmune To Contact Him Directly To Discuss Their Options If you suffered loss… [+3420 chars]",GlobeNewswire,2025-09-30T14:20:00Z,https://www.globenewswire.com/news-release/2025/09/30/3158791/683/en/INVESTOR-DEADLINE-APPROACHING-Faruqi-Faruqi-LLP-Investigates-Claims-on-Behalf-of-Investors-of-Altimmune.html,2025-10-01 22:31:13.036179,
"FIREFLY ALERT: Bragar Eagel & Squire, P.C. is Investigating Firefly Aerospace Inc. on Behalf of Firefly Stockholders and Encourages Investors to Contact the Firm","Bragar Eagel Squire, P.C. Litigation Partner Brandon Walker Encourages Investors Who Suffered Losses In Firefly (FLY) To Contact Him Directly To Discuss Their Options If you purchased or acqui… [+2626 chars]",GlobeNewswire,2025-09-30T14:19:00Z,https://www.globenewswire.com/news-release/2025/09/30/3158790/0/en/FIREFLY-ALERT-Bragar-Eagel-Squire-P-C-is-Investigating-Firefly-Aerospace-Inc-on-Behalf-of-Firefly-Stockholders-and-Encourages-Investors-to-Contact-the-Firm.html,2025-10-01 22:31:13.036211,
"Lengthy Government Shutdown to Impact Insurers, Says AM Best","Unless Congress reaches a compromise on funding by midnight, there will be no budget and the government will shut downsending out waves of implications that will disrupt the insurance industry, accor… [+1903 chars]",Insurance Journal,2025-09-30T14:18:49Z,https://www.insurancejournal.com/news/national/2025/09/30/841069.htm,2025-10-01 22:31:15.832588,
Fox Corp Is A Television And Media Empire On The Cheap,"The Fox News studios and headquarters in New York City on Tuesday, March 21, 2023. (AP Photo/Ted Shaffrey) Copyright 2023 The Associated Press. All rights reserved. Streaming dominates the headline… [+18048 chars]",Forbes,2025-09-30T14:17:11Z,https://www.forbes.com/sites/greatspeculations/2025/09/30/fox-corp-is-a-television-and-media-empire-on-the-cheap/,2025-10-01 22:31:15.832674,
Firefly Aerospace stock tanks 24% after test rocket explosion,"A model of the Firefly Aerospace Blue Ghost lander during the company's initial public offering at the Nasdaq MarketSite in New York, on Aug. 7, 2025.

The explosion occurred during a first-stage test of the satellite-launching Alpha Flight 7 rocket at its facility in Briggs, Texas, Firefly wrote in an update . ""Proper safety protocols were followed, and all personnel are safe,"" Firefly wrote. ""The company is assessing the impact to its stage test stand, and no other facilities were impacted."" The eight-year-old space technology company competes in an increasingly crowded space dominated by billionaire-backed ventures such as Elon Musk 's SpaceX for deals with NASA and prominent government contractors. Appetite is strong. Over the years, Firefly has partnered with NASA, Lockheed Martin and",CNBC,2025-09-30T14:17:07Z,https://www.cnbc.com/2025/09/30/firefly-aerospace-stock-rocket-explosion.html,2025-10-01 22:31:18.610846,
"Microcenter deal back on Apple Mac Mini (2024): M4 10-Core CPU / GPU, 16GB RAM, 256GB $450 + Free Store Pickup $449.99 (5 replies)","MicroCenter[microcenter.com] deal is back on has Apple Mac Mini: M4 10-Core, 16GB RAM, 256GB SSD (2024, MU9D3LL/A) for $449.99. Choose free store pickup where stock permits.Note: Availability for pic… [+438 chars]",Slickdeals.net,2025-09-30T14:16:24Z,https://slickdeals.net/f/18647476-microcenter-deal-back-on-apple-mac-mini-2024-m4-10-core-cpu-gpu-16gb-ram-256gb-450-free-store-pickup-449-99,2025-10-01 22:31:18.610910,
Firefly Alpha Flight 7 Explodes on Test Stand,"The first stage of Fireflys Alpha Flight 7 rocket exploded during testing. Proper safety protocols were followed, and all personnel are safe. The company is assessing the impact to its stage test sta… [+1974 chars]",Next Big Future,2025-09-30T14:14:26Z,https://www.nextbigfuture.com/2025/09/firefly-alpha-flight-7-explodes-on-test-stand.html,2025-10-01 22:31:19.974024,
"Uber and DoorDash Are the Leaders in Ride-Hailing and Delivery. Buy the Stocks, Says Analyst",", 200); return false;"" How will the US government shutdown affect markets? , 200); return false;"" Why is Electronic Art… [+729 chars]",Biztoc.com,2025-09-30T14:14:17Z,https://biztoc.com/x/57314fb6de034fd2,2025-10-01 22:31:19.974098,
P/E Ratio Insights for NOV,"In the current session, NOV Inc. (NYSE:NOV) is trading at $13.08, after a 1.28% decrease. Over the past month, the stock decreased by 0.15%, and in the past year, by 18.86%. With performance like thi… [+135 chars]",Biztoc.com,2025-09-30T14:13:37Z,https://biztoc.com/x/84525adef93b3f8d,2025-10-01 22:31:19.974178,
"INVESTOR DEADLINE APPROACHING: Faruqi & Faruqi, LLP Investigates Claims on Behalf of Investors of Tronox","Faruqi Faruqi, LLP Securities Litigation Partner James (Josh) Wilson Encourages Investors Who Suffered Losses In Tronox To Contact Him Directly To Discuss Their Options If you suffered losses … [+3571 chars]",GlobeNewswire,2025-09-30T14:10:00Z,https://www.globenewswire.com/news-release/2025/09/30/3158784/683/en/INVESTOR-DEADLINE-APPROACHING-Faruqi-Faruqi-LLP-Investigates-Claims-on-Behalf-of-Investors-of-Tronox.html,2025-10-01 22:31:19.974258,
Australia's home prices rise at fastest clip in a year as rate cuts fuel demand,"SYDNEY (Reuters) -Australian home prices increased at the fastest pace in a year in September, driven by rate cuts and record-low listings, property consultant Cotality said on Wednesday.

National home prices increased 0.8% to a record median value of A$857,280 ($565,462) in September, marking the strongest monthly gain since October last year, according to figures from Cotality, formerly CoreLogic.

For the quarter, prices were up 2.2%, compared with a 1.5% lift in the second quarter.

The monthly gain was broad-based, led by a jump of 1.2% in Brisbane and a 1.6% surge in Perth. Sydney prices rose 0.8%, while Melbourne lagged a little at 0.5%.

""The spring selling season is shaping up to be a strong one, with vendors claiming the driver's seat,"" Cotality said.

""Low advertised stock leve",Yahoo Entertainment,2025-09-30T14:09:54Z,https://finance.yahoo.com/news/australias-home-prices-rise-fastest-140954357.html,2025-10-01 22:31:21.970198,
"ET Market Watch: Nifty, Sensex log 8th straight loss as rupee weakens","Hi, you’re listening to ET Markets Radio. I’m your host, Neha Vashishth, and this is your daily dose of the stock market action. Let’s dive in.India’s benchmark indices clocked their 8th straight los… [+1112 chars]",The Times of India,2025-09-30T14:06:55Z,https://economictimes.indiatimes.com/markets/stocks/etmarkets-podcast/et-market-watch-nifty-sensex-log-8th-straight-loss-as-rupee-weakens/podcast/124237384.cms,2025-10-01 22:31:25.155237,
"INVESTOR DEADLINE APPROACHING: Faruqi & Faruqi, LLP Investigates Claims on Behalf of Investors of SelectQuote","Faruqi Faruqi, LLP Securities Litigation Partner James (Josh) Wilson Encourages Investors Who Suffered Losses In SelectQuote To Contact Him Directly To Discuss Their Options If you suffered lo… [+4396 chars]",GlobeNewswire,2025-09-30T14:06:00Z,https://www.globenewswire.com/news-release/2025/09/30/3158776/683/en/INVESTOR-DEADLINE-APPROACHING-Faruqi-Faruqi-LLP-Investigates-Claims-on-Behalf-of-Investors-of-SelectQuote.html,2025-10-01 22:31:25.155328,
"CoreWeave lands $14 billion AI deal with Meta, stock climbs over 15% on Wall Street","CoreWeave Inc. on September 30 signed an agreement to provide Meta Platforms Inc. with up to $14.2 billion in computing power, underscoring the significant expenses involved in creating and operating… [+2603 chars]",Livemint,2025-09-30T14:05:50Z,https://www.livemint.com/companies/coreweave-lands-14-billion-ai-deal-with-meta-stock-climbs-over-15-on-wall-street-11759238488137.html,2025-10-01 22:31:27.012029,
"INVESTOR DEADLINE APPROACHING: Faruqi & Faruqi, LLP Investigates Claims on Behalf of Investors of Lantheus","Faruqi Faruqi, LLP Securities Litigation Partner James (Josh) Wilson Encourages Investors Who Suffered Losses In Lantheus To Contact Him Directly To Discuss Their Options If you suffered losse… [+3622 chars]",GlobeNewswire,2025-09-30T14:05:00Z,https://www.globenewswire.com/news-release/2025/09/30/3158772/683/en/INVESTOR-DEADLINE-APPROACHING-Faruqi-Faruqi-LLP-Investigates-Claims-on-Behalf-of-Investors-of-Lantheus.html,2025-10-01 22:31:27.012120,
Meta and Google Are AI Winners. Why Pinterest Could Join Them,", 200); return false;"" How will the US government shutdown affect markets? , 200); return false;"" Why is Electronic Art… [+736 chars]",Biztoc.com,2025-09-30T14:03:32Z,https://biztoc.com/x/17ad7ea151fc0520,2025-10-01 22:31:27.012191,
Nvidia Stock Edges Up. Can It Keep Its Lead Over AMD?,", 200); return false;"" How will the US government shutdown affect markets? , 200); return false;"" Why is Electronic Art… [+737 chars]",Biztoc.com,2025-09-30T14:03:30Z,https://biztoc.com/x/3117c25ef592c136,2025-10-01 22:31:27.012255,
EchoStar Stock Climbs As Investors Cheer Ongoing Spectrum Sales Strategy,EchoStar Corp. (NASDAQ:SATS) stock is trading higher on Tuesday.The satellite communication company is reportedly engaged in talks to sell some of its wireless spectrum to Verizon Communications Inc.… [+145 chars],Biztoc.com,2025-09-30T14:03:06Z,https://biztoc.com/x/4d1227c02e216db2,2025-10-01 22:31:27.012332,
Romanian ready-meals maker Cris-Tim prepares IPO,"Romanian food business Cris-Tim plans to launch an initial public offering (IPO) on the Bucharest Stock Exchange.The company, which produces cold cut meats and ready meals, said in a statement yester… [+143 chars]",Biztoc.com,2025-09-30T14:02:53Z,https://biztoc.com/x/835558a6b7cd635c,2025-10-01 22:31:27.012410,
Spotify stock price falls as cofounder Daniel Ek announces plans to step down from CEO role in 2026,Shares of Spotify Technology SA were put on the spot this morning as the Swedish audio-streaming company announced that CEO Daniel Ek will be transitioning out of the role at the end of the year. He … [+146 chars],Biztoc.com,2025-09-30T14:02:46Z,https://biztoc.com/x/71ada4ec82e75c34,2025-10-01 22:31:27.012491,
Wall Street coasts toward the end of another winning month,"By STAN CHOE, Associated Press Business WriterNEW YORK (AP) U.S. stocks are coasting toward the finish of Wall Streets latest winning month on Tuesday.The S P 500 slipped 0.2% in early trading, b… [+143 chars]",Biztoc.com,2025-09-30T14:02:34Z,https://biztoc.com/x/2e79dc41562fc081,2025-10-01 22:31:27.012569,
"INVESTOR DEADLINE APPROACHING: Faruqi & Faruqi, LLP Investigates Claims on Behalf of Investors of Quantum","Faruqi Faruqi, LLP Securities Litigation Partner James (Josh) Wilson Encourages Investors Who Suffered Losses In Quantum Corporation To Contact Him Directly To Discuss Their Options If you suf… [+4246 chars]",GlobeNewswire,2025-09-30T14:01:00Z,https://www.globenewswire.com/news-release/2025/09/30/3158768/683/en/INVESTOR-DEADLINE-APPROACHING-Faruqi-Faruqi-LLP-Investigates-Claims-on-Behalf-of-Investors-of-Quantum.html,2025-10-01 22:31:27.012656,
"ORG Partners LLC Boosts Holdings in Quanta Services, Inc. $PWR","ORG Partners LLC increased its holdings in Quanta Services, Inc. (NYSE:PWR – Free Report) by 46.7% during the second quarter, according to the company in its most recent 13F filing with the Securitie… [+5114 chars]",ETF Daily News,2025-09-30T14:00:45Z,https://www.etfdailynews.com/2025/09/30/org-partners-llc-boosts-holdings-in-quanta-services-inc-pwr/,2025-10-01 22:31:28.909104,
The Future of Labor in Retail | Marshall Fisher and Santiago Gallino,"Transcript

Understanding Retail Labor in the Grocery Industry

Dan Loney: We are at an interesting time in the labor markets. The economy is pretty strong, but technology is playing a larger role in the day-to-day operations. How to manage a staff plays a big part in the success of the firm. A recent report by two Wharton professors looks at the state of retail labor using the grocery industry as the main example.

Pleasure to be joined by Marshall Fisher, who’s a professor of operations, information and decisions here at the Wharton School, and also Santiago Gallino, who’s an associate professor of operations, information and decisions as well as an associate professor of marketing here.

Gentlemen, why the focus in terms of understanding more about the labor market with the grocery area",Upenn.edu,2025-09-30T14:00:32Z,http://knowledge.wharton.upenn.edu/podcast/ripple-effect/the-future-of-labor-in-retail-marshall-fisher-and-santiago-gallino/,2025-10-01 22:31:31.616703,
PTOP Signs LOI with INS Digital Intelligence to Launch New AI Division and Gives Update on Reverse,"CAMBRIDGE, Mass., Sept. 30, 2025 (GLOBE NEWSWIRE) -- Peer to Peer Network, Inc. (OTC: PTOPD) (PTOP or the Company) today announced that it has signed a Letter of Intent (LOI) with INS Digital Intelli… [+6730 chars]",GlobeNewswire,2025-09-30T14:00:00Z,https://www.globenewswire.com/news-release/2025/09/30/3158755/0/en/PTOP-Signs-LOI-with-INS-Digital-Intelligence-to-Launch-New-AI-Division-and-Gives-Update-on-Reverse.html,2025-10-01 22:31:31.616759,
Transient juvenile demyelination impairs maturation and function of parvalbumin-positive interneurons in the prefrontal cortex,"Recent studies have highlighted axonal myelination as a common feature of parvalbumin-positive (PV) interneurons throughout the cerebral cortex. However, the precise function of PV interneuron myelination remains incompletely understood. In this study, we used the cuprizone model of demyelination in mice to investigate how PV interneuron myelination might influence their neuronal physiology. Specifically, we examined whether impairing myelination from postnatal day 21 onwards, during a critical neurodevelopmental period of the prefrontal cortex (PFC), can affect PV interneuron maturation and function. Using whole-cell patch-clamp recordings to examine intrinsic properties of PV interneurons in the PFC, we found that juvenile demyelination in mice induced robust alterations of PV interneuro",Plos.org,2025-09-30T14:00:00Z,https://journals.plos.org/plosbiology/article?id=10.1371/journal.pbio.3003421,2025-10-01 22:31:33.817506,
