title,content,source,published_at,url,category,collected_at
"Hotter CPI Unlikely to Deter Rate Cuts, S&P 500 Rally — For Now","(Bloomberg) -- Equities traders are likely to shrug off any evidence of stubborn inflation in Fridays consumer price index report, as the market narrative is dominated by optimism for an expected Fed… [+5132 chars]",Yahoo Entertainment,2025-10-23T14:38:32Z,https://finance.yahoo.com/news/hotter-cpi-unlikely-deter-rate-093641732.html,Market-Wide,2025-10-25 16:18:19.778668
Brands Are Paying More For Ads That Do Less,"Brands are pouring more money into their marketing campaigns but seeing less impact in returnand that gap between spend and impact is widening.
According to Shutterstocks 2025 Creative Impact Report… [+2775 chars]",Adweek,2025-10-23T14:35:26Z,https://www.adweek.com/brand-marketing/brands-are-paying-more-for-ads-that-do-less/,Market-Wide,2025-10-25 16:18:19.778680
From penny stock to meme frenzy: Is BYND’s 388% rally about to crash hard? Today's market move shows Beyond Meat in trouble,"Beyond Meat Inc. (NASDAQ: BYND) has become the latest meme stock sensation. The companys stock soared over 1,400% in a single week, but recent pre-market losses have investors questioning whether the… [+7824 chars]",The Times of India,2025-10-23T14:02:21Z,https://economictimes.indiatimes.com/news/international/us/from-penny-stock-to-meme-frenzy-is-bynds-388-rally-about-to-crash-hard-todays-market-move-shows-beyond-meat-in-trouble/articleshow/124764027.cms,Market-Wide,2025-10-25 16:18:19.778695
‘No free lunch’: Covered call ETFs have high yields but come with a trade-off,"As exchange-traded funds with covered call strategies gain momentum among retail investors, finance experts say these products come with a trade-off.
THIS CONTENT IS RESERVED FOR SUBSCRIBERS ONLY
S… [+5242 chars]",Financial Post,2025-10-23T14:02:11Z,https://financialpost.com/pmn/no-free-lunch-covered-call-etfs-have-high-yields-but-come-with-a-trade-off,Market-Wide,2025-10-25 16:18:19.778710
Green accounting and ESG-driven eco-efficiency in European financial institutions: A two-stage DEA–CRITIC-TOPSIS evaluation,"Abstract
Background
Evaluation of the eco-efficiency of financial institutions and their underlying green accounting practices is imperative as Environmental, Social, and Governance (ESG) principle… [+46601 chars]",Plos.org,2025-10-23T14:00:00Z,https://journals.plos.org/plosone/article?id=10.1371/journal.pone.0334882,Market-Wide,2025-10-25 16:18:19.778728
Warren Buffett once told a group of students that they won't measure success by how much money they have,"This article adheres to strict editorial standards. Some or all links may be monetized.
Weve all heard it before: money doesnt buy happiness and investing legend Warren Buffett took that sentiment o… [+8938 chars]",AOL,2025-10-23T13:37:00Z,https://www.aol.com/finance/warren-buffett-once-told-group-133700762.html,Market-Wide,2025-10-25 16:18:19.778746
"From tracks to tech: Siemens India stakes claim in manufacturing, mobility","NEW DELHI: As India pushes to transform its manufacturing and infrastructure landscape, Siemens Ltd is betting billions on electrification, automation and digitalization to become a backbone of the c… [+4928 chars]",Livemint,2025-10-23T13:27:56Z,https://www.livemint.com/companies/news/siemens-india-growth-strategy-manufacturing-acquisitions-sunil-mathur-gst-reforms-income-tax-11761210574878.html,Market-Wide,2025-10-25 16:18:19.778759
Is ORCL Stock A Better Pick vs. Peers?,"In this photo illustration, the Oracle logo appears on a smartphone reflecting a bright pink background. A consortium led by Oracle, Silver Lake, and Andreessen Horowitz plans to acquire 80% of TikTo… [+3233 chars]",Forbes,2025-10-23T13:25:34Z,https://www.forbes.com/sites/greatspeculations/2025/10/23/is-orcl-stock-a-better-pick-vs-peers/,Market-Wide,2025-10-25 16:18:19.778772
"Enlight to Report Third Quarter 2025 Financial Results on Wednesday, November 12, 2025","TEL AVIV, Israel, Oct. 23, 2025 (GLOBE NEWSWIRE) -- Enlight Renewable Energy (TASE &amp; NASDAQ: ENLT), a leading global renewable energy developer and an independent power producer, will release its… [+9747 chars]",GlobeNewswire,2025-10-23T13:20:00Z,https://www.globenewswire.com/news-release/2025/10/23/3172133/0/en/Enlight-to-Report-Third-Quarter-2025-Financial-Results-on-Wednesday-November-12-2025.html,Market-Wide,2025-10-25 16:18:19.778785
What’s Behind The 30% Surge In UNH Stock?,"CANADA - 2025/10/01: In this photo illustration, the UnitedHealth Group (United Health) logo is seen displayed on a smartphone screen. (Photo Illustration by Thomas Fuller/SOPA Images/LightRocket via… [+3520 chars]",Forbes,2025-10-23T13:19:05Z,https://www.forbes.com/sites/greatspeculations/2025/10/23/whats-behind-the-30-surge-in-unh-stock/,Market-Wide,2025-10-25 16:18:19.778798
Could Broadcom Be In Trouble?,"POLAND - 2025/09/05: In this photo illustration, a Broadcom logo is seen displayed on a smartphone. (Photo Illustration by Omar Marques/SOPA Images/LightRocket via Getty Images)
SOPA Images/LightRoc… [+3762 chars]",Forbes,2025-10-23T13:14:26Z,https://www.forbes.com/sites/greatspeculations/2025/10/23/could-broadcom-be-in-trouble/,Market-Wide,2025-10-25 16:18:19.778811
AMZN Stock Set For A Major Upswing?,"CANADA - 2025/10/21: In this photo illustration, the Amazon logo is seen displayed on a smartphone screen. (Photo Illustration by Thomas Fuller/SOPA Images/LightRocket via Getty Images)
SOPA Images/… [+3777 chars]",Forbes,2025-10-23T13:10:14Z,https://www.forbes.com/sites/greatspeculations/2025/10/23/amzn-stock-set-for-a-major-upswing/,Market-Wide,2025-10-25 16:18:19.778823
Humphrey Yang: How To Maximize Your Money as a High Earner,"According to U.S. Census data, the top 20% of Americans made at least $175,700 in 2024, more than double the $83,730 median household income.
If youre among the countrys high earners, maximizing you… [+5926 chars]",Yahoo Entertainment,2025-10-23T13:00:10Z,https://finance.yahoo.com/news/humphrey-yang-maximize-money-high-130010873.html,Market-Wide,2025-10-25 16:18:19.778837
Fluor Corporation (FLR): A Bull Case Theory,"We came across a bullish thesis on Fluor Corporation on Make Money, Make Times Substack by Oliver | MMMT Wealth. In this article, we will summarize the bulls thesis on FLR. Fluor Corporation's share … [+2601 chars]",Yahoo Entertainment,2025-10-23T12:49:11Z,https://finance.yahoo.com/news/fluor-corporation-flr-bull-case-124911883.html,Market-Wide,2025-10-25 16:18:19.778850
Texas Instruments Stock To $136?,Texas Instruments (TXN) stock has decreased by 5.6% over the last day and is presently priced at $170.71. Our machine-led multifactor analysis indicates that it may be wise to lessen exposure to TXN … [+5126 chars],Forbes,2025-10-23T12:40:30Z,https://www.forbes.com/sites/greatspeculations/2025/10/23/texas-instruments-stock-to-136/,Market-Wide,2025-10-25 16:18:19.778862
Lloyds Bank PLC: Q3 2025 Interim Management Statement,"LONDON, Oct. 23, 2025 (GLOBE NEWSWIRE) -- 
Lloyds Bank plcQ3 2025 Interim Management Statement23 October 2025
Member of the Lloyds Banking Group
FORWARD LOOKING STATEMENTS
This document contains … [+38789 chars]",GlobeNewswire,2025-10-23T12:36:00Z,https://www.globenewswire.com/news-release/2025/10/23/3172044/0/en/Lloyds-Bank-PLC-Q3-2025-Interim-Management-Statement.html,Market-Wide,2025-10-25 16:18:19.778875
Bitcoin ETFs In 401(k)s: What Retirement Savers Should Know,"A person views bitcoin price data on a smartphone. Bitcoin ETFs are increasingly being added to 401(k) and IRA investment menus.
NurPhoto via Getty Images
Disclosure: The author is a Certified Publ… [+4669 chars]",Forbes,2025-10-23T12:32:26Z,https://www.forbes.com/sites/digital-assets/2025/10/23/bitcoin-etfs-in-401ks-what-retirement-savers-should-know/,Market-Wide,2025-10-25 16:18:19.778888
Solana Company Ramps Up Staking Push With Institutional Validators as Shares Tumble,"In brief
<ul><li>Solana Company says it has deepened its on-chain strategy by adding Twinstake and Helius as institutional validators, expanding its $396 million Solana treasury.</li><li>The Nasdaq-… [+3527 chars]",Decrypt,2025-10-23T12:31:03Z,https://decrypt.co/345583/solana-company-staking-push-institutional-validators-shares-tumble,Market-Wide,2025-10-25 16:18:19.778902
Is China coming for the Dollar? Economist says gold binge could change everything,"China is becoming a big player in the global gold market, and experts say it could even challenge the U.S. dollars power in the future. Torsten Slok, Chief Economist at Apollo Global Management, said… [+4061 chars]",The Times of India,2025-10-23T12:19:25Z,https://economictimes.indiatimes.com/news/international/us/is-china-coming-for-the-dollar-economist-says-gold-binge-could-change-everything/articleshow/124761921.cms,Market-Wide,2025-10-25 16:18:19.778915
Opinion: Decoding India's Stance In US Trade Negotiations,"In September 2025, Prime Minister Narendra Modi used the phrase ""unlock the limitless potential of the India-US partnership"" in a social media post on X, referencing renewed trade talks with the US. … [+6123 chars]",Ndtvprofit.com,2025-10-23T12:19:19Z,https://www.ndtvprofit.com/opinion/economy-donald-trump-tariffs-india-us-trade-deal-negotiations-protecting-interests,Market-Wide,2025-10-25 16:18:19.778928
5 Things to Know Before the Stock Market Opens,"Justin Sullivan / Getty Images
 Chipmaking giant Intel is due to release its quarterly results after the closing bell today.
Stock futures are down slightly this morning as investors assess a slew … [+4460 chars]",Investopedia,2025-10-23T12:18:12Z,https://www.investopedia.com/5-things-to-know-before-the-stock-market-opens-october-23-2025-11835433,Market-Wide,2025-10-25 16:18:19.778941
Stronger Bet Than Quanta Stock: FIX Delivers More,"Comfort Systems USA (NYSE:FIX) operates as a competitor to Quanta Services
 (NYSE: PWR) in the Construction &amp; Engineering sector, and has:
1) A lower valuation (P/OpInc) when compared to Quanta… [+3013 chars]",Forbes,2025-10-23T12:15:57Z,https://www.forbes.com/sites/greatspeculations/2025/10/23/stronger-bet-than-quanta-stock-fix-delivers-more/,Market-Wide,2025-10-25 16:18:19.778954
"ZenaTech’s Zena AI Division for Advanced AI-Driven Drone Solutions for US Defense and Homeland Security to be Based in Baton Rouge, Louisiana","VANCOUVER, British Columbia, Oct. 23, 2025 (GLOBE NEWSWIRE) -- ZenaTech, Inc. (Nasdaq: ZENA) (FSE: 49Q) (BMV: ZENA) (ZenaTech), a business technology solution provider specializing in AI (Artificial … [+6950 chars]",GlobeNewswire,2025-10-23T12:15:00Z,https://www.globenewswire.com/news-release/2025/10/23/3172011/0/en/ZenaTech-s-Zena-AI-Division-for-Advanced-AI-Driven-Drone-Solutions-for-US-Defense-and-Homeland-Security-to-be-Based-in-Baton-Rouge-Louisiana.html,Market-Wide,2025-10-25 16:18:19.778969
Buy The Dip In IBM Stock?,"CANADA - 2025/09/27: In this photo illustration, the IBM (International Business Machines Corporation) logo is seen displayed on a smartphone screen. (Photo Illustration by Thomas Fuller/SOPA Images/… [+5424 chars]",Forbes,2025-10-23T12:04:52Z,https://www.forbes.com/sites/greatspeculations/2025/10/23/buy-the-dip-in-ibm-stock/,Market-Wide,2025-10-25 16:18:19.778982
Newmont Stock’s Recent Run Has Been Wild. Why Gold Volatility Won’t Impact Earnings,"{ window.open(this.href, '_blank'); }, 200); return false;""&gt;Why did Tesla's profits drop despite record sales? { window.open(this.href, '_blank'); }, 200); return false;""&gt;How will US sanctions … [+715 chars]",Biztoc.com,2025-10-23T12:04:34Z,https://biztoc.com/x/f532aec3bf71cad4,Market-Wide,2025-10-25 16:18:19.778997
On-chain dollars hit 2.3% of global payments: Why Bitcoiners should care,"Stablecoins were used to move roughly $46 trillion over the past 12 months, according to new a16z crypto report. Beyond that, over $80 trillion has been processed in crypto trading volume across the … [+8505 chars]",CryptoSlate,2025-10-23T11:53:17Z,https://cryptoslate.com/on-chain-dollars-hit-2-3-of-total-payments-why-bitcoiners-should-care/,Market-Wide,2025-10-25 16:18:19.779010
Is This Dividend King a Safe Haven in a Volatile Market?,"In an environment marked by inflation, geopolitical volatility, and shifting consumer behavior, few companies have managed to maintain consistency like The Coca-Cola Company (KO). With more than six … [+4709 chars]",Barchart.com,2025-10-23T11:30:02Z,https://www.barchart.com/story/news/35631979/is-this-dividend-king-a-safe-haven-in-a-volatile-market,Market-Wide,2025-10-25 16:18:19.779023
This CEO says young investors trying to protect their cash is stopping them from getting rich — here's why,"Many young investors are keeping their cash out of the stock market, and one financial expert says that could be the biggest mistake they make.
Josh Brown, CEO of Ritholtz Wealth Management, argues … [+3286 chars]",Yahoo Entertainment,2025-10-23T11:30:00Z,https://finance.yahoo.com/news/ceo-says-young-investors-trying-113000786.html,Market-Wide,2025-10-25 16:18:19.779038
"Risk Proxies Challenge Bitcoin's Bounce; HYPE, XMR Shine: Crypto Daybook Americas","By Omkar Godbole (All times ET unless indicated otherwise)
The crypto market is looking to regain upside traction, with bitcoin BTC
$109,099.90 attempting to top $110,000. The CoinDesk 20 Index has… [+8324 chars]",CoinDesk,2025-10-23T11:15:00Z,https://www.coindesk.com/daybook-us/2025/10/23/risk-proxies-challenge-bitcoin-s-bounce-hype-xmr-shine-crypto-daybook-americas,Market-Wide,2025-10-25 16:18:19.779051
Goldman Sachs Bear Call Spread Could Net 16% in Four Weeks,"Goldman Sachs (GS) stock has been trending lower for the last few weeks and is now below the 50-day moving average.
Im willing to bet that the stock wont rise too much further, and today were going … [+1968 chars]",Barchart.com,2025-10-23T11:00:02Z,https://www.barchart.com/story/news/35630875/goldman-sachs-bear-call-spread-could-net-16-in-four-weeks,Market-Wide,2025-10-25 16:18:19.779064
Valley National Bancorp Announces Third Quarter 2025 Results,"NEW YORK, Oct. 23, 2025 (GLOBE NEWSWIRE) -- Valley National Bancorp (NASDAQ:VLY), the holding company for Valley National Bank, today reported net income for the third quarter 2025 of $163.4 million,… [+118520 chars]",GlobeNewswire,2025-10-23T11:00:00Z,https://www.globenewswire.com/news-release/2025/10/23/3171904/0/en/Valley-National-Bancorp-Announces-Third-Quarter-2025-Results.html,Market-Wide,2025-10-25 16:18:19.779077
Tesla Analyst Says Elon Musk Will 'Be Heavy On Optimism And Light On Truth' For Q3 Earnings Call,"Benzinga and Yahoo Finance LLC may earn commission or revenue on some items through the links below.
A notable Tesla Inc (NASDAQ:TSLA) bearish analyst shares thoughts on what the company will report… [+7520 chars]",Yahoo Entertainment,2025-10-23T10:46:06Z,https://finance.yahoo.com/news/tesla-analyst-says-elon-musk-104606502.html,Market-Wide,2025-10-25 16:18:19.779091
"US stock market futures today: Dow Jones, S&P 500, Nasdaq futures drop as US-China trade tensions escalate — Tesla, IBM, American Airlines earnings jolt Wall Street sentiment","US stock futures slipped Thursday as trade tensions between Washington and Beijing escalated. Tesla, IBM, and American Airlines shares moved sharply on earnings and guidance. Dow Jones Industrial Ave… [+6718 chars]",The Times of India,2025-10-23T10:38:04Z,https://economictimes.indiatimes.com/news/international/us/us-stock-market-futures-today-dow-jones-sp-500-nasdaq-futures-drop-as-us-china-trade-tensions-escalate-tesla-ibm-american-airlines-earnings-jolt-wall-street-sentiment/articleshow/124759852.cms,Market-Wide,2025-10-25 16:18:19.779108
"Why Is Crypto Up Today? – October 23, 2025","The crypto market is up today, with the cryptocurrency market capitalization increasing by 1.3%, now standing at $3.8 trillion. 80 of the top 100 coins have appreciated over the past 24 hours. At the… [+7959 chars]",Cryptonews,2025-10-23T10:25:01Z,https://cryptonews.com/news/why-is-crypto-up-today-october-23-2025/,Market-Wide,2025-10-25 16:18:19.779120
"TransUnion Announces Strong Third Quarter 2025 Results, Exceeding All Key Financial Metrics","<ul><li>Delivered 8 percent revenue growth, or 11 percent organic constant currency excluding impact of last years large breach remediation win in our Consumer Interactive business</li><li>Accelerate… [+101574 chars]",GlobeNewswire,2025-10-23T10:18:00Z,https://www.globenewswire.com/news-release/2025/10/23/3171845/0/en/TransUnion-Announces-Strong-Third-Quarter-2025-Results-Exceeding-All-Key-Financial-Metrics.html,Market-Wide,2025-10-25 16:18:19.779134
Stocks Muted Before the Open With Earnings in Focus,"Third-quarter corporate earnings season continues in full flow, and investors look forward to fresh reports from notable companies today, including Intel (INTC), T-Mobile US (TMUS), Ford Motor (F), B… [+8983 chars]",Barchart.com,2025-10-23T10:17:34Z,https://www.barchart.com/story/news/35629971/stocks-steady-before-the-open-with-earnings-in-focus,Market-Wide,2025-10-25 16:18:19.779150
I Win Asset Management and eBroker Group Limited Sign Strategic Partnership Agreement,"HONG KONG, Oct. 23, 2025 (GLOBE NEWSWIRE) -- I Win Asset Management Limited, a subsidiary of Garden Stage Ltd., announced that it has entered into a strategic partnership agreement with eBroker Group… [+1113 chars]",GlobeNewswire,2025-10-23T10:17:00Z,https://www.globenewswire.com/news-release/2025/10/23/3171844/0/en/I-Win-Asset-Management-and-eBroker-Group-Limited-Sign-Strategic-Partnership-Agreement.html,Market-Wide,2025-10-25 16:18:19.779164
HYPE Price Shoots 12% on $1B Accumulation News from Hyperliquid Strategies,"Defying the broader crypto market downside on Oct. 23, HYPE , the native cryptocurrency of the Hyperliquid decentralized exchange (DEX), has registered a sharp 12% upside. HYPE price rally comes foll… [+2464 chars]",Coinspeaker,2025-10-23T10:15:53Z,https://www.coinspeaker.com/hype-shoots-12-percent-1b-accumulation-hyperliquid/,Market-Wide,2025-10-25 16:18:19.779177
MP Stock To $150?,"CANADA - 2025/09/28: In this photo illustration, the MP Materials logo is seen displayed on a smartphone screen. (Photo Illustration by Thomas Fuller/SOPA Images/LightRocket via Getty Images)
SOPA I… [+6025 chars]",Forbes,2025-10-23T10:00:57Z,https://www.forbes.com/sites/greatspeculations/2025/10/23/mp-stock-to-150/,Market-Wide,2025-10-25 16:18:19.779189
Will Visa Stock Rise On Approaching Earnings?,"ANKARA, TURKIYE - JULY 18: In this photo illustration, Mastercard and Visa debit card are seen in Ankara, Turkiye on July 17, 2025. (Photo by Mustafa Hatipoglu/Anadolu via Getty Images)
Anadolu via … [+3733 chars]",Forbes,2025-10-23T09:30:16Z,https://www.forbes.com/sites/greatspeculations/2025/10/23/will-visa-stock-rise-on-approaching-earnings/,Market-Wide,2025-10-25 16:18:19.779202
"Sunfort Portdex: How Sunfort Portdex Emerges as a Leading AI Trading Platform, Reports Highlight Features & Innovation","New York City, NY, Oct. 23, 2025 (GLOBE NEWSWIRE) -- What Is Sunfort Portdex?
Sunfort Portdex stands at the forefront of 2025s trading innovation, emerging as an AI-driven platform designed to simpl… [+28865 chars]",GlobeNewswire,2025-10-23T09:25:00Z,https://www.globenewswire.com/news-release/2025/10/23/3171801/0/en/Sunfort-Portdex-How-Sunfort-Portdex-Emerges-as-a-Leading-AI-Trading-Platform-Reports-Highlight-Features-Innovation.html,Market-Wide,2025-10-25 16:18:19.779218
You’ve Been Misled! The 4-Year Bitcoin Cycle Doesn’t Actually Exist—Expert,"According to comments from the creator of the stock-to-flow model, the familiar four-year cycle tied to Bitcoin halvings may no longer be a sure guide for traders.
The analyst known as PlanB warned … [+2407 chars]",newsBTC,2025-10-23T09:00:25Z,http://www.newsbtc.com/news/youve-been-misled-the-4-year-bitcoin-cycle-doesnt-actually-exist-expert/,Market-Wide,2025-10-25 16:18:19.779231
"1,300% rally in 4 days! Wall Street gets new meme stock to rekindle GameStop memories","Shares of US-based plant-based protein maker Beyond Meat have surged more than 1,300% in just four trading sessions, fuelled by a social media frenzy reminiscent of GameStops rally. The rally was tri… [+2218 chars]",The Times of India,2025-10-23T08:43:46Z,https://economictimes.indiatimes.com/markets/stocks/news/1300-rally-in-4-days-wall-street-gets-new-meme-stock-to-rekindle-gamestop-memories/articleshow/124757862.cms,Market-Wide,2025-10-25 16:18:19.779245
Hims & Hers: There's Opportunity In This Crash (Upgrade),"With the S&amp;P 500 continuing to scrape toward new heights, it has become an incredibly tough stock market to invest in. That said, the increased volatility in trading over the past several weeks h… [+155 chars]",Biztoc.com,2025-10-23T08:33:46Z,https://biztoc.com/x/29a92fb650c4a34c,Market-Wide,2025-10-25 16:18:19.779258
BOJ sees signs of overheating in Japan's stock market,"Japan's stock market is showing early signs of overheating, the central bank said on Thursday, warning of the risk that uncertainty over U.S. trade policy could cause sharp corrections and hit financ… [+3455 chars]",The Times of India,2025-10-23T08:21:36Z,https://economictimes.indiatimes.com/markets/stocks/news/boj-sees-signs-of-overheating-in-japans-stock-market/articleshow/124757475.cms,Market-Wide,2025-10-25 16:18:19.779271
Gold-Backed Dollar Would Reduce Gold Volatility,"{ window.open(this.href, '_blank'); }, 200); return false;""&gt;Why did Tesla's profit drop despite record sales? { window.open(this.href, '_blank'); }, 200); return false;""&gt;How will US sanctions a… [+682 chars]",Biztoc.com,2025-10-23T08:11:26Z,https://biztoc.com/x/d3cd6cb66c590560,Market-Wide,2025-10-25 16:18:19.779283
BOJ sees signs of overheating in Japan's stock market,"TOKYO :Japan's stock market is showing early signs of overheating, the central bank said on Thursday, warning of the risk that uncertainty over U.S. trade policy could cause sharp corrections and hit… [+3492 chars]",CNA,2025-10-23T08:08:34Z,https://www.channelnewsasia.com/business/boj-sees-signs-overheating-in-japans-stock-market-5420106,Market-Wide,2025-10-25 16:18:19.779296
