title,content,source,published_at,url,collected_at,sentiment
The best ways to discover Connecticut's fall charm,"State Alabama Alaska Arizona Arkansas California Colorado Connecticut Delaware Florida Georgia Hawaii Idaho Illinois Indiana Iowa Kansas Kentucky Louisiana Maine Maryland Massachusetts Michigan Minnesota Mississippi Missouri Montana Nebraska Nevada New Hampshire New Jersey New Mexico New York North Carolina North Dakota Ohio Oklahoma Oregon Pennsylvania Rhode Island South Carolina South Dakota Tennessee Texas Utah Vermont Virginia Washington Washington D.C. West Virginia Wisconsin Wyoming Puerto Rico US Virgin Islands Armed Forces Americas Armed Forces Pacific Armed Forces Europe Northern Mariana Islands Marshall Islands American Samoa Federated States of Micronesia Guam Palau Alberta, Canada British Columbia, Canada Manitoba, Canada New Brunswick, Canada Newfoundland, Canada Nova Scotia, ",Mountain Democrat,2025-10-01T13:00:00Z,https://www.mtdemocrat.com/news/national/the-best-ways-to-discover-connecticut-s-fall-charm/article_af29044f-6f0e-5f43-9e52-8728792bf7a9.html,2025-10-01 22:49:30.812503,0.4431372549019608
Dune: Awakening developer Funcom announces redundancies,"Funcom, the Oslo-based studio behind the recently released Dune: Awakening, has announced it will be laying off staff.

In a statement sent to GamesIndustry.biz, the developer said that the open-world survival game was ""the biggest release we’ve had in our 32-year long history of making great games,"" before indicating that staff members are to be let go as part of a studio restructuring.

""The game has already shown incredible potential,"" the statement said, ""and the right way forward is to focus our internal resources on releasing new content, features, and enhancements.

""The transition from development to long-term live operation, while also building towards a major console release next year, will require us to restructure our teams and focus our resources from across projects and studi",GamesIndustry.biz,2025-10-01T14:29:39Z,https://www.gamesindustry.biz/dune-awakening-developer-funcom-announces-redundancies,2025-10-01 22:49:32.458597,0.0980392156862746
Assam: CID vows crackdown on AI fakes in Zubeen Garg death,"Guwahati: CID on Wednesday warned that anyone disseminating AI-generated images or unverified reports on social media about the probe into legendary singer Zubeen Garg's mysterious death faces immediate legal repercussions, as authorities grapple with a deluge of online falsehoods threatening the investigation's integrity. ""Assam police is strictly monitoring the social media platforms. If anyone is found spreading ""fake AI generated pics or fake news"" strict legal action will be initiated against them. @assampolice @DGPAssamPolice #beware #fakenews #Donotspread"" CID Assam posted on X . Just w",NORTHEAST NOW,2025-10-01T14:30:00Z,https://www.nenow.in/north-east-news/assam/assam-cid-vows-crackdown-on-ai-fakes-in-zubeen-garg-death.html,2025-10-01 22:49:34.711338,-0.4666666666666667
Change is brewing in the coffee industry. What lies ahead?,"Change is brewing in the coffee industry. What lies ahead?





Coffee growers are dealing with a lot right now. Most immediately, the Trump administration's tariffs, which threaten their sales, add to the ongoing challenges of pests and diseases for coffee production. In the longer term, experts say the coffee industry can't continue with business as usual. Growers face a waning labor force, and the areas where coffee can reliably grow are poised to shrink dramatically. While your morning cup isn't going away anytime soon, it could become more expensive — and could taste different, too. In honor of International Coffee Day on Oct. 1, we're taking stock of the world of coffee and what to expect in the years to come.

Sponsored

Climate change is shrinking the land where coffee can grow Due","KUOW-FM (94.9, Seattle)",2025-10-01T14:30:41Z,https://www.kuow.org/stories/change-is-brewing-in-the-coffee-industry-what-lies-ahead,2025-10-01 22:49:37.709323,-0.05098039215686279
Michigan Picks 10 Groups for Economic Growth Program Kicking off October,"Ten Michigan groups won spots in a fresh state program starting October 2025. The Community Growth Academy will run for 18 months, helping areas hit by car industry and power... Ten Michigan groups won spots in a fresh state program starting October 2025. The Community Growth Academy will run for 18 months, helping areas hit by car industry and power sector changes plan their next steps. ""The goal of the Community Growth Academy is to support a proactive strategy for economic growth in Michigan. We know that economic shifts are always occurring, and we want to make sure those shifts have a pos",WRIF Rocks Detroit,2025-10-01T14:20:12Z,https://wrif.com/2025/10/01/michigan-picks-10-groups-for-economic-growth-program-kicking-off-october/,2025-10-01 22:49:38.637775,0.4431372549019608
Govt to launch nationwide awareness drive on unclaimed financial assets from October 4: Ministry,"New Delhi: The government will roll out a three-month nationwide campaign on October 4 to help citizens trace and claim unclaimed assets, an official statement said on Wednesday. The campaign is run by the Department of Financial Services (DFS), Ministry of Finance, in coordination with the Reserve Bank of India, Insurance Regulatory and Development Authority of India (IRDAI), Securities and Exchange Board of India (SEBI) and the Investor Education and Protection Fund Authority. The campaign, titled 'Your Money, Your Right', will be inaugurated by Union Finance and Corporate Affairs Minister N",The Hans India,2025-10-01T14:30:01Z,https://www.thehansindia.com/business/govt-to-launch-nationwide-awareness-drive-on-unclaimed-financial-assets-from-october-4-ministry-1011220,2025-10-01 22:49:39.676475,0.3019607843137255
"Walmart to scrap synthetic food dyes, artificial ingredients from...","Walmart said Wednesday it is scrapping synthetic dyes and other artificial ingredients from its store brands, including Great Value, Marketside, Freshness Guaranteed and Bettergoods, by January 2027. The Arkansas-based retailer is the latest to ditch artificial dyes amid Health Secretary Robert F. Kennedy Jr.'s ""Make America Healthy Again"" push - and perhaps the most influential, since Walmart is the country's biggest grocery chain. Walmart's Great Value, alone, is one of the largest consumer brands in the country - racking up billions of dollars in sales each year. Walmart also plans to gradu",New York Post,2025-10-01T14:28:13Z,https://nypost.com/2025/10/01/business/walmart-to-scrap-synthetic-food-dyes-artificial-ingredients/,2025-10-01 22:49:40.616365,0.388235294117647
How could AI affect Black Friday and Cyber Monday this year?,"State Alabama Alaska Arizona Arkansas California Colorado Connecticut Delaware Florida Georgia Hawaii Idaho Illinois Indiana Iowa Kansas Kentucky Louisiana Maine Maryland Massachusetts Michigan Minnesota Mississippi Missouri Montana Nebraska Nevada New Hampshire New Jersey New Mexico New York North Carolina North Dakota Ohio Oklahoma Oregon Pennsylvania Rhode Island South Carolina South Dakota Tennessee Texas Utah Vermont Virginia Washington Washington D.C. West Virginia Wisconsin Wyoming Puerto Rico US Virgin Islands Armed Forces Americas Armed Forces Pacific Armed Forces Europe Northern Mariana Islands Marshall Islands American Samoa Federated States of Micronesia Guam Palau Alberta, Canada British Columbia, Canada Manitoba, Canada New Brunswick, Canada Newfoundland, Canada Nova Scotia, ",Mountain Democrat,2025-10-01T13:09:27Z,https://www.mtdemocrat.com/news/national/how-could-ai-affect-black-friday-and-cyber-monday-this-year/article_763874f8-0b3e-5141-898b-5812e7935a87.html,2025-10-01 22:49:43.054299,0.4274509803921569
KSE-100 closes flat after volatile session at PSX - Profit by Pakistan Today,"KARACHI: The Pakistan Stock Exchange (PSX) saw a volatile session on Wednesday, with the benchmark KSE-100 Index swinging both ways before settling flat at 165,640.33, up 146.75 points or 0.09%. The session began on a positive note, with the KSE-100 reaching a record intra-day high of 166,522.61. However, profit-taking by investors drove the index down to an intra-day low of 164,155.32 before it recovered at the close. On Tuesday, the IMF sought progress on streamlining the National Finance Commission (NFC) process during its ongoing technical discussions with Pakistan's finance ministry as pa",Profit by Pakistan Today,2025-10-01T14:25:53Z,https://profit.pakistantoday.com.pk/2025/10/01/kse-100-closes-flat-after-volatile-session-at-psx/,2025-10-01 22:49:45.740713,0.2470588235294118
Today's Top 3 News: Prabowo Welcomes Marc Marquez in Jakarta as Indonesia Gears Up for MotoGP,"TEMPO.CO, Jakarta - Tempo English compiled the top 3 news on Wednesday, October 1, 2025. Here are the highlights: Prabowo Welcomes Marc Marquez in Jakarta as Indonesia Gears Up for MotoGP; Indonesia's Prabowo Awards Top Civilian Honor to Bridgewater Founder Ray Dalio; Prabowo Leads Pancasila Sanctity Day Ceremony at Lubang Buaya. The following is the list of the top 3 news on Tempo English today: 1. Prabowo Welcomes Marc Marquez in Jakarta as Indonesia Gears Up for MotoGP Indonesian President Prabowo Subianto welcomed Spanish MotoGP star Marc Marquez at the State Palace in Central Jakarta on T",TEMPO.CO,2025-10-01T14:18:53Z,https://en.tempo.co/read/2053530/todays-top-3-news-prabowo-welcomes-marc-marquez-in-jakarta-as-indonesia-gears-up-for-motogp,2025-10-01 22:49:47.064679,0.4039215686274509
"Legal MSP: Strengthening Farmers, Fortifying the Exchequer","A legal MSP Guarantee ensures farmers receive a fair minimum price, stabilising rural incomes without burdening the exchequer. Backed by global practices and India's own FRP experience, it protects producers while keeping markets efficient. For months, a certain strain of commentary has insisted that a legal guarantee of MSP would ""sink"" any government. That is fear-mongering, not economics. India's own laws, global practice, and the arithmetic of our food economy show the opposite: a well-designed MSP Guarantee Law will civilise the market, stabilise rural incomes, and, net of leakages, stren",krishijagran.com,2025-10-01T14:30:35Z,https://krishijagran.com/opinion/legal-msp-strengthening-farmers-fortifying-the-exchequer/,2025-10-01 22:49:50.090091,0.2627450980392156
"In Poland, migrant workers from Latin America report abuse, exploitation","Yahoo is using AI to generate takeaways from this article. This means the info may not always match what's in the article. Reporting mistakes helps us improve the experience.

Yahoo is using AI to generate takeaways from this article. This means the info may not always match what's in the article. Reporting mistakes helps us improve the experience.

Yahoo is using AI to generate takeaways from this article. This means the info may not always match what's in the article. Reporting mistakes helps us improve the experience. Generate Key Takeaways

Wroclaw, Poland – Rocio Flores, a 44-year-old mother of three, stood trembling in the bathroom of a dilapidated country house in Blaszki, a village in central Poland.

Her breath was shallow as her heart pounded. Minutes earlier, a man from the agen",Yahoo,2025-10-01T14:01:20Z,https://www.yahoo.com/news/articles/poland-migrant-workers-latin-america-140120060.html,2025-10-01 22:49:51.735123,-0.3176470588235294
Govt employees families receive Tk 40 lakh aid in Khulna | District,"KHULNA, Oct 1, 2025 (BSS) - The families of six government employees in Khulna received Tk 40 lakh in financial assistance under the Financial Aid Policy 2020 (Revised) for deceased and permanently disabled civil servants. Khulna Divisional Commissioner Md. Firoz Sarkar handed over the cheques at his office today, following the approval of the Divisional Verification and Recommendation Committee. Of the total assistance, Tk 32 lakh was distributed among the families of four deceased government employees, with each family receiving Tk 8 lakh. The remaining Tk 8 lakh provided to the families of ",Bangladesh Sangbad Sangstha (BSS),2025-10-01T14:29:19Z,https://www.bssnews.net/district/317283,2025-10-01 22:49:53.549055,-0.1372549019607843
"Boulder County laying off 31 people, eliminating 60 vacant positions to close multi-million dollar budget gap","BOULDER COUNTY, Colo. -- Boulder County on Monday announced it will lay off 31 people and eliminate 60 vacant positions as it works to close a multi-million dollar budget shortfall. The county has projected that its spending will soon outpace its revenue. Officials are working to find $30 million to $40 million in savings over the next three years. The county said uncertainty surrounding federal and state funding is adding pressure to ""an already challenging economic situation with rising inflation and uncertainty around future revenue from property taxes and sales and use taxes."" In order to ",KOAA,2025-10-01T14:27:32Z,https://www.koaa.com/news/local-news/boulder-county-laying-off-31-people-eliminating-60-vacant-positions-to-close-multi-million-dollar-budget-gap,2025-10-01 22:49:54.792952,-0.09019607843137256
Gener8tor And StartUp Rutland Announce Five Companies For Fall 2025 GBETA Cohort | Mountain Times,"Rutland's flagship accelerator program is entering its second year with the announcement of the Fall 2025 gBETA Rutland cohort. Global venture fund gener8tor and StartUp Rutland unveiled the five startups selected for the free seven-week program: Spire, Aden Legal Education, TeleRay, Burlington Bio, and Tuktu. The gBETA accelerator is designed to help early-stage companies rapidly scale and pursue investment. Participants receive intensive coaching and gain access to gener8tor's national network of mentors, corporate partners, and investors. The five chosen companies represent a mix of local, ",The Mountain Times,2025-10-01T14:29:39Z,https://mountaintimes.info/2025/10/01/gener8tor-and-startup-rutland-announce-five-companies-for-fall-2025-gbeta-cohort/,2025-10-01 22:50:04.238446,0.4509803921568627
Sir Keir Starmer arrives in Denmark ahead of European leaders' meeting,"The Prime Minister touched down at Copenhagen Airport on Wednesday ahead of the European Political Community (EPC) summit on Thursday. Danish Prime Minister Mette Frederiksen told reporters on Wednesday that Europe is in the middle of a ""hybrid war"" waged by Russia and the continent must arm itself. Ms Frederiksen told reporters: ""I hope that everybody recognises now that there is a hybrid war, and one day it's Poland, the other day it's Denmark, and next week it will probably be somewhere else that we see sabotage or we see drones flying."" The EPC summit will discuss continental security, wit",Belfast Telegraph,2025-10-01T14:29:56Z,https://www.belfasttelegraph.co.uk/news/uk/sir-keir-starmer-arrives-in-denmark-ahead-of-european-leaders-meeting/a1998392111.html,2025-10-01 22:50:04.968196,-0.3019607843137255
Iraq Eyes Major Oil Production Surge by Year-End | OilPrice.com,"OPEC’s second largest producer, Iraq, plans to increase its oil production capacity to 5.5 million barrels per day (bpd) by the end of the year, up from about 4.4 million bpd now, Iraqi Oil Minister Hayyan Abdul Ghani told the Rudaw news outlet on Wednesday.

“The plan is to reach sustainable production capacity this year at a rate of 5.5 million barrels per day through expansion in well drilling and rehabilitation operations, building surface facilities and pipelines, and increasing water injection to maintain reservoir pressure,” Abdul Ghani said.

Iraq plans further production capacity increases to have its output capacity at above 6 million bpd by 2029.

Iraq is also in discussions with Chevron over exploration blocks in Nasiriyah and Salahaddin provinces, the minister told Rudaw.

In ",OilPrice.com,2025-10-01T14:30:00Z,https://oilprice.com/Latest-Energy-News/World-News/Iraq-Eyes-Major-Oil-Production-Surge-by-Year-End.html,2025-10-01 22:50:07.809204,0.2392156862745098
AIR CANADA LAUNCHES ITS NDC PLATFORM WITH TRAVELPORT+,"Relationship expands Airline's Digital Presence with Travelport's LONDON, Oct. 1, 2025 /PRNewswire/ --Travelport, a global technology company that powers travel bookings for hundreds of thousands of travel suppliers worldwide, and Air Canada, Canada's largest airline, today announced the two companies have made the full-range of Air Canada's NDC content available to Travelport-connected travel agencies and travel management companies using Travelport+. ""Our NDC launch with Travelport marks an important milestone in Air Canada's digital transformation journey as we can now offer our best, compl",IT News Online,2025-10-01T14:29:04Z,https://itnewsonline.com/PRNewswire/AIR-CANADA-LAUNCHES-ITS-NDC-PLATFORM-WITH-TRAVELPORT/1084491,2025-10-01 22:50:09.701646,0.4588235294117646
"Texas Ren Fest, Tomball's Spooktacular: 17 events to attend in Tomball, Magnolia this fall season","Jovanna joined Community Impact as a reporter in July 2023. As a features reporter, she covers the North Houston area, including Cy-Fair, Tomball, The Woodlands, Conroe, Spring-Klein and the Lake Houston area. She graduated from Sam Houston State University in December 2021 where she majored in mass communication with a focus in multiplatform journalism and a minor in creative writing, and served as a writer for the campus newspaper, The Houstonian. When she is not writing, Jovanna enjoys spending time outdoors, traveling and fitness.",Community Impact Newspaper,2025-10-01T14:15:00Z,https://communityimpact.com/houston/tomball-magnolia/events/2025/10/01/texas-ren-fest-tomballs-spooktacular-17-events-to-attend-in-tomball-magnolia-this-fall-season/,2025-10-01 22:50:11.994844,0.07450980392156858
"Missing Thornton girl, 15, last spotted Tuesday night, police say","Investigators are searching for a teenage girl who was last seen Tuesday night in southwest Thornton, police said. Serinity Lowery, 15, was last seen at about 7:30 p.m. Tuesday in the 8800 block of Huron Street, near where the street intersects 88th Avenue, according to the Thornton Police Department. Serinity is a 5-foot-6-inch, 120-pound girl with red hair and hazel eyes, police said. She was last seen wearing light pants and a dark sweatshirt with black sandals. Investigators are concerned for the teenager's safety, police said. Anyone with information on Serinity or her whereabouts is aske",The Denver Post,2025-10-01T08:31:19Z,https://www.denverpost.com/2025/10/01/thornton-missing-teenager-huron-street/,2025-10-01 22:50:17.245789,-0.04313725490196074
Brussels airport bomb threat update as Newcastle United fans flock to Belgium | Chronicle Live,"A flight was evacuated at Brussels Airport after a bomb threat was made, with passengers and crew removed from the plane and an investigation now underway A plane at Brussels Airport was held and passengers evacuated following a bomb threat. The news comes on the day hundreds of Newcastle United fans travelled to the Belgian capital to watch the Magpies take on Union SG. A Brussels airport spokesman, Ihsane Chioua Lekhli, confirmed there are no current disruptions to other travellers. ""All services at Brussels Airport are currently operational,"" she told the Mirror, meaning Newcastle fans trav",Chronicle Live,2025-10-01T14:27:31Z,https://www.chroniclelive.co.uk/sport/football/football-news/brussels-airport-bomb-threat-update-32590432,2025-10-01 22:50:19.100887,-0.003921568627450966
"Pakistani rangers open fire on protesters in PoJK, several casualties reported","The protests, led by the Jammu Kashmir Joint Awami Action Committee (JKJAAC), have resulted in over half a dozen casualties and several serious injuries in the past three days, according to the sources. Violent clashes erupted in Muzaffarabad, the capital of Pakistan-occupied Jammu and Kashmir (PoJK), as Pakistsecurity forces opened fire on peaceful protesters demanding the Self-Rule Charter of Demands. The protests, led by the Jammu Kashmir Joint Awami Action Committee (JKJAAC), have resulted in over half a dozen casualties and several serious injuries in the past three days, according to the",Economic Times,2025-10-01T14:23:13Z,https://economictimes.indiatimes.com/news/international/world-news/pakistani-rangers-open-fire-on-protesters-in-pojk-several-casualties-reported/articleshow/124261480.cms,2025-10-01 22:50:20.279638,-0.1843137254901961
"Why many young adults turn on TV or movie subtitles, according to a new poll","NEW YORK (AP) -- Taylor Heine, 35, is often multitasking when she watches TV shows or movies at home. ""I'll be playing on the phone, loving on my animals, maybe cleaning, picking up,"" she says. So she watches with the subtitles turned on. ""That way I can kind of switch back and forth, be able to listen to it or look back at the screen and I know what's going on, Heine says."" She can also catch up if she misses a piece of dialogue. It benefits her fiancé, too. ""When he's cooking or banging around in the kitchen, that way I don't have to blare the TV,"" she says. Closed captions or subtitles can ",The Baltimore Sun,2025-10-01T10:30:53Z,https://www.baltimoresun.com/2025/10/01/why-young-adults-use-subtitles/,2025-10-01 22:50:21.715407,0.07450980392156858
"Atlanta Braves manager Brian Snitker will not return in 2026, will take on senior advisory role","Atlanta Braves manager Brian Snitker will not return as manager next season, the team announced on Wednesday.

The 69-year-old Snitker told the organization that he will not be back in the role in 2026, but will remain with the club as a senior advisor. It was also announced that he will be inducted into the team's Hall of Fame before a game next season.

Advertisement

Advertisement Advertisement

[Yahoo Sports TV is here! Watch live shows and highlights 24/7]

Snitker was hired as interim manager early in the 2016 season and the team soon began to trend upward. Over his first three full seasons, the Braves' win total improved and the franchise would reach 100 wins in 2022 and 2023 after capturing the 2021 World Series title.

During Snitker's run he was a four-time NL Manager of the Year",Yahoo Sports Canada,2025-10-01T14:15:24Z,https://ca.sports.yahoo.com/news/atlanta-braves-manager-brian-snitker-will-not-return-in-2026-will-take-on-senior-advisory-role-141524311.html,2025-10-01 22:50:24.213472,0.4666666666666666
MOMO'S BREAKOUT BOARD : LIMN.......AKAN.......CAPS.......SLNH......,"CCSC Technology shares drop after $0.60 public offering pricing CCSC Technology International Holdings Ltd (NASDAQ:CCTG) saw its stock fall 16.9% on Wednesday after the Hong Kong-based interconnect products company announced it had priced its public offering at $0.60 per share. The offering includes 11,766,627 Class A ordinary shares, each accompanied by two warrants allowing the purchase of additional Class A shares. The warrants carry [...] Chijet shares surge after $1 billion private placement commitment Chijet Motor Company, Inc. (NASDAQ:CJET) saw its stock skyrocket 181.4% on Wednesday fo",Investors Hub,2025-10-01T14:26:04Z,https://investorshub.advfn.com/boards/read_msg.aspx?message_id=176763759,2025-10-01 22:50:26.069938,0.5058823529411764
Leonie James' journey from Varsity to the Bar,"“You need to be able to have that distance to be a good lawyer” Lauren Herd for Varsity

When Leonie James was at Clare College studying law, she dabbled in “bits and bobs of lots of things,” including writing for Varsity and the Tab. Her last article for Varsity was a review of Magdalene May Ball, published in June 2011. After graduation, James pursued a career in law. She is now a family law barrister at 1 King’s Bench Walk Chambers.

Do you think the Cambridge law course helped push you in the right career direction?

Yes, in the sense that I do family law explicitly now. I had a really amazing family teacher when I did family in Cambridge, and it was pretty much from that point that I decided that what I wanted to do was family.

Were you ever discouraged from going into family law, gi",Varsity Online,2025-10-01T14:06:28Z,https://www.varsity.co.uk/interviews/30366,2025-10-01 22:50:28.811142,0.08235294117647052
MOMO'S BREAKOUT BOARD : LKYRF took some REEs huge industry right...,"CCSC Technology shares drop after $0.60 public offering pricing CCSC Technology International Holdings Ltd (NASDAQ:CCTG) saw its stock fall 16.9% on Wednesday after the Hong Kong-based interconnect products company announced it had priced its public offering at $0.60 per share. The offering includes 11,766,627 Class A ordinary shares, each accompanied by two warrants allowing the purchase of additional Class A shares. The warrants carry [...] Chijet shares surge after $1 billion private placement commitment Chijet Motor Company, Inc. (NASDAQ:CJET) saw its stock skyrocket 181.4% on Wednesday fo",Investors Hub,2025-10-01T14:29:07Z,https://investorshub.advfn.com/boards/read_msg.aspx?message_id=176763782,2025-10-01 22:50:30.963570,0.5058823529411764
