title,content,source,published_at,url,collected_at,sentiment
Excitement builds ahead of upcoming photography exhibition in Kilkenny,"The Village Bar in Clogh, County Kilkenny, will play host to a unique photography exhibition this weekend, offering a heartfelt glimpse into the village’s past.

From Friday (October 4) to Sunday (October 6), visitors will be treated to the work of John Coffey, whose evocative photographs capture the characters and community spirit of Clogh between 1978 and 1988.

READ NEXT: Kilkenny's best kept secret? The pub that time forgot but history will remember

Originally from Newbridge, John Coffey moved to Clogh in 1979 and quickly became part of the local fabric, his family running a pub and him documenting village life through his lens.

His photographs, many of which feature people now sadly passed on, present an intimate record of a different way of life.

To prepare, John has spent countle",Kilkenny People,2025-10-01T14:32:25Z,https://www.kilkennypeople.ie/news/castlecomer/1908346/excitement-builds-ahead-of-upcoming-photography-exhibition-in-kilkenny.html,2025-10-01 22:40:10.168077,0.3647058823529412
Warren Hammond's Personal View: From R29K to R67K/oz - Gold's defining bull market since 2021,"From R29K to R67K/oz - Gold's defining bull market since 2021. Image: LinkedIn @Warren Hammond Back in March 2021, when Gold traded at $1 685/oz (R29 143) and investor attention was elsewhere, The Personal View outlined a simple thesis: gold was entering a new secular bull market. On 8 March 2021, I published ""The Personal View: Buying Gold"", recommending gold as a core portfolio holding and at the time buying AngloGold, Gold Fields, Barrick, Wheaton Precious Metals, and First Majestic Silver. Not every equity delivered, but the structural case for Gold has proven correct and transformative. S",The South African,2025-10-01T14:29:15Z,https://www.thesouthafrican.com/business/warren-hammonds-personal-view-from-r29k-to-r67k-oz-golds-defining-bull-market-since-2021/,2025-10-01 22:40:11.656528,0.1686274509803922
Job seekers brace for a 'new job hunt reality' amid labor market contradictions,"Listen to the article 2 min This audio is auto-generated. Please let us know if you have feedback

As the labor market sends mixed signals, more U.S. workers are preparing now for a potentially tougher future, according to a Sept. 24 report from Express Employment Professionals-Harris Poll.

Nearly 8 in 10 job seekers said they believe employers have the upper hand in today’s market, yet 44% are looking for a new job, marking a steady increase from 41% in fall 2024 and 35% in spring 2024.

“Today’s labor market is full of contradictions. Opportunities exist, but finding the right fit is harder than ever,” Bob Funk Jr., CEO, president and chairman of Express Employment International, said in a statement.

In a survey of 1,000 U.S. workers, 40% expressed worries about layoffs, 31% reported f",HR Dive,2025-10-01T14:26:00Z,https://www.hrdive.com/news/job-seekers-new-job-hunt-reality/761574/,2025-10-01 22:40:13.980734,0.1450980392156862
"Why many young adults turn on TV or movie subtitles, according to a new poll","NEW YORK (AP) -- Taylor Heine, 35, is often multitasking when she watches TV shows or movies at home. ""I'll be playing on the phone, loving on my animals, maybe cleaning, picking up,"" she says. So she watches with the subtitles turned on. ""That way I can kind of switch back and forth, be able to listen to it or look back at the screen and I know what's going on, Heine says."" She can also catch up if she misses a piece of dialogue. It benefits her fiancé, too. ""When he's cooking or banging around in the kitchen, that way I don't have to blare the TV,"" she says. Closed captions or subtitles can ",Macomb Daily,2025-10-01T10:30:59Z,https://www.macombdaily.com/2025/10/01/why-young-adults-use-subtitles/,2025-10-01 22:40:14.777602,0.07450980392156858
Nigeria at 65: Lagos Post Online Salutes a Nation of Resilience and Hope,"Advertising Agriculture Aviation/Airlines Banking/Finance Books Chemical Cinema Computers Culture/Arts Defense/Aerospace Education Electricity Entertainment Environment Food/Beverages Health Infectious Diseases Infrastructure Insurance Internet Technology Investment Logistics Maritime Mining Mobile Motoring Music Oil and Gas Pharmaceutical Renewable Energy Retail Sport Telecommunications Textile Tourism Transport Wood/Forest

Animals Asia Awards Basketball Business Children Coronavirus Cycling Development Economy Energy European Government Events/Media Advisory Football Foreign Policy Handicapped/Disabled Humanitarian Aid Justice/Legal Issues Labour Market Not for Profit Oil and Gas Discoveries Personnel Announcements Religion Rugby Technology Trade Urbanism/Cities Water/Sanitation Women

",Global Partnership for Education,2025-10-01T14:27:52Z,https://www.africa-newsroom.com/press/nigeria-at-65-lagos-post-online-salutes-a-nation-of-resilience-and-hope,2025-10-01 22:40:18.743353,0.3725490196078431
Ibanda coffee farmers upbeat despite drop in prices,"________________ Coffee farmers in Ibanda are optimistic of better days ahead despite the current drop in prices. Traders quoted Arabica coffee beans (clean) at sh16,000 per kilogramme in Ibanda town on October 1. But farmers with quality beans pocket sh17,000 per kilo. It costs sh16,500 a kilo in Nyakatookye, Kagongo division. This indicates a drop from sh18,000 during the first week of September. Robusta coffee costs sh13,500 per kilo in Ibanda town, but is lower at sh13,000 in Rushango town council, Ibanda North County. The beans were at sh15,000 per kilo at the beginning of last month. Mab",New Vision,2025-10-01T14:30:29Z,https://www.newvision.co.ug/category/business/ibanda-coffee-farmers-upbeat-despite-drop-in-NV_219643,2025-10-01 22:40:20.200118,0.1294117647058823
"Targhar station to transform airport connectivity for NMIA - TravelBiz Monitor: India travel news, travel trends, tourism","Separated only by a road from the upcoming Navi Mumbai International Airport (NMIA), the Targhar suburban railway station is nearing completion. With its strategic location, the station is set to become one of the most important suburban hubs in Mumbai’s rail network. The modern design and facilities reflect its role as a gateway, providing seamless airport access to thousands of daily commuters and travelers. Once operational, it will redefine suburban connectivity by linking trains directly to shuttle services heading towards the airport.

The station is designed with a wave-shaped roof, inspired by the nearby creek, making it a distinctive architectural landmark. This aesthetic choice not only blends with the local geography but also ensures that Targhar stands out as a recognisable tra","Travel Biz India : India travel news, travel trends, tourism ",2025-10-01T14:30:33Z,https://travelbizmonitor.com/top-stories/targhar-station-to-transform-airport-connectivity-for-nmia/,2025-10-01 22:40:23.823166,0.2078431372549019
Workers are avoiding advancement. How can HR adjust when no one wants to lead?,"Listen to the article 6 min This audio is auto-generated. Please let us know if you have feedback

The U.S. workforce may be in a leadership crisis: Recent research has suggested that nobody wants to be a supervisor anymore.

More than half of surveyed job seekers who are or were managers said they have left their roles — or plan to do so — because of a lack of fulfillment or advancement. Likewise, the majority of Gen Zers surveyed said they would rather develop their individual expertise than manage fellow workers, according to the results from Express Employment Professionals.

This is a trend sometimes called “conscious unbossing,” which Jennifer Dulski, CEO and founder of Rising Team, a talent development platform provider, defines as a “growing reluctance — especially among Gen Z — to",HR Dive,2025-10-01T14:26:00Z,https://www.hrdive.com/news/conscious-unbossing-workplace-trend/760946/,2025-10-01 22:40:25.632423,0.08235294117647052
Cathy Engelbert's huge future update amid fierce Napheesa Collier criticism,"Since being named as the first commissioner in WNBA history on May 15, 2019, Cathy Engelbert has presided over a period of unprecedented growth in women's professional basketball.

Engelbert, the former Deloitte CEO, helped secure a historic $2.2 billion media rights deal for the WNBA last year amid a 180 percent increase in franchise valuations. Under Engelbert's watch, organizations around the league have dedicated significant resources to state-of-the-art practice facilities that will ensure high-quality competition for years to come.

But Engelbert's tenure as commissioner has had its problems, too. Minnesota Lynx superstar Napheesa Collier laid those issues bare for all to see on Tuesday, when she claimed Engelbert and league leadership are the ""worst in the world"" at protecting the W",Sporting News,2025-10-01T14:28:24Z,https://www.sportingnews.com/us/wnba/news/cathy-engelbert-huge-future-update-amid-fierce-napheesa-collier-criticism/e39696e04fc113c338f69d51,2025-10-01 22:40:26.508957,-0.02745098039215688
International company set to buy South African company for R23 billion,"The takeover of Barloworld by a consortium of investors led by Saudi Arabia's Zahid Group has become unconditional. Barloworld is a JSE-listed industrial company and is the exclusive distributor of Caterpillar construction equipment in Southern Africa. The company is set to be acquired by Newco, which comprises Gulf Falcon Holding, a subsidiary of Saudi Arabia's Zahid Group, and Entsha, a company linked to Barloworld CEO Dominic Sewela. Zahid Group offers construction, energy, manufacturing, travel, financial, hospitality, oil and marketing services. Barloworld shareholders have now been advis",BusinessTech,2025-10-01T14:31:28Z,https://businesstech.co.za/news/trending/838825/international-company-set-to-buy-south-african-company-for-r23-billion/,2025-10-01 22:40:27.207600,0.388235294117647
Florida was a top destination for immigrants who came to the US under Biden,"ORLANDO, Fla. (AP) -- After Paola Freites was allowed into the U.S. in 2024, she and her husband settled in Florida, drawn by warm temperatures, a large Latino community and the ease of finding employment and housing. They were among hundreds of thousands of immigrants who came to the state in recent years as immigration surged under former President Joe Biden. No state has been more affected by the increase in immigrants than Florida, according to internal government data obtained by The Associated Press. Florida had 1,271 migrants who arrived from May 2023 to January 2025 for every 100,000 r",Winnipeg Free Press,2025-10-01T14:29:28Z,https://www.winnipegfreepress.com/arts-and-life/life/faith/2025/10/01/florida-was-a-top-destination-for-immigrants-who-came-to-the-us-under-biden-2,2025-10-01 22:40:28.220190,-0.0117647058823529
Bitcoin News Today: BTC Eyes $117K Resistance as Solana Climbs on Accumulation and ETF Hopes,"Bitcoin Rebounds to $114,000 as Crypto Market Cap Hits $3.91 Trillion, while Solana shows Accumulation Signs Bitcoin bounced back alongside the broader digital assets, as the cumulative crypto market cap rose 3.29% to $3.91 trillion. Almost 95% of the 100 largest cryptocurrencies recorded positive gains as investors returned to purchasing after a turbulent week. After opening at $113,000, Bitcoin price increased by 3.1% and surged above $150,000. The key support now holds at the range of $110,000 to $114,000, and immediate resistance is at $117,000 to $120,000. Technical indicators suggest con",Analytics Insight,2025-10-01T14:30:00Z,https://www.analyticsinsight.net/news/bitcoin-news-today-btc-eyes-117k-resistance-as-solana-climbs-on-accumulation-and-etf-hopes,2025-10-01 22:40:29.070396,0.3411764705882352
"Sterlite Electric, Rays Power Infra, Augmont and others file IPOs with SEBI - CNBC TV18","1. Sterlite Electric IPO | Vedanta Group firm Sterlite Electric has filed papers with SEBI for an IPO comprising a fresh issue of 77.9 lakh shares and an equal OFS. Proceeds will be used for debt repayment, capex, including new plants and machinery, and general corporate purposes. The company operates in power transmission and distribution, serving both domestic and global markets. 2. Rays Power Infra IPO | Mumbai-based Rays Power Infra aims to raise ₹1,150 crore through an IPO, including a fresh issue of ₹900 crore and OFS of ₹250 crore. Funds will go into its subsidiary Rays Green Energy for",cnbctv18.com,2025-10-01T14:31:56Z,https://www.cnbctv18.com/photos/market/upcoming-ipos-sterlite-electric-rays-power-infra-augmont-and-others-file-draft-papers-with-sebi-ws-e-19700285.htm,2025-10-01 22:40:30.641608,0.1529411764705881
How Spain's 'clickbait cities' are trying to lure tourists - at a cost to locals,"MADRID - Spanish cities are increasingly seeing themselves as digital brands, while also prioritising their appeal to tourists over the interests of the local population, a new book claims. Vicent Molins, an urban analyst and the author of Clickbait City, says a clear dividing line is emerging between the interests of those who want to promote cities to tourists and those who live in them. ""The city becomes audiovisual content created for social networks, tourist applications and digital media,"" Molins told The i Paper. Clickbait City, published earlier this year, contends that in many cases a",inews.co.uk,2025-10-01T14:30:00Z,https://inews.co.uk/news/world/spain-clickbait-cities-lure-tourists-at-cost-locals-3950111,2025-10-01 22:40:32.056816,0.1607843137254903
"Centre approves mitigation, recovery, reconstruction projects of Rs 4645.60 crore for nine states","New Delhi [India], October 1 (ANI): The Central government has approved a number of mitigation, recovery, and reconstruction projects with a total outlay of Rs 4645.60 crore to benefit nine states across the country. The project will benefit the states of Assam, Kerala, Madhya Pradesh, Odisha, Rajasthan, Uttar Pradesh, Bihar, Chhattisgarh, and Andhra Pradesh. A High-Level Committee (HLC), under the chairmanship of Union Home Minister Amit Shah, approved the project. The Committee, comprising the Finance Minister, the Agriculture Minister, and the Vice Chairman of NITI Aayog, considered the pro",ANI News,2025-10-01T14:30:56Z,https://www.aninews.in/news/national/general-news/centre-approves-mitigation-recovery-reconstruction-projects-of-rs-464560-crore-for-nine-states20251001195940/,2025-10-01 22:40:33.599388,0.3803921568627451
Florida was a top destination for immigrants who came to the US under Biden,"ORLANDO, Fla. (AP) -- After Paola Freites was allowed into the U.S. in 2024, she and her husband settled in Florida, drawn by warm temperatures, a large Latino community and the ease of finding employment and housing. They were among hundreds of thousands of immigrants who came to the state in recent years as immigration surged under former President Joe Biden. No state has been more affected by the increase in immigrants than Florida, according to internal government data obtained by The Associated Press. Florida had 1,271 migrants who arrived from May 2023 to January 2025 for every 100,000 r",Winnipeg Free Press,2025-10-01T14:28:08Z,https://www.winnipegfreepress.com/arts-and-life/life/faith/2025/10/01/florida-was-a-top-destination-for-immigrants-who-came-to-the-us-under-biden,2025-10-01 22:40:34.302010,-0.05098039215686279
Kenya begins construction of global commerce center to boost trade with China,"NAIROBI, Oct. 1 (Xinhua) -- Kenyan President William Ruto on Wednesday launched the construction of the five-billion-shillings (about 38.7 million U.S. dollars) China-Kenya International Commerce Center, a project designed to strengthen Sino-Kenyan trade and investment.

Senior government officials, industry executives, and local leaders attended the groundbreaking ceremony for the exhibition complex in Nairobi, Kenya's capital, which is developed by China Plaza Group Company.

Ruto said the landmark mixed-use project, covering more than 68,000 square meters, reflects strong confidence in Kenya's economy as a stable and predictable environment that rewards enterprise and guarantees fair returns for investors.

""The project will host a world-class exhibition and trade center, a five-star ho",english.news.cn,2025-10-01T14:31:45Z,https://english.news.cn/20251001/bfe0963244de4f38aec3a0f3bb805f3d/c.html,2025-10-01 22:40:35.795891,0.3647058823529412
Kanastra: Private Credit Infrastructure Gets A Full-Stack Overhaul,"Forbes contributors publish independent expert analyses and insights. At F-Prime, we have long tracked the rise of alternative assets as they become a core piece of the modern investment portfolio, and the subsequent rise of infrastructure players enabling their expansion. Within ""alts"", private credit has been one of the fastest-growing and most overlooked segments. With some estimates for the asset class standing at $1.8T (largely driven by direct lending in the US), others have sized the more complex asset-based finance market in emerging economies closer to $20T. In countries like Brazil, ",Forbes,2025-10-01T14:15:11Z,https://www.forbes.com/sites/rociowu/2025/10/01/kanastra-private-credit-infrastructure-gets-a-full-stack-overhaul/,2025-10-01 22:40:35.796462,0.3333333333333333
Across the CD-Verse: September 2025,"We’re back with another installment of our curated headlines from across the CD-Verse. From financial investments to a US brand that launched its products into space, September 2025 proved to be an exciting month in the beauty space.

CosmeticsDesign APAC

In the APAC region, financial investments, beauty tech launches, and one brand’s push to expand its presence in the natural hair care space caught our attention this month.

The US-headquartered alternative asset management firm announced its definitive agreement with JUNO, one of South Korea’s most prominent premium hair services and hair care brand, on September 2.

Although the investment sum was not disclosed, Blackstone told CosmeticsDesign-Asia to take reference from a report on Bloomberg, which mentioned that the company is buying",cosmeticsdesign.com,2025-10-01T14:27:10Z,https://www.cosmeticsdesign.com/Article/2025/10/01/across-the-cd-verse-september-2025/,2025-10-01 22:40:36.769649,0.5294117647058822
"Premier, Prime Minister Discuss Next Steps for Wind West","Premier Tim Houston will meet with Tim Hodgson, federal Minister of Energy and Natural Resources, in Ottawa today, October 1, and Prime Minister Mark Carney on Thursday, October 2, to discuss energy security and the economic benefits of the Wind West project.

“Wind West is a project of national significance and has the potential to make Nova Scotia a clean energy superpower and bring jobs and investment to our communities,” said Premier Houston. “It also can help Canada become a global powerhouse and the strongest economy in the G7.”

The Government of Canada has identified Wind West as a nation-building strategy and has committed to working with the Province to develop the project further and help make it a reality.

A strategic plan released by the Province last month outlines how the f",news.novascotia.ca,2025-10-01T14:29:35Z,https://news.novascotia.ca/en/2025/10/01/premier-prime-minister-discuss-next-steps-wind-west,2025-10-01 22:40:39.202121,0.6627450980392158
"""No one will be spared"": Sarbananda Sonowal assures action regarding Zubeen Garg's death","Jorhat (Assam) [India], October 1 (ANI): Union Minister and Rajya Sabha MP from Assam Sarbananda Sonowal on Wednesday assured that whoever is involved in the death of iconic singer Zubeen Garg, ""will not be spared"" and be ""given exemplary punishment"", amid the ongoing investigation by the Special Investigation Team (SIT). ""From the side of the government, the investigation which has started, the clear message from the government is that someone who is involved in the incident will be given the strictest punishment. That is clear. No one will be spared, whoever is involved will be given exempla",ANI News,2025-10-01T14:30:56Z,https://www.aninews.in/news/national/general-news/no-one-will-be-spared-sarbananda-sonowal-assures-action-regarding-zubeen-gargs-death20251001195919/,2025-10-01 22:40:40.174979,-0.003921568627450966
TOP 4 INSIGHTS C-SUITE LEADERS SHOULD FOCUS ON AS 2026 APPROACHES,"2025 arrived with a fizzle following the post election malaise, however that lethargy was shortlived as the second and third quarters whipped us all into a frenzy around everything from the AI maelstrom, to the reimagining of the entire marketing and advertising industries. As a result, many brands appeared uncertain of where to go next with their newly transformed organizations as customers remained emotionally detached, with spending stagnant, if not down, and returns on AI investments hard to justify. Within these seismic shifts, we witnessed a new breed of CMO continue to arise -- one prep",Forbes,2025-10-01T14:26:18Z,https://www.forbes.com/sites/billeehoward/2025/10/01/top-4-insights-c-suite-leaders-should-focus-on-as-2026-approaches/,2025-10-01 22:40:40.177749,0.2156862745098038
Uwaleke Advocates Coordinated Strategy To Drive Inclusive Growth - The Whistler Newspaper,"President of the Association of Capital Market Academics of Nigeria (ACMAN), Prof. Uche Uwaleke, has called for a deliberate and coordinated national strategy that strengthens institutions, fosters innovation, and accelerates digital inclusion, warning that Nigeria's development goals will remain elusive without such reforms. He stressed that inclusive and sustainable economic growth requires holistic action anchored on innovation, governance reforms, and digital transformation. Uwaleke, who is also a professor of Capital Market at Nasarawa State University, Keffi, noted that Nigeria must prio",The Whistler Nigeria,2025-10-01T14:27:23Z,https://thewhistler.ng/uwaleke-advocates-coordinated-strategy-to-drive-inclusive-growth/,2025-10-01 22:40:41.531708,0.3803921568627451
CDC Page Not Found - News Directory 3,"This data is provided to assist users in locating moved content. Please report any issues to the webmaster. Dr. Jennifer Chen is a board-certified physician with 12 years of medical practice and 8 years of health journalism experience. Dr. Chen has contributed to major health publication. She specializes in translating complex medical research into accessible content for the general public, covering topics from breakthrough treatments to public health policy. Her expertise spans preventive medicine, chronic disease management, and emerging health technologies.",News Directory 3,2025-10-01T14:22:47Z,https://www.newsdirectory3.com/cdc-page-not-found-107/,2025-10-01 22:40:44.343706,0.05098039215686279
Prediction markets still facing uncertainty as regulators sidestep sports contracts | Yogonet International,"Sports event contracts remained largely unaddressed at a joint SEC-CFTC roundtable this week, leaving unresolved questions for prediction markets Kalshi and Polymarket as state and federal regulators continue to scrutinize the products. CFTC Rule 40.11 prohibits event contracts on subjects such as terrorism, war, assassination, and gaming. Several jurisdictions have challenged prediction markets, arguing they conflict with state laws. Despite the anticipation that the four-hour session would address how such contracts could be regulated, panelists did not provide clarity. Executives from Kalsh",yogonet.com,2025-10-01T04:24:41Z,https://www.yogonet.com/international/news/2025/10/01/115601-prediction-markets-still-facing-uncertainty-as-regulators-sidestep-sports-contracts,2025-10-01 22:40:46.105416,0.1686274509803922
Citi Investor Services Extends Single Event Processing Technology to North America | PYMNTS.com,"By completing this form, you agree to receive marketing communications from PYMNTS and to the sharing of your information with our sponsor, if applicable, in accordance with our Privacy Policy and Terms and Conditions. SEP enables real-time asset servicing so that clients can have greater access to funds and improved accuracy, the bank said in a Wednesday (Oct. 1) press release. The technology was initially launched in select European markets and with International Central Securities Depositories and, together with its rollout in North America, will be extended to the rest of Citi's custody ne",PYMNTS.com,2025-10-01T14:26:59Z,https://www.pymnts.com/news/banking/2025/citi-investor-services-extends-single-event-processing-technology-north-america/,2025-10-01 22:40:47.499820,0.3725490196078431
Ottawa denies Marineland request to export its remaining beluga whales to China,"Ottawa has denied a request from Marineland to send its remaining beluga whales to China.

Fisheries Minister Joanne Thompson says the federal government will not grant an export permit to ship the 30 whales to the Chimelong Ocean Kingdom aquarium.

Thompson says approving the request would mean a continued life in captivity and a return to public entertainment for the whales.

She says the decision is consistent with a 2019 law that banned whale and dolphin captivity, made entertainment shows illegal and forbade breeding.

Twenty whales have died at Marineland since 2019 and the 30 that remain are the last captive whales in Canada.

Marineland did not immediately respond to a request for comment.

This report by The Canadian Press was first published Oct. 1, 2025.

Liam Casey, The Canadia",BayToday.ca,2025-10-01T14:20:00Z,https://www.baytoday.ca/national-news/ottawa-denies-marineland-request-to-export-its-remaining-beluga-whales-to-china-11288287,2025-10-01 22:40:48.884248,-0.1764705882352942
