title,content,source,published_at,url,collected_at,sentiment
"Zepto's Aadit Palicha, Kaivalya Vohra youngest billionaires in Hurun India Rich List 2025","New Delhi | Aadit Palicha and Kaivalya Vohra, the Gen-Z co-founders of e-commerce platform Zepto, have emerged as the youngest billionaires featured on the M3M Hurun India Rich List 2025. Vohra and Palicha boast net worths of Rs 4,480 crore and Rs 5,380 crore, respectively. Since its launch in 2021, Zepto has rapidly grown to become one of India's leading quick commerce players, with its latest valuation pegged at USD 5.9 billion. ""The meteoric rise of Zepto's co-founders, Kaivalya Vohra, 22, and Aadit Palicha, 23, highlights how technology and innovation are compressing wealth-creation timeli",metrovaartha.com,2025-10-01T14:31:45Z,https://english.metrovaartha.com/economy/business/zeptos-aadit-palicha-kaivalya-vohra-youngest-billionaires-in-hurun-india-rich-list-2025,2025-10-01 22:59:27.469732,0.2156862745098038
Sanofi Commits Additional $625M to Sanofi Ventures to Fuel Biotech and Digital Health Innovation,"- Sanofi Ventures has announced a significant $625M multi-year capital commitment from Sanofi, substantially increasing its total assets under management (AUM) to over $1.4B. - The new capital injection into the evergreen venture fund reinforces Sanofi's strong belief that important medical breakthroughs often begin in early-stage companies. The new funding commitment builds on more than a decade of investing in innovative biotech and digital health companies that align with Sanofi's long-term growth ambitions. Sanofi Ventures, the corporate venture capital arm of Sanofi, will remain focused o",HIT Consultant Media,2025-10-01T13:15:34Z,https://hitconsultant.net/2025/10/01/sanofi-commits-additional-625m-to-sanofi-ventures/,2025-10-01 22:59:28.463235,0.7490196078431373
"Interpolitan Money Secures DFSA Category 3C And 4C Licences, Expanding Its Service Offering In UAE As Part Of Global Growth","Interpolitan Money Secures DFSA Category 3C And 4C Licences, Expanding Its Service Offering In UAE As Part Of Global Growth

Alternative banking solutions provider Interpolitan Money has been granted both a Category 3C and 4C licence by the Dubai Financial Services Authority (DFSA), marking a significant milestone in the firm’s global expansion strategy and strengthening its presence in the Middle East.

The dual licences follow Interpolitan’s recent approval with FINTRAC in Canada earlier this year, alongside its original FCA licence in the UK. Gaining approval as an Authorised Firm in the Dubai International Financial Centre (DIFC) enables Interpolitan Money to broaden its financial services and advisory capabilities in one of the world’s most dynamic financial hubs.

Together, the licen",Financial IT,2025-10-01T14:33:24Z,https://financialit.net/news/banking/interpolitan-money-secures-dfsa-category-3c-and-4c-licences-expanding-its-service,2025-10-01 22:59:31.375286,0.584313725490196
Fusian honoring Breast Cancer Awareness with pink sushi,"Fusian honoring Breast Cancer Awareness with pink sushi

Photo: Fusian

October 1, 2025

Fast casual restaurant chain Fusian is offering pink sushi rolls throughout October to raise money for the Breast Cancer Fund of Ohio.

For every sushi roll made with a special pink soy wrap, the company will donate $1 to the organization. The donations will help provide emergency financial assistance to breast cancer patients undergoing active treatment in Ohio, according to a press release.

""We want to do something that feels authentic to FUSIAN and is genuinely impactful, as everyone knows someone who has been affected by breast cancer,"" Stephan Harman, co-founder of Fusian, said the release. ""By choosing a pink roll, our guests have the power to support the strength and resilience of patients righ",Fast Casual,2025-10-01T13:57:56Z,https://www.fastcasual.com/news/fusian-honoring-breast-cancer-awareness-with-pink-sushi/,2025-10-01 22:59:34.131718,0.1372549019607843
Candles? As Gifts? Groundbreaking. Try This Chic Scent Diffuser Instead.,"Something I unabashedly love about myself is that I am a great gift giver. I’ve given friends unique jewelry pieces that wind up in their daily rotation, surprised my parents with sweet birthday treats that fit within their diet, and once gifted my fiancé’s brother-in-law (a guy I barely knew) with coffee beans so good he still orders them to this day. I guess you could say this talent is just my gift in life.

If you’re wondering how you, too, can become an expert-level gifter, here’s my secret: always choose the unexpected. The best presents are the ones people might not buy for themselves but end up using every single day. That’s why, this holiday season, I’m skipping the predictable candle aisle and reaching for something more chic, more versatile, and — honestly — more fun: the Air Wi",Bustle,2025-10-01T13:01:43Z,https://www.bustle.com/shopping/candles-as-gifts-groundbreaking-try-this-chic-scent-diffuser-instead,2025-10-01 22:59:35.462609,0.4745098039215687
Qair starts construction of floating solar plant in Seychelles,"Qair has launched construction of the Seysun Lagoon floating photovoltaics (PV) plant, a 5.8 MW project located in the Providence Lagoon on Mahé Island, Seychelles.

The ceremony was held in the presence of Flavien Joubert, Minister of Agriculture, Climate Change and Environment, Billy Rangasamy, Minister of Lands and Housing, Bernard Georges, Leader of Government Business in the National Assembly, Anne Tallineau, Ambassador of France to Seychelles, Tony Imaduwa, Principal Secretary for Climate Change and Energy, and senior officials of the Public Utilities Corp. (PUC).

Just weeks after financial close, the project is now entering its final development stage. Backed by a long-term power purchase agreement, all electricity generated will be sold to the PUC, directly contributing to Seychel",Energy Global,2025-10-01T14:33:34Z,https://www.energyglobal.com/solar/01102025/qair-starts-construction-of-floating-solar-plant-in-seychelles/,2025-10-01 22:59:38.046281,0.4274509803921569
"Why is the 2025 U.S. government shut down? Full impact explained: national parks, Social Security, USPS, military pay, key services  --  and when will Washington reopen?","U.S. government officially shut down on October 1, 2025, after Congress failed to pass a budget agreement. While painful for many federal employees and service users, experts say most Americans won't see major impacts if the shutdown lasts a short time. However, longer shutdowns could disrupt financial markets, travel, and essential services, raising concerns for household finances and security. The U.S. federal government officially shut down at 12:01 a.m. on October 1, 2025. Congress failed to pass a funding bill in time, triggering the first full government shutdown in nearly seven years. F",Economic Times,2025-10-01T14:24:52Z,https://economictimes.indiatimes.com/news/international/us/why-the-u-s-government-is-shut-down-in-2025-are-national-parks-social-security-usps-military-pay-and-key-services-affected-and-when-will-washington-reopen/articleshow/124261100.cms,2025-10-01 22:59:39.560134,-0.05098039215686279
FTC Sues Zillow and Redfin Over Allegedly Suppressing Rental Ad Competition,"A home that Zillow shows was sold for more than $2 million in the Coconut Grove neighborhood in Miami, Fla., on Feb. 18, 2022. Joe Raedle/Getty Images",www.theepochtimes.com,2025-10-01T14:32:44Z,https://www.theepochtimes.com/us/ftc-sues-zillow-and-redfin-over-allegedly-suppressing-rental-ad-competition-5922850,2025-10-01 22:59:40.793185,-0.2392156862745098
Machi Big Brother Faces $9M Loss After $44M Profit on Hyperliquid - Crypto Economy,"Taiwanese music star and crypto investor Jeffrey Huang, widely known as Machi Big Brother, is facing a substantial floating loss on his Hyperliquid account. Blockchain data shows Huang's account ""0x020c,"" also recognized for holding rare Bored Ape Yacht Club NFTs, is down roughly $8.7 million on a 5x leveraged long position in the Plasma (XPL) token. This sharp decline comes after a peak profit of around $44 million only 13 days ago. The leveraged trade, which bets on XPL price appreciation, has a liquidation threshold set at $0.5366. Huang has continued holding despite funding fees exceeding ",Crypto Economy,2025-10-01T14:26:10Z,https://crypto-economy.com/machi-big-brother-faces-9m-loss-after-44m-profit-on-hyperliquid/,2025-10-01 22:59:43.093129,0.1294117647058823
Google Play Opens A New Channel For Branded Payments,"Google Play Opens A New Channel For Branded Payments

Blackhawk Network (BHN), a global leader in branded payment solutions, today announced it will partner with Google Play to launch a gift card mall in the Play Store. By combining BHN’s world-class digital gifting portfolio and technology with the reach of Google Play, a global digital content store, the companies are creating a premier destination for digital gifting. For the first time, users will be able to purchase and send gift cards from the world’s leading brands, including BHN’s exclusive Originals, directly inside the Play Store. Purchases are completed in the Play Store with secure delivery by email or text.

Google Play serves more than 2.5 billion monthly users in over 190 markets. Demand for digital gift cards continues to a",Financial IT,2025-10-01T14:33:24Z,https://financialit.net/news/payments/google-play-opens-new-channel-branded-payments,2025-10-01 22:59:45.633072,0.607843137254902
CrossFire Alert - Fast alerts. Smarter entries.,"Saves time by sending alerts so you don't need to monitor the charts constantly. This Expert Advisor uses retail trader sentiment from the Ziwox API to implement a contrarian trading strategy, taking trades opposite to the majority of retail positions. By combining sentiment data with a moving average trend filter, it identifies potential market reversals and avoids crowded trades. The EA automatically fetches and parses sentiment in real-time, executes buy or sell orders based on contrarian logic, and displays clear visual indicators of retail long and short ratios directly on the chart, prov",mql5.com,2025-10-01T14:24:25Z,https://www.mql5.com/pt/code/64331,2025-10-01 22:59:47.416704,0.1529411764705881
MOMO'S BREAKOUT BOARD : $PTOP Signs LOI with INS Digital Intelli...,"CCSC Technology shares drop after $0.60 public offering pricing CCSC Technology International Holdings Ltd (NASDAQ:CCTG) saw its stock fall 16.9% on Wednesday after the Hong Kong-based interconnect products company announced it had priced its public offering at $0.60 per share. The offering includes 11,766,627 Class A ordinary shares, each accompanied by two warrants allowing the purchase of additional Class A shares. The warrants carry [...] Chijet shares surge after $1 billion private placement commitment Chijet Motor Company, Inc. (NASDAQ:CJET) saw its stock skyrocket 181.4% on Wednesday fo",Investors Hub,2025-10-01T14:21:56Z,https://investorshub.advfn.com/boards/read_msg.aspx?message_id=176763718,2025-10-01 22:59:48.905406,0.5058823529411764
"The 2025 BE Smart HBCU Hackathon: More Students, More Impact","HBCU by Ashlei Stevens The 2025 BE Smart HBCU Hackathon: More Students, More Impact Themed “Built Brilliant. Built Different: 10 Years of Elevating Excellence,” the Hackathon sets the stage for a unique coding competition that fosters innovation, collaboration, empowerment, and engagement with the latest cutting-edge technology.







The 2025 BE Smart HBCU Hackathon Celebrates a Decade of Tech Excellence

More than 300 students from 43 historically Black colleges and universities (HBCUs) will showcase their tech talent and compete for jobs at Black Enterprise’s 10th Annual BE Smart Hackathon. Hosted by American Airlines, the Nov. 5-8 coding competition in Charlotte gathers the largest pool of students in the event’s history. This year, there are 310 students from 43 schools forming 62 te",Black Enterprise,2025-10-01T14:30:00Z,https://www.blackenterprise.com/more-students-more-impact-hackathon/,2025-10-01 22:59:51.409123,0.4509803921568627
Tourism Confederation renews call for 9% VAT rate,"The Irish Tourism Industry Confederation (ITIC) has renewed its call for the 9% VAT rate for the food-led hospitality sector to be restored at the start of next year.

The chief executive of ITIC said Budget 2026, which will be announced next week, is ""vital for the sector"" and he called on the Government to cut the rate from 13.5% on 1 January.

Eoghan O'Mara Walsh made the comments at confederation’s annual conference at the Lyrath Estate in Kilkenny, which is being attend by over 350 tourism industry figures.

He said the costs of business are ""a huge burden on tourism enterprises up and down the country"" and he added that ""margins are really, really being squeezed"".

Mr O’Mara Walsh said the one thing that the Government can control is the applicable VAT rate.

""So, VAT needs to be res",RTE.ie,2025-10-01T14:21:47Z,https://www.rte.ie/news/business/2025/1001/1536305-tourism-vat-rate/,2025-10-01 22:59:53.294457,0.03529411764705892
Florida was a top destination for immigrants who came to the US under Biden,"ORLANDO, Fla. (AP) — After Paola Freites was allowed into the U.S. in 2024, she and her husband settled in Florida, drawn by warm temperatures, a large Latino community and the ease of finding employment and housing.

They were among hundreds of thousands of immigrants who came to the state in recent years as immigration surged under former President Joe Biden.

No state has been more affected by the increase in immigrants than Florida, according to internal government data obtained by The Associated Press. Florida had 1,271 migrants who arrived from May 2023 to January 2025 for every 100,000 residents, followed by New York, California, Texas and Illinois.

Advertisement Advertisement

Advertisement Advertisement

Freites and her husband fled violence in Colombia with their three children.",Yahoo,2025-10-01T14:29:28Z,https://ca.news.yahoo.com/florida-top-destination-immigrants-came-142928913.html,2025-10-01 22:59:54.680018,-0.0117647058823529
"Pakistani rangers open fire on protesters in PoJK, several casualties reported","The protests, led by the Jammu Kashmir Joint Awami Action Committee (JKJAAC), have resulted in over half a dozen casualties and several serious injuries in the past three days, according to the sources. Violent clashes erupted in Muzaffarabad, the capital of Pakistan-occupied Jammu and Kashmir (PoJK), as Pakistsecurity forces opened fire on peaceful protesters demanding the Self-Rule Charter of Demands. The protests, led by the Jammu Kashmir Joint Awami Action Committee (JKJAAC), have resulted in over half a dozen casualties and several serious injuries in the past three days, according to the",Economic Times,2025-10-01T14:23:13Z,https://economictimes.indiatimes.com/news/international/world-news/pakistani-rangers-open-fire-on-protesters-in-pojk-several-casualties-reported/articleshow/124261480.cms,2025-10-01 22:59:56.249851,-0.1843137254901961
Brussels airport bomb threat update as Newcastle United fans flock to Belgium | Chronicle Live,"A flight was evacuated at Brussels Airport after a bomb threat was made, with passengers and crew removed from the plane and an investigation now underway A plane at Brussels Airport was held and passengers evacuated following a bomb threat. The news comes on the day hundreds of Newcastle United fans travelled to the Belgian capital to watch the Magpies take on Union SG. A Brussels airport spokesman, Ihsane Chioua Lekhli, confirmed there are no current disruptions to other travellers. ""All services at Brussels Airport are currently operational,"" she told the Mirror, meaning Newcastle fans trav",Chronicle Live,2025-10-01T14:27:31Z,https://www.chroniclelive.co.uk/sport/football/football-news/brussels-airport-bomb-threat-update-32590432,2025-10-01 22:59:58.337851,-0.003921568627450966
"Missing Thornton girl, 15, last spotted Tuesday night, police say","Investigators are searching for a teenage girl who was last seen Tuesday night in southwest Thornton, police said. Serinity Lowery, 15, was last seen at about 7:30 p.m. Tuesday in the 8800 block of Huron Street, near where the street intersects 88th Avenue, according to the Thornton Police Department. Serinity is a 5-foot-6-inch, 120-pound girl with red hair and hazel eyes, police said. She was last seen wearing light pants and a dark sweatshirt with black sandals. Investigators are concerned for the teenager's safety, police said. Anyone with information on Serinity or her whereabouts is aske",The Denver Post,2025-10-01T08:31:19Z,https://www.denverpost.com/2025/10/01/thornton-missing-teenager-huron-street/,2025-10-01 22:59:59.033910,-0.04313725490196074
"Why many young adults turn on TV or movie subtitles, according to a new poll","NEW YORK (AP) -- Taylor Heine, 35, is often multitasking when she watches TV shows or movies at home. ""I'll be playing on the phone, loving on my animals, maybe cleaning, picking up,"" she says. So she watches with the subtitles turned on. ""That way I can kind of switch back and forth, be able to listen to it or look back at the screen and I know what's going on, Heine says."" She can also catch up if she misses a piece of dialogue. It benefits her fiancé, too. ""When he's cooking or banging around in the kitchen, that way I don't have to blare the TV,"" she says. Closed captions or subtitles can ",The Baltimore Sun,2025-10-01T10:30:53Z,https://www.baltimoresun.com/2025/10/01/why-young-adults-use-subtitles/,2025-10-01 23:00:00.022398,0.07450980392156858
"Atlanta Braves manager Brian Snitker will not return in 2026, will take on senior advisory role","Atlanta Braves manager Brian Snitker will not return as manager next season, the team announced on Wednesday.

The 69-year-old Snitker told the organization that he will not be back in the role in 2026, but will remain with the club as a senior advisor. It was also announced that he will be inducted into the team's Hall of Fame before a game next season.

Advertisement

Advertisement Advertisement

[Yahoo Sports TV is here! Watch live shows and highlights 24/7]

Snitker was hired as interim manager early in the 2016 season and the team soon began to trend upward. Over his first three full seasons, the Braves' win total improved and the franchise would reach 100 wins in 2022 and 2023 after capturing the 2021 World Series title.

During Snitker's run he was a four-time NL Manager of the Year",Yahoo Sports Canada,2025-10-01T14:15:24Z,https://ca.sports.yahoo.com/news/atlanta-braves-manager-brian-snitker-will-not-return-in-2026-will-take-on-senior-advisory-role-141524311.html,2025-10-01 23:00:02.383638,0.4666666666666666
MOMO'S BREAKOUT BOARD : LIMN.......AKAN.......CAPS.......SLNH......,"CCSC Technology shares drop after $0.60 public offering pricing CCSC Technology International Holdings Ltd (NASDAQ:CCTG) saw its stock fall 16.9% on Wednesday after the Hong Kong-based interconnect products company announced it had priced its public offering at $0.60 per share. The offering includes 11,766,627 Class A ordinary shares, each accompanied by two warrants allowing the purchase of additional Class A shares. The warrants carry [...] Chijet shares surge after $1 billion private placement commitment Chijet Motor Company, Inc. (NASDAQ:CJET) saw its stock skyrocket 181.4% on Wednesday fo",Investors Hub,2025-10-01T14:26:04Z,https://investorshub.advfn.com/boards/read_msg.aspx?message_id=176763759,2025-10-01 23:00:07.533721,0.5058823529411764
Leonie James' journey from Varsity to the Bar,"“You need to be able to have that distance to be a good lawyer” Lauren Herd for Varsity

When Leonie James was at Clare College studying law, she dabbled in “bits and bobs of lots of things,” including writing for Varsity and the Tab. Her last article for Varsity was a review of Magdalene May Ball, published in June 2011. After graduation, James pursued a career in law. She is now a family law barrister at 1 King’s Bench Walk Chambers.

Do you think the Cambridge law course helped push you in the right career direction?

Yes, in the sense that I do family law explicitly now. I had a really amazing family teacher when I did family in Cambridge, and it was pretty much from that point that I decided that what I wanted to do was family.

Were you ever discouraged from going into family law, gi",Varsity Online,2025-10-01T14:06:28Z,https://www.varsity.co.uk/interviews/30366,2025-10-01 23:00:09.560437,0.08235294117647052
MOMO'S BREAKOUT BOARD : LKYRF took some REEs huge industry right...,"CCSC Technology shares drop after $0.60 public offering pricing CCSC Technology International Holdings Ltd (NASDAQ:CCTG) saw its stock fall 16.9% on Wednesday after the Hong Kong-based interconnect products company announced it had priced its public offering at $0.60 per share. The offering includes 11,766,627 Class A ordinary shares, each accompanied by two warrants allowing the purchase of additional Class A shares. The warrants carry [...] Chijet shares surge after $1 billion private placement commitment Chijet Motor Company, Inc. (NASDAQ:CJET) saw its stock skyrocket 181.4% on Wednesday fo",Investors Hub,2025-10-01T14:29:07Z,https://investorshub.advfn.com/boards/read_msg.aspx?message_id=176763782,2025-10-01 23:00:11.675644,0.5058823529411764
"EU mulls using frozen Russian assets for loan to Ukraine, wary of legal issues","European leaders generally support using €140 billion of frozen Russian assets to provide a loan to Ukraine, repayable only after Russia pays war reparations. Legal issues, including respecting sovereign asset rights, remain a concern. EU governments would guarantee the loan for Ukraine's military and operational needs. European leaders expressed general support on Wednesday for the idea of using Russian assets frozen in the West to provide a 140 billion euro loan to Ukraine, but said some legal aspects of the operation would need to be clarified first. Since U.S. military financing for Kyiv i",Economic Times,2025-10-01T14:20:37Z,https://economictimes.indiatimes.com/news/defence/eu-mulls-using-frozen-russian-assets-for-loan-to-ukraine-wary-of-legal-issues/articleshow/124261427.cms,2025-10-01 23:00:13.135056,0.2549019607843137
japanese customs,"Secrets of an Innkeeper: 3 Japanese guesthouse habits we could all learn from At the beginning of this year, my husband and I took over management of a guesthouse in Japan. While we were looking forward to our new role in the community, the truth is that we were already busy enough without taking on yet another daily responsibility. But in the countryside, where it's hard to find employees willing to come and live far from convenience stores and flush toilets, most of us are already doing double or triple duty to keep our little villages alive. And where I live, tourism is a big part of that. ",SoraNews24 -Japan News-,2025-10-01T14:32:47Z,https://soranews24.com/tag/japanese-customs/,2025-10-01 23:00:14.480664,0.3333333333333333
Jordan And India Deepen Cultural And Travel Ties As Jordan Tourism Board Positions The Kingdom As A Diverse Destination For Indian Travelers - Travel And Tour World,"The Jordan Tourism Board (JTB) recently concluded a highly successful two-city roadshow in Mumbai and Delhi, aimed at strengthening tourism ties between Jordan and India. The roadshow sought to position Jordan as a premier travel destination for Indian tourists by showcasing its unique blend of history, natural beauty, and diverse experiences. Through this initiative, the JTB emphasized Jordan's accessibility, cultural richness, and varied offerings that cater to every kind of traveller, fostering a deeper connection between the two nations and encouraging more Indian visitors to explore all t",Travel And Tour World,2025-10-01T14:30:00Z,https://www.travelandtourworld.com/news/article/jordan-and-india-deepen-cultural-and-travel-ties-as-jordan-tourism-board-positions-the-kingdom-as-a-diverse-destination-for-indian-travelers/,2025-10-01 23:00:17.013182,0.6549019607843136
"British Gas, Octopus, EDF, EON customers can use five laundry tips to cut bills - Birmingham Live","Five simple changes to your household laundry habits can cut your energy bills as the Ofgem price cap rises. Ofgem's cap has risen by two per cent or £35 from October 1, going up from £1,720 to £1,755. This is based on the average amount spent per year by a typical household that uses electricity and gas and pays by direct debit but your actual bills depend on usage and could be higher. With energy consumption set to rise naturally as we head into autumn and winter, it's a good idea to be efficient with fuel usage in the home. Experts have shared some simple washing machine tips that could hel",Birmingham Mail,2025-10-01T14:26:27Z,https://www.birminghammail.co.uk/news/cost-of-living/five-tips-laundry-cut-bills-32590284,2025-10-01 23:00:19.361846,0.2941176470588236
