title,content,source,published_at,url,category,collected_at
"BTC, XRP, ETH, SOL News: Gauging Post-Inflation Price Volatility","{ window.open(this.href, '_blank'); }, 200); return false;""&gt;Why did Beyond Meat stock surge then tumble? { window.open(this.href, '_blank'); }, 200); return false;""&gt;How will Trumps new Russia o… [+814 chars]",Biztoc.com,2025-10-24T07:27:03Z,https://biztoc.com/x/e61e1f731e96996b,Market-Wide,2025-10-25 16:18:19.777827
7 smallcap stocks with double-digit Sales growth in Q2: one turned multibagger,"Oct 24, 2025, 11:28:59 AM IST
The earnings season is gaining momentum, with 108 smallcap companies reporting their September quarter results. A deeper dive into the numbers reveals that 42 firms ach… [+2680 chars]",Economictimes.com,2025-10-24T05:46:56Z,https://m.economictimes.com/markets/stocks/news/7-smallcap-stocks-with-double-digit-sales-growth-in-q2-one-turned-multibagger/sales-surge/slideshow/124778088.cms,Market-Wide,2025-10-25 16:18:19.777866
Cathie Wood-Backed Solana Treasury Explodes 50% After Revealing ‘Aggressive’ M&A and SOL Buys,"Solmate Infrastructure, a Cathie Wood-backed Solana-focused digital asset treasury, saw its shares soar by nearly 50% on Wednesday after unveiling plans for an aggressive mergers and acquisitions str… [+4728 chars]",Cryptonews,2025-10-24T05:41:08Z,https://cryptonews.com/news/cathie-wood-backed-solana-treasury-explodes-50-after-revealing-aggressive-ma-and-sol-buys/,Market-Wide,2025-10-25 16:18:19.777884
Exploring 3 High Growth Tech Stocks in Europe,"The European market has shown mixed performance recently, with the pan-European STOXX Europe 600 Index edging higher due to dovish signals from the U.S. Federal Reserve and easing trade tensions betw… [+5920 chars]",Yahoo Entertainment,2025-10-24T05:38:06Z,https://finance.yahoo.com/news/exploring-3-high-growth-tech-053806226.html,Market-Wide,2025-10-25 16:18:19.777899
Tamo turns TMPV! Tata Motors shares get a new name from today after the demerger,"Starting today, October 24, shares ofc will trade as Tata Motors Passenger Vehicles (TMPV), marking the formal completion of the companys renaming process after its recent demerger. The BSE had previ… [+2351 chars]",The Times of India,2025-10-24T04:47:12Z,https://economictimes.indiatimes.com/markets/stocks/news/tamo-turns-tmpv-tata-motors-shares-get-a-new-name-from-today-after-the-demerger/articleshow/124776887.cms,Market-Wide,2025-10-25 16:18:19.777913
"Nifty rally fuels renewed optimism; analysts eye 30,800 as medium-term target","The Nifty 50 extended its winning streak on Thursday, inching closer to its all-time high as optimism returned to Indian equities. With key technical levels being breached and supportive macro cues i… [+4137 chars]",The Times of India,2025-10-24T03:37:18Z,https://economictimes.indiatimes.com/markets/stocks/news/nifty-rally-fuels-renewed-optimism-analysts-eye-30800-as-medium-term-target/articleshow/124775841.cms,Market-Wide,2025-10-25 16:18:19.777928
"T-Mobile Raises Outlook, So Why Is Wall Street Selling?","Benzinga and Yahoo Finance LLC may earn commission or revenue on some items through the links below.
T-Mobile US, Inc. (NASDAQ:TMUS) stock dropped slightly after it released its third-quarter result… [+7178 chars]",Yahoo Entertainment,2025-10-24T03:31:04Z,https://finance.yahoo.com/news/t-mobile-raises-outlook-why-033104376.html,Market-Wide,2025-10-25 16:18:19.777941
Bitcoin climbs to $111K as a pardon for Binance’s ‘CZ’ fuels a broad crypto rally,"<ul><li>The crypto market is rallying, with Bitcoin climbing 2.7 percent to over $110,700.</li><li>The rally was fueled by a presidential pardon for the Binance founder “CZ.”</li><li>The pardon for C… [+2501 chars]",Coinjournal.net,2025-10-24T03:14:50Z,https://coinjournal.net/news/bitcoin-climbs-to-111k-as-a-pardon-for-binances-cz-fuels-a-broad-crypto-rally/,Market-Wide,2025-10-25 16:18:19.777955
ASX Penny Stocks With Market Caps Over A$30M To Watch,"As the Australian share market edges towards a soft upswing, buoyed by global political developments and commodity price movements, investors are keenly observing potential opportunities. Penny stock… [+5519 chars]",Yahoo Entertainment,2025-10-24T03:05:14Z,https://finance.yahoo.com/news/asx-penny-stocks-market-caps-030514119.html,Market-Wide,2025-10-25 16:18:19.777968
"CoreWeave Is 'Frightening... It's Unbelievable,' Says Expert, Expecting Its Revenue To Multiply Nearly 5x By 2028","Benzinga and Yahoo Finance LLC may earn commission or revenue on some items through the links below.
Specialist AI cloud provider CoreWeave Inc. (NASDAQ:CRWV) is on a frightening growth trajectory, … [+7263 chars]",Yahoo Entertainment,2025-10-24T02:31:33Z,https://finance.yahoo.com/news/coreweave-frightening-unbelievable-says-expert-023133241.html,Market-Wide,2025-10-25 16:18:19.777983
How Investors May Respond To Moderna (MRNA) Halting Development of mRNA-1647 CMV Vaccine,"<ul><li>Moderna announced in October 2025 that it will discontinue development of its investigational cytomegalovirus (CMV) vaccine, mRNA-1647, following disappointing results from a Phase 3 clinical… [+4053 chars]",Yahoo Entertainment,2025-10-24T01:15:32Z,https://finance.yahoo.com/news/investors-may-respond-moderna-mrna-011532187.html,Market-Wide,2025-10-25 16:18:19.777998
A Look At The Intrinsic Value Of Genting Singapore Limited (SGX:G13),"<ul><li>The projected fair value for Genting Singapore is S$0.89 based on 2 Stage Free Cash Flow to Equity
</li><li>Current share price of S$0.74 suggests Genting Singapore is potentially trading cl… [+7747 chars]",Yahoo Entertainment,2025-10-24T00:37:31Z,https://finance.yahoo.com/news/look-intrinsic-value-genting-singapore-003731825.html,Market-Wide,2025-10-25 16:18:19.778011
This 6.7%-Yielding Dividend Aristocrat Has Raised Its Payout 60 Times in the Last 56 Years. Should You Buy?,"For investors seeking reliable income, Dividend Aristocrats could be solid long-term investments. These are companies within the S&amp;P 500 Index ($SPX) that have increased their dividend payments e… [+4629 chars]",Barchart.com,2025-10-23T23:30:02Z,https://www.barchart.com/story/news/35649389/this-6-7-yielding-dividend-aristocrat-has-raised-its-payout-60-times-in-the-last-56-years-should-you-buy,Market-Wide,2025-10-25 16:18:19.778026
Crypto's Back: FCA Lifts UK Ban on Bitcoin-Linked Investments — But Experts Warn 'Don't Rush In',"The Financial Conduct Authority (FCA) in the UK has lifted the our-year ban on cryptocurrencies, particularly on crypto exchange-traded notes (cETNs). Are the British ready for an influx of these ris… [+3372 chars]",International Business Times,2025-10-23T21:57:30Z,https://www.ibtimes.com/cryptos-back-fca-lifts-uk-ban-bitcoin-linked-investments-experts-warn-dont-rush-3788212,Market-Wide,2025-10-25 16:18:19.778045
Meridian Corporation Reports Third Quarter 2025 Results and Announces a Quarterly Dividend of $0.125 per Common Share,"MALVERN, Pa., Oct. 23, 2025 (GLOBE NEWSWIRE) -- Meridian Corporation (Nasdaq: MRBK) today reported:
<table><tr><td> </td><td>Three Months Ended</td></tr><tr><td>(Dollars in thousands, except per sha… [+82195 chars]",GlobeNewswire,2025-10-23T21:49:00Z,https://www.globenewswire.com/news-release/2025/10/23/3172562/0/en/Meridian-Corporation-Reports-Third-Quarter-2025-Results-and-Announces-a-Quarterly-Dividend-of-0-125-per-Common-Share.html,Market-Wide,2025-10-25 16:18:19.778063
Deckers Outdoor beats Q3 earnings expectations,"Deckers Outdoor Corporation (NYSE: DECK) delivered a strong third-quarter performance for 2025, outpacing Wall Street expectations on both earnings and revenue. The outdoor footwear and apparel leade… [+5647 chars]",Rolling Out,2025-10-23T21:28:14Z,https://rollingout.com/2025/10/23/deckers-outdoor-beats-q3-earnings/,Market-Wide,2025-10-25 16:18:19.778079
Hammond Power Solutions Reports Third Quarter 2025 Financial Results,"GUELPH, Ontario, Oct. 23, 2025 (GLOBE NEWSWIRE) -- Hammond Power Solutions Inc. (HPS or the Company) (TSX: HPS.A), a leading manufacturer of dry-type transformers, power quality products and related … [+14624 chars]",GlobeNewswire,2025-10-23T21:15:00Z,https://www.globenewswire.com/news-release/2025/10/23/3172541/0/en/Hammond-Power-Solutions-Reports-Third-Quarter-2025-Financial-Results.html,Market-Wide,2025-10-25 16:18:19.778096
Baker Hughes Company Announces Third-Quarter 2025 Results,"Third-quarter highlights
<ul><li>Orders of $8.2 billion, including $4.1 billion of IET orders.</li><li>RPO of $35.3 billion, including record IET RPO of $32.1 billion.</li><li>Revenue of $7.0 billio… [+49052 chars]",GlobeNewswire,2025-10-23T21:00:00Z,https://www.globenewswire.com/news-release/2025/10/23/3172534/0/en/Baker-Hughes-Company-Announces-Third-Quarter-2025-Results.html,Market-Wide,2025-10-25 16:18:19.778112
"This Meme Stock ETF Is Back from the Dead Just in Time for Halloween – and Beyond Meat’s 1,000% Surge","Just when you thought the meme stock craze was over, dead and buried, it returns with a scream.
The return this week of the Roundhill Meme Stock ETF (MEME) completes a round trip for the small but m… [+5139 chars]",Barchart.com,2025-10-23T20:37:39Z,https://www.barchart.com/story/news/35646685/this-meme-stock-etf-is-back-from-the-dead-just-in-time-for-halloween-and-beyond-meats-1-000-surge,Market-Wide,2025-10-25 16:18:19.778130
Turkey Leads MENA with $200B in Crypto Volume – but Chainalysis Warns It’s ‘All Speculation’,"Turkey has emerged as the Middle East and North Africas largest cryptocurrency market, recording nearly $200 billion in annual transactions, according to new data from Chainalysis.
The countrys volu… [+5787 chars]",Cryptonews,2025-10-23T20:31:00Z,https://cryptonews.com/news/turkey-leads-mena-with-200b-in-crypto-volume-but-chainalysis-warns-its-all-speculation/,Market-Wide,2025-10-25 16:18:19.778147
"MidWestOne Financial Group, Inc. Reports Financial Results for the Third Quarter of 2025","IOWA CITY, Iowa, Oct. 23, 2025 (GLOBE NEWSWIRE) -- MidWestOne Financial Group, Inc. (Nasdaq: MOFG) (""we,"" ""our,"" or the ""Company"") today reported results for the third quarter of 2025.
ThirdQuarter … [+127520 chars]",GlobeNewswire,2025-10-23T20:17:00Z,https://www.globenewswire.com/news-release/2025/10/23/3172484/0/en/MidWestOne-Financial-Group-Inc-Reports-Financial-Results-for-the-Third-Quarter-of-2025.html,Market-Wide,2025-10-25 16:18:19.778164
Could this ASX tech stock be the next 10 bagger?,"If you've spent any time investing on the ASX, you've likely heard of a ""10-bagger"": the kind of stock that grows tenfold from its starting point.
Finding a true 10-bagger is no easy feat. 
It's no… [+3498 chars]",Motley Fool Australia,2025-10-23T20:11:17Z,https://www.fool.com.au/2025/10/24/could-this-asx-tech-stock-be-the-next-10-bagger/,Market-Wide,2025-10-25 16:18:19.778179
"Financial Institutions, Inc. Reports Third Quarter 2025 Results, Including Net Income Available to Common Shareholders of $20.1 million, or $0.99 per Diluted Share","WARSAW, N.Y., Oct. 23, 2025 (GLOBE NEWSWIRE) -- Financial Institutions, Inc. (NASDAQ: FISI) (the ""Company,"" ""we"" or ""us""), parent company of Five Star Bank (the ""Bank"") and Courier Capital, LLC (""Cou… [+100922 chars]",GlobeNewswire,2025-10-23T20:05:00Z,https://www.globenewswire.com/news-release/2025/10/23/3172435/9870/en/Financial-Institutions-Inc-Reports-Third-Quarter-2025-Results-Including-Net-Income-Available-to-Common-Shareholders-of-20-1-million-or-0-99-per-Diluted-Share.html,Market-Wide,2025-10-25 16:18:19.778200
"6 in 10 Americans are invested in the stock market — a record high. But with $51T at risk in a crash, here’s how to prep","Things have been looking rosy on the stock markets this year, but beware of rose-colored glasses looking to the future.
In July, August and September of 2025, the Nasdaq Composite recorded 27 new hi… [+5503 chars]",Yahoo Entertainment,2025-10-23T20:00:00Z,https://finance.yahoo.com/news/6-10-americans-invested-stock-200000280.html,Market-Wide,2025-10-25 16:18:19.778218
Everyone is waiting for Friday's big inflation report. Here's what to expect,"The Friday release of September's consumer price index report is pretty much the only game in town this month for a Wall Street that is hungry for data, raising the chances for it to be a market-movi… [+4089 chars]",CNBC,2025-10-23T19:22:35Z,https://www.cnbc.com/2025/10/23/cpi-inflation-preview.html,Market-Wide,2025-10-25 16:18:19.778234
How Analyst Views on Cognex Are Changing as the Growth Story Evolves,"Cognex stock has seen its Fair Value Estimate increase slightly, moving from $48.00 to $48.25, as recent analyst commentary incorporates both optimistic signals and lingering caution. This subtle adj… [+4894 chars]",Yahoo Entertainment,2025-10-23T19:17:04Z,https://finance.yahoo.com/news/analyst-views-cognex-changing-growth-191704525.html,Market-Wide,2025-10-25 16:18:19.778251
3 quick ways to capitalize on gold's price fluctuations now,"Investors who are willing to act quickly on gold's price swings could reap some big returns in today's market.
Chuyko Sergey/Sergei Chuyko/Getty Images
After tumbling earlier this week, gold prices… [+5670 chars]",CBS News,2025-10-23T19:05:31Z,https://www.cbsnews.com/news/quick-ways-to-capitalize-on-golds-price-fluctuations-now/,Market-Wide,2025-10-25 16:18:19.778264
"As Coinbase Buys the Echo Platform, Should You Buy, Sell, or Hold COIN Stock?","Coinbase Global (COIN) is a leading U.S.-based cryptocurrency exchange. Coinbase offers secure trading, investing, and custody services for over 240 digital assets, including Bitcoin (BTCUSD) and Eth… [+4352 chars]",Barchart.com,2025-10-23T18:43:17Z,https://www.barchart.com/story/news/35643857/as-coinbase-buys-the-echo-platform-should-you-buy-sell-or-hold-coin-stock,Market-Wide,2025-10-25 16:18:19.778281
Can Beyond Meat Match the GameStop Meme Stock Craze?,"In brief
<ul><li>Beyond Meat stock has dropped sharply from its Wednesday high, which came after it surged by 1,435% over six days.</li><li>A prominent BYND trader believes this is just a healthy re… [+4823 chars]",Decrypt,2025-10-23T18:42:38Z,https://decrypt.co/345722/can-beyond-meat-match-gamestop-meme-stock-craze,Market-Wide,2025-10-25 16:18:19.778297
Marjorie Taylor Greene Buys 6 Stocks And Bitcoin ETF: Here's Her Latest Shopping List,"Benzinga and Yahoo Finance LLC may earn commission or revenue on some items through the links below.
Congresswoman Marjorie Taylor Greene (R-Ga.) is among the most active traders in Congress. Here's… [+8301 chars]",Yahoo Entertainment,2025-10-23T18:31:07Z,https://finance.yahoo.com/news/marjorie-taylor-greene-buys-6-183107845.html,Market-Wide,2025-10-25 16:18:19.778314
"As $11 billion cash shortfall looms, we ask: is Volkswagen cooked?","By Magnus Manske, shared under CC BY-SA 2.0 Generic license.
According to reports from Europe, internal reviews suggest the Volkswagen Group could be more than $11 billion short of the free cash flo… [+4554 chars]",Electrek,2025-10-23T18:11:41Z,http://electrek.co/2025/10/23/as-11-billion-cash-shortfall-looms-we-ask-is-volkswagen-cooked/,Market-Wide,2025-10-25 16:18:19.778330
How to Trade the ‘Government Put’ in Intel Stock Ahead of Q3 Earnings,"In the financial markets, its been said that you cant fight the Fed. But in Intels (INTC) case, it might be more accurate to say you cant fight Washington.
With the U.S. government taking a 10% equi… [+5306 chars]",Barchart.com,2025-10-23T18:06:33Z,https://www.barchart.com/story/news/35643293/how-to-trade-the-government-put-in-intel-stock-ahead-of-q3-earnings,Market-Wide,2025-10-25 16:18:19.778343
Wall Streeters poised to get record bonuses in 2025 with profits exceeding $60B: NY comptroller,"Wall Street bankers are set to rake in record bonuses this year, according to a new report from New York’s bean counter-in-chief, with profits fueled by a resurgence in dealmaking and a soaring stock… [+4170 chars]",New York Post,2025-10-23T17:41:45Z,https://nypost.com/2025/10/23/business/wall-streeters-poised-to-get-record-bonuses-in-2025-new-york-state-comptroller/,Market-Wide,2025-10-25 16:18:19.778369
8 best email marketing tools for HVAC companies in 2025,"The HVAC industry often means juggling emergency calls, seasonal demand spikes, and fierce local competition. When your schedules packed during summer heatwaves and winter chills but crickets in spri… [+34809 chars]",Hubspot.com,2025-10-23T17:32:19Z,https://blog.hubspot.com/marketing/best-email-marketing-tools-for-hvac-companies#article,Market-Wide,2025-10-25 16:18:19.778383
General Dynamics Reports 10/24 And Options Expire The Same Day,"According to NextEarningsDate.com, the General Dynamics next earnings date is projected to be 10/24 before market open, with earnings estimates of $3.72/share on $12.56 Billion of revenue. Looking ba… [+851 chars]",Forbes,2025-10-23T17:21:52Z,https://www.forbes.com/sites/dividendchannel/2025/10/23/general-dynamics-reports-1024-and-options-expire-the-same-day/,Market-Wide,2025-10-25 16:18:19.778396
C&F Financial Corporation Announces Net Income for Third Quarter and First Nine Months,"TOANO, Va., Oct. 23, 2025 (GLOBE NEWSWIRE) -- C&amp;F Financial Corporation (the Corporation) (NASDAQ: CFFI), the holding company for C&amp;F Bank, today reported consolidated net income of $7.1 mill… [+80263 chars]",GlobeNewswire,2025-10-23T17:00:00Z,https://www.globenewswire.com/news-release/2025/10/23/3172340/31704/en/C-F-Financial-Corporation-Announces-Net-Income-for-Third-Quarter-and-First-Nine-Months.html,Market-Wide,2025-10-25 16:18:19.778409
Catch A Free Ride On The LNG Wave With Cheniere Energy,The Liquefied Natural Gas (LNG) tanker Maria Energy (background) is moored alongside the Floating Storage and Regasification Unit (FSRU) vessel Hoegh Esperanza (foreground) at the Uniper LNG terminal… [+24864 chars],Forbes,2025-10-23T16:51:36Z,https://www.forbes.com/sites/greatspeculations/2025/10/23/catch-a-free-ride-on-the-lng-wave-with-cheniere-energy/,Market-Wide,2025-10-25 16:18:19.778422
"With stock market concentration risk at peak, 'cash, precious metals, and crypto' is new normal","With a handful of mega-cap tech and AI stocks at the top of the S&amp;P 500 Index dominating the U.S. market in a way without historical precedent, portfolio concentration risk has taken on a new for… [+3192 chars]",CNBC,2025-10-23T16:43:09Z,https://www.cnbc.com/2025/10/23/cash-precious-metals-crypto-is-new-norm-for-peak-stock-market-risk.html,Market-Wide,2025-10-25 16:18:19.778438
Federal Home Loan Bank of Atlanta Announces Third Quarter 2025 Operating Highlights and Declares Dividend,"ATLANTA, Oct. 23, 2025 (GLOBE NEWSWIRE) -- Federal Home Loan Bank of Atlanta (the Bank) today released preliminary unaudited financial highlights for the quarter ended September 30, 2025. All numbers… [+13170 chars]",GlobeNewswire,2025-10-23T16:26:00Z,https://www.globenewswire.com/news-release/2025/10/23/3172317/2953/en/Federal-Home-Loan-Bank-of-Atlanta-Announces-Third-Quarter-2025-Operating-Highlights-and-Declares-Dividend.html,Market-Wide,2025-10-25 16:18:19.778452
Legendary trader who predicted 1980s 50% gold crash now warns Bitcoin could be next,"Over his five-decade career, Peter Brandt made some of the most memorable market calls across commodities, foreign exchange and crypto.
From predicting golds historic reversal in the 1980s to accura… [+3705 chars]",TheStreet,2025-10-23T16:24:42Z,https://www.thestreet.com/crypto/trading/legendary-trader-predicted-1980s-gold-crash-issues-warning-for-bitcoin,Market-Wide,2025-10-25 16:18:19.778466
Volvo and VW warn Nexperia battle risks triggering factory shutdowns,Volvo Cars and Volkswagen have warned that there may be temporary plant shutdowns in Europe as a result of supply chain disruptions caused by a battle between China and the Netherlands over control o… [+3704 chars],The Irish Times,2025-10-23T16:16:06Z,https://www.irishtimes.com/business/2025/10/23/volvo-and-vw-warn-nexperia-battle-risks-triggering-factory-shutdowns/,Market-Wide,2025-10-25 16:18:19.778482
"Michael S. Eisenga, CEO of First American Properties, Issues Market Outlook: “The Dollar Debasement Trade Is Coming to an End”","COLUMBUS, Wis., Oct. 23, 2025 (GLOBE NEWSWIRE) -- Michael S. Eisenga, Chief Executive Officer of First American Properties, today issued a statement addressing the shifting dynamics of the U.S. econo… [+3022 chars]",GlobeNewswire,2025-10-23T16:13:00Z,https://www.globenewswire.com/news-release/2025/10/23/3172309/0/en/Michael-S-Eisenga-CEO-of-First-American-Properties-Issues-Market-Outlook-The-Dollar-Debasement-Trade-Is-Coming-to-an-End.html,Market-Wide,2025-10-25 16:18:19.778502
Intel Stock Faces a Crucial Earnings Test Today. Here’s What You Need To Know,"David Paul Morris / Bloomberg / Getty Images
 Shares of Intel are up over 80% for 2025 after their recent rally
<ul><li>Intel is scheduled to report its quarterly results after the closing bell Thu… [+2090 chars]",Investopedia,2025-10-23T15:59:25Z,https://www.investopedia.com/intel-stock-faces-crucial-earnings-test-what-you-need-to-know-11835495,Market-Wide,2025-10-25 16:18:19.778518
"US stock market today: Wall Street climbed 0.3% – Dow, S&P 500 and Nasdaq all rise as tech stocks drive rebound; gold and oil surge","U.S. stock market saw significant movements on Thursday, with major indices recording gains after a volatile trading week. Investors reacted strongly to a combination of rising oil prices, corporate … [+10555 chars]",The Times of India,2025-10-23T15:57:31Z,https://economictimes.indiatimes.com/news/international/us/us-stock-market-today-wall-street-climbed-0-3-dow-sp-500-and-nasdaq-all-rise-as-tech-stocks-drive-rebound-gold-and-oil-surge/articleshow/124765682.cms,Market-Wide,2025-10-25 16:18:19.778534
Do You Believe in the Growth Potential of STERIS (STE)?,"Upslope Capital Management, an investment management company, released its third-quarter investor letter. A copy of the letter can be downloaded here. The third quarter was a strong one for the fund … [+2688 chars]",Yahoo Entertainment,2025-10-23T15:56:13Z,https://finance.yahoo.com/news/believe-growth-potential-steris-ste-155613583.html,Market-Wide,2025-10-25 16:18:19.778546
What Makes West Pharmaceutical Services (WST) a Prospective Investment?,"Upslope Capital Management, an investment management company, released its third-quarter investor letter. A copy of the letter can be downloaded here. The third quarter was a strong one for the fund … [+2694 chars]",Yahoo Entertainment,2025-10-23T15:48:35Z,https://finance.yahoo.com/news/makes-west-pharmaceutical-services-wst-154835538.html,Market-Wide,2025-10-25 16:18:19.778560
Is Ventas (VTR) The Best REIT Dividend Stock to Buy for Non-AI Trade?,"We recently published Top 10 Trending Stocks Everyones Watching in Q4. Ventas Inc (NYSE:VTR) is one of the trending stocks everyone's watching.
Morningstars Dave Sekera said in a recent program on S… [+1388 chars]",Yahoo Entertainment,2025-10-23T15:46:31Z,https://finance.yahoo.com/news/ventas-vtr-best-reit-dividend-154631176.html,Market-Wide,2025-10-25 16:18:19.778573
What Makes Bio-Rad Laboratories (BIO) an Investment Bet?,"Upslope Capital Management, an investment management company, released its third-quarter investor letter. A copy of the letter can be downloaded here. The third quarter was a strong one for the fund … [+2856 chars]",Yahoo Entertainment,2025-10-23T15:44:09Z,https://finance.yahoo.com/news/makes-bio-rad-laboratories-bio-154409682.html,Market-Wide,2025-10-25 16:18:19.778585
Here’s Upslope Capital Management’s Views on International Money Express (IMXI),"Upslope Capital Management, an investment management company, released its third-quarter investor letter. A copy of the letter can be downloaded here. The third quarter was a strong one for the fund … [+2749 chars]",Yahoo Entertainment,2025-10-23T15:42:21Z,https://finance.yahoo.com/news/upslope-capital-management-views-international-154221976.html,Market-Wide,2025-10-25 16:18:19.778599
Tariff Tally: Global Losses Eclipse $35 Billion Going Into Q3 Earnings,"Even before third-quarter 2025 earnings started rolling in, global businesses had warned of over $35 billion in costs from U.S. tariffs.That estimate is only rising as Q3 reporting hits the newsstand… [+5212 chars]",pymnts.com,2025-10-23T15:30:41Z,https://www.pymnts.com/earnings/2025/tariff-tally-global-losses-eclipse-35-billion-dollars-going-into-q3-earnings/,Market-Wide,2025-10-25 16:18:19.778615
Tesla's Stock Is Sliding After Earnings. Next Up: A Big Vote on Elon Musk's Pay,"Sergei Gapon / AFP via Getty Images
 Tesla's shares were sliding Thursday, cutting into year-to-date gains, after the company reported earnings yesterday.
<ul><li>Shares of Tesla are slipping Thurs… [+3184 chars]",Investopedia,2025-10-23T15:26:07Z,https://www.investopedia.com/tesla-stock-is-sliding-after-earnings-next-up-a-big-vote-on-elon-musk-pay-11835492,Market-Wide,2025-10-25 16:18:19.778628
Warren Buffett’s Secret Weapon for 2026,"wsmahar / E+ via Getty Images
As Warren Buffett prepares to hand over leadership of Berkshire Hathaway (NYSE:BRK-A)(NYSE:BRK-B) to Greg Abel by year's end, his strategy remains focused on resilience… [+4041 chars]",24/7 Wall St.,2025-10-23T14:56:45Z,https://247wallst.com/investing/2025/10/23/warren-buffetts-secret-weapon-for-2026/,Market-Wide,2025-10-25 16:18:19.778641
"Gold prices soar to incredible $4,134 record high","Gold reaches new heights amid market uncertainty
Gold prices continued their impressive climb Thursday morning, reaching $4,134 per ounce as of 10 a.m. Eastern Time. The precious metal gained $75 fr… [+5583 chars]",Rolling Out,2025-10-23T14:52:34Z,https://rollingout.com/2025/10/23/gold-prices-hits-4134-record-high/,Market-Wide,2025-10-25 16:18:19.778654
