ticker,title,content,source,published_at,url,collected_at
TSLA,"Jim Cramer Talks About Tesla, Inc. (TSLA) & AI","We recently published 12 Hot, Cold & Stable Stocks Jim Cramer Recently Discussed.
Tesla, Inc. (NASDAQ:TSLA) is one of the stocks Jim Cramer recently discussed.
Cramer discussed Tesla, Inc. (NASDAQ:TSLA) last week on Monday after Elon Musk bought a billion dollars of shares.
The CNBC TV…This story appeared on finance.yahoo.com , 2025-09-23 16:08:02.",Biztoc.com,2025-09-23T16:31:42Z,https://biztoc.com/x/a0e5523f2d18cba6,2025-09-25 10:32:58.154578
TSLA,"Jim Cramer Talks About Tesla, Inc. (TSLA) & AI","We recently published 12 Hot, Cold & Stable Stocks Jim Cramer Recently Discussed.
Tesla, Inc. (NASDAQ:TSLA) is one of the stocks Jim Cramer recently discussed.
Cramer discussed Tesla, Inc. (NASDAQ:TSLA) last week on Monday after Elon Musk bought a billion dollars of shares.
Like Musk, Cramer also believes that Tesla, Inc. (NASDAQ:TSLA) can become an important player in autonomous driving and robots.
READ NEXT: 30 Stocks That Should Double in 3 Years and 11 Hidden AI Stocks to Buy Right Now.",Yahoo Entertainment,2025-09-23T16:08:02Z,https://finance.yahoo.com/news/jim-cramer-talks-tesla-inc-160802720.html,2025-09-25 10:32:59.121098
TSLA,Stocks Lower After Fed Chair Powell Comments,"Switch the Market flagOpen the menu and switch theMarket flag for targeted data from your country of choice.
for targeted data from your country of choice.",Barchart.com,2025-09-23T15:17:13Z,https://www.barchart.com/story/news/34983527/stocks-mixed-before-fed-chair-powell-comments,2025-09-25 10:33:00.426659
TSLA,"Tesla Stock Jumps 29% In a Month, Should You Cash Out?","Switch the Market flagOpen the menu and switch theMarket flag for targeted data from your country of choice.
for targeted data from your country of choice.",Barchart.com,2025-09-23T14:15:42Z,https://www.barchart.com/story/news/34981930/tesla-stock-jumps-29-in-a-month-should-you-cash-out,2025-09-25 10:33:02.043245
TSLA,Dean of Valuation Aswath Damodaran Tells Why He Sold Tesla (TSLA) Shares,"We recently published These 10 Stocks are Buzzing After Important Analyst Calls.
Tesla Inc (NASDAQ:TSLA) is one of the stocks analysts were recently talking about.
Aswath Damodaran, NYU Stern School of Business professor of finance, recently explained in a program on CNBC why he trimmed…This story appeared on finance.yahoo.com , 2025-09-23 13:13:14.",Biztoc.com,2025-09-23T13:33:05Z,https://biztoc.com/x/994e47477c58dab6,2025-09-25 10:33:02.501890
TSLA,Dean of Valuation Aswath Damodaran Tells Why He Sold Tesla (TSLA) Shares,"Tesla Inc (NASDAQ:TSLA) is one of the stocks analysts were recently talking about.
Aswath Damodaran, NYU Stern School of Business professor of finance, recently explained in a program on CNBC why he trimmed his stake in Tesla.
I think my concern at with Tesla Inc (NASDAQ:TSLA) has become a political stock and I’m terrible at politics.
For example, in California, the largest U.S. market for electric vehicle adoption and sales, Tesla sales fell about 12% year over year in 2024, causing its market share to drop from 60.1% in 2023 to 52.5% in 2024.
READ NEXT: 30 Stocks That Should Double in 3 Years and 11 Hidden AI Stocks to Buy Right Now.",Yahoo Entertainment,2025-09-23T13:13:14Z,https://finance.yahoo.com/news/dean-valuation-aswath-damodaran-tells-131314708.html,2025-09-25 10:33:03.434549
TSLA,Insurance Stocks To Research – September 21st,"Insurance stocks are equity shares of companies that underwrite and sell insurance policies—ranging from life and health to property and casualty—while managing risk through actuarial pricing and claims administration.
The Automotive segment offers electric vehicles, as well as sells automotive regulatory credits; and non-warranty after-sales vehicle, used vehicles, body shop and parts, supercharging, retail merchandise, and vehicle insurance services.
Read Our Latest Research Report on UNHBerkshire Hathaway (BRK.B)Berkshire Hathaway Inc., through its subsidiaries, engages in the insurance, freight rail transportation, and utility businesses worldwide.
The company provides property, casualty, life, accident, and health insurance and reinsurance; and operates railroad systems in North America.
Read Our Latest Research Report on INTURecommended Stories",ETF Daily News,2025-09-23T07:44:55Z,https://www.etfdailynews.com/2025/09/23/insurance-stocks-to-research-september-21st/,2025-09-25 10:33:04.566384
TSLA,Utility Stocks To Watch Today – September 21st,"Tesla, Berkshire Hathaway, Eaton, Rivian Automotive, Cognizant Technology Solutions, Eversource Energy, and Southern are the seven Utility stocks to watch today, according to MarketBeat’s stock screener tool.
Utility stocks are shares of companies that provide essential public services such as electricity, water, natural gas and sewage treatment.
It also generates, transmits, stores, and distributes electricity from natural gas, coal, wind, solar, hydroelectric, nuclear, and geothermal sources; operates natural gas distribution and storage facilities, interstate pipelines, liquefied natural gas facilities, and compressor and meter stations; and holds interest in coal mining assets.
Read Our Latest Research Report on CTSHEversource Energy (ES)Eversource Energy, a public utility holding company, engages in the energy delivery business.
The company operates through Electric Distribution, Electric Transmission, Natural Gas Distribution, and Water Distribution segments.",ETF Daily News,2025-09-23T07:44:48Z,https://www.etfdailynews.com/2025/09/23/utility-stocks-to-watch-today-september-21st/,2025-09-25 10:33:05.754633
TSLA,Large Cap Stocks To Follow Today – September 21st,"AppLovin, NVIDIA, Apple, Tesla, Invesco QQQ, Microsoft, and Robinhood Markets are the seven Large Cap stocks to watch today, according to MarketBeat’s stock screener tool.
These companies had the highest dollar trading volume of any Large Cap stocks within the last several days.
Read Our Latest Research Report on NVDAApple (AAPL)Apple Inc. designs, manufactures, and markets smartphones, personal computers, tablets, wearables, and accessories worldwide.
Read Our Latest Research Report on MSFTRobinhood Markets (HOOD)Robinhood Markets, Inc. operates financial services platform in the United States.
Read Our Latest Research Report on HOODRecommended Stories",ETF Daily News,2025-09-23T07:06:55Z,https://www.etfdailynews.com/2025/09/23/large-cap-stocks-to-follow-today-september-21st/,2025-09-25 10:33:06.881933
TSLA,Tesla (TSLA) Stock Target Raised to $500 as Analyst Stays Bullish on AI Edge,"Tesla, Inc. (NASDAQ:TSLA) is one of the AI Stocks in Focus on Wall Street.
On September 22, Piper Sandler reiterated the stock as “Overweight” and raised its price target on the stock to $500 per share from $400.
While we acknowledge the potential of TSLA as an investment, we believe certain AI stocks offer greater upside potential and carry less downside risk.
If you're looking for an extremely undervalued AI stock that also stands to benefit significantly from Trump-era tariffs and the onshoring trend, see our free report on the best short-term AI stock.
READ NEXT: 10 AI Stocks You Should Not Ignore and 10 Must-Watch AI Stocks on Wall Street.",Yahoo Entertainment,2025-09-23T03:42:53Z,https://finance.yahoo.com/news/tesla-tsla-stock-target-raised-034253176.html,2025-09-25 10:33:07.838050
TSLA,"Stock market today: Dow, S&P 500, Nasdaq futures waver after another record-setting day on Wall Street","The S&P 500 (^GSPC) fell about 0.6%, and the tech-heavy Nasdaq Composite (^IXIC) lost almost 1%.
Powell suggested during a speech in Rhode Island that the central bank would move cautiously after resuming rate cuts last week, noting the challenge of balancing its dual mandate at the moment.
""Near-term risks to inflation are tilted to the upside and risks to employment to the downside — a challenging situation.
Later, in a question-and-answer session, he noted that ""by many measures, for example, equity prices are fairly highly valued.""
Powell's comments set the stage for the release on Friday of the Fed's preferred inflation gauge, the Personal Consumption Expenditures index.",Yahoo Entertainment,2025-09-22T23:03:19Z,https://finance.yahoo.com/news/live/stock-market-today-dow-sp-500-nasdaq-futures-waver-after-another-record-setting-day-on-wall-street-230319860.html,2025-09-25 10:33:08.973273
TSLA,Tesla Model Y Fails Teen's Road Test — Marked 'Out of Order' Mid-Exam,"Autonomous driving features on Tesla Inc (NASDAQ:TSLA) vehicles may be good for the future of robotaxis, but might not be practical to pass driver's tests as a Canadian teenager recently found out.
TSLA stock is moving in positive territory.
Track the latest developments here.
What…This story appeared on benzinga.com , 2025-09-22 22:31:30.",Biztoc.com,2025-09-22T22:44:41Z,https://biztoc.com/x/e6ac72c12b2e5a62,2025-09-25 10:33:09.352515
TSLA,Tesla stock jumps to new 2025 closing high as bull run rolls on,"Tesla (TSLA) shares chugged higher and hit a new 2025 closing high, shaking off a tough start to the year as investors look ahead to the company's self-driving future.
Tesla stock topped $440 in early trade, up nearly 4%, but ultimately closed up 1.9% to $434.21, topping its prior 2025 closing high of $428.22 reached on Jan. 15.
Tesla stock is now higher over nine of the last 10 trading sessions.
Potter hiked his price target to $500 from $400 following a visit to China, where the analyst claimed Chinese automakers looked to Tesla for AI and self-driving guidance.
In the words of one company, ‘without Tesla going from 0 to 1, we can't go from 1 to 100,’” Potter wrote.",Yahoo Entertainment,2025-09-22T20:22:24Z,https://finance.yahoo.com/news/tesla-stock-jumps-to-new-2025-closing-high-as-bull-run-rolls-on-202224560.html,2025-09-25 10:33:10.255543
AMZN,11 22 63 S01 720p AMZN WEB-DL H264-playWEB,"Published by OMEGA View all posts by FOXPost navigationFeel free to post your Old 11 22 63 S01 720p AMZN WEB-DL H264-playWEB torrent, subtitles, samples, free download, quality, NFO, direct link, free link, uploaded.to, rapidgator, turbobit, openload, mega.co.nz, filefactory, crack, serial, keygen, requirements or whatever-related comments here.
Don't be rude (permban), use only English, don't go offtopic and read FAQ before asking a question.
Owners of this website aren't responsible for content of comments.",Rlsbb.to,2025-09-23T23:20:19Z,https://post.rlsbb.to/11-22-63-s01-720p-amzn-web-dl-h264-playweb/,2025-09-25 10:33:12.544281
AMZN,"Stock market today: Nasdaq, Dow, S&P 500 fall with divided Fed, Alibaba in focus","US stocks fell on Wednesday as Wall Street digested mixed messaging from Fed officials on interest rates.
Debate over the prospects for US interest rate cuts — the big focus for markets right now — appeared to pressure stocks.
Fed Chair Jerome Powell reiterated in a speech on Tuesday that the central bank would proceed cautiously on further rate cuts, even as he left the door open to more easing.
Markets are watching for reassurance that inflation isn't posing a threat to high expectations for two more rate cuts this year.
Meanwhile, some tech stocks are showing gains despite a broader drop across the Nasdaq, which snapped a winning streak on Tuesday amid losses for the ""Magnificent Seven"" Big Tech stocks.",Yahoo Entertainment,2025-09-23T23:03:54Z,https://finance.yahoo.com/news/live/stock-market-today-nasdaq-dow-sp-500-fall-with-divided-fed-alibaba-in-focus-230354294.html,2025-09-25 10:33:13.680369
AMZN,"Stock market today: Nasdaq, Dow, S&P 500 waver with divided Fed, Alibaba in focus","US stocks fell on Wednesday as Wall Street digested mixed messaging from Fed officials on interest rates.
Debate over the prospects for US interest rate cuts — the big focus for markets right now — appeared to pressure stocks.
Fed Chair Jerome Powell reiterated in a speech on Tuesday that the central bank would proceed cautiously on further rate cuts, even as he left the door open to more easing.
Markets are watching for reassurance that inflation isn't posing a threat to high expectations for two more rate cuts this year.
Meanwhile, some tech stocks are showing gains despite a broader drop across the Nasdaq, which snapped a winning streak on Tuesday amid losses for the ""Magnificent Seven"" Big Tech stocks.",Yahoo Entertainment,2025-09-23T23:03:54Z,https://finance.yahoo.com/news/live/stock-market-today-nasdaq-dow-sp-500-waver-with-divided-fed-alibaba-in-focus-230354679.html,2025-09-25 10:33:14.663475
AMZN,Safe House S01-S02 720p AMZN WEB-DL H264-MiXED,"Published by OMEGA View all posts by LisaPost navigationFeel free to post your Old Safe House S01-S02 720p AMZN WEB-DL H264-MiXED torrent, subtitles, samples, free download, quality, NFO, direct link, free link, uploaded.to, rapidgator, turbobit, openload, mega.co.nz, filefactory, crack, serial, keygen, requirements or whatever-related comments here.
Don't be rude (permban), use only English, don't go offtopic and read FAQ before asking a question.
Owners of this website aren't responsible for content of comments.",Rlsbb.to,2025-09-23T22:54:19Z,https://post.rlsbb.to/safe-house-s01-s02-720p-amzn-web-dl-h264-mixed/,2025-09-25 10:33:16.528650
AMZN,Meekah S02 1080p AMZN WEB-DL H264-iRMAS,"Published by OMEGA View all posts by RobotnicoPost navigationFeel free to post your Old Meekah S02 1080p AMZN WEB-DL H264-iRMAS torrent, subtitles, samples, free download, quality, NFO, direct link, free link, uploaded.to, rapidgator, turbobit, openload, mega.co.nz, filefactory, crack, serial, keygen, requirements or whatever-related comments here.
Don't be rude (permban), use only English, don't go offtopic and read FAQ before asking a question.
Owners of this website aren't responsible for content of comments.",Rlsbb.to,2025-09-23T22:54:19Z,https://post.rlsbb.to/meekah-s02-1080p-amzn-web-dl-h264-irmas/,2025-09-25 10:33:17.012724
AMZN,Ant Anstead Born Mechanic S02E02 720p AMZN WEB-DL H264-RAWR,"Ant Anstead Born Mechanic S02E02 720p AMZN WEB-DL H264-RAWR Posted on Sept 24th, 2025 at 12:3 am in TV Shows by Robotnico Season 2, Episode 02 – “Morris Traveller”Ant and his dad find a ‘perfect’ Woodie, but there’s a catch.
There’s no engine!
The farmhouse is in danger of collapse due to rotten wooden beams Links: HOMEPAGE – TVDB Ant.Anstead.Born.Mechanic.S02E02.720p.WEB.H264-JFFMKV | AC3 / dolby digital plus | 1.28GBNFO – Subtitles – Screenshot – Torrent – FiKPER – NiTROFLARE – RAPiDGATOR Ant.Anstead.Born.Mechanic.S02E02.720p.AMZN.WEB-DL.DDP2.0.H.264-RAWRMKV | AC3 / dolby digital plus | 1.47GBNFO – Subtitles – Screenshot – Torrent – FiKPER – NiTROFLARE – RAPiDGATOR Ant.Anstead.Born.Mechanic.S02E02.1080p.AMZN.WEB-DL.DDP2.0.H.264-RAWRMKV | AC3 / dolby digital plus | 2.75GBNFO – Subtitles – Screenshot – Torrent – FiKPER – NiTROFLARE – RAPiDGATOR Ant.Anstead.Born.Mechanic.S02E02.WEB.H264-RBB [P2P]MP4 | AAC | 364MBNFO - Subtitles – Screenshot – Torrent – FiKPER – NiTROFLARE – RAPiDGATORPublished by OMEGA View all posts by RobotnicoPost navigationFeel free to post your Old Ant Anstead Born Mechanic S02E02 720p AMZN WEB-DL H264-RAWR torrent, subtitles, samples, free download, quality, NFO, direct link, free link, uploaded.to, rapidgator, turbobit, openload, mega.co.nz, filefactory, crack, serial, keygen, requirements or whatever-related comments here.
Don't be rude (permban), use only English, don't go offtopic and read FAQ before asking a question.
Owners of this website aren't responsible for content of comments.",Rlsbb.to,2025-09-23T22:05:02Z,https://post.rlsbb.to/ant-anstead-born-mechanic-s02e02-720p-amzn-web-dl-h264-rawr/,2025-09-25 10:33:17.794495
AMZN,"US stock market retreats after record highs as Powell warns of “highly valued” markets — S&P 500 slips, Nasdaq hit by Nvidia selloff, Micron jumps on strong results","(Catch all the US News, UK News, Canada News, International Breaking News Events, and Latest News Updates on The Economic Times.)
Download The Economic Times News App to get Daily International News Updates.",The Times of India,2025-09-23T20:56:34Z,https://economictimes.indiatimes.com/news/international/us/us-stock-market-retreats-after-record-highs-as-powell-warns-of-highly-valued-markets-sp-500-slips-nasdaq-hit-by-nvidia-selloff-micron-jumps-on-strong-results/articleshow/124078451.cms,2025-09-25 10:33:18.102185
AMZN,"Stock market today: Dow, S&P 500, Nasdaq slide after Powell flags Fed's challenge, 'highly valued' stocks","The S&P 500 (^GSPC) fell about 0.6%, and the tech-heavy Nasdaq Composite (^IXIC) lost almost 1%.
Powell suggested during a speech in Rhode Island that the central bank would move cautiously after resuming rate cuts last week, noting the challenge of balancing its dual mandate at the moment.
""Near-term risks to inflation are tilted to the upside and risks to employment to the downside — a challenging situation.
Later, in a question-and-answer session, he noted that ""by many measures, for example, equity prices are fairly highly valued.""
Powell's comments set the stage for the release on Friday of the Fed's preferred inflation gauge, the Personal Consumption Expenditures index.",Yahoo Entertainment,2025-09-23T20:01:43Z,https://finance.yahoo.com/news/live/stock-market-today-dow-sp-500-nasdaq-slide-after-powell-flags-feds-challenge-highly-valued-stocks-174834474.html,2025-09-25 10:33:19.513657
AMZN,Teen Wolf S01-S06 720p AMZN WEB-DL H264-playWEB,"An average high school student and his best friend get caught up in some trouble causing him to receive a werewolf bite.
As a result they find themselves in the middle of all sorts of dramas in Beacon Hills.
Links: HOMEPAGE – iMDBTeen.Wolf.S01.720p.AMZN.WEB-DL.DD+5.1.H.264-playWEBMKV | AC3 / dolby digital plus | 12EP [14.3 GB]NFO - Subtitles – Torrent – FiKPER – NiTROFLARE – RAPiDGATORTeen.Wolf.S01.1080p.AMZN.WEB-DL.DD+5.1.H.264-playWEBMKV | AC3 / dolby digital plus | 12EP [31 GB]NFO - Subtitles – Torrent – FiKPER – NiTROFLARE – RAPiDGATORTeen.Wolf.S02.720p.AMZN.WEB-DL.DD+5.1.H.264-playWEBMKV | AC3 / dolby digital plus | 12EP [17.9 GB]NFO - Subtitles – Torrent – FiKPER – NiTROFLARE – RAPiDGATORTeen.Wolf.S02.1080p.AMZN.WEB-DL.DD+5.1.H.264-playWEBMKV | AC3 / dolby digital plus | 12EP [34.8 GB]NFO - Subtitles – Torrent – FiKPER – NiTROFLARE – RAPiDGATORTeen.Wolf.S03.720p.AMZN.WEB-DL.DD+5.1.H.264-playWEBMKV | AC3 / dolby digital plus | 24EP [32.7 GB]NFO - Subtitles – Torrent – FiKPER – NiTROFLARE – RAPiDGATORTeen.Wolf.S03.1080p.AMZN.WEB-DL.DD+5.1.H.264-playWEBMKV | AC3 / dolby digital plus | 24EP [67.4 GB]NFO - Subtitles – Torrent – FiKPER – NiTROFLARE – RAPiDGATORTeen.Wolf.S04.720p.AMZN.WEB-DL.DD+5.1.H.264-playWEBMKV | AC3 / dolby digital plus | 12EP [18.9 GB]NFO - Subtitles – Torrent – FiKPER – NiTROFLARE – RAPiDGATORTeen.Wolf.S04.1080p.AMZN.WEB-DL.DD+5.1.H.264-playWEBMKV | AC3 / dolby digital plus | 12EP [35.7 GB]NFO - Subtitles – Torrent – FiKPER – NiTROFLARE – RAPiDGATORTeen.Wolf.S05.720p.AMZN.WEB-DL.DD+5.1.H.264-playWEBMKV | AC3 / dolby digital plus | 20EP [26 GB]NFO - Subtitles – Torrent – FiKPER – NiTROFLARE – RAPiDGATORTeen.Wolf.S04.1080p.AMZN.WEB-DL.DD+5.1.H.264-playWEBMKV | AC3 / dolby digital plus | 12EP [35.7 GB]NFO - Subtitles – Torrent – FiKPER – NiTROFLARE – RAPiDGATORTeen.Wolf.S06.720p.AMZN.WEB-DL.DD+5.1.H.264-playWEBMKV | AC3 / dolby digital plus | 20EP [25.6 GB]NFO - Subtitles – Torrent – FiKPER – NiTROFLARE – RAPiDGATORTeen.Wolf.S06.1080p.AMZN.WEB-DL.DD+5.1.H.264-playWEBMKV | AC3 / dolby digital plus | 20EP [58.5 GB]NFO - Subtitles – Torrent – FiKPER – NiTROFLARE – RAPiDGATOR",Rlsbb.to,2025-09-23T19:35:49Z,https://post.rlsbb.to/teen-wolf-s01-s06-720p-amzn-web-dl-h264-playweb/,2025-09-25 10:33:21.794036
AMZN,Meekah S01 1080p AMZN WEB-DL H264-iRMAS,"Published by OMEGA View all posts by RobotnicoPost navigationFeel free to post your Old Meekah S01 1080p AMZN WEB-DL H264-iRMAS torrent, subtitles, samples, free download, quality, NFO, direct link, free link, uploaded.to, rapidgator, turbobit, openload, mega.co.nz, filefactory, crack, serial, keygen, requirements or whatever-related comments here.
Don't be rude (permban), use only English, don't go offtopic and read FAQ before asking a question.
Owners of this website aren't responsible for content of comments.",Rlsbb.to,2025-09-23T19:24:38Z,https://post.rlsbb.to/meekah-s01-1080p-amzn-web-dl-h264-irmas/,2025-09-25 10:33:23.735491
AMZN,Micron set to report Q4 earnings in latest test of AI trade,"Micron (MU) stock rose early on Wednesday after the chipmaker reported fiscal fourth quarter earnings that surpassed Wall Street's expectations.
Micron's fiscal fourth quarter revenue of $11.3 billion was ahead of the $11.15 billion expected by analysts polled by Bloomberg.
The Idaho-based memory chipmaker — whose semiconductors are used alongside Nvidia's chips in AI data centers — saw adjusted earnings per share of $3.03 for the three months ending Aug. 28, more than the $2.84 projected.
The beat was fueled by the AI data center boom, company executives said, with data centers representing 40% of the chipmaker's total revenue in the fourth quarter.
The company guided for first quarter revenue between $12.2 billion and $12.8 billion, more than the $11.9 billion expected by analysts tracked by Bloomberg.",Yahoo Entertainment,2025-09-23T19:23:51Z,https://finance.yahoo.com/news/micron-set-to-report-q4-earnings-in-latest-test-of-ai-trade-192351303.html,2025-09-25 10:33:24.765599
AMZN,90 Day Fiance The Other Way S07E03 1080p AMZN WEB-DL H264-Kitsune,"90 Day Fiance The Other Way S07E03 1080p AMZN WEB-DL H264-Kitsune Posted on Sept 23rd, 2025 at 8:41 pm in TV Shows by Robotnico Season 7, Episode 03 – “Naya Safar”Americans move to a foreign country all in the name of love.
Will uprooting their lives in the United States pay off, or will they be packing up and moving back to America brokenhearted?
Links: HOMEPAGE – TVDB 90.Day.Fiance.The.Other.Way.S07E03.720p.WEB.H264-JFFMKV | AC3 / dolby digital plus | 1.26GBNFO - Subtitles – Screenshot – Torrent – FiKPER – NiTROFLARE – RAPiDGATOR 90.Day.Fiance.The.Other.Way.S07E03.1080p.AMZN.WEB-DL.DDP2.0.H.264-KitsuneMKV | AC3 / dolby digital plus | 2.93GBNFO – Subtitles – Torrent – FiKPER – NiTROFLARE – RAPiDGATOR 90.Day.Fiance.The.Other.Way.S07E03.WEB.H264-RBB [P2P]MP4 | AAC | 356MBNFO – Subtitles – Screenshot – Torrent – FiKPER – NiTROFLARE – RAPiDGATORPublished by OMEGA View all posts by RobotnicoPost navigationFeel free to post your Old 90 Day Fiance The Other Way S07E03 1080p AMZN WEB-DL H264-Kitsune torrent, subtitles, samples, free download, quality, NFO, direct link, free link, uploaded.to, rapidgator, turbobit, openload, mega.co.nz, filefactory, crack, serial, keygen, requirements or whatever-related comments here.
Don't be rude (permban), use only English, don't go offtopic and read FAQ before asking a question.
Owners of this website aren't responsible for content of comments.",Rlsbb.to,2025-09-23T18:53:05Z,https://post.rlsbb.to/90-day-fiance-the-other-way-s07e03-1080p-amzn-web-dl-h264-kitsune/,2025-09-25 10:33:26.644849
AMZN,Streets Of Blood 2009 1080p AMZN WEB-DL H264-GPRS,"Plot: A police officer’s partner has died during Hurricane Katrina, but he later discovers that his partner may have been murdered.
An investigation follows, taking the officer and his new partner into the depths of the criminal underworld.
Genre: Action | Crime | DramaIMDB Rating Live:IMDB Rating: 4.4/10 From 4,186 UsersTMDB Rating: N/ARotten Rating: 40%Metacritic Rating: N/ADirected by: Charles WinklerStarring: Val Kilmer , 50 Cent , Sharon StoneRelease Name: Streets.Of.Blood.2009.WEB.H264-RBBSize: 832MBVideo: MP4 | 720×400 | 1 000 kb/s | 23.976 FPSAudio: English | AAC | 192 kb/sRuntime: 1 h 34 minSubtitles: English [Selectable] or (HERE)Samples: Video @ Screens – #1 – #2 – #3Links: iMDB | Trailer | NFO | Torrent SearchDownload MP4: FiKPER – NiTROFLARE – RAPiDGATORRelease Name: Streets.Of.Blood.2009.720p.WEB.H264-JFFSize: 3.11GBVideo: MKV | 1280x720 | 4 000 kb/s | 23.976 FPSAudio: English | AC3 / dolby digital plus | 640 kb/sRuntime: 1 h 34 minSubtitles: English [Selectable] or (HERE)Samples: Video @ Screens – #1 – #2 – #3Links: iMDB | Trailer | NFO | Torrent SearchDownload 720p: FiKPER – NiTROFLARE – RAPiDGATORRelease Name: Streets.Of.Blood.2009.1080p.AMZN.WEB-DL.DDP5.1.H.264-GPRSSize: 6.72GBVideo: MKV | 1920×1080 | 9 487 kb/s | 23.976 FPSAudio: English | AC3 / dolby digital plus | 640 kb/sRuntime: 1 h 34 minSubtitles: English [Selectable] or (HERE)Samples: Video @ #1 – #2 – #3Links: iMDB | Trailer | NFO | Torrent SearchDownload 1080p: FiKPER – NiTROFLARE – RAPiDGATOR",Rlsbb.to,2025-09-23T18:39:48Z,https://post.rlsbb.to/streets-of-blood-2009-1080p-amzn-web-dl-h264-gprs/,2025-09-25 10:33:27.613001
