ticker,title,content,source,published_at,url,collected_at
GOOGL,Capital Advantage Inc. Sells 447 Shares of Alphabet Inc. $GOOGL,"The firm owned 3,473 shares of the information services provider’s stock after selling 447 shares during the quarter.
Wedge Capital Management L L P NC lifted its position in shares of Alphabet by 9.5% during the 2nd quarter.
Wedge Capital Management L L P NC now owns 384,780 shares of the information services provider’s stock valued at $67,810,000 after acquiring an additional 33,451 shares during the period.
Finally, Harbour Capital Advisors LLC lifted its position in shares of Alphabet by 0.4% during the 2nd quarter.
Harbour Capital Advisors LLC now owns 21,201 shares of the information services provider’s stock valued at $3,787,000 after acquiring an additional 90 shares during the period.",ETF Daily News,2025-09-23T11:50:48Z,https://www.etfdailynews.com/2025/09/23/capital-advantage-inc-sells-447-shares-of-alphabet-inc-googl/,2025-09-25 10:32:26.501667
GOOGL,Alphabet Inc. $GOOGL Shares Sold by Vantage Wealth,"Guardian Wealth Management Inc. increased its position in shares of Alphabet by 242.9% in the first quarter.
Guardian Wealth Management Inc. now owns 168 shares of the information services provider’s stock worth $26,000 after acquiring an additional 119 shares in the last quarter.
Insiders have sold 258,088 shares of company stock worth $52,405,304 in the last 90 days.
It operates through Google Services, Google Cloud, and Other Bets segments.
The Google Services segment provides products and services, including ads, Android, Chrome, devices, Gmail, Google Drive, Google Maps, Google Photos, Google Play, Search, and YouTube.",ETF Daily News,2025-09-23T11:50:48Z,https://www.etfdailynews.com/2025/09/23/alphabet-inc-googl-shares-sold-by-vantage-wealth/,2025-09-25 10:32:27.653499
GOOGL,"Global X Japan Co. Ltd. Sells 13,052 Shares of Alphabet Inc. $GOOGL","The fund owned 158,053 shares of the information services provider’s stock after selling 13,052 shares during the period.
von Borstel & Associates Inc. purchased a new stake in Alphabet during the first quarter valued at about $28,000.
Finally, Financial Gravity Asset Management Inc. purchased a new stake in Alphabet during the first quarter valued at about $39,000.
Insiders Place Their BetsIn other Alphabet news, Director Kavitark Ram Shriram sold 15,000 shares of Alphabet stock in a transaction that occurred on Friday, July 18th.
Also, insider John Kent Walker sold 23,820 shares of Alphabet stock in a transaction that occurred on Monday, August 4th.",ETF Daily News,2025-09-23T10:26:51Z,https://www.etfdailynews.com/2025/09/23/global-x-japan-co-ltd-sells-13052-shares-of-alphabet-inc-googl/,2025-09-25 10:32:28.781076
GOOGL,Marshall & Sullivan Inc. WA Purchases 103 Shares of Alphabet Inc. $GOOGL,"The firm owned 42,866 shares of the information services provider’s stock after buying an additional 103 shares during the quarter.
Cypress Capital LLC now owns 14,310 shares of the information services provider’s stock worth $2,213,000 after purchasing an additional 563 shares during the period.
Alphabet Price PerformanceShares of NASDAQ GOOGL opened at $252.53 on Tuesday.
It operates through Google Services, Google Cloud, and Other Bets segments.
The Google Services segment provides products and services, including ads, Android, Chrome, devices, Gmail, Google Drive, Google Maps, Google Photos, Google Play, Search, and YouTube.",ETF Daily News,2025-09-23T10:26:50Z,https://www.etfdailynews.com/2025/09/23/marshall-sullivan-inc-wa-purchases-103-shares-of-alphabet-inc-googl/,2025-09-25 10:32:29.933641
GOOGL,Myecfo LLC Has $2.22 Million Stake in Alphabet Inc. $GOOGL,"IMA Advisory Services Inc. bought a new stake in shares of Alphabet during the first quarter worth $28,000.
von Borstel & Associates Inc. bought a new stake in shares of Alphabet during the first quarter worth $28,000.
Finally, Financial Gravity Asset Management Inc. bought a new stake in shares of Alphabet during the first quarter worth $39,000.
Insider ActivityIn related news, CEO Sundar Pichai sold 32,500 shares of Alphabet stock in a transaction that occurred on Wednesday, September 3rd.
Also, insider John Kent Walker sold 23,820 shares of Alphabet stock in a transaction that occurred on Monday, August 4th.",ETF Daily News,2025-09-23T10:26:50Z,https://www.etfdailynews.com/2025/09/23/myecfo-llc-has-2-22-million-stake-in-alphabet-inc-googl/,2025-09-25 10:32:31.064973
GOOGL,Alphabet Inc. $GOOGL Shares Sold by Professional Advisory Services Inc.,"The institutional investor owned 10,705 shares of the information services provider’s stock after selling 262 shares during the period.
Mystic Asset Management Inc. now owns 28,454 shares of the information services provider’s stock valued at $4,400,000 after purchasing an additional 1,791 shares during the period.
Harbour Trust & Investment Management Co now owns 27,075 shares of the information services provider’s stock valued at $4,187,000 after purchasing an additional 80 shares during the period.
Cypress Capital LLC now owns 14,310 shares of the information services provider’s stock valued at $2,213,000 after purchasing an additional 563 shares during the period.
Alaethes Wealth LLC now owns 7,646 shares of the information services provider’s stock valued at $1,182,000 after purchasing an additional 84 shares during the period.",ETF Daily News,2025-09-23T10:26:49Z,https://www.etfdailynews.com/2025/09/23/alphabet-inc-googl-shares-sold-by-professional-advisory-services-inc/,2025-09-25 10:32:32.152298
GOOGL,Alphabet Inc. $GOOGL Stock Holdings Decreased by Pinnacle Bancorp Inc.,"Alphabet accounts for approximately 1.1% of Pinnacle Bancorp Inc.’s holdings, making the stock its 18th biggest position.
Pinnacle Bancorp Inc.’s holdings in Alphabet were worth $3,567,000 as of its most recent SEC filing.
Wolff Financial Management LLC boosted its holdings in shares of Alphabet by 2.6% in the second quarter.
Also, CAO Amie Thuener O’toole sold 2,778 shares of Alphabet stock in a transaction that occurred on Monday, September 15th.
In the last three months, insiders sold 258,088 shares of company stock valued at $52,405,304.",ETF Daily News,2025-09-23T10:26:49Z,https://www.etfdailynews.com/2025/09/23/alphabet-inc-googl-stock-holdings-decreased-by-pinnacle-bancorp-inc/,2025-09-25 10:32:33.246864
MSFT,How to double your ASX share portfolio without chasing risky stocks,"Learn MoreHow to double your ASX share portfolio without chasing risky stocksYou’re reading a free article with opinions that may differ from The Motley Fool’s Premium Investing Services.
But in reality, you don't need to chase risky stocks to build serious wealth on the ASX.
Focus on quality ASX sharesThe simplest way to double your portfolio is to own high-quality assets and give them time to grow.
ASX shares like Telstra Group Ltd (ASX: TLS) and Harvey Norman Holdings Ltd (ASX: HVN) provide reliable, fully franked dividends that you can reinvest to supercharge compounding.
What you need is time, discipline, and exposure to quality ASX shares and ETFs.",Motley Fool Australia,2025-09-23T23:41:49Z,https://www.fool.com.au/2025/09/24/how-to-double-your-asx-share-portfolio-without-chasing-risky-stocks/,2025-09-25 10:32:34.190147
MSFT,"Stock market today: Nasdaq, Dow, S&P 500 waver with divided Fed, Alibaba in focus","US stocks fell on Wednesday as Wall Street digested mixed messaging from Fed officials on interest rates.
Debate over the prospects for US interest rate cuts — the big focus for markets right now — appeared to pressure stocks.
Fed Chair Jerome Powell reiterated in a speech on Tuesday that the central bank would proceed cautiously on further rate cuts, even as he left the door open to more easing.
Markets are watching for reassurance that inflation isn't posing a threat to high expectations for two more rate cuts this year.
Meanwhile, some tech stocks are showing gains despite a broader drop across the Nasdaq, which snapped a winning streak on Tuesday amid losses for the ""Magnificent Seven"" Big Tech stocks.",Yahoo Entertainment,2025-09-23T23:03:54Z,https://finance.yahoo.com/news/live/stock-market-today-nasdaq-dow-sp-500-waver-with-divided-fed-alibaba-in-focus-230354679.html,2025-09-25 10:32:35.359697
MSFT,"Stock market today: Nasdaq, Dow, S&P 500 fall with divided Fed, Alibaba in focus","US stocks fell on Wednesday as Wall Street digested mixed messaging from Fed officials on interest rates.
Debate over the prospects for US interest rate cuts — the big focus for markets right now — appeared to pressure stocks.
Fed Chair Jerome Powell reiterated in a speech on Tuesday that the central bank would proceed cautiously on further rate cuts, even as he left the door open to more easing.
Markets are watching for reassurance that inflation isn't posing a threat to high expectations for two more rate cuts this year.
Meanwhile, some tech stocks are showing gains despite a broader drop across the Nasdaq, which snapped a winning streak on Tuesday amid losses for the ""Magnificent Seven"" Big Tech stocks.",Yahoo Entertainment,2025-09-23T23:03:54Z,https://finance.yahoo.com/news/live/stock-market-today-nasdaq-dow-sp-500-fall-with-divided-fed-alibaba-in-focus-230354294.html,2025-09-25 10:32:36.454234
MSFT,"Stock market today: Dow, S&P 500, Nasdaq slide after Powell flags Fed's challenge, 'highly valued' stocks","The S&P 500 (^GSPC) fell about 0.6%, and the tech-heavy Nasdaq Composite (^IXIC) lost almost 1%.
Powell suggested during a speech in Rhode Island that the central bank would move cautiously after resuming rate cuts last week, noting the challenge of balancing its dual mandate at the moment.
""Near-term risks to inflation are tilted to the upside and risks to employment to the downside — a challenging situation.
Later, in a question-and-answer session, he noted that ""by many measures, for example, equity prices are fairly highly valued.""
Powell's comments set the stage for the release on Friday of the Fed's preferred inflation gauge, the Personal Consumption Expenditures index.",Yahoo Entertainment,2025-09-23T20:01:43Z,https://finance.yahoo.com/news/live/stock-market-today-dow-sp-500-nasdaq-slide-after-powell-flags-feds-challenge-highly-valued-stocks-174834474.html,2025-09-25 10:32:37.550730
MSFT,Micron set to report Q4 earnings in latest test of AI trade,"Micron (MU) stock rose early on Wednesday after the chipmaker reported fiscal fourth quarter earnings that surpassed Wall Street's expectations.
Micron's fiscal fourth quarter revenue of $11.3 billion was ahead of the $11.15 billion expected by analysts polled by Bloomberg.
The Idaho-based memory chipmaker — whose semiconductors are used alongside Nvidia's chips in AI data centers — saw adjusted earnings per share of $3.03 for the three months ending Aug. 28, more than the $2.84 projected.
The beat was fueled by the AI data center boom, company executives said, with data centers representing 40% of the chipmaker's total revenue in the fourth quarter.
The company guided for first quarter revenue between $12.2 billion and $12.8 billion, more than the $11.9 billion expected by analysts tracked by Bloomberg.",Yahoo Entertainment,2025-09-23T19:23:51Z,https://finance.yahoo.com/news/micron-set-to-report-q4-earnings-in-latest-test-of-ai-trade-192351303.html,2025-09-25 10:32:38.414756
MSFT,"Stock market today: Dow, S&P 500, Nasdaq slide as Powell warns of 'challenging situation'","The S&P 500 (^GSPC) fell about 0.6%, and the tech-heavy Nasdaq Composite (^IXIC) lost almost 1%.
Powell suggested during a speech in Rhode Island that the central bank would move cautiously after resuming rate cuts last week, noting the challenge of balancing its dual mandate at the moment.
""Near-term risks to inflation are tilted to the upside and risks to employment to the downside — a challenging situation.
Later, in a question-and-answer session, he noted that ""by many measures, for example, equity prices are fairly highly valued.""
Powell's comments set the stage for the release on Friday of the Fed's preferred inflation gauge, the Personal Consumption Expenditures index.",Yahoo Entertainment,2025-09-23T17:48:34Z,https://finance.yahoo.com/news/live/stock-market-today-dow-sp-500-nasdaq-slide-as-powell-warns-of-challenging-situation-174834970.html,2025-09-25 10:32:39.453683
MSFT,"Microsoft says it is experimenting with microfluidics, which involves sending fluid through channels in AI and server chips to improve cooling efficiency",", 200); return false;"">Why did Nvidia invest $100 billion in OpenAI? , 200); return false;"">How will Trump's $100K H-1B… [+805 chars]",Biztoc.com,2025-09-23T17:05:00Z,https://biztoc.com/x/a0cf0ad883c1806a,2025-09-25 10:32:39.835232
MSFT,The ‘Irrational Exuberance’ in AI Stocks Isn’t Going Anywhere. Buy These 3 Top-Rated Names Here.,"Switch the Market flagOpen the menu and switch theMarket flag for targeted data from your country of choice.
for targeted data from your country of choice.",Barchart.com,2025-09-23T16:33:25Z,https://www.barchart.com/story/news/34985172/the-irrational-exuberance-in-ai-stocks-isnt-going-anywhere-buy-these-3-top-rated-names-here,2025-09-25 10:32:41.310438
MSFT,"Is Oracle Stock a Buy, Sell, or Hold as the Company Names 2 New CEOs?","Switch the Market flagOpen the menu and switch theMarket flag for targeted data from your country of choice.
for targeted data from your country of choice.",Barchart.com,2025-09-23T16:01:41Z,https://www.barchart.com/story/news/34984465/is-oracle-stock-a-buy-sell-or-hold-as-the-company-names-2-new-ceos,2025-09-25 10:32:42.573045
MSFT,Aswath Damodaran on Microsoft (MSFT) Return on AI Investments: ‘I Don’t See The Numbers’ Yet,", 200); return false;"">Why did Nvidia invest $100 billion in OpenAI? , 200); return false;"">How will Trump's $100K H-1B… [+762 chars]",Biztoc.com,2025-09-23T15:57:39Z,https://biztoc.com/x/6748098584ca3fae,2025-09-25 10:32:43.086762
MSFT,Aswath Damodaran on Microsoft (MSFT) Return on AI Investments: ‘I Don’t See The Numbers’ Yet,"If you click 'Accept all', we and our partners, including 238 who are part of the IAB Transparency & Consent Framework, will also store and/or access information on a device (in other words, use … [+714 chars]",Yahoo Entertainment,2025-09-23T15:38:08Z,https://consent.yahoo.com/v2/collectConsent?sessionId=1_cc-session_e12bbdf1-9c36-4978-bec1-ece915affd8b,2025-09-25 10:32:43.410347
MSFT,Stocks Lower After Fed Chair Powell Comments,"Switch the Market flagOpen the menu and switch theMarket flag for targeted data from your country of choice.
for targeted data from your country of choice.",Barchart.com,2025-09-23T15:17:13Z,https://www.barchart.com/story/news/34983527/stocks-mixed-before-fed-chair-powell-comments,2025-09-25 10:32:44.658680
MSFT,Microsoft Is Turning to the Field of Microfluidics to Cool Down AI Chips,", 200); return false;"">What triggered Nvidia's $100B OpenAI investment? , 200); return false;"">How will Trumps new H-1B… [+810 chars]",Biztoc.com,2025-09-23T15:13:15Z,https://biztoc.com/x/8314034c749e6fb3,2025-09-25 10:32:45.068364
MSFT,Comparative Study: Microsoft And Industry Competitors In Software Industry,"In today's rapidly changing and fiercely competitive business landscape, it is essential for investors and industry enthusiasts to thoroughly analyze companies.
In this article, we will conduct a comprehensive industry comparison, evaluating Microsoft MSFT against its key competitors in…This story appeared on benzinga.com , 2025-09-23 15:00:36.",Biztoc.com,2025-09-23T15:13:12Z,https://biztoc.com/x/06e50d8fbfdba1b0,2025-09-25 10:32:45.487207
MSFT,Here’s Why Microsoft Corporation (MSFT) Rallied in Q2,", 200); return false;"">What triggered Nvidia's $100B OpenAI investment? , 200); return false;"">How will Trumps new H-1B… [+767 chars]",Biztoc.com,2025-09-23T14:06:06Z,https://biztoc.com/x/d3fe64a341a7366a,2025-09-25 10:32:45.875475
MSFT,Here’s Why Microsoft Corporation (MSFT) Rallied in Q2,"In its second-quarter 2025 investor letter, Columbia Threadneedle Global Technology Growth Strategy highlighted stocks such as Microsoft Corporation (NASDAQ:MSFT).
Microsoft Corporation (NASDAQ:MSFT) is a multinational software company that develops and supports software, services, devices, and solutions.
The one-month return of Microsoft Corporation (NASDAQ:MSFT) was 2.47%, and its shares gained 19.87% of their value over the last 52 weeks.
On September 22, 2025, Microsoft Corporation (NASDAQ:MSFT) stock closed at $514.45 per share, with a market capitalization of $3.824 trillion.
If you're looking for an extremely undervalued AI stock that also stands to benefit significantly from Trump-era tariffs and the onshoring trend, see our free report on the best short-term AI stock.",Yahoo Entertainment,2025-09-23T13:47:57Z,https://finance.yahoo.com/news/why-microsoft-corporation-msft-rallied-134757673.html,2025-09-25 10:32:46.803842
MSFT,How To Grab 8.4% A Year From Real Estate Without Owning A Home,$20 trillion. Thats how much value has been added to the US housing market in the last five years. Its a number so big its near-impossible to get your head around. And its a double-edged sword. On … [+5280 chars],Forbes,2025-09-23T13:15:00Z,https://www.forbes.com/sites/michaelfoster/2025/09/23/how-to-grab-84-a-year-from-real-estate-without-owning-a-home/,2025-09-25 10:32:46.874124
MSFT,Is Google Stock a Buy at New All-Time Highs?,"Switch the Market flagOpen the menu and switch theMarket flag for targeted data from your country of choice.
for targeted data from your country of choice.",Barchart.com,2025-09-23T13:07:34Z,https://www.barchart.com/story/news/34979435/is-google-stock-a-buy-at-new-all-time-highs,2025-09-25 10:32:48.103395
MSFT,What Makes Microsoft (MSFT) a Strong Investment?,"Fred Alger Management, an investment management company, released its “Alger Spectra Fund” second-quarter 2025 investor letter.
A copy of the letter can be downloaded here.
In the second quarter, the equities rebounded significantly following a challenging first quarter.
In this…This story appeared on finance.yahoo.com , 2025-09-23 12:37:13.",Biztoc.com,2025-09-23T12:59:06Z,https://biztoc.com/x/0b91ef7835865404,2025-09-25 10:32:48.498363
MSFT,What Makes Microsoft (MSFT) a Strong Investment?,"In its second-quarter 2025 investor letter, Alger Spectra Fund highlighted stocks such as Microsoft Corporation (NASDAQ:MSFT).
The one-month return of Microsoft Corporation (NASDAQ:MSFT) was 2.47%, and its shares gained 19.87% of their value over the last 52 weeks.
On September 22, 2025, Microsoft Corporation (NASDAQ:MSFT) stock closed at $514.45 per share, with a market capitalization of $3.824 trillion.
Alger Spectra Fund stated the following regarding Microsoft Corporation (NASDAQ:MSFT) in its second quarter 2025 investor letter:""Microsoft Corporation (NASDAQ:MSFT) is a beneficiary of corporate America’s transformative digitization.
While we acknowledge the potential of Microsoft Corporation (NASDAQ:MSFT) as an investment, we believe certain AI stocks offer greater upside potential and carry less downside risk.",Yahoo Entertainment,2025-09-23T12:37:13Z,https://finance.yahoo.com/news/makes-microsoft-msft-strong-investment-123713638.html,2025-09-25 10:32:49.450312
TSLA,"Stock market today: Nasdaq, Dow, S&P 500 waver with divided Fed, Alibaba in focus","US stocks fell on Wednesday as Wall Street digested mixed messaging from Fed officials on interest rates.
Debate over the prospects for US interest rate cuts — the big focus for markets right now — appeared to pressure stocks.
Fed Chair Jerome Powell reiterated in a speech on Tuesday that the central bank would proceed cautiously on further rate cuts, even as he left the door open to more easing.
Markets are watching for reassurance that inflation isn't posing a threat to high expectations for two more rate cuts this year.
Meanwhile, some tech stocks are showing gains despite a broader drop across the Nasdaq, which snapped a winning streak on Tuesday amid losses for the ""Magnificent Seven"" Big Tech stocks.",Yahoo Entertainment,2025-09-23T23:03:54Z,https://finance.yahoo.com/news/live/stock-market-today-nasdaq-dow-sp-500-waver-with-divided-fed-alibaba-in-focus-230354679.html,2025-09-25 10:32:51.089453
TSLA,"Stock market today: Nasdaq, Dow, S&P 500 fall with divided Fed, Alibaba in focus","US stocks fell on Wednesday as Wall Street digested mixed messaging from Fed officials on interest rates.
Debate over the prospects for US interest rate cuts — the big focus for markets right now — appeared to pressure stocks.
Fed Chair Jerome Powell reiterated in a speech on Tuesday that the central bank would proceed cautiously on further rate cuts, even as he left the door open to more easing.
Markets are watching for reassurance that inflation isn't posing a threat to high expectations for two more rate cuts this year.
Meanwhile, some tech stocks are showing gains despite a broader drop across the Nasdaq, which snapped a winning streak on Tuesday amid losses for the ""Magnificent Seven"" Big Tech stocks.",Yahoo Entertainment,2025-09-23T23:03:54Z,https://finance.yahoo.com/news/live/stock-market-today-nasdaq-dow-sp-500-fall-with-divided-fed-alibaba-in-focus-230354294.html,2025-09-25 10:32:53.108081
TSLA,"Tesla stock falters, but UBS points out competitive advantages","Tesla's rough year on Wall Street seems to be at an inflection point.
The electric vehicle maker has faced falling sales for nearly two years.
Even before Tesla's CEO jumped into the political fray over a year ago, Tesla (TSLA) saw a growth slowdown that led to falling deliveries for…This story appeared on thestreet.com , 2025-09-23 21:37:00.",Biztoc.com,2025-09-23T21:46:53Z,https://biztoc.com/x/25589f735a69cbd1,2025-09-25 10:32:53.476533
TSLA,"Stock market today: Dow, S&P 500, Nasdaq slide after Powell flags Fed's challenge, 'highly valued' stocks","The S&P 500 (^GSPC) fell about 0.6%, and the tech-heavy Nasdaq Composite (^IXIC) lost almost 1%.
Powell suggested during a speech in Rhode Island that the central bank would move cautiously after resuming rate cuts last week, noting the challenge of balancing its dual mandate at the moment.
""Near-term risks to inflation are tilted to the upside and risks to employment to the downside — a challenging situation.
Later, in a question-and-answer session, he noted that ""by many measures, for example, equity prices are fairly highly valued.""
Powell's comments set the stage for the release on Friday of the Fed's preferred inflation gauge, the Personal Consumption Expenditures index.",Yahoo Entertainment,2025-09-23T20:01:43Z,https://finance.yahoo.com/news/live/stock-market-today-dow-sp-500-nasdaq-slide-after-powell-flags-feds-challenge-highly-valued-stocks-174834474.html,2025-09-25 10:32:54.548377
TSLA,Tesla (TSLA) is having its first and last good quarter in a while,"New Tesla Model Y; via Tesla.
Tesla (TSLA) is having its first good quarter (Q3) in a while.
The range of estimated deliveries is now between 430,000 and 480,000 Tesla deliveries in Q3, with the most consistently accurate analysts being in the higher end of that range.
Advertisement - scroll for more contentIn Q3 2024, Tesla delivered 463,000 vehicles, indicating that the Company has a real shot at increasing deliveries year-over-year this quarter.
But it’s only going to be good for a few good headlines this quarter.",Electrek,2025-09-23T18:05:59Z,http://electrek.co/2025/09/23/tesla-tsla-is-having-its-first-and-last-good-quarter-in-a-while/,2025-09-25 10:32:55.595270
TSLA,"Stock market today: Dow, S&P 500, Nasdaq slide as Powell warns of 'challenging situation'","The S&P 500 (^GSPC) fell about 0.6%, and the tech-heavy Nasdaq Composite (^IXIC) lost almost 1%.
Powell suggested during a speech in Rhode Island that the central bank would move cautiously after resuming rate cuts last week, noting the challenge of balancing its dual mandate at the moment.
""Near-term risks to inflation are tilted to the upside and risks to employment to the downside — a challenging situation.
Later, in a question-and-answer session, he noted that ""by many measures, for example, equity prices are fairly highly valued.""
Powell's comments set the stage for the release on Friday of the Fed's preferred inflation gauge, the Personal Consumption Expenditures index.",Yahoo Entertainment,2025-09-23T17:48:34Z,https://finance.yahoo.com/news/live/stock-market-today-dow-sp-500-nasdaq-slide-as-powell-warns-of-challenging-situation-174834970.html,2025-09-25 10:32:56.571431
TSLA,"Tesla, Inc. $TSLA Shares Acquired by Wedge Capital Management L L P NC","The fund owned 2,957 shares of the electric vehicle producer’s stock after buying an additional 478 shares during the period.
Wedge Capital Management L L P NC’s holdings in Tesla were worth $939,000 as of its most recent SEC filing.
Tesla Stock PerformanceShares of NASDAQ TSLA opened at $434.21 on Tuesday.
Insiders Place Their BetsIn other news, CFO Vaibhav Taneja sold 4,000 shares of Tesla stock in a transaction that occurred on Monday, July 7th.
Also, SVP Xiaotong Zhu sold 20,000 shares of Tesla stock in a transaction that occurred on Thursday, September 11th.",ETF Daily News,2025-09-23T17:32:44Z,https://www.etfdailynews.com/2025/09/23/tesla-inc-tsla-shares-acquired-by-wedge-capital-management-l-l-p-nc/,2025-09-25 10:32:57.754978
