ticker,title,content,source,published_at,url,collected_at
META,New Blood Pressure Guidelines Mean You May Now Have Hypertension,"Systolic blood pressure, the top number, represents the pressure in the blood vessels when the heart is squeezing blood into the body.
Diastolic blood pressure, the bottom number, is the pressure in the blood vessels when the heart is relaxing.
Now, patients are categorized as having ""elevated blood pressure"" if their blood pressure is 120-129 over less than 80 mm Hg, or stage 1 hypertension if they are 130-139/80-89.
On average, for every additional 30 minutes of aerobic exercise a person gets per week, systolic blood pressure decreases by 2 mm Hg and diastolic blood pressure drops by 1 mm Hg, with the largest reduction occurring at 150 minutes of dynamic exercise per week.
These include healthy diet, regular exercise, stopping or avoiding smoking, sleeping seven to nine hours per night, and controlling weight, cholesterol, blood sugar, and blood pressure.",ScienceAlert,2025-09-24T01:34:09Z,https://www.sciencealert.com/new-blood-pressure-guidelines-mean-you-may-now-have-hypertension,2025-09-25 10:33:58.737052
META,OpenAI to join tech giants in building five new data centres in US,"SynopsisOpenAI, backed by Nvidia's $100 billion investment, partners with SoftBank and Oracle to construct five new data centers across the U.S.
These facilities, part of the $500 billion Stargate Project initiated with President Trump, aim to bolster AI technology development.
Oracle will oversee and finance three centers, while SoftBank will fund two, expanding OpenAI's data infrastructure.",The Times of India,2025-09-24T01:16:04Z,https://economictimes.indiatimes.com/tech/technology/openai-to-join-tech-giants-in-building-five-new-data-centres-in-us/articleshow/124081006.cms,2025-09-25 10:33:59.206665
META,"How power training is your hack for aging better: Gain strength, speed, and balance","(Catch all the US News, UK News, Canada News, International Breaking News Events, and Latest News Updates on The Economic Times.)
Download The Economic Times News App to get Daily International News Updates.",The Times of India,2025-09-24T00:48:04Z,https://economictimes.indiatimes.com/news/international/us/how-power-training-is-your-hack-for-aging-better-gain-strength-speed-and-balance/articleshow/124080852.cms,2025-09-25 10:33:59.561454
META,Former Zomato CEO Rakesh Ranjan joins Allen Online,"SynopsisRanjan, who now takes charge at the edtech unit, had led Zomato’s core food delivery operations for two years before being succeeded by Aditya Mangla.
He stepped down from his role in April and formally exited the Gurgaon-based company earlier this month.",The Times of India,2025-09-24T00:30:00Z,https://economictimes.indiatimes.com/tech/startups/former-zomato-ceo-rakesh-ranjan-joins-allen-online/articleshow/124076752.cms,2025-09-25 10:34:00.098785
META,All You Need To Know Going Into Trade On Wednesday,"Muthoot Microfin: The company has successfully allotted 5,000 non-convertible debentures with a total value of Rs 50 crore.
Havells India: The company has announced that Lloyd Kolors refrigerators are now available on Flipkart and other distribution channels, starting at Rs 18,990.
Rama Steel Tubes: The company has allotted 7.7 crore shares at an issue price of Rs 11.25 per share on a preferential basis.
Tech Mahindra: The company’s arm, Tech Mahindra London, has executed a share transfer pact to divest its entire 26.42% stake in Surance.
Arihant Capital: The company has approved allotment of 5 lakh shares at an issue price of Rs 87 per share, raising Rs 4.35 crore.",Ndtvprofit.com,2025-09-24T00:30:00Z,https://www.ndtvprofit.com/markets/stock-market-today-all-you-need-to-know-going-into-trade-on-sept-24-2,2025-09-25 10:34:00.710063
META,Meta to Invest ‘Tens of Millions’ to Combat State-Level AI Bills,"Meta is reportedly investing “tens of millions” in its new super PAC dedicated to combating state-level proposals to regulate artificial intelligence (AI) and other technologies.
The American Technology Excellence Project aims to block state-level bills that the company believes…This story appeared on pymnts.com , 2025-09-23 23:39:27.",Biztoc.com,2025-09-24T00:14:10Z,https://biztoc.com/x/688e08a6a70b8d34,2025-09-25 10:34:01.089395
META,Why AI Chatbots Can't Process Persian Social Etiquette,"""Oh what wouldn't I give to be spat at in the face..."" -- a prisoner in ""Life of Brian""",Slashdot.org,2025-09-24T00:09:24Z,https://slashdot.org/submission/17340488/why-ai-chatbots-cant-process-persian-social-etiquette,2025-09-25 10:34:01.615121
META,WhatsApp’s latest new feature is much better on Android,"In total, WhatsApp on iOS will be able to translate messages between the 19 languages supported by Apple’s Translate app.
Considering how many people around the world use WhatsApp, that feature could be even more consequential than the Live Translation on the Android users are getting a better version of the feature, albeit with fewer supported languages.
In total, WhatsApp on iOS will be able to translate messages between the 19 languages supported by Apple’s Translate app.
Android users will be able to use translations in six languages:Meta’s new feature comes shortly after Apple launched Live Translation on its own Messages app on iOS 26 .
Considering how many people around the world use WhatsApp, that feature could be even more consequential than the Live Translation on the AirPods Pro 3 .",PhoneArena,2025-09-23T23:54:13Z,https://www.phonearena.com/news/whatsapps-latest-new-feature-is-much-better-on-android_id174290,2025-09-25 10:34:02.364211
META,Diablo 4 Tier Lists and Planner Updated for Season 10,"Blizzard has just released Diablo 4 Season 10 -- the Season of Infernal Chaos -- featuring the new Chaos Armor feature along with adjustments to the endgame loop.
If you want to get theorcrafting, check out Maxroll’s Diablo 4 Planner (updated for Season 10).
As a result Maxroll has updated all of their Diablo 4 Tier Lists .
The Bossing Builds Tier List focuses on single target damage output and ability to kill T4 Bosses quickly and efficiently.
Written by: IGN staff with help from the Maxroll Diablo 4 Team",IGN,2025-09-23T23:47:33Z,https://www.ign.com/articles/diablo-4-tier-lists-and-planner-updated-for-season-10,2025-09-25 10:34:02.782922
META,Meta just missed a senator's deadline for submitting records about its AI chatbot policies for kids,"Mark Zuckerberg attends the 2025 Breakthrough Prize ceremony in Santa Monica, California.
Mario Anzuoni/REUTERSMeta hasn't complied with Sen. Josh Hawley's demand for hundreds of pages of AI chatbot rules.
The tech giant is under fire for having rules that once allowed ""sensual"" chats…This story appeared on businessinsider.com , 2025-09-23 23:29:10.",Biztoc.com,2025-09-23T23:39:43Z,https://biztoc.com/x/c33d5fa51b1d47a9,2025-09-25 10:34:03.187199
META,Meta to Invest ‘Tens of Millions’ to Combat State-Level AI Bills,"Meta is reportedly investing “tens of millions” in its new super PAC dedicated to combating state-level proposals to regulate artificial intelligence (AI) and other technologies.
There have been 1,100 state-level tech policy proposals introduced this year, according to the report.
Politico reported Aug. 26 that Meta launched a California super PAC called Mobilizing Economic Transformation Across California that will support candidates for state offices who favor AI innovation.
When the Senate rejected the proposed 10-year moratorium on state-level AI regulations, it did so in a 99-1 vote.
Some of those who criticized the proposal flagged concerns about keeping states from regulating a powerful and potentially disruptive technology.",pymnts.com,2025-09-23T23:39:27Z,http://www.pymnts.com/meta/2025/meta-to-invest-tens-of-millions-to-combat-state-level-ai-bills/,2025-09-25 10:34:04.034010
META,Stablecoin Titan Tether Seeks $500 Billion Valuation on $20 Billion Raise: Report,"In brief Tether is seeking to raise up to $20 billion, according to a report.
The private raise could give the stablecoin issuer a valuation of $500 billion.
The company currently has a valuation above $30 billion, according to Yahoo Finance data.
Tether has a market cap of $172 billion, more than double Circle's $74 billion value, according to crypto data provider CoinGecko.
On Tuesday at a conference in Seoul, Hines said during an interview that Tether has no plans to raise money, Bloomberg reported.",Decrypt,2025-09-23T23:29:14Z,https://decrypt.co/340988/stablecoin-tether-seeks-500-billion-valuation-20-billion-raise-report,2025-09-25 10:34:05.474844
META,Meta just missed a senator's deadline for submitting records about its AI chatbot policies for kids,"Impact LinkMeta has missed a Senate deadline to hand over records of how its AI chatbots interacted with children, defying a request tied to revelations about the company's internal policies.
Meta removed that language and is training its chatbots to block inappropriate chats with teens, it told Business Insider.
As of Tuesday, Meta hadn't sent all the records and had not complied with Hawley's deadline, Hawley's spokesperson Bernadette Breslin confirmed to Business Insider.
Related stories Business Insider tells the innovative stories you want to know Business Insider tells the innovative stories you want to knowThe scrutiny comes as Meta doubles down on its chatbot strategy.
""The silence looks evasive and highlights how unprepared Meta seems for the responsibilities that come with deploying AI to children.""",Business Insider,2025-09-23T23:29:10Z,https://www.businessinsider.com/meta-misses-senate-deadline-on-ai-chatbot-child-safety-records-2025-9,2025-09-25 10:34:06.425580
META,"Advertising Week New York returns Oct. 6-9 with 1,200+ speakers, 28 content tracks for creators, marketers, and more","Each year, Advertising Week New York welcomes thousands of attendees as well as major brands like Coca-Cola, McDonald’s, Johnson & Johnson, Nike, Nintendo, Starbucks, Walmart, and Unilever, plus content platforms like TikTok, Twitch, and Meta.
Subscribe for daily Tubefilter Top Stories Subscribe“Discover groundbreaking ideas, create new partnerships and soak up the energy of the industry’s most dynamic event,” Advertising Week organizers said.
As for those who can make it in person, Advertising Week New York is currently running an early bird registration with 20% off passes.
Advertising Week New York runs Oct. 6-9 in THE PENN DISTRICT at 100 W. 33rd St. in New York City.
Advertising Week New York is a Tubefilter partner.",Tubefilter,2025-09-23T23:21:29Z,https://www.tubefilter.com/2025/09/23/advertising-week-new-york-2025/,2025-09-25 10:34:06.527371
META,Sobakistan: The Land of Dogs Announces Public Playtest,"Posted in: Games, Indie Games, Video Games | Tagged: Sobakistan: The Land of Dogs, Terletski Games Sobakistan: The Land of Dogs will be holding a special playtest this October, showing off the dog-c… [+2521 chars]",Bleeding Cool News,2025-09-23T23:12:03Z,https://bleedingcool.com/games/sobakistan-the-land-of-dogs-announces-public-playtest/,2025-09-25 10:34:06.583152
NFLX,Netflix Stock Is Up 40% in 2025 But Wall Street Isn’t Backing Down. Should You Buy NFLX Now?,", 200); return false;"">Why is Nvidia investing $100 billion in OpenAI? , 200); return false;"">How will Trump's $100K H-… [+798 chars]",Biztoc.com,2025-09-22T19:33:17Z,https://biztoc.com/x/dc36ac80353d8e99,2025-09-25 10:34:07.325785
NFLX,Netflix Stock Is Up 40% in 2025 But Wall Street Isn’t Backing Down. Should You Buy NFLX Now?,"Switch the Market flagOpen the menu and switch theMarket flag for targeted data from your country of choice.
for targeted data from your country of choice.",Barchart.com,2025-09-22T19:17:59Z,https://www.barchart.com/story/news/34961658/netflix-stock-is-up-40-in-2025-but-wall-street-isnt-backing-down-should-you-buy-nflx-now,2025-09-25 10:34:08.792651
NFLX,AB InBev and Netflix Announce Global Brand Partnership,The unprecedented multi-year partnership connects iconic beer brands with Netflix titles and live events THIS CONTENT IS RESERVED FOR RS ONLY now to read the latest news in your … [+6325 chars],Financial Post,2025-09-22T11:09:39Z,https://financialpost.com/pmn/business-wire-news-releases-pmn/ab-inbev-and-netflix-announce-global-brand-partnership,2025-09-25 10:34:09.073215
NFLX,Bernstein Maintains Outperform Rating for Netflix (NFLX) Amid Content Licensing Concerns,"On September 15, Bernstein addressed concerns regarding Netflix Inc. (NASDAQ:NFLX)’s content licensing contracts while maintaining its Outperform rating and $1,390 price target for the streaming giant.
The reaffirmation comes amid questions around Netflix’s dependence on Paramount and Warner Bros.
Discovery content in the wake of rumors that Paramount Global may buy Warner Bros.
While we acknowledge the potential of NFLX as an investment, we believe certain AI stocks offer greater upside potential and carry less downside risk.
READ NEXT: 10 Best Magic Formula Stocks for 2025 and 10 Best Retirement Stocks to Buy According to Hedge Funds.",Yahoo Entertainment,2025-09-21T08:11:24Z,https://finance.yahoo.com/news/bernstein-maintains-outperform-rating-netflix-081124540.html,2025-09-25 10:34:09.955895
NFLX,"KeyBanc Reaffirms Overweight Rating for Netflix (NFLX), Sees Strong Ad Revenue Growth","If you click 'Accept all', we and our partners, including 238 who are part of the IAB Transparency & Consent Framework, will also store and/or access information on a device (in other words, use … [+714 chars]",Yahoo Entertainment,2025-09-21T07:59:26Z,https://consent.yahoo.com/v2/collectConsent?sessionId=1_cc-session_e3310f4e-c15b-47e2-95e3-93927486a140,2025-09-25 10:34:10.774311
NFLX,"3,774 Shares in Netflix, Inc. $NFLX Bought by Financiere des Professionnels Fonds d investissement inc.","Financiere des Professionnels Fonds d investissement inc. bought a new position in Netflix, Inc. (NASDAQ:NFLX – Free Report) during the 2nd quarter, Holdings Channel reports.
The institutional investor bought 3,774 shares of the Internet television network’s stock, valued at approximately $5,054,000.
Also, Director Reed Hastings sold 25,959 shares of Netflix stock in a transaction dated Tuesday, September 2nd.
Insiders have sold a total of 89,348 shares of company stock valued at $109,498,489 over the last ninety days.
Netflix Stock Up 1.6%Shares of Netflix stock opened at $1,226.97 on Friday.",ETF Daily News,2025-09-20T07:56:55Z,https://www.etfdailynews.com/2025/09/20/3774-shares-in-netflix-inc-nflx-bought-by-financiere-des-professionnels-fonds-d-investissement-inc/,2025-09-25 10:34:11.880888
NFLX,"If You Invested In Netflix When It Was Still a DVD Rental Service, Here’s How Much You’d Have Today","When it comes to adapting to different technologies and consumer patterns, few companies have succeeded as well as Netflix (NFLX) — and hardly any have been bigger winners on Wall Street.
Read Next: Self-Made Millionaires Suggest 5 Stocks You Should Never SellCheck Out: How Much Money…This story appeared on finance.yahoo.com , 2025-09-19 16:40:35.",Biztoc.com,2025-09-19T16:54:02Z,https://biztoc.com/x/f7ac5af920c7489b,2025-09-25 10:34:12.250798
NFLX,"If You Invested In Netflix When It Was Still a DVD Rental Service, Here’s How Much You’d Have Today","But while Blockbuster was slow to adapt to the next decade’s streaming trend, Netflix quickly spotted the opportunity.
Explore More: Barbara Corcoran: This Is the Only Investment I’ll ‘Never Sell’How Much Would Your Netflix Investment Be Worth Now?
If you bought Netflix shares in December 2006 — when it was still a DVD rental company — you made a very smart move.
Here’s a look at how much money you would have now with an initial $1,000 investment, before Netflix branched out into streaming services.
The 2006 price shown below was adjusted from the original price to reflect a 7-for-1 stock split in July 2015.",Yahoo Entertainment,2025-09-19T16:40:35Z,https://finance.yahoo.com/news/invested-netflix-still-dvd-rental-164035336.html,2025-09-25 10:34:13.218646
NFLX,This Bearish Trade Might Work Best If Netflix Stock Is Fading,", 200); return false;"">Why is SoftBank cutting 20% of its workforce? , 200); return false;"">How will Trump-Xi TikTok de… [+721 chars]",Biztoc.com,2025-09-19T15:03:00Z,https://biztoc.com/x/be2668e80aee7dda,2025-09-25 10:34:13.593598
NFLX,Should You Invest in Netflix (NFLX)?,"In its second-quarter 2025 investor letter, the Macquarie Core Equity Fund highlighted stocks such as Netflix, Inc. (NASDAQ:NFLX).
On September 18, 2025, Netflix, Inc. (NASDAQ:NFLX) stock closed at $1,207.78 per share, with a market capitalization of $520.628 billion.
Macquarie Core Equity Fund stated the following regarding Netflix, Inc. (NASDAQ:NFLX) in its second quarter 2025 investor letter:""Netflix, Inc. (NASDAQ:NFLX) offers a subscription-based streaming service.
Netflix, Inc. (NFLX): Not An Analyst Who Isn't Buying Netflix, Says Jim CramerNetflix, Inc. (NASDAQ:NFLX) is in 14th position on our list of 30 Most Popular Stocks Among Hedge Funds.
In addition, please check out our hedge fund investor letters Q2 2025 page for more investor letters from hedge funds and other leading investors.",Yahoo Entertainment,2025-09-19T12:34:06Z,https://finance.yahoo.com/news/invest-netflix-nflx-123406577.html,2025-09-25 10:34:14.523595
NFLX,"Analysts Set Netflix, Inc. (NASDAQ:NFLX) Price Target at $1,317.58","Wall Street Zen upgraded Netflix from a “hold” rating to a “buy” rating in a research note on Saturday, September 13th.
Barclays reaffirmed a “sell” rating and set a $1,100.00 target price (up from $1,000.00) on shares of Netflix in a report on Wednesday, July 9th.
Canaccord Genuity Group reiterated a “buy” rating on shares of Netflix in a research report on Thursday, July 10th.
The stock was sold at an average price of $1,153.52, for a total value of $274,537.76.
Netflix Company Profile(Get Free Report)Netflix, Inc provides entertainment services.",ETF Daily News,2025-09-19T07:01:27Z,https://www.etfdailynews.com/2025/09/19/analysts-set-netflix-inc-nasdaqnflx-price-target-at-1317-58/,2025-09-25 10:34:15.680227
NFLX,Netflix (NASDAQ:NFLX) Trading Up 2.3% on Analyst Upgrade,"Netflix, Inc. (NASDAQ:NFLX – Get Free Report) shares rose 2.3% during mid-day trading on Wednesday after Loop Capital upgraded the stock from a hold rating to a buy rating.
Loop Capital now has a $1,350.00 price target on the stock, up from their previous price target of $1,150.00.
Jefferies Financial Group reissued a “buy” rating on shares of Netflix in a report on Tuesday, August 12th.
Also, CEO Theodore A. Sarandos sold 2,026 shares of Netflix stock in a transaction dated Tuesday, August 5th.
Netflix Company Profile(Get Free Report)Netflix, Inc provides entertainment services.",ETF Daily News,2025-09-19T05:18:54Z,https://www.etfdailynews.com/2025/09/19/netflix-nasdaqnflx-trading-up-2-3-on-analyst-upgrade/,2025-09-25 10:34:16.836019
NFLX,"Advisors Capital Boosts Netflix, Inc. (NFLX) Stake as Company Partners with Amazon Ads","Netflix, Inc. (NASDAQ:NFLX) is among the high growth mega cap stocks you can buy and hold for the next 3 years.
According to the latest Form 13F filing with the SEC, Advisors Capital Management LLC has expanded its holdings in Netflix, Inc. (NASDAQ:NFLX) by 5.0% in the first quarter.…This story appeared on finance.yahoo.com , 2025-09-18 14:56:20.",Biztoc.com,2025-09-18T15:23:02Z,https://biztoc.com/x/d5be2bf311d7db69,2025-09-25 10:34:17.244290
NFLX,"Advisors Capital Boosts Netflix, Inc. (NFLX) Stake as Company Partners with Amazon Ads","Netflix, Inc. (NASDAQ:NFLX) is among the high growth mega cap stocks you can buy and hold for the next 3 years.
According to the latest Form 13F filing with the SEC, Advisors Capital Management LLC has expanded its holdings in Netflix, Inc. (NASDAQ:NFLX) by 5.0% in the first quarter.
Last week, Netflix, Inc. (NASDAQ:NFLX) announced its partnership with Amazon Ads (NASDAQ:AMZN) to grant advertisers using Amazon DSP access to its ad inventory.
While we acknowledge the potential of NFLX as an investment, we believe certain AI stocks offer greater upside potential and carry less downside risk.
If you're looking for an extremely undervalued AI stock that also stands to benefit significantly from Trump-era tariffs and the onshoring trend, see our free report on the best short-term AI stock.",Yahoo Entertainment,2025-09-18T14:56:20Z,https://finance.yahoo.com/news/advisors-capital-boosts-netflix-inc-145620144.html,2025-09-25 10:34:18.234831
NFLX,Netflix (NASDAQ:NFLX) Upgraded at Loop Capital,"Loop Capital upgraded shares of Netflix (NASDAQ:NFLX – Free Report) from a hold rating to a buy rating in a research note published on Wednesday, MarketBeat Ratings reports.
Loop Capital currently has $1,350.00 price objective on the Internet television network’s stock, up from their previous price objective of $1,150.00.
Finally, Morgan Stanley restated an “equal weight” rating on shares of Netflix in a report on Monday, July 21st.
Insider Buying and SellingIn other news, insider Cletus R. Willems sold 238 shares of Netflix stock in a transaction on Wednesday, August 6th.
Also, Director Reed Hastings sold 25,959 shares of Netflix stock in a transaction on Tuesday, September 2nd.",ETF Daily News,2025-09-18T07:00:52Z,https://www.etfdailynews.com/2025/09/18/netflix-nasdaqnflx-upgraded-at-loop-capital/,2025-09-25 10:34:19.334435
NFLX,Purpose Investments Inc. Announces September 2025 Distributions,"TORONTO, Sept. 17, 2025 (GLOBE NEWSWIRE) Purpose Investments Inc. (Purpose) is pleased to announce distributions for the month of September 2025 for its open-end exchange traded funds and closed-end … [+14080 chars]",Financial Post,2025-09-18T00:04:29Z,https://financialpost.com/globe-newswire/purpose-investments-inc-announces-september-2025-distributions,2025-09-25 10:34:19.619224
