ticker,title,category,content,source,published_at,url,relevance_score,collected_at,quality_score,sentiment
AAPL,"Some marketers are proudly touting anti-AI campaigns, but those promises could put them in a tricky spot down the road",Technology,"I'm closing my eyes and letting AI take the wheel. That's the proposed future for GM, where executives are touting a new ""eyes-off"" self-driving feature launching in 2028. Nothing like a little cat nap when you're hitting 80 mph on the highway.

In today's big story, a portion of Corporate America is proud to tell you how it's avoiding AI. But executives' deep buy-in of the tech might make its arrival inevitable.

What's on deck:

Markets: Steve Cohen's Point72 shook up its top quant unit. Here's how it all went down.

Tech: The great flattening just came for Google's ad division.

Business: If you haven't secured a ""KPop Demon Hunter"" Halloween costume yet, you might be out of luck. (Please don't tell my three-year-old.)

But first, all in on not going all-in.

If this was forwarded to you, sign up here.

The big story

OnlyHumans

A human wrote the sentence you are currently reading. Is that a good enough reason for you to stick around?

That's the strategy behind some big-name corporate brands. While a good chunk of businesses tout their use of AI, another cohort is proudly declaring they're against it.

(Side note: If you'd actually prefer a robot wrote this newsletter, please don't share that opinion with my bosses.)

Aerie, Heineken, and DC Comics are some of the brands shouting from the rooftops (or massive billboards) about their anti-AI stance, writes BI's Lara O'Reilly and Jordan Hart.

For these companies, it's a bet that promoting human authenticity will resonate with people who are growing tired of AI infiltrating all aspects of life.

Finding that human-AI balance was a key theme at Advertising Week New York, Lara previously reported. And even those on the cutting edge of AI seem to recognize the need to tap into the human element.

Just look at this ad from OpenAI of a guy trying to do pull-ups. How very relatable and human!

Of course, there's no guarantee people are buying it.

""Would you like me to go ahead and do the workout for you?"" reads one of the top comments on YouTube.

The anti-AI companies are toeing a fine line.

While most people have some level of AI fatigue — I'm sick of getting tricked by those fake, AI-generated post-game press conferences — it also seems foolish to disregard the technology altogether.

The benefits of leveraging AI to some degree are undeniable, and dismissing that could be a grave mistake. Some might argue that a purely human approach in a world full of AI is a differentiator, like a restaurant sourcing all its ingredients from a local farm.

But while that business model might work on a small scale, the bigger you are the harder it becomes. That's especially true if your rivals are willing to dive into the AI pool headfirst.

Marketers could also be doing a bit of self-preservation. The more you proclaim the importance of marketing your company as human-first, the more job security you give yourself.

However, one study hints at the inevitability of AI adoption. The survey found 87% of executives use AI on the job, writes BI's Sarah E. Needleman. That's compared to just 57% usage among managers and 27% of employees using it.

The split shows how those at the top of orgs are the biggest proponents of the tech. But that doesn't make the adoption any easier, as Sarah covered in the deep divide taking place at video-game giant Electronic Arts.

3 things in markets

1. Behind the shocking shakeup at Steve Cohen's top quant unit. The surprising ouster of Cubist president Denis Dancanet followed months of quiet maneuvering by Cohen and his top leader, people familiar with the matter said. Cubist is the roughly $7 billion quant division of Cohen's hedge fund Point72. Here's how it all unfolded.

2. Beyond Meat's meme-stock craze might be starting to spoil. Shares in the buzzy plant-based meat company finished down 1% on Wednesday and fell a further 20% in early trading on Thursday. Two options trading data points — and even the retail trader driving Beyond Meat's rally — suggest investors should be cautious.

3. Why gold's record-breaking rally has stalled out. After repeatedly hitting all-time highs over the course of a month, the precious metal has recently retreated. Market experts say gold's decline is likely driven by technical factors.

3 things in tech

1. Google is stripping back management layers (again). In a memo sent to staff last month, the search giant said it was eliminating a middle-management layer in its US ads business. The move is part of Google's larger efforts to speed up decisions and cut bureaucracy, and it reflects a wider trend happening across Big Tech.

2. Meta's AI layoffs, in its own words. Chief AI officer Alexandr Wang said the cuts, which affect 600 Superintelligence Labs employees, will help the company make decisions more quickly. Read the full memo.

3. Amazon is taking the L in AI, but can it bounce back? Bernstein's Mark Shmulik — a top Wall Street tech analyst — said in a note that while AWS might be last in the AI race, it's not dead yet. Shmulik said AWS is showing early signs of progress, and its partnership with Anthropic is promising.

3 things in business

1. Tesla's record quarterly revenue wasn't enough for Wall Street. The EV giant's profit came in below analyst expectations, causing the stock to decline in after-hours trading. Elon Musk also railed against the major proxy firms opposing his proposed pay package, calling them ""corporate terrorists.""

2. Good luck finding a ""KPop Demon Hunters"" Halloween costume. Looks like Netflix really underestimated demand: The officially licensed costumes by Spirit Halloween are sold out online and in most stores. However, unlicensed dupes abound on sites like Etsy and Amazon.

3. It may be the toughest season ever for 'Shark Tank' contestants. Why? Because Tariffs are screwing up the show's usual playbook, BI's Katherine Li writes. For businesses that rely on global supply chains, the cost of production and projected profits may have collapsed between their on-camera pitch and the time their episode airs.

In other news

I was an Apple employee named Sam Sung. After I went viral, I took a new name, but I wish I'd enjoyed the moment more.

Reddit drags Perplexity in a new lawsuit, accusing it of building up a $20 billion company off stolen data.

YouTube's settlement with Trump is helping pay for the White House demolition and ballroom.

These states aren't sending November SNAP benefits due to the government shutdown.

A profitable Airbnb host asks 3 questions before choosing a short-term rental property to invest in.

Micro dramas viewed on phones took over China. Now they're coming for the US.

From 'sandwich bots' to 'omakase' — a guide to the weirder lingo in the crypto fraud trial of two MIT-educated brothers.

Here is how to use OpenAI's new ChatGPT-powered search engine, Atlas.

What's happening today

Intel, Ford, T-Mobile, and Southwest Airlines report earnings.",Business Insider,2025-10-23T13:47:59Z,https://www.businessinsider.com/marketing-anti-ai-campaign-advertising-big-bet-2025-10,0.7,2025-10-24 22:26:17.505840,0.9999999999999999,
AAPL,Watch These Tesla Price Levels as Stock Skids After Earnings Miss,Technology,"Tesla (TSLA) shares fell Thursday morning after the company's quarterly profit came in short of analysts' estimates, even as it returned to revenue growth following two quarters of declines.

The company reported adjusted earnings of 50 cents per share in the period, missing the average Wall Street estimate of 54 cents a share. Lower EV prices and higher operating costs tied to restructuring and AI investments dented the bottom line. CEO Elon Musk told analysts that Tesla is at a ""critical inflection point"" as it focuses on its next phase of growth, which will center on “real-world” applications of AI, including self-driving cars and smart robots.

Tesla shares were down 5% at around $418 in the opening minutes of Thursday's session. The stock, which was the top performer among Magnificent Seven stocks in the third quarter, was up 9% for the year through Wednesday's close.

Below, we break down the technicals on Tesla’s chart and identify key price levels worth watching out for.

Pennant Pattern Breakdown

After hitting their 2025 high earlier this month, Tesla shares have consolidated within a pennant, a chart pattern signaling a continuation of the stock’s recent uptrend.

However, the price looks set to break down below the pattern in Thursday’s trading session following the weaker-than-expected earnings, suggesting waning bullish momentum and the potential for a near-term pullback.

It’s also worth noting that volume has declined during the pennant pattern, indicating a lack of conviction among buyers and sellers ahead of the company’s quarterly results.

Let’s identify three key support levels to watch on Tesla’s chart if the shares lose ground and also point out a zone of resistance worth monitoring during potential upswings in the stock.

Key Support Levels to Watch

The first level to watch sits around $360. This area, roughly midway between the 50- and 200-day moving averages, would likely attract buyers’ attention near a trendline that links a series of peaks on the chart between November and August.

Selling below this level could see the shares retreat toward $292. The price may find support in this location near the March countertrend high and a cluster of trading activity spanning from April to July.

A more-significant retracement may spark a decline to the $267 level. Investors could see this as a high probability buying area near three prominent peaks that formed on the chart in July, September, and October last year.

Zone of Resistance Worth Monitoring

During upswings in Tesla shares, investors should keep a close eye on a zone of resistance between $465 and $489. Those who have purchased at lower prices may seek exit points in this region near the top of the pennant pattern and the stock’s record high.

The comments, opinions, and analyses expressed on Investopedia are for informational purposes only. Read our warranty and liability disclaimer for more info.",Investopedia,2025-10-23T13:34:10Z,https://www.investopedia.com/watch-these-tesla-price-levels-as-stock-skids-after-earnings-miss-11835425,0.7,2025-10-24 22:27:12.114072,0.9999999999999999,
AAPL,US stocks open flat as poor earnings dampen investor mood,Technology,"Synopsis

Wall Street opened flat on Thursday as lackluster earnings from Tesla and IBM dampened investor mood, while brewing trade tensions between the U.S. and China threatened to deepen the market's unease.

Wall Street was largely muted on Thursday, as lackluster earnings from Tesla and IBM cast a shadow over risk appetite, while investors kept a close eye on simmering U.S.-China trade tensions.

Tesla's third-quarter profit missed expectations, dragging its shares down 5.3%. A revenue beat offered little relief, as Wall Street grappled with tempered optimism through the week.

The electric-vehicle maker kicked off earnings for the ""Magnificent Seven"" — a cohort that forms nearly 35% of S&P 500's weight, and could dictate the market's next move.

IBM dropped 5.4% after the company recorded a slowdown in growth in its key cloud software segment, eclipsing a third-quarter beat.

Amid a whirlwind of earnings reports, profit-taking and escalating trade tensions, the equity rally is showing signs of fatigue.

Live Events

While most companies have outpaced analyst estimates, cautious outlooks have cast a shadow as investors look for justification behind sky-high equity valuations.

""The numbers are not high profile enough and not rampant enough to really drive a market through these big milestones,"" said Chris Beauchamp, chief market analyst at IG Group.

""The caution does feed in and big earnings are to come through next week and that might just be the wait and see approach.""

At 09:38 a.m., the Dow Jones Industrial Average rose 41.34 points, or 0.10%, to 46,631.75, the S&P 500 gained 11.93 points, or 0.18%, to 6,711.33 and the Nasdaq Composite gained 23.30 points, or 0.09%, to 22,760.43.

Quantum computing firms were a bright spot after the Wall Street Journal reported that U.S. President Donald Trump's administration was in talks with several of them to take equity stakes in exchange for federal funding.

IonQ and D-Wave Quantum gained 5.7% and 15.6%, respectively, while Rigetti Computing added 8%.

Energy stocks added 1.2% following a jump in crude prices on fresh U.S. sanctions against Russia. Chevron, Exxon Mobil and Halliburton rose between 1% and 2.1%.

Health insurer Molina Healthcare plunged 20.9% after slashing its annual profit forecast. Peers Centene and UnitedHealth fell 6.6% and 1.5%, respectively.

S&P Industrials index rose 0.8% after a slew of earnings. Honeywell raised its annual profit forecast on strong aerospace demand, sending its shares up 5%.

American Airlines shares gained 3.6% after the carrier raised its profit forecast for the year, while Southwest Airlines slipped 3.7% despite a surprise quarterly profit.

T-Mobile dipped 2.3% despite adding more-than-expected wireless subscribers during the third quarter.

DATA DROUGHT DRAGS ON

With the U.S. government shutdown entering its twenty-third day, key economic releases, including Thursday's usual reading of weekly jobless claims data, remain frozen, leaving investors without crucial signals.

That puts Friday's core CPI print, expected to hold steady at 3.1%, in sharp focus as the Federal Reserve's only clear inflation guide ahead of next week's policy meeting.

Markets have already priced in a 25-basis-point rate cut, with traders betting the Fed will ease again in December.

Meanwhile, a Reuters report said the Trump administration was weighing sweeping curbs on high-tech exports to China in retaliation for Beijing's latest restrictions on rare-earth shipments. The report injected fresh uncertainty into the markets.

Advancing issues outnumbered decliners by a 2.07-to-1 ratio on the NYSE and by a 1.66-to-1 ratio on the Nasdaq.

The S&P 500 posted 5 new 52-week highs and one new low while the Nasdaq Composite recorded 19 new highs and 32 new lows.

(You can now subscribe to our ETMarkets WhatsApp channel)

(What's moving Sensex and Nifty Track latest market news, stock tips, Budget 2025, Share Market on Budget 2025 and expert advice, on ETMarkets. Also, ETMarkets.com is now on Telegram. For fastest news alerts on financial markets, investment strategies and stocks alerts, subscribe to our Telegram feeds .)

Subscribe to ET Prime and read the Economic Times ePaper Online.and Sensex Today.

Top Trending Stocks: SBI Share Price, Axis Bank Share Price, HDFC Bank Share Price, Infosys Share Price, Wipro Share Price, NTPC Share Price

...moreless

Has Reliance opened a window of hope for an Indo-US trade deal?

Sterlite back in Thoothukudi with green copper. Will it get the red carpet?

Barrels to bytes & gigawatts: Inside RIL’s carefully scripted green ambition

From heirloom to hedge: How India’s love for gold became a trillion-dollar powerhouse

Bira 91 – From challenging king of good times to fight for survival

Stock Radar: 30% rally in a month! Inox Green stock hits fresh record high; check target & stop loss

1

2

3",The Times of India,2025-10-23T13:37:03Z,https://economictimes.indiatimes.com/markets/stocks/news/us-stocks-open-flat-as-poor-earnings-dampen-investor-mood/articleshow/124764061.cms,0.7,2025-10-24 22:26:59.516547,0.8999999999999999,
AAPL,"What’s up with… Nokia, Orange, mobile security",Technology,"In today’s industry news roundup: Nokia’s third-quarter financials surprise analysts, with booming demand for AI, cloud and 5G putting the company back on track following its profit warning in July; Orange CEO doubles down on consolidation hopes as she reports overall third-quarter revenue and EBITDal growth and claims 300 million customers worldwide; Verizon’s recent Mobile Security Index finds mobile attacks are on the rise, with the threat made worse by the growing use of AI by employees in the workplace; and much more!

Nokia remains on track to achieve its full-year outlook after reporting third-quarter results that certainly seem to have come as a pleasant surprise to analysts, with AI and cloud business providing a welcome boost.As noted by Reuters, the comparable operating profit in the quarter to the end of September reached €435m, while analysts polled by LSEG (London Stock Exchange Group) expected this metric to reach €342m. The Finland-based vendor appears to be back on a more even keel following a difficult first six months of the year. Indeed, the vendor hadissued a profit warning in July, blaming foreign exchange rate fluctuations (a weaker dollar) and “tariff headwinds” that are “outside its control”. Its outlook now remains unchanged for 2025 as a whole, although it has revised upwards the operating profit outlook by €0.1bn, to between €1.7bn and €2.2bn. This is owing to a change in venture fund reporting after Nokia decided to scale down its passive venture fund investments. In the third quarter, net sales rose 9% to €4.83bn on a comparable basis, said to be aided by strong growth in optical networks and cloud services. In a statement, Nokia president and CEO Justin Hotard said network infrastructure “delivered 11% net sales growth. Optical networks grew 19%, coming largely from AI and cloud customers”. Nokia noted that AI and cloud customers accounted for 6% of net sales at group level, and 14% of network infrastructure sales. According to the Reuters report, Hotard told journalists that AI and datacentre demand “continues to be robust. In fact, it continues to accelerate from our perspective”. Net sales from cloud and network services increased by 13% as “operator investments in 5G core remain strong”, said Hotard. “Our cloud-native 5G core offering continues to gain traction and we are gaining market share”, he added. Hotard highlighted, in particular,the recent deal with VodafoneThree that marked Nokia’s re-entry as a RAN supplier in the UK market for both Vodafone and Three’s combined network operations following their recent merger. For more details about Nokia’s results, seethis press release.

This week has also seen a smattering ofthird-quarter results from telcos, including Orange, which released its figures on Thursday. During the earnings call, Orange Group CEO Christel Heydemann wasted no time in addressing the France-based operator’s consolidation ambitions following its recent€17bn joint takeover offer for certain activities of Alice France, including SFR. The non-binding offer by Bouygues Telecom, Iliad (Free) and Orange was swiftly rejected by Altice, but the trio has indicated that it intends to continue negotiations to see if an agreement can be reached. According to Heydemann, “this deal would allow us to strengthen investments in France while maintaining a competitive ecosystem for the benefit of consumers”. She also stressed there is “no certainty that we will reach an agreement, and we are willing to engage in a constructive dialogue with the Altice group”. Turning to Orange’s financial performance, Heydemann painted a broadly positive picture for the third quarter, noting that both revenue and earnings before interest, taxes, depreciation and amortisation after lease (EBITDAaL) expenses increased in the three months to 30 September 2025. In fact, EBITDAaL rose by a reasonably healthy 3.7% on a comparable basis to €3.44bn, prompting Orange to increase its annual guidance to at least 3.5%. Revenue rose by a somewhat lower rate of 0.8% to €9.99bn. Heydemann also pointed out that Orange has now passed the “symbolic threshold of 300 million customers worldwide”. In terms of group segments, Africa and the Middle East remained a growth driver, as has now been the case for several quarters. This region saw revenue rise by 12.2% owing to a 13.1% increase in retail revenues, marking 10 consecutive quarters of double-digit growth. Orange’s domestic market, France, saw revenue fall by 3.7% on a comparable basis to €4.34bn, blamed in part on the “anticipated decline” in wholesale. At the same time, Orange said mobile net additions in France have reached their highest level since 2022. Excluding France, the Europe segment saw a return to revenue growth with an increase of 4.7%, largely owing to retail services growth. Orange Business, however, remains a work in progress, reporting a 4.3% decline in revenue. The operator described the IT services market as “challenging”, whereas Orange Cyberdefense continued to shine, with a 6.3% revenue increase in the first nine months of the year. For more details about Orange’s results, see this press release.

The various flavours of AI may be good for business, as highlighted by Nokia above, but it also brings a growing level of risk for mobile devices, according to a new report from Verizon Business. TheVerizon 2025 Mobile Security Index (MSI) reveals that mobile devices are “under attack, now more than ever, with 85% of organisations reporting increasing mobile attacks”. Although 75% of organisations are said to have upped their mobile security spending over the past year, the increase in the number of employees using generative AI services for work purposes “is quickly expanding the attack surface”, the report warns. It notes that 34% of organisations “fear that more sophisticated and large-scale AI-powered attacks will significantly increase their risk, and 38% believe ransomware will become even more dangerous when powered by AI”. Chris Novak, VP of global cybersecurity solutions at Verizon Business, declared that this year’s Mobile Security Index “is a clear wake-up call: Mobile security is no longer a perimeter defence but a battle fought in the palm of every employee’s hand. We talk about the perfect storm: With the rise of AI, we’re witnessing a Category 5 hurricane in mobile security, where AI is the wind – and human error is the open window”. For more details about the report’s findings, seethis press release. The report can also be found using this link.

Alternative pan-European long-distance network operatorEXA Infrastructure is maintaining its recent busy streak. On Thursday, it announced it has signed an agreement to purchase all long-haul duct assets belonging to Conexio doo Beograd, a provider of dark fibre and colocation services across Serbia. No financial details of the transaction were provided, however. The operator noted that the transaction further strengthens its “strategic footprint in the Balkans”, and builds on its previous acquisitions of Unitel in Croatia and GCN in Bulgaria. Under the agreement, EXA Infrastructure will buy two high-density polyethylene (HDPE) ducts spanning 860km, existing cables, and 15 points of presence (PoP) locations. The transaction also includes the transfer of existing customer contracts. EXA’s latest move comes hot on the heels of a “major” but unspecified investment in the diversity and capacity of its network between Marseille and Paris. The company also recentlyissued a press release to announce it had “refinanced its existing facilities and raised new financing… to support continued growth ambitions and network expansion plans”. It noted that the combined value of the refinanced debt and new investment is €1.3bn, but didn’t provide many details.",TelecomTV,2025-10-23T14:18:40Z,https://www.telecomtv.com/content/5g/what-s-up-with-nokia-orange-mobile-security-54148/,0.6,2025-10-24 22:25:37.940244,0.9999999999999999,
