ticker,title,content,source,published_at,url,category,sentiment,tickers,collected_at
T,Pre-Market Futures Flat at This Hour,Pre-Market Futures Flat at This Hour.,Zacks Investment Research,2025-10-22 16:15:23+00:00,https://www.zacks.com/stock/news/2774319/pre-market-futures-flat-at-this-hour?cid=CS-STOCKNEWSAPI-FT-economic_highlights-2774319,Communication Services,Neutral,"['GEV', 'T', 'TECK', 'TMO']",2025-10-29 22:13:15.923623
T,AT&T Inc. (T) Q3 2025 Earnings Call Transcript,"AT&T Inc. (NYSE:T ) Q3 2025 Earnings Call October 22, 2025 8:30 AM EDT Company Participants Brett Feldman - Senior Vice President of Finance & Investor Relations John Stankey - CEO & Chairman Pascal Desroches - Senior EVP & CFO Conference Call Participants Peter Supino - Wolfe Research, LLC Benjamin Swinburne - Morgan Stanley, Research Division John Hodulik - UBS Investment Bank, Research Division David Barden - New Street Research LLP Michael Ng - Goldman Sachs Group, Inc., Research Division Sebastiano Petti - JPMorgan Chase & Co, Research Division Michael Rollins - Citigroup Inc., Research Division Presentation Operator Good morning, and welcome to AT&T's Third Quarter 2025 Earnings Call. [Operator Instructions] As a reminder, this conference is being recorded.",Seeking Alpha,2025-10-22 15:43:49+00:00,https://seekingalpha.com/article/4831907-at-and-t-inc-t-q3-2025-earnings-call-transcript,Communication Services,Neutral,"['T', 'TBB']",2025-10-29 22:13:15.923626
T,T Misses Q3 Earnings & Revenue Estimates Despite Healthy Demand,AT&T posts modest Q3 results as solid mobility and broadband gains fail to offset earnings and revenue misses.,Zacks Investment Research,2025-10-22 15:40:25+00:00,https://www.zacks.com/stock/news/2774277/t-misses-q3-earnings-revenue-estimates-despite-healthy-demand?cid=CS-STOCKNEWSAPI-FT-analyst_blog|earnings_article-2774277,Communication Services,Neutral,['T'],2025-10-29 22:13:15.923629
T,"Q3 Earnings Bonanza Pulls a Flat Pre-Market: T, TMO, TSLA, etc.",Q3 earnings reports released yesterday afternoon did not quite have the positive sheen we've seen elsewhere this far into earnings season.,Zacks Investment Research,2025-10-22 15:36:12+00:00,https://www.zacks.com/stock/news/2774268/q3-earnings-bonanza-pulls-a-flat-pre-market-t-tmo-tsla-etc?cid=CS-STOCKNEWSAPI-FT-ahead_of_wall_street-2774268,Communication Services,Positive,"['T', 'TMO', 'TSLA']",2025-10-29 22:13:15.923632
T,AT&T: Why The Street Is Very Disappointed,"AT&T Inc. Q3 revenue missed expectations, but wireless postpaid and fiber net adds exceeded targets, supporting ongoing growth initiatives. T delivered strong free cash flow of $4.9 billion, easily covering its dividend with a safe payout ratio of 42.8%. Net debt declined year-over-year, but total debt rose due to spectrum purchases, pushing leverage higher and limiting near-term dividend growth.",Seeking Alpha,2025-10-22 15:17:09+00:00,https://seekingalpha.com/article/4831905-at-and-t-why-the-street-is-very-disappointed,Communication Services,Negative,['T'],2025-10-29 22:13:15.923635
T,AT&T CEO John Stankey on Q3 earnings: We feel 'really confident' about where the business is,"AT&T CEO John Stankey joins 'Squawk on the Street' to discuss the company's latest earnings report, his perspective on the pricing environment for wireless services, and more.",CNBC Television,2025-10-22 14:35:09+00:00,https://www.youtube.com/watch?v=rWt8iaHqTzI,Communication Services,Positive,['T'],2025-10-29 22:13:15.923638
T,"Compared to Estimates, AT&T (T) Q3 Earnings: A Look at Key Metrics","While the top- and bottom-line numbers for AT&T (T) give a sense of how the business performed in the quarter ended September 2025, it could be worth looking at how some of its key metrics compare to Wall Street estimates and year-ago values.",Zacks Investment Research,2025-10-22 14:31:19+00:00,https://www.zacks.com/stock/news/2773993/compared-to-estimates-at-t-t-q3-earnings-a-look-at-key-metrics?cid=CS-STOCKNEWSAPI-FT-fundamental_analysis|nfm-2773993,Communication Services,Neutral,['T'],2025-10-29 22:13:15.923641
T,"AT&T subscriber additions top estimates for Q3, shares slip on revenue miss","AT&T Inc (NYSE:T, ETR:SOBA) saw its shares fall almost 5% in early trade on Wednesday as it reported a slight revenue miss for the third quarter. The telecommunications company posted revenues of $30.7 billion, up 1.6% from a year earlier but slightly below Wall Street estimates of $30.85 billion.",Proactive Investors,2025-10-22 13:41:05+00:00,https://www.proactiveinvestors.com/companies/news/1080880?SNAPI,Communication Services,Neutral,['T'],2025-10-29 22:13:15.923644
T,AT&T Just Delivered for Investors. It's Not Too Late to Buy the Stock.,"AT&T reported mixed results relative to expectations, but the news was generally positive. AT&T added subscribers across wireless, fiber, and Internet Air, and its converged strategy made progress.",The Motley Fool,2025-10-22 12:56:11+00:00,https://www.fool.com/investing/2025/10/22/att-just-delivered-for-investors-its-not-too-late/,Communication Services,Positive,['T'],2025-10-29 22:13:15.923647
T,AT&T (T) Q3 Earnings and Revenues Lag Estimates,"AT&T (T) came out with quarterly earnings of $0.54 per share, missing the Zacks Consensus Estimate of $0.55 per share. This compares to earnings of $0.6 per share a year ago.",Zacks Investment Research,2025-10-22 12:46:05+00:00,https://www.zacks.com/stock/news/2773806/at-t-t-q3-earnings-and-revenues-lag-estimates?cid=CS-STOCKNEWSAPI-FT-tale_of_the_tape|yseop_template_4-2773806,Communication Services,Negative,['T'],2025-10-29 22:13:15.923650
T,AT&T shows off another big boost in subscribers. Here's what to know.,The company has made a push to offer more customers both fiber and wireless services and says the move is paying off. Analysts will be monitoring the impact of promotions.,Market Watch,2025-10-22 11:45:00+00:00,https://www.marketwatch.com/story/at-t-shows-off-another-big-boost-in-subscribers-heres-what-to-know-7d282e52,Communication Services,Positive,['T'],2025-10-29 22:13:15.923653
T,AT&T Stock Rises. Why This Matters More Than So-So Earnings.,"More customers than expected switched to the wireless carrier's cellphone plans over the third quarter, which helped to boost shares.",Barrons,2025-10-22 11:11:00+00:00,https://www.barrons.com/articles/att-earnings-stock-price-9f2944b2,Communication Services,Positive,['T'],2025-10-29 22:13:15.923656
T,"AT&T Earnings In-Line, Wireless Subscriber Growth Tops Estimates","AT&T met Q3 earnings estimates while revenue slightly missed, but wireless subscriber additions topped views. AT&T stock rose.",Investors Business Daily,2025-10-22 11:08:41+00:00,https://www.investors.com/news/technology/att-stock-att-earnings-wireless-subscriber/,Communication Services,Positive,['T'],2025-10-29 22:13:15.923659
T,"AT&T Swings to Profit, Sales Rise","AT&T revenue advanced in the third quarter, despite lower-than-expected phone sales in its mobility business.",WSJ,2025-10-22 10:38:00+00:00,https://www.wsj.com/business/earnings/at-t-swings-to-profit-sales-rise-2648fe90,Communication Services,Positive,['T'],2025-10-29 22:13:15.923661
T,"AT&T tops subscriber estimates as bundled plans, iPhone promotions lift sales","AT&T added more wireless subscribers than expected in the third quarter on Wednesday, as bundled plans and heavy promotions around the latest iPhone launch helped it attract more customers in a fiercely competitive market.",Reuters,2025-10-22 10:36:45+00:00,https://www.reuters.com/business/media-telecom/att-tops-subscriber-estimates-bundled-plans-iphone-promotions-lift-sales-2025-10-22/,Communication Services,Positive,['T'],2025-10-29 22:13:15.923664
T,AT&T Reports Strong Third-Quarter Financial Performance,"Differentiated investment-led strategy continues to drive customer growth and advance AT&T's converged connectivity leadership DALLAS , Oct. 22, 2025 /PRNewswire/ -- AT&T Inc. (NYSE: T) reported strong third-quarter results that demonstrate continued customer demand for its nation-leading wireless and fiber offerings and position the Company to deliver on its full-year consolidated financial outlook. ""We have the key building blocks in place to give our customers the best connectivity experience in the industry and we're winning the race to lead in convergence,"" said John Stankey, AT&T Chairman and CEO.",PRNewsWire,2025-10-22 10:33:00+00:00,https://www.prnewswire.com/news-releases/att-reports-strong-third-quarter-financial-performance-302591371.html,Communication Services,Neutral,['T'],2025-10-29 22:13:15.923667
T,2 Dividend Stocks That Can Pay You Forever,"When it comes to picking dividend stocks, you not only want a firm that can support a generous payout, but one that can grow it at a fairly predictable rate over extended periods of time.",24/7 Wall Street,2025-10-21 18:41:48+00:00,https://247wallst.com/investing/2025/10/21/2-dividend-stocks-that-can-pay-you-forever/?utm_source=snapi,Communication Services,Positive,"['AXP', 'T']",2025-10-29 22:13:15.923670
T,AT&T Earnings Due. Verizon Dividend At Risk Under New CEO?,Third quarter earnings for AT&T are due Oct. 22. T-Mobile reports Q3 financial results Oct. 23 and Verizon on Oct. 29.,Investors Business Daily,2025-10-21 12:01:27+00:00,https://www.investors.com/news/technology/att-stock-verizon-stock-dividend-tmobile-stock-new-ceo/,Communication Services,Negative,['T'],2025-10-29 22:13:15.923673
T,JPMorgan Says Correction Will Be “Healthy” – 5 Safe High-Yield Dividend Stocks,Jamie Dimon is one of the highest-profile bankers in the world.,24/7 Wall Street,2025-10-20 20:12:30+00:00,https://247wallst.com/investing/2025/10/20/jpmorgan-says-correction-will-be-healthy-5-safe-high-yield-dividend-stocks/?utm_source=snapi,Communication Services,Positive,"['ET', 'ETR', 'MDLZ', 'MRK', 'T']",2025-10-29 22:13:15.923676
T,Top Wall Street analysts are upbeat on these 3 dividend-paying stocks,"Here are three dividend-paying stocks, highlighted by Wall Street's top pros.",CNBC,2025-10-19 11:33:57+00:00,https://www.cnbc.com/2025/10/19/top-wall-street-analysts-are-upbeat-on-these-3-dividend-paying-stocks.html,Communication Services,Positive,"['CTRA', 'EOG', 'T']",2025-10-29 22:13:15.923678
T,AT&T: Why I'm Still Buying The High-Yielding Preferred Stock,"AT&T preferred shares and debt securities offer attractive yields above 6%, with robust coverage from strong net profits and cash flows. T's Series C preferred stock trades at a discount, providing a 6% yield and lower call risk compared to Series A, enhancing risk/reward appeal. Despite a $23B spectrum license acquisition, T's financial performance remains solid, supporting confidence in its fixed income securities.",Seeking Alpha,2025-10-18 15:40:00+00:00,https://seekingalpha.com/article/4830871-at-and-t-why-im-still-buying-the-high-yielding-preferred-stock,Communication Services,Positive,['T'],2025-10-29 22:13:15.923682
T,T Expands Public Safety Connectivity Portfolio: Will it Drive Growth?,"T rolls out FirstNet Fusion, aiming to redefine public safety communications amid intensifying competition in the sector.",Zacks Investment Research,2025-10-17 17:10:55+00:00,https://www.zacks.com/stock/news/2771330/t-expands-public-safety-connectivity-portfolio-will-it-drive-growth?cid=CS-STOCKNEWSAPI-FT-analyst_blog|quick_take-2771330,Communication Services,Positive,['T'],2025-10-29 22:13:15.923684
T,AT&T (T) Q3 Earnings Preview: What You Should Know Beyond the Headline Estimates,Get a deeper insight into the potential performance of AT&T (T) for the quarter ended September 2025 by going beyond Wall Street's top-and-bottom-line estimates and examining the estimates for some of its key metrics.,Zacks Investment Research,2025-10-17 14:16:08+00:00,https://www.zacks.com/stock/news/2771003/at-t-t-q3-earnings-preview-what-you-should-know-beyond-the-headline-estimates?cid=CS-STOCKNEWSAPI-FT-fundamental_analysis|nfm_preview-2771003,Communication Services,Neutral,['T'],2025-10-29 22:13:15.923687
T,2 Surefire Dividend Stocks to Buy for the Long Haul,"In 2022 and 2023, rising interest rates drove many income investors to sell their dividend stocks and buy risk-free CDs and T-bills for higher yields. But as interest rates decline again, many of those investors will rotate back toward blue chip dividend stocks.",The Motley Fool,2025-10-16 23:23:00+00:00,https://www.fool.com/investing/2025/10/16/2-surefire-dividend-stocks-to-buy-for-the-long-hau/,Communication Services,Positive,"['T', 'VICI']",2025-10-29 22:13:15.923690
T,T Stock Before Q3 Earnings: A Smart Buy or Risky Investment?,"AT&T gears up for Q3 earnings as it boosts 5G and fiber growth, trims debt, but faces rising competitive and financial pressures.",Zacks Investment Research,2025-10-16 18:51:06+00:00,https://www.zacks.com/stock/news/2770528/t-stock-before-q3-earnings-a-smart-buy-or-risky-investment?cid=CS-STOCKNEWSAPI-FT-analyst_blog|most_popular_stocks-2770528,Communication Services,Positive,['T'],2025-10-29 22:13:15.923692
T,"AT&T: Q3 Earnings Preview, The Reason Why The Market Is Growing Uneasy","AT&T (NYSE:T) is scheduled to report Q3 earnings next week and pressure to deliver is rising. In addition to some operational metrics, decisions regarding AT&T's capital allocaiton would be of equal importance. Growth of Fiber ARPU will be one of the key performance indicators to watch.",Seeking Alpha,2025-10-16 12:00:00+00:00,https://seekingalpha.com/article/4830348-at-and-t-q3-earnings-preview-the-reason-why-market-growing-uneasy,Communication Services,Negative,['T'],2025-10-29 22:13:15.923695
T,AT&T: The Telecom Giant To Buy,"AT&T has doubled its stock price since 2023, driven by network modernization and a renewed focus on core telecom operations. T is aggressively expanding its 5G and fiber networks, aided by strategic spectrum acquisitions and favorable tax incentives from recent legislation. Despite a saturated market and substantial debt, T's strong free cash flow, robust dividend yield, and infrastructure moat support its investment case.",Seeking Alpha,2025-10-15 18:27:36+00:00,https://seekingalpha.com/article/4830195-at-and-t-the-telecom-giant-to-buy,Communication Services,Positive,['T'],2025-10-29 22:13:15.923698
T,AT&T (T) Expected to Beat Earnings Estimates: Can the Stock Move Higher?,AT&T (T) possesses the right combination of the two key ingredients for a likely earnings beat in its upcoming report. Get prepared with the key expectations.,Zacks Investment Research,2025-10-15 15:02:33+00:00,https://www.zacks.com/stock/news/2769305/at-t-t-expected-to-beat-earnings-estimates-can-the-stock-move-higher?cid=CS-STOCKNEWSAPI-FT-tale_of_the_tape|yseop_template_9-2769305,Communication Services,Positive,['T'],2025-10-29 22:13:15.923701
T,2 Charts Show Why I Prefer AT&T Stock Over Verizon,"AT&T Inc. offers a more compelling total shareholder yield than Verizon Communications Inc., despite VZ's higher headline dividend yield. T's aggressive debt reduction and recent share buybacks significantly enhance its total shareholder return versus VZ's more modest improvements. While T trades at a valuation premium on P/E, debt-adjusted metrics narrow the gap.",Seeking Alpha,2025-10-14 21:12:58+00:00,https://seekingalpha.com/article/4829925-2-charts-show-why-i-prefer-at-and-t-stock-over-verizon,Communication Services,Positive,"['T', 'VZ']",2025-10-29 22:13:15.923703
T,4 Closed-End Fund Buys (And 1 Sell) In The Month Of September 2025,"September was another strong month for equity indexes despite it historically being a weaker month, meaning we were able to buck that seasonality trend. The Fed cut 25 basis points last month and is expected to cut more going forward, which could help to keep optimism and momentum in equities. Pushing into all-time highs, I tend to allow cash to build up for the next downturn, but I still add every month regardless to help build up my cash flow.",Seeking Alpha,2025-10-14 20:49:30+00:00,https://seekingalpha.com/article/4829922-4-closed-end-fund-buys-and-1-sell-in-the-month-of-september-2025,Communication Services,Neutral,"['DPG', 'ETV', 'ETW', 'HTD', 'PDT', 'QQQ', 'SPY', 'T', 'TBB', 'UTF', 'VZ']",2025-10-29 22:13:15.923706
T,AT&T (T) Stock Drops Despite Market Gains: Important Facts to Note,"AT&T (T) closed the most recent trading day at $25.6, moving 1.06% from the previous trading session.",Zacks Investment Research,2025-10-13 22:46:29+00:00,https://www.zacks.com/stock/news/2767820/at-t-t-stock-drops-despite-market-gains-important-facts-to-note?cid=CS-STOCKNEWSAPI-FT-tale_of_the_tape|yseop_template_6-2767820,Communication Services,Neutral,['T'],2025-10-29 22:13:15.923709
T,AT&T's Big Day,"AT&T Inc.'s earnings later this month will be an absolutely crucial day for determining if T stock's selloff continues. Strong free cash flow is key to ensuring dividend security and chipping away new debt, but could there be a raise to the payout? A sub-50% dividend payout ratio, big capital investment, and huge repurchases are where cash flow is going.",Seeking Alpha,2025-10-13 18:51:47+00:00,https://seekingalpha.com/article/4829589-att-big-day,Communication Services,Negative,['T'],2025-10-29 22:13:17.632049
T,T Shares Rise 20% in the Past Year: Should You Invest Now?,AT&T's 20% stock surge outpaces industry growth as heavy network and AI investments drive long-term momentum amid stiff competition.,Zacks Investment Research,2025-10-13 18:11:21+00:00,https://www.zacks.com/stock/news/2767700/t-shares-rise-20-in-the-past-year-should-you-invest-now?cid=CS-STOCKNEWSAPI-FT-analyst_blog|most_popular_stocks-2767700,Communication Services,Positive,['T'],2025-10-29 22:13:17.632061
T,Buy Any Of 14 IDEAL 'Safer' S&P 500 October Dividend Dogs,"Fourteen of the highest-yielding, 'safer' S&P 500 dividend stocks are currently attractively priced, with free cash flow supporting their payouts. Top ten S&P 500 dividend 'dogs' are projected to deliver 23.93% to 38.57% net gains by October 2026, based on analyst targets. Stocks like CAG, VZ, DOC, BMY, KVUE, CPB, UDR, VTRS, KIM, TFC, KEY, HPQ, T, and RF meet the ideal of dividends from $1K invested exceeding share price.",Seeking Alpha,2025-10-12 14:11:35+00:00,https://seekingalpha.com/article/4829386-buy-any-of-14-ideal-safer-sp500-october-dividend-dogs,Communication Services,Positive,"['AES', 'AMCR', 'ARE', 'BMY', 'CAG', 'CPB', 'DOC', 'DOW', 'EIX', 'EMN', 'FRT', 'HPQ', 'HRL', 'IPG', 'KEY', 'KHC', 'KIM', 'KVUE', 'LKQ', 'LYB', 'MO', 'NVDA', 'OKE', 'PFE', 'RF', 'SWK', 'T', 'TFC', 'UDR', 'UPS', 'VTRS', 'VZ']",2025-10-29 22:13:17.632065
T,Goldman Sachs Sees ‘Drawdown' (Sell-Off) Potential: 4 Safe Dividend Giants,"Last week, Goldman Sachs CEO David Solomon delivered a speech in Italy, warning of the potential for an artificial intelligence (AI) bubble following one of the biggest stock market rallies in years.",24/7 Wall Street,2025-10-10 18:41:09+00:00,https://247wallst.com/investing/2025/10/10/goldman-sachs-sees-drawdown-sell-off-potential-4-safe-dividend-giants/?utm_source=snapi,Communication Services,Neutral,"['BAC', 'DUK', 'T', 'VLO']",2025-10-29 22:13:17.632068
T,AT&T Inc. (T) Is a Trending Stock: Facts to Know Before Betting on It,"AT&T (T) has been one of the stocks most watched by Zacks.com users lately. So, it is worth exploring what lies ahead for the stock.",Zacks Investment Research,2025-10-09 14:01:21+00:00,https://www.zacks.com/stock/news/2765234/at-t-inc-t-is-a-trending-stock-facts-to-know-before-betting-on-it?cid=CS-STOCKNEWSAPI-FT-tale_of_the_tape|most_searched_stocks-2765234,Communication Services,Positive,['T'],2025-10-29 22:13:17.632074
T,"Ex-Dividend Reminder: AT&T, Verizon Communications And Brady","On 10/10/25, AT&T, Verizon Communications and Brady will all trade ex-dividend for their respective upcoming dividends. AT&T will pay its quarterly dividend of $0.2775 on 11/3/25, Verizon Communications will pay its quarterly dividend of $0.69 on 11/3/25, and Brady will pay its quarterly dividend of $0.245 on 10/31/25.",Forbes,2025-10-08 15:20:03+00:00,https://www.forbes.com/sites/dividendchannel/2025/10/08/ex-dividend-reminder-att-verizon-communications-and-brady/,Communication Services,Neutral,"['BRC', 'T', 'VZ']",2025-10-29 22:13:17.632076
T,AT&T: A Switch To Verizon Has Never Looked More Irresistible,Valuation cycles offer many opportunities for trades. The two major US telecoms are moving in a different direction. Verizon Communications Inc. now offers a compelling value relative to AT&T.,Seeking Alpha,2025-10-08 10:57:38+00:00,https://seekingalpha.com/article/4828501-at-and-t-a-switch-to-verizon-has-never-looked-more-irresistible,Communication Services,Negative,"['T', 'VZ']",2025-10-29 22:13:17.632078
T,AT&T Stock: Is This Free Cash Flow Machine A Buy On The Dip?,"T has been turning the corner and has generated strong total returns over the past few years. However, recently it has pulled back sharply. I take a look to see if it is worth buying on the dip.",Seeking Alpha,2025-10-08 10:21:54+00:00,https://seekingalpha.com/article/4828494-att-stock-free-cash-flow-machine-buy-on-dip,Communication Services,Positive,['T'],2025-10-29 22:13:17.632081
T,AT&T (T) Ascends While Market Falls: Some Facts to Note,"AT&T (T) closed the most recent trading day at $26.16, moving +1.12% from the previous trading session.",Zacks Investment Research,2025-10-07 22:46:09+00:00,https://www.zacks.com/stock/news/2763986/at-t-t-ascends-while-market-falls-some-facts-to-note?cid=CS-STOCKNEWSAPI-FT-tale_of_the_tape|yseop_template_6-2763986,Communication Services,Neutral,['T'],2025-10-29 22:13:17.632083
T,St. Louis Financial Sells $3.3 Million in AT&T Stock With Next Earnings on Deck,"St. Louis Financial Planners Asset Management, LLC disclosed in a Thursday filing with the SEC that it sold shares of AT&T worth an estimated $3.3 million in the third quarter.",The Motley Fool,2025-10-03 16:26:53+00:00,https://www.fool.com/coverage/filings/2025/10/03/st-louis-financial-sells-usd3-3-million-in-at-and-t-stock-with-next-earnings-on-deck/,Communication Services,Negative,['T'],2025-10-29 22:13:17.632088
T,Is It Worth Investing in AT&T (T) Based on Wall Street's Bullish Views?,"The recommendations of Wall Street analysts are often relied on by investors when deciding whether to buy, sell, or hold a stock. Media reports about these brokerage-firm-employed (or sell-side) analysts changing their ratings often affect a stock's price.",Zacks Investment Research,2025-10-03 14:31:18+00:00,https://www.zacks.com/stock/news/2761444/is-it-worth-investing-in-at-t-t-based-on-wall-street-s-bullish-views?cid=CS-STOCKNEWSAPI-FT-fundamental_analysis|average_broker_rating-2761444,Communication Services,Neutral,['T'],2025-10-29 22:13:17.632090
T,4 Telecom Giants Are Goldman Sachs October High-Yield Dividend Picks,"Founded in 1869, Goldman Sachs is the world's second-largest investment bank by revenue and is ranked 55th on the Fortune 500 list of the largest U.S.",24/7 Wall Street,2025-10-02 13:43:38+00:00,https://247wallst.com/investing/2025/10/02/4-telecom-giants-are-goldman-sachs-october-high-yield-dividend-picks/?utm_source=snapi,Communication Services,Positive,"['CMCSA', 'T', 'TMUS', 'VZ']",2025-10-29 22:13:17.632093
T,AT&T (T) Stock Sinks As Market Gains: Here's Why,"In the latest trading session, AT&T (T) closed at $27.55, marking a -2.44% move from the previous day.",Zacks Investment Research,2025-10-01 22:46:18+00:00,https://www.zacks.com/stock/news/2760451/at-t-t-stock-sinks-as-market-gains-here-s-why?cid=CS-STOCKNEWSAPI-FT-tale_of_the_tape|yseop_template_6-2760451,Communication Services,Negative,['T'],2025-10-29 22:13:17.632095
T,AT&T's stock trades at a notable premium to Verizon's. Should you still buy?,Barclays just downgraded AT&T's stock over concerns about industry competition and debt levels.,Market Watch,2025-10-01 15:56:00+00:00,https://www.marketwatch.com/story/at-ts-stock-trades-at-a-notable-premium-to-verizons-should-you-still-buy-db419904,Communication Services,Negative,"['T', 'VZ']",2025-10-29 22:13:17.632099
T,AT&T Selects STREAMWIDE to Power the FirstNet Next-Generation Mission-Critical Application for Public Safety in the U.S.,PARIS--(BUSINESS WIRE)--AT&T selects STREAMWIDE to power the FirstNet next-generation mission-critical application for public safety in the U.S.,Business Wire,2025-09-30 15:45:00+00:00,https://www.businesswire.com/news/home/20250930909125/en/ATT-Selects-STREAMWIDE-to-Power-the-FirstNet-Next-Generation-Mission-Critical-Application-for-Public-Safety-in-the-U.S./,Communication Services,Neutral,['T'],2025-10-29 22:13:17.632101
T,"AT&T CEO John Stankey on impact of AI, new iPhone demand and future of connectivity","AT&T CEO John Stankey joins 'Squawk Box' to discuss the impact of AI on the company, partnership with Ford, Apple iPhone demand, American Airlines partnership, screening spam calls, and more.",CNBC Television,2025-09-30 12:08:18+00:00,https://www.youtube.com/watch?v=vKX14PvbBZk,Communication Services,Positive,['T'],2025-10-29 22:13:17.632104
T,"Have $5,000? These 2 Stocks Could Be Bargain Buys for 2025 and Beyond.",It is not often that one sees bargains in the technology sector. Tech is best known for cutting-edge companies that bring new technologies to the market.,The Motley Fool,2025-09-29 11:15:00+00:00,https://www.fool.com/investing/2025/09/29/have-5000-these-2-stocks-could-be-bargain-buys-for/,Communication Services,Positive,"['META', 'T']",2025-10-29 22:13:17.632106
T,Goldman Sachs Sees 4 Rate Cuts by Next Summer: 5 High-Yield Dividend Winners,Investors love dividend stocks because they offer a significant income stream and have massive total return potential.,24/7 Wall Street,2025-09-26 14:11:54+00:00,https://247wallst.com/investing/2025/09/26/goldman-sachs-sees-4-rate-cuts-by-next-summer-5-high-yield-dividend-winners/?utm_source=snapi,Communication Services,Positive,"['AMGN', 'CMCSA', 'DUK', 'MRK', 'T']",2025-10-29 22:13:17.632108
