ticker,title,category,content,source,published_at,url,relevance_score,collected_at,quality_score,sentiment
XOM,Elon Musk defends $1 trillion pay package: ‘I just don’t feel comfortable building a robot army here and then being ousted’,Energy,"“I just don’t feel comfortable building a robot army here and then being ousted because of some asinine recommendations from ISS and Glass Lewis who have no freaking clue. I mean, those guys are corporate terrorists,” Musk said Wednesday on Tesla’s quarterly earnings call, referring to the proxy advisory services who are urging investors to reject the pay plan.

The proposal would award Musk up to $1 trillion in stock if he meets key performance targets, including growing the company to an $8.5 trillion market cap, more than a 500% increase from today’s valuation. Musk insisted the package isn’t about personal gain—but rather about ensuring he retains enough influence to steer Tesla’s next chapter, focused on AI, robotaxis, and humanoid robots. If approved, Musk’s stake could rise from 13% to nearly 29%.

“It’s called compensation, but it’s not like I’m going to go spend the money,” Musk added. “It’s just, if we build this robot army, do I have at least a strong influence over that robot army, not current control, but a strong influence? That’s what it comes down to in a nutshell. I don’t feel comfortable wielding that robot army if I don’t have at least a strong influence.”

Musk conceded that having voting control in the “mid-20s” per cent range would help secure a “strong influence,” but gives shareholders enough control to fire him if he goes “insane.”

Musk’s net worth is about $455 billion, according to Bloomberg’s Billionaire Index.

Musk may soon be crowned the inaugural king of the trillionaires club

Tesla’s board announced the ambitious executive pay plan for Musk in September. If approved at the company’s annual meeting on Nov. 6, Musk will be incrementally paid out over 420 million shares of the EV company—that is, only if he can achieve the company’s growth plans, which include the delivery of 20 million Tesla vehicles and 1 million robotaxis in commercial operation.

At the time of the announcement, Tesla stock price was down roughly 10% for the year, and the board felt the long-term CEO performance award would “retain and incentivize Elon to focus his energies.”

“While we believe Elon is the only person capable of leading Tesla at this critical inflection point, changing the world is neither an overnight process nor the work of a single person,” Tesla’s Board wrote in a letter to shareholders. “So, we also want your help in securing the team and strategy needed to achieve goals that others will perceive as impossible but that we know are possible for Tesla.”

Since then, Tesla’s stock has rebounded, now up more than 15% year-to-date.

Musk has long sought more control at Tesla, arguing complex innovations require significant influence over the company.",Fortune,2025-10-23T14:23:03Z,https://fortune.com/2025/10/23/billionaire-elon-musk-defends-trillion-dollar-tesla-pay-package-proposal-robot-army-world-richest-man-salary/,0.4,2025-10-24 22:27:40.066607,0.9999999999999999,
XOM,"I’m 61, tired of working and anxious to start my next chapter. My wife and I have $1.5M saved — is it enough to retire?",Energy,"So, how do you keep your portfolio above water when the market wavers?

Read more: Warren Buffett says you can't buy time — but real estate investors have found this 1 loophole. See how they’re buying back hundreds of hours a year (for absolutely free)

Alternative assets and retirement

This is where alternative assets can step in. Unlike traditional stocks and bonds, alternative assets can be a powerful hedge against inflation — which can erode the value of your money over the long term.

Gold is a traditional safe-haven asset, meaning it’s an investment many flock to during times of market uncertainty. The precious yellow metal has also been on a historic bull run, breaching $4,000 per ounce in September. (4)

Plus, with a gold IRA, you can take advantage of significant tax benefits for your retirement. Thor Metals offers a gold IRA that allows investors to hold physical gold or gold-related assets within a retirement account, combining the tax advantages of an IRA with the protective benefits of investing in gold. This combination can make it an attractive option for those looking to hedge their retirement funds against economic uncertainties.

To learn more, you can get a free information guide that includes details on how to get up to $20,000 in free metals on qualifying purchases. Just keep in mind that gold is typically just one part of a well-diversified portfolio.

Another inflation-resistant alternative investment you could consider is commercial real estate.

Traditionally, direct access to the $22.5 trillion commercial real estate sector was limited to a select group of elite investors, but that’s changed with First National Realty Partners (FNRP). FNRP helps accredited investors diversify their portfolio through grocery-anchored commercial properties, without needing to take on the responsibilities of being a landlord.

With a minimum investment of $50,000, investors can own a share of properties leased by national brands like Whole Foods, Kroger and Walmart, which provide essential goods to their communities. Thanks to triple net leases, accredited investors can invest in these properties without worrying about tenant costs cutting into their potential returns.

Simply answer a few questions — including how much you would like to invest — to start browsing their full list of available properties.

FNRP also has a self-directed IRA (SDIRA), which allows you to invest for your retirement through tangible, income-producing assets that can offer predictable cash flows and long-term growth. With FNRP, your rental income and investment gains can grow tax-deferred in a SDIRA – maximizing your savings and diminishing your reliance on public markets.

How much should you have saved by age 61?

With $1.5 million saved, Jim and Helen are ahead of many Americans. The median retirement savings for Americans between 55 and 64 was around $185,000, according to the Federal Reserve. (5)

However, financial planners often suggest that by the time you reach your early sixties, you should have between eight and ten times your annual income saved for retirement. For Jim and Helen, that would equate to a nest egg between $2.4 million and $3 million, meaning they’re far below target even if they’re doing well for their cohort.

There is no single “golden number” for retirement savings, because spending habits, health and lifestyle choices vary. That said, $1.5 million can provide a comfortable retirement for some, especially if at least one spouse continues to earn income and delays withdrawals from savings accounts.

The real question is whether Jim and Helen can maintain their current quality of life in retirement.

Estimating retirement income at 61

If both Jim and Helen retire this year, they could begin drawing from their retirement accounts without penalty.

Based on the commonly cited 4% withdrawal rule, a $1.5 million nest egg could give them about $60,000 annually, before taxes. That’s 80% less than the couple’s current level of annual income.

While it seems unlikely they would be able to comfortably live at a substantially lower level of income, there might be ways they can cut costs to live on a somewhat smaller nest egg. They could use Monarch Money’s all-in-one budgeting app to see where they’re over-spending and under-investing, to make the most of their money.

Monarch Money puts all your finances under one roof, from your banking statements to your investments. You can also add separate or joint accounts to your dashboard, which can be great for tracking anything from grocery runs to gas station fill-ups for couples. The app is also well reviewed. Forbes ranked Monarch Money as their best budgeting app for 2025, as did the Wall Street Journal.

And the best part? Monarch Money offers a seven-day free trial so you can see if it’s right for you. If you like what you see, you could then snag 50% off with code WISE50.

The earlier they retire, the more seriously they’ll need to take their budgeting.

For instance, if they claim Social Security at 62, the first year Americans are eligible for benefits, they would receive about 30% less per month than if they wait until full retirement age, at 67. They would earn less than half of what they could get if they delayed retirement until 70.

If Helen were to put off her retirement until 67, her Social Security benefits could significantly boost their income. If she delays claiming benefits until then, she will receive a higher payout for life. Jim could claim his benefit earlier, wait until full retirement age or even 70 to maximize his payout.

By combining withdrawals from their savings, Social Security and Helen's continued earnings for the next six years, they could maintain their current standard of living until both are retired.

But, again, this would depend primarily on Helen’s plans and whether she’s hoping to retire now, alongside her husband.

Actionable steps before retiring

Before deciding to retire, there are a few things that Jim and Helen should consider:

Creating a detailed retirement budget that includes health care, housing, travel and discretionary spending.

Working part-time or as consultants for extra income, so that Jim and/or Helen can reduce their withdrawals from savings in the early years. If Jim finds part-time work, this could give them not only a small financial bump but also a social connection.

Meeting with a financial planner to run simulations based on different retirement ages and market conditions.

One option would be to work with Advisor.com to find a financial advisor that suits their goals. All of Advisor.com’s financial experts are pre-vetted fiduciaries, meaning they have a legal obligation to act in your best interest.

After inputting your ZIP code to find a nearby advisor, you can set up a free call with no obligation to hire, so you can make sure they’re the right fit for your needs.

From here, Jim and Helen could revisit their investment allocation to balance income needs with long-term growth potential.

The bottom line

Retiring at 61 with $1.5 million and no debt is possible, especially with one spouse continuing to work for several more years.

However, if Helen and Jim retire together, they may need to change their lifestyle to adapt to their new annual income.

They should remember that the key to retirement success is understanding how long your money needs to last, and what lifestyle you want to maintain. In Jim and Helen’s case, Helen’s continued income could provide a cushion if she decides to keep working. But her decision should be grounded in careful planning, realistic spending expectations and an awareness of longevity risk — not to mention a conversation with a financial planner.

With the right strategy, Jim and Helen could transition into retirement with both financial security and peace of mind.

You May Also Like

Ultra-rich Americans are ditching stocks and real estate, says investing legend — 5 assets they’re using to shockproof their millions

Want an extra $1,300,000 when you retire? Dave Ramsey says this 7-step plan ‘works every single time’ to kill debt, get rich in America — and that ‘anyone’ can do it

High-net-worth investors are quietly collecting payouts from grocery-anchored real estate like Walmart and CVS. Here’s how it works

This tiny hot Costco item has skyrocketed 74% in price in under 2 years — but now the retail giant is restricting purchase. Here’s how to buy the coveted asset in bulk

Join 200,000+ readers and get Moneywise’s best stories and exclusive interviews first — clear insights curated and delivered weekly. Subscribe now.

Article sources

We rely only on vetted sources and credible third-party reporting. For details, see our editorial ethics and guidelines.

Pew Research Center (1, 2); Social Security Administration (3); APMEX (4); The Federal Reserve (5)

This article provides information only and should not be construed as advice. It is provided without warranty of any kind.",Yahoo Entertainment,2025-10-23T14:23:00Z,https://finance.yahoo.com/news/m-61-tired-working-anxious-142300206.html,0.4,2025-10-24 22:27:40.095370,0.9999999999999999,
XOM,"Blue Jays, MLSE stake drive Rogers revenue growth amid World Series run",Energy,"Article content

Swelling enthusiasm for the World Series-bound Toronto Blue Jays boosted sales at Rogers Communications Inc., which owns the team and broadcasts its games, nearly offsetting an overall dip in adjusted earnings.

THIS CONTENT IS RESERVED FOR SUBSCRIBERS ONLY

Subscribe now to read the latest news in your city and across Canada.

Exclusive articles from Barbara Shecter, Joe O'Connor, Gabriel Friedman, and others.

Daily content from Financial Times, the world's leading global business publication.

Unlimited online access to read articles from Financial Post, National Post and 15 news sites across Canada with one account.

National Post ePaper, an electronic replica of the print edition to view on any device, share and comment on.

Daily puzzles, including the New York Times Crossword.

SUBSCRIBE TO UNLOCK MORE ARTICLES

Subscribe now to read the latest news in your city and across Canada.

Exclusive articles from Barbara Shecter, Joe O'Connor, Gabriel Friedman and others.

Daily content from Financial Times, the world's leading global business publication.

Unlimited online access to read articles from Financial Post, National Post and 15 news sites across Canada with one account.

National Post ePaper, an electronic replica of the print edition to view on any device, share and comment on.

Daily puzzles, including the New York Times Crossword.

REGISTER / SIGN IN TO UNLOCK MORE ARTICLES

Create an account or sign in to continue with your reading experience.

Access articles from across Canada with one account.

Share your thoughts and join the conversation in the comments.

Enjoy additional articles per month.

Get email updates from your favourite authors.

THIS ARTICLE IS FREE TO READ REGISTER TO UNLOCK.

Create an account or sign in to continue with your reading experience.

Access articles from across Canada with one account

Share your thoughts and join the conversation in the comments

Enjoy additional articles per month

Get email updates from your favourite authors

Sign In or Create an Account

Email Address

or

Article content

The telecom reported a surge in media revenue of 26 per cent year-over-year in the three months ended Sept. 30.

Article content

We apologize, but this video has failed to load.

Try refreshing your browser, or

tap here to see other videos from our team.

Blue Jays, MLSE stake drive Rogers revenue growth amid World Series run Back to video

Article content

The leap accounted for the vast majority of growth in total revenue, which increased four per cent to $5.35 billion, despite the media segment comprising the smallest of Rogers’ three main areas. Wireless and cable make up the other two.

Article content

Article content

“In media, revenue growth was up 26 per cent, driven by a strong Blue Jays regular season and the consolidation of MLSE results,” chief executive Tony Staffieri told analysts on a conference call Thursday.

Article content

Total profits in the third quarter rose by an order of magnitude to $5.75 billion, mainly due to a one-time non-cash gain linked to Rogers’ acquisition of BCE Inc.’s stake in Maple Leaf Sports & Entertainment. The deal made Rogers the majority owner of the country’s largest sports company, whose assets include the Toronto Maple Leafs and Toronto Raptors.

Article content

Meanwhile, the Blue Jays’ “very strong regular season performance” garnered higher attendance levels and growing interest from fans countrywide, particularly in September when the team clinched a return to the post-season, said chief financial officer Glenn Brandt.

Article content

Regardless of the outcome of the championship contest that kicks off Friday, Rogers will see higher media revenue this month thanks to its baseball franchise.

Article content

“The Blue Jays’ very successful MLB playoffs and World Series run will provide further added growth in the fourth quarter,” Brandt said.

Article content

Article content

“Go Jays.”

Article content

Rogers’ wireless service — its biggest income source — saw revenue dip to $2.06 billion in its latest quarter from $2.07 billion a year earlier.

Article content

“In the highly competitive wireless market, we saw some pressure on service revenue and ARPU (average revenue per user),” Staffieri said. Executives also pointed to lower immigration levels as a reason for the slight downturn.

Article content

Cable revenue climbed to $1.98 billion from $1.97 billion the year before.

Article content

On an adjusted basis, which excluded a $5-billion gain related to the MLSE deal, Rogers said it earned $740 million attributable to shareholders or $1.37 per share in the third quarter, down from $762 million or $1.42 per share a year ago.

Article content

This report by The Canadian Press was first published Oct. 23, 2025.

Article content

Companies in this story: (TSX:RCI.B)",Financial Post,2025-10-23T14:17:52Z,https://financialpost.com/pmn/blue-jays-mlse-stake-drive-rogers-revenue-growth-amid-world-series-run,0.4,2025-10-24 22:27:40.151267,0.9999999999999999,
XOM,Apollo considers sale of Hispanic grocer Heritage Grocers Group,Energy,"US private equity company Apollo Global Management is exploring the sale of its Hispanic grocery chain, Heritage Grocers Group.

The move comes as concerns over mass deportations and Immigration and Customs Enforcement (ICE) raids have prompted Heritage’s core Hispanic customers to exercise greater caution over their shopping habits, dampening consumer demand within Latino communities across the US, as reported by Reuters.

Apollo could secure $1.5bn from the potential sale and has engaged investment bank UBS to manage the process.

Heritage Grocers generates $150m in earnings before interest, taxes, depreciation and amortisation (EBITDA) and records more than $2bn in annual revenue.

Apollo and UBS declined to comment on Reuters’ inquiries, while Heritage Grocers also did not respond to requests for comment.

The company operates several Hispanic-focused grocery banners, including El Rancho Supermercado, Cardenas Markets and Tony’s Fresh Market.

Apollo acquired Tony’s from its founding family and Cardenas from private equity firm KKR in 2022, merging the two.

It purchased El Rancho in 2023.

Heritage Grocers currently operates 115 stores across Arizona, California, Illinois, Kansas, Nevada and Texas.

Apollo has made various investments in the grocery sector, including The Fresh Market, Sprouts Farmers Market, Smart & Final and Albertsons.",Retail-insight-network.com,2025-10-23T14:03:53Z,https://www.retail-insight-network.com/news/apollo-sale-heritage-grocers-group/,0.4,2025-10-24 22:27:40.534378,0.9999999999999999,
XOM,"Stocks Rise, Shaking Off Early Jitters After Tesla Earnings",Energy,"Wall Street bought the dip in riskier assets on Thursday ahead of the first trickle of government data since the start of the shutdown.

The Dow Jones Industrial Average rose 144 points, or 0.3%. The S&P 500 was up 0.6%. The Nasdaq Composite was up 0.9%. The major indexes approached their highest closing levels on record before paring some of their gains in the final hour of trading.

The yield on the 2-year Treasury note rose to 3.48% to snap a three-day streak of falling yields. The 10-year yield was up to 3.99%.

The consumer price index for September is due out Friday at 8:30 a.m. ET. The report was slated to come out just over a week ago, but the shutdown has suspended most government data releases. Heading into the report, some traders appeared to trim bets on two rate cuts through the end of the year: Odds of a half-point in cuts through December dipped to 91.9% from 95.5% on Wednesday, according to the CME FedWatch Tool.

The Bureau of Labor Statistics said earlier this month it would publish the report to allow the Social Security Administration to meet a deadline related to inflation-adjusted benefit payments. It said no other releases will be rescheduled or produced until regular government services resume.

After falling sharply on Wednesday, more speculative parts of the market like quantum computing, crypto, and nuclear were on the rebound.

“What a difference a day makes,” writes Mizuho’s Daniel O’Regan. “We are seeing the exact opposite price action of the last few days with crowded longs, high beta fliers and meme stocks regaining lost momentum.”

O’Regan writes that based on client conversations, he feels like many of the moves are driven by quantitative traders, commodity trading advisors, and rebalancing, rather than active managers. He adds that most clients he talks to are waiting for pullbacks in high-quality stocks as we head into the heart of earnings season. Five of the Magnificent Seven stocks will report results in the week ahead, followed by Nvidia in November.",Barron's,2025-10-23T13:56:38Z,https://www.barrons.com/livecoverage/stock-market-news-today-102325,0.4,2025-10-24 22:27:41.741021,0.9999999999999999,
XOM,"LendingClub upgraded, Enphase Energy downgraded: Wall Street's top analyst calls",Energy,"JPMorgan upgraded LendingClub (LC) to Overweight from Neutral with a price target of $22, up from $17. The firm believes LendingClub has ""more ways than ever"" to grow originations and profits without incurring punitive charges. It sees this driving accelerating profit growth and improved return metrics in 2026.

Roth Capital upgraded Core Scientific (CORZ) to Buy from Neutral with a price target of $23.50, up from $17. The firm now assumes the company's takeover by CoreWeave (CRWV) does not go through amid increasing activity and commentary around voting against the deal.

Deutsche Bank upgraded CME Group (CME) to Buy from Hold with a price target of $300, up from $266, following the Q3 report. The firm believes CME's organic growth initiatives, mainly within the prediction markets, will drive its earnings growth into the high single digits in 2026.

Needham upgraded TransMedics (TMDX) to Buy from Hold with a $148 price target. Needham's transplant tracker indicates that TransMedics' U.S. sales are likely to beat consensus in Q3.

UBS upgraded UiPath (PATH) to Neutral from Sell with a price target of $17, up from $10, as the firm resumed coverage of the stock. The outlook is ""still mixed,"" but near-term GenAI risk fears appear ""overdone,"" UBS tells investors.

Mizuho downgraded Enphase Energy (ENPH) to Neutral from Outperform with a price target of $37, down from $50. The firm cites reduced residential solar demand in 2026, Enphase's lower solar market share due to lease switching, and limited visibility into the success of its new lease and loan financing model for the downgrade.

Mizuho downgraded Hologic (HOLX) to Neutral from Outperform with a $78 price target after the company agreed to be acquired by funds managed by Blackstone (BX) and TPG (TPG) in a transaction valued at up to $79 per share, representing an enterprise value of up to $18.3B.

Wells Fargo downgraded Tegna (TGNA) to Equal Weight from Overweight with an unchanged price target of $22. The firm cites the pending Nexstar (NXST) for the downgrade.

H.C. Wainwright downgraded Avadel Pharmaceuticals (AVDL) to Neutral from Buy with a price target of $20, down from $36, after the company entered into a definitive agreement to be acquired by Alkermes (ALKS) in an all-cash transaction for up to $20.00 per share - $18.50 per share plus a contingent value right of $1.50 per share.

Citi downgraded Arcturus Therapeutics (ARCT) to Neutral from Buy with a price target of $12, down from $49. The ARCT-032 Phase 2 trail did not show a meaningful improvement for cystic fibrosis patients despite high expectations, the firm tells investors in a research note.

Citi initiated coverage of PayPal (PYPL) with a Neutral rating and $78 price target. The company's two-sided network and ""strong brand"" make it a key player in the payment ecosystem, but the ""key metric to watch,"" namely improvement in PayPal branded growth, has failed to materialize so far, the firm tells investors.

Citi initiated coverage of Block (XYZ) with a Buy rating and $105 price target. Block has turned the corner and is focused on accelerating growth, the firm tells investors in a research note. Citi also started coverage of Visa (V), MasterCard (MA), and Affirm (AFRM) with Buy ratings.

KeyBanc initiated coverage of Booking Holdings (BKNG) with an Overweight rating and $6,450 price target as well as Expedia (EXPE) with a Sector Weight rating and no price target. Booking has a ""strong track record"" of executing against its initiatives.

Bernstein initiated coverage of BellRing Brands (BRBR) with an Outperform rating and $46 price target. The firm believes the company's market share will prove resilient and views the stock's valuation as attractive at current levels.

Jefferies initiated coverage of Gulfport Energy (GPOR) with a Buy rating and $250 price target. The firm believes the company's inventory position is misunderstood and cost execution is underappreciated.",Yahoo Entertainment,2025-10-23T13:39:08Z,https://finance.yahoo.com/news/lendingclub-upgraded-enphase-energy-downgraded-133908575.html,0.4,2025-10-24 22:27:42.028238,0.9999999999999999,
