ticker,title,content,source,published_at,url,collected_at
AAPL,How to double your ASX share portfolio without chasing risky stocks,"Learn MoreHow to double your ASX share portfolio without chasing risky stocksYou’re reading a free article with opinions that may differ from The Motley Fool’s Premium Investing Services.
But in reality, you don't need to chase risky stocks to build serious wealth on the ASX.
Focus on quality ASX sharesThe simplest way to double your portfolio is to own high-quality assets and give them time to grow.
ASX shares like Telstra Group Ltd (ASX: TLS) and Harvey Norman Holdings Ltd (ASX: HVN) provide reliable, fully franked dividends that you can reinvest to supercharge compounding.
What you need is time, discipline, and exposure to quality ASX shares and ETFs.",Motley Fool Australia,2025-09-23T23:41:49Z,https://www.fool.com.au/2025/09/24/how-to-double-your-asx-share-portfolio-without-chasing-risky-stocks/,2025-09-25 10:31:52.611346
AAPL,"Stock market today: Dow, S&P 500, Nasdaq slide after Powell flags Fed's challenge, 'highly valued' stocks","The S&P 500 (^GSPC) fell about 0.6%, and the tech-heavy Nasdaq Composite (^IXIC) lost almost 1%.
Powell suggested during a speech in Rhode Island that the central bank would move cautiously after resuming rate cuts last week, noting the challenge of balancing its dual mandate at the moment.
""Near-term risks to inflation are tilted to the upside and risks to employment to the downside — a challenging situation.
Later, in a question-and-answer session, he noted that ""by many measures, for example, equity prices are fairly highly valued.""
Powell's comments set the stage for the release on Friday of the Fed's preferred inflation gauge, the Personal Consumption Expenditures index.",Yahoo Entertainment,2025-09-23T20:01:43Z,https://finance.yahoo.com/news/live/stock-market-today-dow-sp-500-nasdaq-slide-after-powell-flags-feds-challenge-highly-valued-stocks-174834474.html,2025-09-25 10:31:54.113401
AAPL,"Stock market today: Dow, S&P 500, Nasdaq slide as Powell warns of 'challenging situation'","The S&P 500 (^GSPC) fell about 0.6%, and the tech-heavy Nasdaq Composite (^IXIC) lost almost 1%.
Powell suggested during a speech in Rhode Island that the central bank would move cautiously after resuming rate cuts last week, noting the challenge of balancing its dual mandate at the moment.
""Near-term risks to inflation are tilted to the upside and risks to employment to the downside — a challenging situation.
Later, in a question-and-answer session, he noted that ""by many measures, for example, equity prices are fairly highly valued.""
Powell's comments set the stage for the release on Friday of the Fed's preferred inflation gauge, the Personal Consumption Expenditures index.",Yahoo Entertainment,2025-09-23T17:48:34Z,https://finance.yahoo.com/news/live/stock-market-today-dow-sp-500-nasdaq-slide-as-powell-warns-of-challenging-situation-174834970.html,2025-09-25 10:31:55.285969
AAPL,Stocks Lower After Fed Chair Powell Comments,"Switch the Market flagOpen the menu and switch theMarket flag for targeted data from your country of choice.
for targeted data from your country of choice.",Barchart.com,2025-09-23T15:17:13Z,https://www.barchart.com/story/news/34983527/stocks-mixed-before-fed-chair-powell-comments,2025-09-25 10:31:56.680917
AAPL,"Investigating Apple's Standing In Technology Hardware, Storage & Peripherals Industry Compared To Competitors","In today's rapidly changing and highly competitive business world, it is vital for investors and industry enthusiasts to carefully assess companies.
In this article, we will perform a comprehensive industry comparison, evaluating Apple AAPL against its key competitors in the Technology…This story appeared on benzinga.com , 2025-09-23 15:01:07.",Biztoc.com,2025-09-23T15:13:31Z,https://biztoc.com/x/958e6bfce6908a58,2025-09-25 10:31:57.087895
AAPL,Columbia Threadneedle Global Technology Growth Strategy: Apple (AAPL) Faced a Classic Innovator’s Dilemma,"Columbia Threadneedle Investments, an investment management company, released its “Columbia Threadneedle Global Technology Growth Strategy” second-quarter 2025 investor letter.
In its second-quarter 2025 investor letter, Columbia Threadneedle Global Technology Growth Strategy highlighted stocks such as Apple Inc. (NASDAQ:AAPL).
Apple Inc. (NASDAQ:AAPL) is an American multinational company that designs, manufactures, and markets smartphones, personal computers, tablets, wearables, and accessories.
On September 22, 2025, Apple Inc. (NASDAQ:AAPL) stock closed at $256.08 per share, with a market capitalization of $3.8 trillion.
Columbia Threadneedle Global Technology Growth Strategy stated the following regarding Apple Inc. (NASDAQ:AAPL) in its second quarter 2025 investor letter:""Finally, shares of technology bellwether Apple Inc. (NASDAQ:AAPL) underperformed the market and lost value as the company faced a classic innovator’s dilemma, which appeared all the more egregious as competitors embraced the AI opportunity.",Yahoo Entertainment,2025-09-23T13:39:28Z,https://finance.yahoo.com/news/columbia-threadneedle-global-technology-growth-133928822.html,2025-09-25 10:31:58.103327
AAPL,Here’s What Impacted Apple (AAPL) in Q2,"In its second-quarter 2025 investor letter, Alger Spectra Fund highlighted stocks such as Apple Inc. (NASDAQ:AAPL).
Apple Inc. (NASDAQ:AAPL) is an American multinational company that designs, manufactures, and markets smartphones, personal computers, tablets, wearables, and accessories.…This story appeared on finance.yahoo.com , 2025-09-23 13:05:43.",Biztoc.com,2025-09-23T13:32:33Z,https://biztoc.com/x/eec08118ef967ef6,2025-09-25 10:31:58.515631
AAPL,Is Google Stock a Buy at New All-Time Highs?,"Switch the Market flagOpen the menu and switch theMarket flag for targeted data from your country of choice.
for targeted data from your country of choice.",Barchart.com,2025-09-23T13:07:34Z,https://www.barchart.com/story/news/34979435/is-google-stock-a-buy-at-new-all-time-highs,2025-09-25 10:31:59.806742
AAPL,Here’s What Impacted Apple (AAPL) in Q2,"Fred Alger Management, an investment management company, released its “Alger Spectra Fund” second-quarter 2025 investor letter.
In its second-quarter 2025 investor letter, Alger Spectra Fund highlighted stocks such as Apple Inc. (NASDAQ:AAPL).
On September 22, 2025, Apple Inc. (NASDAQ:AAPL) stock closed at $256.08 per share, with a market capitalization of $3.8 trillion.
While we acknowledge the potential of Apple Inc. (NASDAQ:AAPL) as an investment, we believe certain AI stocks offer greater upside potential and carry less downside risk.
If you're looking for an extremely undervalued AI stock that also stands to benefit significantly from Trump-era tariffs and the onshoring trend, see our free report on the best short-term AI stock.",Yahoo Entertainment,2025-09-23T13:05:43Z,https://finance.yahoo.com/news/impacted-apple-aapl-q2-130543625.html,2025-09-25 10:32:00.664777
AAPL,Analyst Says He ‘Loves’ Apple (AAPL) Amid ‘Good News’ Following iPhone 17 Launch,"We recently published These 10 Stocks are Buzzing After Important Analyst Calls.
Apple Inc. (NASDAQ:AAPL) is one of the stocks analysts were recently talking about.
Kevin Simpson from Capital Wealth Planning recently said on CNBC that he is bullish on Apple and explained the reasons…This story appeared on finance.yahoo.com , 2025-09-23 12:32:44.",Biztoc.com,2025-09-23T12:59:02Z,https://biztoc.com/x/e0df576b0caef06d,2025-09-25 10:32:01.048832
AAPL,Analyst Says He ‘Loves’ Apple (AAPL) Amid ‘Good News’ Following iPhone 17 Launch,"Apple Inc. (NASDAQ:AAPL) is one of the stocks analysts were recently talking about.
The good news on the Apple Inc (NASDAQ:AAPL) Pros and the margins there are impressive.
The fact that the price increase has absolutely nothing to do with tariffs, wink wink, is great.
If you are looking for an extremely cheap AI stock that is also a major beneficiary of Trump tariffs and onshoring, see our free report on the best short-term AI stock.
READ NEXT: 30 Stocks That Should Double in 3 Years and 11 Hidden AI Stocks to Buy Right Now.",Yahoo Entertainment,2025-09-23T12:32:44Z,https://finance.yahoo.com/news/analyst-says-loves-apple-aapl-123244141.html,2025-09-25 10:32:02.033290
AAPL,Apple Inc. $AAPL Shares Sold by Exchange Bank,"Exchange Bank lowered its holdings in Apple Inc. (NASDAQ:AAPL – Free Report) by 2.8% during the second quarter, Holdings Channel.com reports.
The firm owned 26,811 shares of the iPhone maker’s stock after selling 776 shares during the period.
Avid Wealth Partners LLC boosted its position in shares of Apple by 28.3% during the first quarter.
Bell & Brown Wealth Advisors LLC grew its stake in shares of Apple by 0.4% in the first quarter.
Needham & Company LLC reaffirmed a “hold” rating on shares of Apple in a research note on Friday, July 25th.",ETF Daily News,2025-09-23T08:31:00Z,https://www.etfdailynews.com/2025/09/23/apple-inc-aapl-shares-sold-by-exchange-bank/,2025-09-25 10:32:03.175433
AAPL,Krilogy Financial LLC Has $48.34 Million Stock Holdings in Apple Inc. $AAPL,"Apple accounts for about 2.8% of Krilogy Financial LLC’s holdings, making the stock its 7th biggest holding.
Krilogy Financial LLC’s holdings in Apple were worth $48,335,000 as of its most recent filing with the Securities and Exchange Commission (SEC).
Apple Stock PerformanceShares of Apple stock opened at $256.08 on Tuesday.
Apple Dividend AnnouncementThe firm also recently announced a quarterly dividend, which was paid on Thursday, August 14th.
Needham & Company LLC restated a “hold” rating on shares of Apple in a research report on Friday, July 25th.",ETF Daily News,2025-09-23T08:30:58Z,https://www.etfdailynews.com/2025/09/23/krilogy-financial-llc-has-48-34-million-stock-holdings-in-apple-inc-aapl/,2025-09-25 10:32:04.325340
AAPL,Apple Inc. $AAPL Position Boosted by Fiduciary Alliance LLC,"Fiduciary Alliance LLC lifted its stake in Apple Inc. (NASDAQ:AAPL – Free Report) by 5.2% during the 2nd quarter, Holdings Channel.com reports.
ROSS JOHNSON & Associates LLC raised its position in shares of Apple by 1,800.0% during the 1st quarter.
Life Planning Partners Inc purchased a new stake in Apple during the fourth quarter valued at approximately $47,000.
Conquis Financial LLC purchased a new stake in Apple during the 4th quarter valued at $63,000.
Apple Trading Up 4.3%Shares of Apple stock opened at $256.08 on Tuesday.",ETF Daily News,2025-09-23T08:30:49Z,https://www.etfdailynews.com/2025/09/23/apple-inc-aapl-position-boosted-by-fiduciary-alliance-llc/,2025-09-25 10:32:04.713067
AAPL,Apple Inc. $AAPL Stake Decreased by Clarus Wealth Advisors,"Apple comprises 3.1% of Clarus Wealth Advisors’ investment portfolio, making the stock its 9th biggest position.
Clarus Wealth Advisors’ holdings in Apple were worth $6,697,000 as of its most recent SEC filing.
Sarver Vrooman Wealth Advisors increased its holdings in shares of Apple by 112.8% in the second quarter.
Apple Stock PerformanceShares of AAPL opened at $256.08 on Tuesday.
Apple Company Profile(Free Report)Apple Inc designs, manufactures, and markets smartphones, personal computers, tablets, wearables, and accessories worldwide.",ETF Daily News,2025-09-23T07:56:55Z,https://www.etfdailynews.com/2025/09/23/apple-inc-aapl-stake-decreased-by-clarus-wealth-advisors/,2025-09-25 10:32:05.873735
AAPL,Apple Inc. $AAPL Holdings Lowered by Key Client Fiduciary Advisors LLC,"Key Client Fiduciary Advisors LLC decreased its stake in Apple Inc. (NASDAQ:AAPL – Free Report) by 1.2% during the second quarter, Holdings Channel reports.
Apple makes up approximately 4.1% of Key Client Fiduciary Advisors LLC’s investment portfolio, making the stock its 3rd largest position.
Key Client Fiduciary Advisors LLC’s holdings in Apple were worth $10,146,000 as of its most recent filing with the Securities & Exchange Commission.
Get Apple alerts:Insider Buying and Selling at AppleIn other news, SVP Deirdre O’brien sold 34,821 shares of Apple stock in a transaction on Friday, August 8th.
Apple Price PerformanceNASDAQ:AAPL opened at $256.08 on Tuesday.",ETF Daily News,2025-09-23T07:56:53Z,https://www.etfdailynews.com/2025/09/23/apple-inc-aapl-holdings-lowered-by-key-client-fiduciary-advisors-llc/,2025-09-25 10:32:07.017001
AAPL,Parkside Advisors LLC Reduces Position in Apple Inc. $AAPL,"Parkside Advisors LLC cut its stake in shares of Apple Inc. (NASDAQ:AAPL – Free Report) by 2.9% during the second quarter, Holdings Channel.com reports.
Apple accounts for about 1.2% of Parkside Advisors LLC’s investment portfolio, making the stock its 19th biggest holding.
Norges Bank purchased a new stake in shares of Apple in the 4th quarter valued at $46,868,648,000.
Nuveen LLC purchased a new stake in Apple in the first quarter valued at $17,472,482,000.
GAMMA Investing LLC now owns 60,066,398 shares of the iPhone maker’s stock valued at $133,425,490,000 after purchasing an additional 59,835,676 shares during the last quarter.",ETF Daily News,2025-09-23T07:56:52Z,https://www.etfdailynews.com/2025/09/23/parkside-advisors-llc-reduces-position-in-apple-inc-aapl/,2025-09-25 10:32:07.505091
AAPL,St. Louis Financial Planners Asset Management LLC Has $2.70 Million Position in Apple Inc. $AAPL,"Apple accounts for approximately 2.1% of St. Louis Financial Planners Asset Management LLC’s investment portfolio, making the stock its 18th biggest holding.
St. Louis Financial Planners Asset Management LLC’s holdings in Apple were worth $2,704,000 at the end of the most recent quarter.
Elite Financial Inc. acquired a new position in shares of Apple during the first quarter valued at about $58,000.
Conquis Financial LLC acquired a new position in shares of Apple during the fourth quarter valued at about $63,000.
Finally, LSV Asset Management acquired a new position in shares of Apple during the fourth quarter valued at about $65,000.",ETF Daily News,2025-09-23T07:56:52Z,https://www.etfdailynews.com/2025/09/23/st-louis-financial-planners-asset-management-llc-has-2-70-million-position-in-apple-inc-aapl/,2025-09-25 10:32:08.590575
AAPL,Apple Inc. $AAPL is Orser Capital Management LLC’s 4th Largest Position,"Apple comprises about 5.2% of Orser Capital Management LLC’s portfolio, making the stock its 4th largest holding.
Orser Capital Management LLC’s holdings in Apple were worth $7,026,000 at the end of the most recent reporting period.
Life Planning Partners Inc acquired a new position in shares of Apple during the 4th quarter worth approximately $47,000.
Conquis Financial LLC acquired a new position in shares of Apple during the 4th quarter worth approximately $63,000.
Finally, LSV Asset Management acquired a new position in shares of Apple during the 4th quarter worth approximately $65,000.",ETF Daily News,2025-09-23T07:56:50Z,https://www.etfdailynews.com/2025/09/23/apple-inc-aapl-is-orser-capital-management-llcs-4th-largest-position/,2025-09-25 10:32:09.664024
AAPL,Apple Inc. $AAPL is Byrne Asset Management LLC’s 2nd Largest Position,"Byrne Asset Management LLC raised its stake in shares of Apple Inc. (NASDAQ:AAPL – Free Report) by 2.2% in the second quarter, Holdings Channel.com reports.
Apple makes up about 4.3% of Byrne Asset Management LLC’s holdings, making the stock its 2nd largest holding.
Byrne Asset Management LLC’s holdings in Apple were worth $6,363,000 at the end of the most recent quarter.
Conquis Financial LLC purchased a new stake in shares of Apple in the 4th quarter worth $63,000.
LSV Asset Management purchased a new stake in shares of Apple in the 4th quarter worth $65,000.",ETF Daily News,2025-09-23T07:56:49Z,https://www.etfdailynews.com/2025/09/23/apple-inc-aapl-is-byrne-asset-management-llcs-2nd-largest-position/,2025-09-25 10:32:10.774217
GOOGL,"Stock market today: Nasdaq, Dow, S&P 500 waver with divided Fed, Alibaba in focus","US stocks fell on Wednesday as Wall Street digested mixed messaging from Fed officials on interest rates.
Debate over the prospects for US interest rate cuts — the big focus for markets right now — appeared to pressure stocks.
Fed Chair Jerome Powell reiterated in a speech on Tuesday that the central bank would proceed cautiously on further rate cuts, even as he left the door open to more easing.
Markets are watching for reassurance that inflation isn't posing a threat to high expectations for two more rate cuts this year.
Meanwhile, some tech stocks are showing gains despite a broader drop across the Nasdaq, which snapped a winning streak on Tuesday amid losses for the ""Magnificent Seven"" Big Tech stocks.",Yahoo Entertainment,2025-09-23T23:03:54Z,https://finance.yahoo.com/news/live/stock-market-today-nasdaq-dow-sp-500-waver-with-divided-fed-alibaba-in-focus-230354679.html,2025-09-25 10:32:12.220014
GOOGL,"Stock market today: Nasdaq, Dow, S&P 500 fall with divided Fed, Alibaba in focus","US stocks fell on Wednesday as Wall Street digested mixed messaging from Fed officials on interest rates.
Debate over the prospects for US interest rate cuts — the big focus for markets right now — appeared to pressure stocks.
Fed Chair Jerome Powell reiterated in a speech on Tuesday that the central bank would proceed cautiously on further rate cuts, even as he left the door open to more easing.
Markets are watching for reassurance that inflation isn't posing a threat to high expectations for two more rate cuts this year.
Meanwhile, some tech stocks are showing gains despite a broader drop across the Nasdaq, which snapped a winning streak on Tuesday amid losses for the ""Magnificent Seven"" Big Tech stocks.",Yahoo Entertainment,2025-09-23T23:03:54Z,https://finance.yahoo.com/news/live/stock-market-today-nasdaq-dow-sp-500-fall-with-divided-fed-alibaba-in-focus-230354294.html,2025-09-25 10:32:13.556433
GOOGL,"Stock market today: Dow, S&P 500, Nasdaq slide after Powell flags Fed's challenge, 'highly valued' stocks","The S&P 500 (^GSPC) fell about 0.6%, and the tech-heavy Nasdaq Composite (^IXIC) lost almost 1%.
Powell suggested during a speech in Rhode Island that the central bank would move cautiously after resuming rate cuts last week, noting the challenge of balancing its dual mandate at the moment.
""Near-term risks to inflation are tilted to the upside and risks to employment to the downside — a challenging situation.
Later, in a question-and-answer session, he noted that ""by many measures, for example, equity prices are fairly highly valued.""
Powell's comments set the stage for the release on Friday of the Fed's preferred inflation gauge, the Personal Consumption Expenditures index.",Yahoo Entertainment,2025-09-23T20:01:43Z,https://finance.yahoo.com/news/live/stock-market-today-dow-sp-500-nasdaq-slide-after-powell-flags-feds-challenge-highly-valued-stocks-174834474.html,2025-09-25 10:32:15.017532
GOOGL,Micron set to report Q4 earnings in latest test of AI trade,"Micron (MU) stock rose early on Wednesday after the chipmaker reported fiscal fourth quarter earnings that surpassed Wall Street's expectations.
Micron's fiscal fourth quarter revenue of $11.3 billion was ahead of the $11.15 billion expected by analysts polled by Bloomberg.
The Idaho-based memory chipmaker — whose semiconductors are used alongside Nvidia's chips in AI data centers — saw adjusted earnings per share of $3.03 for the three months ending Aug. 28, more than the $2.84 projected.
The beat was fueled by the AI data center boom, company executives said, with data centers representing 40% of the chipmaker's total revenue in the fourth quarter.
The company guided for first quarter revenue between $12.2 billion and $12.8 billion, more than the $11.9 billion expected by analysts tracked by Bloomberg.",Yahoo Entertainment,2025-09-23T19:23:51Z,https://finance.yahoo.com/news/micron-set-to-report-q4-earnings-in-latest-test-of-ai-trade-192351303.html,2025-09-25 10:32:16.491600
GOOGL,"Stock market today: Dow, S&P 500, Nasdaq slide as Powell warns of 'challenging situation'","The S&P 500 (^GSPC) fell about 0.6%, and the tech-heavy Nasdaq Composite (^IXIC) lost almost 1%.
Powell suggested during a speech in Rhode Island that the central bank would move cautiously after resuming rate cuts last week, noting the challenge of balancing its dual mandate at the moment.
""Near-term risks to inflation are tilted to the upside and risks to employment to the downside — a challenging situation.
Later, in a question-and-answer session, he noted that ""by many measures, for example, equity prices are fairly highly valued.""
Powell's comments set the stage for the release on Friday of the Fed's preferred inflation gauge, the Personal Consumption Expenditures index.",Yahoo Entertainment,2025-09-23T17:48:34Z,https://finance.yahoo.com/news/live/stock-market-today-dow-sp-500-nasdaq-slide-as-powell-warns-of-challenging-situation-174834970.html,2025-09-25 10:32:17.590273
GOOGL,Jim Cramer Discusses Alphabet Inc. (GOOGL) Performance In 2025,"We recently published 12 Hot, Cold & Stable Stocks Jim Cramer Recently Discussed.
Alphabet Inc. (NASDAQ:GOOGL) is one of the stocks Jim Cramer recently discussed.
Alphabet Inc. (NASDAQ:GOOGL)’s shares have gained 34.5% year-to-date, with most of them coming in the second half of the…This story appeared on finance.yahoo.com , 2025-09-23 16:08:31.",Biztoc.com,2025-09-23T16:32:05Z,https://biztoc.com/x/94ae1a85582db537,2025-09-25 10:32:17.996065
GOOGL,Jim Cramer Discusses Alphabet Inc. (GOOGL) Performance In 2025,"We recently published 12 Hot, Cold & Stable Stocks Jim Cramer Recently Discussed.
Alphabet Inc. (NASDAQ:GOOGL) is one of the stocks Jim Cramer recently discussed.
This time, he discussed Alphabet Inc. (NASDAQ:GOOGL) in the context of the stock being cheap:Jim Cramer Discusses Alphabet Inc. (GOOGL) Performance In 2025Pixabay/Public Domain“Alphabet we can justify where it’s going, .
If you are looking for an extremely cheap AI stock that is also a major beneficiary of Trump tariffs and onshoring, see our free report on the best short-term AI stock.
READ NEXT: 30 Stocks That Should Double in 3 Years and 11 Hidden AI Stocks to Buy Right Now.",Yahoo Entertainment,2025-09-23T16:08:31Z,https://finance.yahoo.com/news/jim-cramer-discusses-alphabet-inc-160831835.html,2025-09-25 10:32:18.935007
GOOGL,"Is Oracle Stock a Buy, Sell, or Hold as the Company Names 2 New CEOs?","Switch the Market flagOpen the menu and switch theMarket flag for targeted data from your country of choice.
for targeted data from your country of choice.",Barchart.com,2025-09-23T16:01:41Z,https://www.barchart.com/story/news/34984465/is-oracle-stock-a-buy-sell-or-hold-as-the-company-names-2-new-ceos,2025-09-25 10:32:20.177364
GOOGL,Stocks Lower After Fed Chair Powell Comments,"Switch the Market flagOpen the menu and switch theMarket flag for targeted data from your country of choice.
for targeted data from your country of choice.",Barchart.com,2025-09-23T15:17:13Z,https://www.barchart.com/story/news/34983527/stocks-mixed-before-fed-chair-powell-comments,2025-09-25 10:32:21.468277
GOOGL,"Google Fights Antitrust Trial To Avoid Ad Tech Breakup: 'Too Great A Risk,' Says DOJ","Alphabet Inc’s GOOGL GOOG Google is battling an antitrust trial to prevent a forced sale of a segment of its online advertising business.
DOJ, States Push Google To Sell AdX, Open AuctionsThe trial, which commenced on Monday in Alexandria, Virginia, is the U.S. government’s latest…This story appeared on benzinga.com , 2025-09-23 13:03:38.",Biztoc.com,2025-09-23T13:20:58Z,https://biztoc.com/x/13c02172b5c709a8,2025-09-25 10:32:21.862919
GOOGL,Is Google Stock a Buy at New All-Time Highs?,"Switch the Market flagOpen the menu and switch theMarket flag for targeted data from your country of choice.
for targeted data from your country of choice.",Barchart.com,2025-09-23T13:07:34Z,https://www.barchart.com/story/news/34979435/is-google-stock-a-buy-at-new-all-time-highs,2025-09-25 10:32:23.107476
GOOGL,Alphabet Inc. $GOOGL Stock Holdings Lifted by Wedge Capital Management L L P NC,"Alphabet accounts for 1.2% of Wedge Capital Management L L P NC’s investment portfolio, making the stock its 8th biggest holding.
Wedge Capital Management L L P NC’s holdings in Alphabet were worth $67,810,000 as of its most recent filing with the Securities and Exchange Commission.
von Borstel & Associates Inc. purchased a new stake in shares of Alphabet in the first quarter valued at approximately $28,000.
IMA Advisory Services Inc. purchased a new stake in shares of Alphabet in the first quarter valued at approximately $28,000.
Finally, Financial Gravity Asset Management Inc. purchased a new stake in shares of Alphabet in the first quarter valued at approximately $39,000.",ETF Daily News,2025-09-23T11:51:02Z,https://www.etfdailynews.com/2025/09/23/alphabet-inc-googl-stock-holdings-lifted-by-wedge-capital-management-l-l-p-nc/,2025-09-25 10:32:24.238118
GOOGL,Alphabet Inc. $GOOGL Shares Sold by Kaufman Rossin Wealth LLC,"Kaufman Rossin Wealth LLC trimmed its holdings in shares of Alphabet Inc. (NASDAQ:GOOGL – Free Report) by 34.5% during the second quarter, according to its most recent Form 13F filing with the SEC.
Get Alphabet alerts:Alphabet Stock Down 0.9%Shares of Alphabet stock opened at $252.53 on Tuesday.
Insiders sold a total of 258,088 shares of company stock valued at $52,405,304 over the last 90 days.
It operates through Google Services, Google Cloud, and Other Bets segments.
The Google Services segment provides products and services, including ads, Android, Chrome, devices, Gmail, Google Drive, Google Maps, Google Photos, Google Play, Search, and YouTube.",ETF Daily News,2025-09-23T11:50:54Z,https://www.etfdailynews.com/2025/09/23/alphabet-inc-googl-shares-sold-by-kaufman-rossin-wealth-llc/,2025-09-25 10:32:25.343322
