ticker,title,category,content,source,published_at,url,relevance_score,collected_at,quality_score,sentiment
AAPL,"Here are Friday's biggest analyst calls: Nvidia, Apple, Coinbase, Intel, Beyond Meat, Amazon, Microsoft, eBay & more",,"Here are the biggest calls on Wall Street on Friday: Evercore ISI reiterates Apple as outperform Evercore says it's bullish on the company's partnership with Formula One. ""While the initial price tag may seem high to some investors, we think acquiring the broadcasting rights is a part of AAPL long-term strategy of expanding in live sports."" JPMorgan upgrades Kodiak Sciences to overweight from neutral JPMorgan says shares of the biotech company are compelling. ""We are upgrading Kodiak (KOD) to Overweight (from Neutral prior) and adjusting our December 2026 price target to $24 ($15 prior)."" Stifel downgrades Snap to sell from hold Stifel says its checks show too many negative catalysts. "" SNAP: Our checks continue to skew negative, and with incremental confidence TikTok is not going away in the U.S., we believe this trend is unlikely to reverse any time soon."" Morgan Stanley upgrades Commercial Metals to overweight from equal weight Morgan Stanley says the M & A ""overhang"" has been removed from the stock. ""We are upgrading CMC to Overweight on the completion of upcoming acquisitions that remove the prior perceived M & A overhang"" JPMorgan initiates Alphatec as overweight JPMorgan says the med tech company has a differentiated offering. ""We are initiating coverage of Alphatec with an Overweight rating and a December 2026 price target of $19."" Keybanc resumes Amazon as overweight Key says Amazon shares are compelling. ""With shares trading well below historical levels at 22.9x 2027E P/E, we believe this screens as an attractive entry point."" JPMorgan upgrades Coinbase to overweight from neutral JPMorgan says shares of the crypto company are too attractive to ignore. ""We are upgrading Coinbase to Overweight as we look ahead to emerging monetization opportunities and abating risks at what we see is an attractive valuation versus cryptocurrency peers."" Read more. Jefferies reiterates Microsoft as buy Jefferies says it's sticking with the stock ahead of earnings next week. ""After its best print in recent memory, MSFT is flat but positioned to rerate, driven by Azure and M365 momentum, robust bookings growth and rising AI contribution."" Morgan Stanley reiterates Intel as equal weight The firm says it's sticking with its equal weight rating but that Intel's earnings report on Thursday was ""encouraging."" ""Significant upside in 3q especially on margins, showing a pattern of underpromising and over-delivering, which is encouraging."" Cantor Fitzgerald initiates Novavax as overweight Cantor says it's bullish on shares of the biotech company. ""We are initiating coverage on NVAX with an OW rating and 12-month $18 PT, representing 115% upside from current levels."" Citizens JMP upgrades eBay to outperform from market perform Citizens says ""AI is a tailwind"" for eBay. ""We upgrade shares of eBay to Market Outperform from Market Perform and establish a $115 price target as we believe eBay's product work is creating a significantly better consumer experience..."" UBS upgrades Alliant Energy to buy from neutral UBS says it sees ""data center growth"" for the energy company. ""We are upgrading shares of LNT to Buy and raising our price target to $79 from $74 due to the company's unique position to capitalize on additional load and generation investment required to meet surging data center demand."" Rothschild & Co Redburn initiates Albemarle as buy The firm says the lithium company is best positioned. ""We launch coverage of Albemarle with a Buy recommendation."" Citi upgrades MNTN to buy from neutral Citi said in its upgrade of the connected TV company that MNTN shares have plenty more room to run. ""Compelling Growth at a Reasonable Valuation as CTV Continues to Attract Incremental Budgets."" Mizuho reiterates Beyond Meat as underperform Mizuho lowered its price target to $1.50 from $2 on shares of the meme stock. ""Volatility Elevated but Fundamentals Weak; Reducing PT on Dilution; Maintain Underperform. ... .Recent financing actions fo r BYND have addressed concerns for short- and long-term capital structure but weak fundamentals maintain our Underperform for BYND shares."" Morgan Stanley upgrades Tractor Supply to equal weight from underweight Morgan Stanley says it sees improving margins. ""Comp growth is normalizing and TSCO is moving past peak margin pressure from its investment cycle."" BTIG initiates Kyivstar as buy BTIG says it's bullish on shares of the Ukraine mobile satellite company. ""We are initiating coverage of Kyivstar Group Ltd. ( KYIV) with a Buy rating and $17 price target."" Truist reiterates Nvidia and Uber as buy Truist says it's bullish on Uber's autonomous vehicle partnership with Nvidia. ""On Thursday, NVIDIA released a white paper in which it provided an update on the company's AV-centered strategic partnership with Uber. Recall, the companies originally announced the partnership at CES 2025 and as part of the partnership NVDA's Cosmos - a cloud-based AI supercomputing platform– is utilizing Uber's driving data to enable developers of AVs with the ability to simulate driving scenarios to train AVs.""",CNBC,2025-10-24T12:34:44Z,https://www.cnbc.com/2025/10/24/fridays-stocks-from-analyst-calls-like-nvidia.html,0.9999999999999999,2025-10-24 22:27:56.544017,,-0.1764705882352942
AAPL,"Top 2 Tech And Telecom Stocks That May Plunge This Month - Apple (NASDAQ:AAPL), Lumen Technologies (NYSE:LUMN)",,"As of Oct. 24, 2025, two stocks in the communication services sector could be flashing a real warning to investors who value momentum as a key criteria in their trading decisions.

The RSI is a momentum indicator, which compares a stock’s strength on days when prices go up to its strength on days when prices go down. When compared to a stock’s price action, it can give traders a better sense of how a stock may perform in the short term. An asset is typically considered overbought when the RSI is above 70, according to Benzinga Pro.

Here's the latest list of major overbought players in this sector.

Warner Bros Discovery Inc (NASDAQ:WBD)

Warner Bros. Discovery is talking to potential suitors for part or the entirety of the business. One interested party could be technology giant Apple Inc (NASDAQ:AAPL), according to a new report. The company's stock gained around 17% over the past five days and has a 52-week high of $21.56.

RSI Value: 76

WBD Price Action: Shares of Warner Bros Discovery rose 3.5% to close at $21.25 on Thursday.

Edge Stock Ratings: 96.66 Momentum score with Value at 27.44.

Lumen Technologies Inc (NYSE:LUMN)

On Oct. 23, Lumen Technologies announced an AI partnership with Palantir Technologies Inc. (NASDAQ:PLTR). The collaboration aims to merge Palantir's advanced AI systems with Lumen's high-speed digital infrastructure to help companies move data faster and operationalize AI more securely. “Palantir frees data, while Lumen moves it. Together, we’re uniquely positioned to enable enterprises to unlock their AI ambitions with unprecedented scale and speed,” said Kate Johnson, CEO of Lumen Technologies. “We share the same disruptive DNA—reimagining the foundations of our industries to help others do the same. By bringing AI into real-world operations through a connected ecosystem, we’re empowering businesses to reinvent how they operate, compete, and grow.” The company's stock gained around 38% over the past month and has a 52-week high of $10.33.

RSI Value: 75.2

LUMN Price Action: Shares of Lumen Technologies gained 10.7% to close at $7.79 on Thursday.

Curious about other BZ Edge Rankings? Click here to discover how similar stocks measure up.

Read This Next:

Top 2 Utilities Stocks You May Want To Dump This Quarter

Photo via Shutterstock

Loading...

Loading...

Market News and Data brought to you by Benzinga APIs

© 2025 Benzinga.com. Benzinga does not provide investment advice. All rights reserved.",Benzinga,2025-10-24T10:45:40Z,https://www.benzinga.com/trading-ideas/short-ideas/25/10/48400191/top-2-tech-and-telecom-stocks-that-may-plunge-this-month,0.7999999999999999,2025-10-24 22:28:09.010383,,0.3176470588235294
AAPL,"How To Trade SPY, Top Tech Stocks As Market Awaits CPI Data",,"Good Morning Traders!

Today is one of the most important trading sessions of the month with the release of the Consumer Price Index for September at 8:30 AM Eastern. This report will heavily influence expectations around monetary policy over the next several meetings and could create sizable volatility if it deviates from forecasts.

At 9:45 AM Eastern, traders will receive updated readings on Manufacturing, Services, and Composite PMIs for October through the S&P Global releases. These datasets help shape the near-term outlook on economic momentum following the Fed's policy stance. Kansas City Services data at 11 AM Eastern will round out the scheduled activity.

With sentiment tightly hinged to inflation expectations, price action is likely to be fast and directional following the morning news. Manage exposure carefully, react to what the tape is showing, and set risk parameters before volatility hits.

Now, we will discuss SPY, QQQ, AAPL, MSFT, NVDA, GOOGL, META, and TSLA.

SPDR S&P 500 ETF Trust (SPY)

SPY opens at 673.75, where buyers are looking to maintain upward momentum ahead of a major data release. A push above this level could carry price into 675.00 and 676.20, with continued strength lifting toward 677.40. If bullish participation grows on positive inflation news, SPY may stretch into 678.65 and 679.85 as investors position into the weekend. Each step higher shows increasing confidence that the market can handle the macro backdrop.

If SPY loses 673.75 off the open, sellers may press into 672.45. A failure to stabilize there can send price into 671.15 and 669.95, with heavier downside potentially reaching 668.70. If momentum accelerates, SPY could dip toward 667.45 before buyers attempt to step back in. These levels will show whether CPI triggers risk-off reactions or simply a brief reset before upside continuation.

Invesco QQQ Trust Series 1 (QQQ)

QQQ begins the session at 613.75, where bulls will try to carry tech leadership into the new data cycle. A move above could lift price into 614.90 and 616.05, with buyers possibly driving into 617.20. If momentum strengthens, QQQ could stretch into 618.35 and 619.55. Each upward move suggests traders are rotating back into growth if inflation progresses in the right direction.

If QQQ drops below 613.75, sellers may probe into 612.50. A break of that zone could lead into 611.30 and 610.10, with continued softness reaching 608.85. If pressure intensifies, QQQ may find deeper testing into 607.60. These areas will tell us whether the market wants to lighten exposure or simply shake out weak hands on the morning reaction.

Apple Inc. (AAPL)

Apple opens at 260.50, and bulls want to keep the stock perched near its recent higher base. A hold above could drive price into 261.45 and 262.40, with added momentum lifting toward 263.35. If strength builds post-CPI, Apple may push into 264.30 and 265.25. Each leg higher reinforces the idea that investors continue to view Apple as a defensive cornerstone with upside potential.

If Apple slips below 260.50, sellers may lean into 259.55. Continued pressure could drag the stock into 258.60 and 257.65, with heavier selling reaching 256.70. If weakness expands, Apple may drift toward 255.75 before stabilizing. These zones will reveal whether a soft CPI print shakes investor confidence or simply offers fresh entries.

Microsoft Corp. (MSFT)

Microsoft begins the day at 521.75, where buyers will be watching for confirmation after a steady week of grind higher. A move above could send price into 522.95 and 524.20, with continued strength driving into 525.40. If demand accelerates, MSFT may stretch toward 526.65 and 527.85. Each push upward shows traders staying committed to quality mega caps through volatility.

If MSFT breaks below 521.75, sellers may target 520.55. A drop under here opens the path to 519.35 and 518.10, with heavier downside reaching 516.90. If selling firms up, the stock could test 515.70 before buyers appear. These levels will help determine how sensitive software names are to inflation expectations today.

NVIDIA Corporation (NVDA)

NVIDIA opens at 183.25, where bulls will try to show continued accumulation after recent hesitation. A move higher could lift price into 184.30 and 185.35, with momentum carrying into 186.40. If upside extends, NVDA may reach 187.45 and 188.50. Each advancement reinforces ongoing confidence in semiconductors as a leading segment.

If NVIDIA loses 183.25, sellers may pull price into 182.20. A deeper fade could expose 181.15 and 180.10, with added weakness carrying into 179.05. If pressure continues, the stock could slip toward 178.00 before catching support. These zones show where growth appetite could temporarily fade if CPI disappoints.

Alphabet Inc Class A (GOOGL)

Alphabet starts the session at 256.25, and buyers will try to sustain its recent positive tone. A move above could push price into 257.20 and 258.15, with buyers later chasing into 259.10. If strength builds, the stock could reach 260.00 and 260.95. Each rise would highlight continued trust in communication names even during data-driven volatility.

If GOOGL fails at 256.25, sellers may drag it into 255.25. A breakdown there exposes 254.20 and 253.15, with deeper selling bringing the tape into 252.10. If momentum softens further, the stock could test 251.05 before setting a base. These levels reveal where bargain hunters could emerge if the morning numbers create a short-term dip.

Meta Platforms Inc (META)

Meta opens at 737.50, with bulls looking to extend its sturdy climb. A lift above could bring price into 739.70 and 741.85, with more aggressive continuation pushing into 744.00. If buyers remain eager, META may reach 746.20 and 748.35. Each new high signals that traders remain committed to strength in the higher beta growth names.

If META falls below 737.50, sellers may push into 735.35. Continued weakness could target 733.20 and 731.10, with heavier downside driving toward 728.95. If selling continues, the stock may slip toward 726.85 before stabilizing. These zones will show whether volatility after CPI is a brief shakeout or a warning signal.

Tesla Inc. (TSLA)

Tesla begins the morning at 446.25, and buyers will attempt to build a firmer base for continuation. A move higher could carry price into 447.85 and 449.45, with stronger participation driving into 451.00. If bullish enthusiasm increases, Tesla may stretch into 452.60 and 454.20. Each move upward shows improving conviction after weeks of consolidation.

If Tesla drops below 446.25, sellers may first probe 444.65. A loss of this level could take the stock into 443.05 and 441.50, with added weakness driving into 439.95. If pressure builds, Tesla could retest 438.40 before buyers return. These areas will be key in assessing whether risk appetite holds up on the inflation print.

Final Word: Good luck, trade safely, and enjoy your weekend.",Benzinga,2025-10-24T12:39:11Z,https://www.benzinga.com/Opinion/25/10/48402134/how-to-trade-spy-top-tech-stocks-as-market-awaits-cpi-data,0.7,2025-10-24 22:27:49.019874,,0.1764705882352942
AAPL,What's moving markets next week,,"Next week will be the busiest in this current earnings cycle. Five of the Magnificent 7 stocks are reporting. Alphabet (GOOG, GOOGL), Amazon (AMZN), Apple (AAPL), Meta (META) and Microsoft (MSFT) all have third quarter results out. The Fed is expected to cut interest rates on Wednesday and Presidents Trump and Xi are set to meet on Thursday. For more live coverage of markets watch the full episode of Market Sunrise and head to Yahoo Finance.",Yahoo! Finance,2025-10-24T12:12:45Z,https://uk.finance.yahoo.com/video/whats-moving-markets-next-week-121245587.html,0.7,2025-10-24 22:27:52.341369,,0.1686274509803922
AAPL,What's moving markets next week,,"Next week will be the busiest in this current earnings cycle. Five of the Magnificent 7 stocks are reporting. Alphabet (GOOG, GOOGL), Amazon (AMZN), Apple (AAPL), Meta (META) and Microsoft (MSFT) all have third quarter results out. The Fed is expected to cut interest rates on Wednesday and Presidents Trump and Xi are set to meet on Thursday. For more live coverage of markets watch the full episode of Market Sunrise and head to Yahoo Finance.",Yahoo! Finance,2025-10-24T12:12:45Z,https://ca.finance.yahoo.com/video/whats-moving-markets-next-week-121245587.html,0.7,2025-10-24 22:28:02.550609,,0.1686274509803922
AAPL,"Apple Surprises Market, Ships U.S.-Built AI Servers Ahead of Schedule",,"This article first appeared on GuruFocus.

Apple (AAPL, Financials) has begun shipping advanced AI servers from a new manufacturing facility in Houston, Texas, months ahead of schedule. The milestone marks a major step in Apple's $600 billion initiative to expand domestic production and support its growing artificial intelligence and cloud infrastructure operations.

Is AAPL fairly valued? Test your thesis with our free DCF calculator.

Chief Executive Officer Tim Cook announced the launch on X, saying the servers would power Apple's Private Cloud Compute and Apple Intelligence systems. Chief Operating Officer Sabih Khan said the company accelerated construction and expects to expand the Houston site further next year to increase capacity.

Apple first talked about the 250,000-square-foot facility in February, saying it will open in 2026. The facility will make high-performance servers that can handle AI processing and data management within Apple's ecosystem. It will also create thousands of jobs.

Apple's next milestone will be scaling production in Houston and integrating the new servers across its data centers globally.",Yahoo! Finance,2025-10-24T12:27:15Z,https://finance.yahoo.com/news/apple-surprises-market-ships-u-122715649.html,0.5,2025-10-24 22:27:59.218677,,0.2627450980392156
AAPL,"A Simple Buffett-Inspired Portfolio You Can Build With Just $1,000",,"Key Points

Buffett is considered the greatest investor of all time.

These six stocks are representative of iconic Buffett stocks.

Just $1,000 can build a mini-Buffett portfolio.

10 stocks we like better than Berkshire Hathaway ›

They don't call him the Oracle of Omaha for nothing!

Berkshire Hathaway (NYSE: BRK.A) (NYSE: BRK.B) CEO and Chairman Warren Buffett is widely considered the greatest investor of all time, inspiring millions of investors along the way. Over his six decades at the helm of the giant conglomerate, he and his hand-picked team have worked to identify stocks of good companies with good management that are undervalued by the market.

It's worked extremely well. Berkshire's stock has generated a compound annual growth rate of almost 20%, double the average annual return of the S&P 500 over that time.

Why not replicate that success?

It's not difficult to build a similar portfolio by studying Buffett's methods. The current portfolio of publicly traded U.S. stocks owned by Berkshire Hathaway has more than 40 stocks and is worth more than $300 billion.

And that doesn't even include the scores of companies Berkshire owns outright, like GEICO Auto Insurance, BNSF railway, and Fruit of the Loom.

A broad portfolio

The stocks Berkshire owns minority stakes in range in price from about $8 (Liberty Latin America Series A) to more than $7,600 a share (NVR Inc). It would be extremely difficult and expensive (not to mention time-consuming) to attempt to mirror that portfolio, even if you bought just one share of each stock.

But if you have just $1,000 to invest and want to create a portfolio that looks a lot like something Buffett would hold (and does), here are six stocks to start with. And you can get a share of each for a combined total price of less than $1,000.

Six iconic Buffett stocks

1. Apple

Let's start with Apple (NASDAQ: AAPL), the giant consumer electronics company and third-largest public company on the planet by market cap. Buffett and Berkshire first invested in Apple in early 2016 with a $1 billion share purchase and continued to increase the stake over the years. Today, Berkshire owns $69.8 billion in Apple shares. That makes it the company's largest holding, at more than 23% of its portfolio. It has netted the company a gain of 524% so far.

Apple is the only stock in this mini portfolio that's down for the year, but Buffett continues to hold it and has great confidence in its long-term prospects. The share price is currently around $249.

2. Bank of America

Berkshire made its initial investment in Bank of America (NYSE: BAC) in August 2011 by purchasing preferred stock and warrants. It converted its warrants to common stock in 2017. The national bank accounts for more than 10% of Berkshire's portfolio. And the stock is up 17% this year. Plus, it pays a nice dividend yield of 2.14%. A share costs about $51.50.

3. Coca-Cola

Coca-Cola (NYSE: KO) is currently Berkshire's fourth largest holdings. A big believer in holding businesses with natural economic moats, Buffett began buying the iconic beverage company's shares in 1988 because he believed it was undervalued. The stock has a yield of 3.04% and is up 9.4% so far this year. Shares trade at about $68.

4. American Express

American Express (NYSE: AXP) has been in the Berkshire portfolio since 1998, though Buffett has increased Berkshire's stake since then and it now owns nearly 22% of outstanding AXP shares worth $51.3 billion. This stock is relatively expensive, at about $340 a share. It has climbed almost 15% in 2025.

5. Chevron

Berkshire made an initial investment in the energy giant Chevron (NYSE: CVX) in 2020 and has been buying and selling since. It's one of Buffett's most actively traded holdings, and it has an attractive 4.5% yield. The stock is currently priced at around $153 a share. It's up 6% this year.

6. Nucor

Nucor (NYSE: NUE) is a steel manufacturer that Berkshire first bought back in the 1990s, considering it a great value play. Buffett purchased another 6.6 million shares this year for about $850 million. Its current price per share is about $133. The share price is up almost 14% this year.

These six stocks are spread across different sectors of the economy, from technology and energy to financials, consumer defensive, and basic materials.

Purchasing one share of each will cost a total of about $995. That will buy you a nice mini-Buffett starter portfolio. And you'll have $5 left over for a latte.

Should you buy stock in Berkshire Hathaway right now?

Before you buy stock in Berkshire Hathaway, consider this:

The Motley Fool Stock Advisor analyst team just identified what they believe are the 10 best stocks for investors to buy now… and Berkshire Hathaway wasn’t one of them. The 10 stocks that made the cut could produce monster returns in the coming years.

Consider when Netflix made this list on December 17, 2004... if you invested $1,000 at the time of our recommendation, you’d have $669,449!* Or when Nvidia made this list on April 15, 2005... if you invested $1,000 at the time of our recommendation, you’d have $1,110,486!*

Now, it’s worth noting Stock Advisor’s total average return is 1,076% — a market-crushing outperformance compared to 191% for the S&P 500. Don't miss the latest top 10 list, available with Stock Advisor, and join an investing community built by individual investors for individual investors.

See the 10 stocks »

*Stock Advisor returns as of October 20, 2025

American Express is an advertising partner of Motley Fool Money. Bank of America is an advertising partner of Motley Fool Money. Matthew Benjamin has positions in Berkshire Hathaway. The Motley Fool has positions in and recommends Apple, Berkshire Hathaway, Chevron, and NVR. The Motley Fool has a disclosure policy.

A Simple Buffett-Inspired Portfolio You Can Build With Just $1,000 was originally published by The Motley Fool",Yahoo! Finance,2025-10-24T11:30:32Z,https://finance.yahoo.com/news/simple-buffett-inspired-portfolio-build-000500742.html,0.4,2025-10-24 22:28:06.314535,,0.2392156862745098
