ticker,title,category,content,source,published_at,url,relevance_score,collected_at,quality_score,sentiment
JPM,European markets rise after major earnings reports; Gucci-owner Kering surges 9%,Financial Services,"Brendan McDermid | Reuters

LONDON — European stocks ended Thursday in positive territory as investors looked to earnings reports for clues on business activity and confidence in the region.

The pan-European Stoxx 600 closed the session up 0.4%. The U.K.'s FTSE 100 index added 0.7%, France's CAC 40 advanced 0.2%, and Italy's FTSE MIB also saw gains of 0.4%. Germany's DAX also edged higher, ending up 0.3%.

It was a busy day for earnings in Europe with Kering , Roche Holding , Unilever , Vinci , Thales , LSEG , Dassault Systemes , Antofagasta , Swedbank, Nokia and Lloyds Banking Group among the big names reporting third-quarter figures.

Stock Chart IconStock chart icon

Enterprise software firm SAP released earnings late on Wednesday, which missed analyst expectations. The German company reported a 7% increase in revenue for the third quarter of 9.08 billion euros ($10.53 billion), below expectations of 9.15 billion euros ($7.96 billion), according to consensus figures compiled by LSEG.

However, it saw gains of 22% in its cloud revenue, with CEO Christian Klein putting it down to increasing AI and data cloud market share.

watch now

""For Q4 we are executing against a strong pipeline - which gives us confidence in our accelerating total revenue growth ambition for 2026,"" he said in a statement. SAP's shares ended the session up 2.2%.

Gucci-owner Kering also reported after the bell on Wednesday. The group's revenue totaled 3.4 billion euros in the quarter, down 5% on a comparable basis but it beat expectations of 3.31 billion euros, per a consensus compiled by FactSet. Gucci sales — which typically make up close to half of Kering's total revenues — came in just shy of forecasts at 1.3 billion euros, down 14% on a comparable basis on the year before. Its shares closed 8.7% higher.

Stock Chart IconStock chart icon

In financial services, Lloyds Banking Group on Thursday reported pre-tax profit of almost £1.2 billion, slightly higher than consensus estimates of about £1 billion, but down from the £1.8 billion of the same period last year. It comes after the British lender announced earlier this month an additional £800 million charge relating to customer compensation arising from the U.K. car finance misselling scandal. Its shares were up 1.2% at the closing bell.

Shares in Skandinaviska Enskilda Banken (SEB) lost 0.1% as its net interest income reached 10.4 billion Swedish krona during the third quarter, beating the 10.2 Swedish krona predicted by analysts. The bank's quarterly-earnings report showed net profits of 7.68 billion Swedish krona for the three-month period, missing the 7.86 billion Swedish krona forecast by analysts, according to LSEG estimates.

watch now

Swedbank reported pre-tax profits of 10.8 billion Swedish krona, above the 9.4 billion Swedish krona forecast by analysts. Shares in the Stockholm-listed lender — which has a strong presence in Estonia, Latvia and Lithuania — fell 0.2% on the day. The bank saw net interest income reach 10.8 billion Swedish krona, above analyst estimates of 10.7 billion Swedish krona.

Attention turns to energy

Oil prices were in focus Thursday after they jumped around 3% in the previous session when the Trump administration imposed further sanctions on Russia's two largest crude companies, Rosneft and Lukoil. The commodity was up by more than 5% in afternoon trade.

The administration cited Moscow's ""lack of serious commitment to a peace process to end the war in Ukraine.""

European Union member states also approved new sanctions on Russia on Wednesday, to be formally adopted today, including a ban on liquefied natural gas imports further as the bloc ramps up efforts to decouple its energy supply from Russian oil and gas.

""We really want to deprive Russia of the means to fund this war to end this war,"" Kaja Kallas, European Union high representative for foreign affairs and security policy, and vice president of the European Commission, told CNBC's ""Europe Early Edition"" on Thursday.

The continent has made progress on this, Kallas noted, but ""not all the member states are there,"" she said. ""So the criticism that we have heard, also from the United States, regarding some of our member states still buying oil and gas, it's very relevant,"" she added.

Kallas spoke ahead of an EU leaders' summit on Thursday, where further measures will be discussed. Brussels will also discuss using frozen Russian assets as a reparations loan to support Ukraine.

Broader Asia-Pacific markets mostly fell, tracking Wall Street's declines on Wednesday on concerns about U.S.-China trade relations. Trade fears resurfaced after Reuters reported that the Trump administration is considering curbs on exports to China that are made with U.S. software, citing a U.S. official and three people briefed by U.S. authorities.

U.S. stock markets were in positive territory as investors digested quarterly earnings releases that came out after the previous market close, including from Tesla, IBM, Moderna and Lam Research.

— CNBC's Hugh Leask, Pia Singh and Nur Hikmah Md Ali contributed to this market report.",CNBC,2025-10-23T14:03:45Z,https://www.cnbc.com/2025/10/23/european-markets-set-to-open-lower-ahead-of-major-earnings-reports.html,0.6,2025-10-24 22:27:37.824988,0.9999999999999999,
JPM,Should You Hold Booking Holdings (BKNG)?,Financial Services,"Wedgewood Partners, an investment management company, released its third-quarter 2025 investor letter. The letter is available for download here. AI stocks remain the favorite topic of Wall Street in the third quarter. In the third quarter, Wedgewood Composite’s net return was 5.9% compared to the Standard & Poor’s 8.1%, the Russell 1000 Growth Index’s 10.5%, and the Russell 1000 Value Index’s 5.3% return for the same period. In addition, you can check the fund’s best 5 holdings to know its best picks in 2025.

In its third-quarter 2025 investor letter, Wedgewood Partners highlighted stocks such as Booking Holdings Inc. (NASDAQ:BKNG). Headquartered in Norwalk, Connecticut, Booking Holdings Inc. (NASDAQ:BKNG) provides online travel and restaurant booking services. The one-month return of Booking Holdings Inc. (NASDAQ:BKNG) was -5.34%, and its shares gained 21.27% of their value over the last 52 weeks. On October 22, 2025, Booking Holdings Inc. (NASDAQ:BKNG) stock closed at $5,230.59 per share, with a market capitalization of $169.523 billion.

Wedgewood Partners stated the following regarding Booking Holdings Inc. (NASDAQ:BKNG) in its third quarter 2025 investor letter:

""Booking Holdings Inc. (NASDAQ:BKNG) also detracted from performance during the quarter. Revenues grew +16% and earnings per share were up +32% on strong room night growth in its ex-U.S. markets. The Company derives over +60% of its bookings from travelers who go directly to the booking.com app or website. This has freed up advertising cash low to reinvest in distribution across search engines, social media, and now agentic commerce through OpenAI's ""Operator."" Booking's focus on fragmented hotel suppliers in ex-U.S. markets is quite differentiated, so much so that it has allowed it to amass scale in areas that competitors simply have trouble reaching. The Company's obsessive focus on generating attractive returns from advertising has also been a key driver of its success, and that should continue to be beneficial to shareholders, regardless of the marketing channel consumers choose.""",Yahoo Entertainment,2025-10-23T13:46:29Z,https://finance.yahoo.com/news/hold-booking-holdings-bkng-134629426.html,0.6,2025-10-24 22:27:38.463392,0.9999999999999999,
JPM,Musk Hijacks Tesla Earnings Call to Vouch for $1 Trillion Pay Plan,Financial Services,"Elon Musk, the world’s richest person, spent the end of Tesla Inc.’s earnings call pleading with investors to approve his $1 trillion pay package and blasting the shareholder advisory firms that have come out against the proposal.

“There needs to be enough voting control to give a strong influence, but not so much that I can’t be fired if I go insane,” Musk said, interrupting his chief financial officer as the more than hour-long call wrapped up.

Most Read from Bloomberg

Pritzker Slams Chicago Mayor’s Plan for Tax on Big Payrolls

Cruise Ships Show South Korea’s Struggle to Host Global Leaders

MTA to Sell $230 Million of Debt Amid Tolling Plan Legal Fight

American Roads Are Paved With Inefficiency

What a 1970s Commune in Arizona Got Right About Desert Urbanism

It was classic Musk: a fiery end to what had otherwise been a ho-hum call largely devoted to Tesla’s artificial intelligence, humanoid robot and self-driving initiatives. Shareholders will vote on the pay package at Tesla’s Nov. 6 annual meeting in Austin.

Tesla’s earnings report was largely disappointing, with profit missing estimates despite record vehicle deliveries. Operating income plunged 40% in the third quarter, reflecting ongoing strains on an electric-vehicle business that’s being buffeted by changing US policies.

Costs are rising sharply for Tesla, with tariffs taking a more than $400 million toll on last quarter’s results. Operating expenses soared 50% to $3.4 billion in the period.

Tesla shares dropped as much as 5.7% shortly after the start of regular trading Thursday. The stock is up almost 9% for the year, trailing the 14% advance by the S&P 500 Index.

‘Unmitigated Concerns’

Proxy advisers Institutional Shareholder Services and Glass Lewis have recommended that investors reject the unprecedented payout to Musk, the value of which is dependent on Tesla reaching market value thresholds and operational milestones. ISS cited “unmitigated concerns” with the magnitude and design of the award, while Glass Lewis took issue with its potential to dilute other shareholders’ ownership.

Musk emphasized, as he has in the past, that sufficient voting control matters more to him than monetary compensation from Tesla.

“I just don’t feel comfortable building a robot army here, and then being ousted because of some asinine recommendations from ISS and Glass Lewis, who have no freaking clue,” he said.

After Musk was finished, Tesla CFO Vaibhav Taneja resumed his closing remarks, praising the “amazing job” the special board committee did in constructing the award.",Yahoo Entertainment,2025-10-23T13:40:10Z,https://finance.yahoo.com/news/musk-hijacks-tesla-earnings-call-134010146.html,0.6,2025-10-24 22:27:38.599289,0.9999999999999999,
JPM,(PR) IBM Releases Third-Quarter 2025 Results,Financial Services,"IBM today announced third-quarter 2025 earnings results.

""This quarter we accelerated performance across all of our segments, and again exceeded expectations for revenue, profit and free cash flow. Clients globally continue to leverage our technology and domain expertise to drive productivity in their operations and deliver real business value with AI. Our AI book of business now stands at more than $9.5 billion,"" said Arvind Krishna, IBM chairman, president and chief executive officer. ""Given the strength of our business, we are raising our full-year outlook for revenue growth and free cash flow.""Third-Quarter Highlights

Revenue

Revenue of $16.3 billion, up 9 percent, up 7 percent at constant currency

Software revenue up 10 percent, up 9 percent at constant currency

Consulting revenue up 3 percent, up 2 percent at constant currency

Infrastructure revenue up 17 percent, up 15 percent at constant currency

Profit

Gross Profit Margin: GAAP: 57.3 percent, up 1.1 points; Operating (Non-GAAP): 58.7 percent, up 1.2 points

Pre-Tax Income Margin: GAAP: 14.9 percent, up 20.2 points; Operating (Non-GAAP): 18.6 percent, up 2.0 points

Cash Flow

Year to date, net cash from operating activities of $9.2 billion; free cash flow of $7.2 billion

""New innovation, the strength and diversity of our portfolio, and our disciplined execution led to acceleration in revenue growth and profit in the quarter,"" said James Kavanaugh, IBM senior vice president and chief financial officer. ""Consistent focus on the fundamentals of our business delivered double-digit growth in adjusted EBITDA, and drove another quarter of strong free cash flow, the fuel for our investments and ability to return value to shareholders.""

Segment Results for Third Quarter

Software—revenues of $7.2 billion, up 10 percent, up 9 percent at constant currency:

Hybrid Cloud (Red Hat) up 14 percent, up 12 percent at constant currency

Automation up 24 percent, up 22 percent at constant currency

Data up 8 percent, up 7 percent at constant currency

Transaction Processing down 1 percent, down 3 percent at constant currency

Consulting—revenues of $5.3 billion, up 3 percent, up 2 percent at constant currency:

Strategy and Technology up 2 percent, flat at constant currency

Intelligent Operations up 5 percent, up 4 percent at constant currency

Infrastructure—revenues of $3.6 billion, up 17 percent, up 15 percent at constant currency:

Hybrid Infrastructure up 28 percent, up 26 percent at constant currency

IBM Z up 61 percent, up 59 percent at constant currency

Distributed Infrastructure up 10 percent, up 8 percent at constant currency

Infrastructure Support up 1 percent, flat at constant currency

Financing—revenues of $0.2 billion, up 10 percent, up 8 percent at constant currency

Cash Flow and Balance Sheet

In the third quarter, the company generated net cash from operating activities of $3.1 billion, up $0.2 billion year to year. IBM's free cash flow was $2.4 billion, up $0.3 billion year to year. The company returned $1.6 billion to shareholders in dividends in the third quarter.

For the first nine months of the year, the company generated net cash from operating activities of $9.2 billion, flat year to year. IBM's free cash flow was $7.2 billion, up $0.6 billion year to year.

IBM ended the third quarter with $14.9 billion of cash, restricted cash and marketable securities, up $0.1 billion from year-end 2024. Debt, including IBM Financing debt of $11.3 billion, totaled $63.1 billion, up $8.1 billion year to date.

Full-Year 2025 Expectations

Revenue: The company now expects constant currency revenue growth of more than 5 percent. At current foreign exchange rates, currency is expected to be about a one-and-a-half-point tailwind to growth for the year.

Free cash flow: The company now expects about $14 billion in free cash flow for the full year.

Dividend Declaration

On October 22, 2025, the IBM board of directors approved a regular quarterly cash dividend of $1.68 per common share, to stockholders of record on November 10, 2025. With payment of the December 10, 2025, dividend, IBM will have paid consecutive quarterly dividends every year since 1916.

Source: IBM

Related News",Techpowerup.com,2025-10-23T14:15:10Z,https://www.techpowerup.com/342183/ibm-releases-third-quarter-2025-results,0.6,2025-10-24 22:27:37.497510,0.8999999999999999,
JPM,How To Earn $500 A Month From Ford Stock Ahead Of Q3 Earnings,Financial Services,"Ford Motor Company (NYSE:F) will release earnings results for the third quarter after the closing bell on Thursday, Oct. 23.

In the meantime, some investors may be eyeing potential gains from the company's dividends. The carmaker currently offers an annual dividend yield of 4.83%, which is a quarterly dividend amount of 15 cents per share (60 cents a year).

So, how can investors capitalize on its dividend yield to earn a regular $500 monthly?

To earn $500 per month or $6,000 annually from dividends alone, you would need an investment of approximately $124,300 or around 10,000 shares. For a more modest $100 per month or $1,200 per year, you would need $24,860 or around 2,000 shares.

To calculate: Divide the desired annual income ($6,000 or $1,200) by the dividend ($0.60 in this case). So, $6,000 / $0.60 = 10,000 ($500 per month), and $1,200 / $0.60 = 2,000 shares ($100 per month).

Note that dividend yield can change on a rolling basis, as the dividend payment and the stock price both fluctuate over time.

How that works: The dividend yield is computed by dividing the annual dividend payment by the stock’s current price.

For example, if a stock pays an annual dividend of $2 and is currently priced at $50, the dividend yield would be 4% ($2/$50). However, if the stock price increases to $60, the dividend yield drops to 3.33% ($2/$60). Conversely, if the stock price falls to $40, the dividend yield rises to 5% ($2/$40).

Similarly, changes in the dividend payment can impact the yield. If a company increases its dividend, the yield will also increase, provided the stock price stays the same. Conversely, if the dividend payment decreases, so will the yield.

Ford Price Action

Shares of Ford fell 1% to close at $12.43 on Wednesday.

Analysts expect the company to report quarterly earnings at 36 cents per share. That’s down from 49 cents per share in the year-ago period.

The consensus estimate for Ford's quarterly revenue is $43.86 billion, compared to $43.07 billion a year earlier, according to data from Benzinga Pro.

The company has beaten analyst estimates for revenue in two straight quarters. It also exceeded estimates in seven of the last 10 quarters overall.

Read More:

Wall Street’s Most Accurate Analysts Give Their Take On 3 Utilities Stocks Delivering High-Dividend Yields

© Doug Hood/Asbury Park Press / USA TODAY NETWORK via Imagn Images",Benzinga,2025-10-23T14:08:38Z,https://www.benzinga.com/news/25/10/48376971/how-to-earn-500-a-month-from-ford-stock-ahead-of-q3-earnings-2,0.5,2025-10-24 22:27:37.616722,0.9999999999999999,
JPM,IBM Stock Falls Sharply After Q3 Beat-- Here's What Went Wrong,Financial Services,"This article first appeared on GuruFocus.

Oct 23 - IBM (NYSE:IBM) stock dipped about 6% in early Thursday trading after the company's third-quarter results, released late Wednesday, showed slower software growth despite beating overall estimates.

The tech giant reported adjusted earnings of $2.65 per share, surpassing analyst expectations of $2.45, while revenue climbed to $16.33 billion, above the $16.09 billion consensus.

Warning! GuruFocus has detected 9 Warning Signs with INTC.

Is IBM fairly valued? Test your thesis with our free DCF calculator.

Net income rose to $1.74 billion, reversing a loss from a year earlier. IBM also raised its full-year revenue growth target to more than 5% and lifted free cash flow guidance to $14 billion.

Still, investors appeared concerned about the pace of software expansion. Software sales grew 10% year over year to $7.2 billion, matching forecasts but falling short of more bullish hopes. The Red Hat unit, a key driver of IBM's AI and hybrid-cloud strategy, showed signs of slowing momentum, which analysts said could weigh on sentiment.

Evercore ISI analyst Amit Daryanani said Red Hat's deceleration may unsettle investors, while Jefferies' Brent Thill noted that IBM's software recovery now depends heavily on reigniting Red Hat growth. Despite strong infrastructure and consulting gains, traders focused on software softness, pulling shares lower.",Yahoo Entertainment,2025-10-23T14:08:27Z,https://finance.yahoo.com/news/ibm-stock-falls-sharply-q3-140827383.html,0.5,2025-10-24 22:27:37.645065,0.9999999999999999,
