ticker,title,content,source,published_at,url,category,sentiment,tickers,collected_at
JPM,JPMorganChase to Present at the BancAnalysts Association of Boston Conference,"NEW YORK--(BUSINESS WIRE)--Bori Cox, CFO of Consumer & Community Banking, will present at the BancAnalysts Association of Boston Conference at the Langham Hotel in Boston on Thursday, November 6, 2025 at 8:55 a.m. (Eastern). A live audio webcast will be available on the day of the conference at www.jpmorganchase.com under Investor Relations, Events & Presentations. JPMorgan Chase & Co. (NYSE: JPM) is a leading financial services firm based in the United States of America (“U.S.”), w.",Business Wire,2025-10-09 20:47:00+00:00,https://www.businesswire.com/news/home/20251009816972/en/JPMorganChase-to-Present-at-the-BancAnalysts-Association-of-Boston-Conference/,Financial Services,Neutral,['JPM'],2025-10-29 22:12:51.414855
JPM,Jamie Dimon Issues Harsh Stock Market Warning – 5 of JPMorgan's Safest Dividend Stocks,"Jamie Dimon is one of the highest-profile bankers in the world. Like Warren Buffett, David Solomon, or other Wall Street titans, when he speaks, people listen.",24/7 Wall Street,2025-10-09 19:01:26+00:00,https://247wallst.com/investing/2025/10/09/jamie-dimon-issues-stern-stock-market-warning-5-of-jpmorgans-safest-dividend-stocks/?utm_source=snapi,Financial Services,Neutral,"['ET', 'ETR', 'JPM', 'MRK', 'T']",2025-10-29 22:12:51.414857
JPM,JPMorgan's Jamie Dimon is ‘far more worried' about potential stock market fall than most of Wall Street,"The head of America's largest bank said he was ""far more worried"" about a possible stock market downturn than some of his rivals; he predicted it would come within the next six months to two years.",New York Post,2025-10-09 18:22:40+00:00,https://nypost.com/2025/10/09/business/jpmorgans-jamie-dimon-is-far-more-worried-about-potential-stock-market-fall-than-most-of-wall-street/,Financial Services,Negative,['JPM'],2025-10-29 22:12:51.414858
JPM,JPMorgan Chase Expanding in India to Facilitate Cross-Border Money Movement,"JPMorgan Chase & Co. is reportedly working to expand its operations in India. The bank is expanding its payment services in the country to help clients process and move money globally, as well as pursuing partnerships with Indian FinTechs that focus on cross-border flows, Bloomberg reported Thursday (Oct.",PYMNTS,2025-10-09 16:22:49+00:00,https://www.pymnts.com/news/cross-border-commerce/cross-border-payments/2025/jpmorgan-chase-expanding-in-india-to-facilitate-cross-border-money-movement/?utm_source=snapi,Financial Services,Positive,['JPM'],2025-10-29 22:12:51.414859
JPM,Insights Into JPMorgan Chase & Co. (JPM) Q3: Wall Street Projections for Key Metrics,"Looking beyond Wall Street's top-and-bottom-line estimate forecasts for JPMorgan Chase & Co. (JPM), delve into some of its key metrics to gain a deeper insight into the company's potential performance for the quarter ended September 2025.",Zacks Investment Research,2025-10-09 14:15:29+00:00,https://www.zacks.com/stock/news/2765277/insights-into-jpmorgan-chase-co-jpm-q3-wall-street-projections-for-key-metrics?cid=CS-STOCKNEWSAPI-FT-fundamental_analysis|nfm_preview-2765277,Financial Services,Positive,['JPM'],2025-10-29 22:12:51.414860
JPM,Head of largest US bank warns of risk of American stock market crash,"Jamie Dimon, chair of JPMorgan Chase, said he was ‘far more worried than others' about serious market correction",The Guardian,2025-10-09 11:30:04+00:00,https://www.theguardian.com/business/2025/oct/09/head-of-jpmorgan-chase-warns-of-risk-of-american-stock-market-crash,Financial Services,Negative,['JPM'],2025-10-29 22:12:51.414861
JPM,US banks to reap bigger profits as deals rebound in third quarter,"The six largest U.S. banks are expected to report stronger third-quarter earnings next week, catapulted by a rebound in investment banking.",Reuters,2025-10-09 10:34:42+00:00,https://www.reuters.com/business/finance/us-banks-reap-bigger-profits-deals-rebound-third-quarter-2025-10-09/,Financial Services,Positive,"['BAC', 'C', 'GS', 'JPM', 'MS', 'WFC']",2025-10-29 22:12:51.414862
JPM,At Least 30 Financials Report Next Week: Credit Not Likely An Issue (Yet) - A Look At 2 Big Banks,"Next week, beginning October 13th, at least 30 financial services companies are scheduled to report their Q3 '25 earnings, and the reports appear to cover the market cap spectrum. When JPMorgan reports Tuesday morning, October 14th, before the opening bell, analysts are expecting EPS of $.83 and net revenue of $45.35 billion for expected y-o-y growth of 11% and 5%, respectively. For Q3 '25, analysts are looking for $1.90 in EPS on $21 billion in net revenue for expected y-o-y growth of 26% and 4%, with Citi's EPS growth expected to far outpace JPM's 11%.",Seeking Alpha,2025-10-09 00:25:00+00:00,https://seekingalpha.com/article/4828688-at-least-30-financials-report-next-week-credit-not-likely-an-issue-yet-a-look-at-2-big-banks,Financial Services,Positive,"['C', 'JPM']",2025-10-29 22:12:51.414863
JPM,The Q3 Earnings Season Gets Underway: A Closer Look,"Note: The following is an excerpt from this week's Earnings Trends report. You can access the full report that contains detailed historical actual and estimates for the current and following periods, please click here>>>",Zacks Investment Research,2025-10-09 00:16:07+00:00,https://www.zacks.com/commentary/2764974/the-q3-earnings-season-gets-underway-a-closer-look?cid=CS-STOCKNEWSAPI-FT-earnings_trends-2764974,Financial Services,Neutral,"['C', 'JPM', 'WFC']",2025-10-29 22:12:51.414864
JPM,Party Like it's 1999? Why the Nasdaq will Double from Here,"The 2025 bull market is unusually bullish. Although stocks experienced a tremendous run since the 'Liberation Day' lows, several key data points suggest that the Nasdaq could still double from here.",Zacks Investment Research,2025-10-08 23:31:08+00:00,https://www.zacks.com/commentary/2764948/party-like-it-s-1999-why-the-nasdaq-will-double-from-here?cid=CS-STOCKNEWSAPI-FT-investment_ideas-2764948,Financial Services,Positive,"['AMD', 'BE', 'CRWV', 'FIG', 'JPM', 'SHOP']",2025-10-29 22:12:51.414865
JPM,JPMorgan Chase & Co. (JPM) Stock Drops Despite Market Gains: Important Facts to Note,"In the latest trading session, JPMorgan Chase & Co. (JPM) closed at $304.03, marking a -1.19% move from the previous day.",Zacks Investment Research,2025-10-08 22:46:38+00:00,https://www.zacks.com/stock/news/2764905/jpmorgan-chase-co-jpm-stock-drops-despite-market-gains-important-facts-to-note?cid=CS-STOCKNEWSAPI-FT-tale_of_the_tape|yseop_template_6-2764905,Financial Services,Neutral,['JPM'],2025-10-29 22:12:51.414866
JPM,Why JPMorgan's Rising Stock Defies Traditional Valuations And Jamie Dimon's Own Advice,"“I want to make it really clear, OK? We're not going to buy back a lot of stock at these prices,” said billionaire JPMorgan Chase CEO Jamie Dimon during the bank's annual meeting in May of 2024.",Forbes,2025-10-08 19:25:06+00:00,https://www.forbes.com/sites/brandonkochkodin/2025/10/08/why-jpmorgans-rising-stock-defies-traditional-valuations-and-jamie-dimons-own-advice/,Financial Services,Neutral,['JPM'],2025-10-29 22:12:51.414867
JPM,TIGR vs. JPM: Which Stock Is the Better Value Option?,Investors interested in Financial - Investment Bank stocks are likely familiar with UP Fintech Holding Limited (TIGR) and JPMorgan Chase & Co. (JPM). But which of these two stocks presents investors with the better value opportunity right now?,Zacks Investment Research,2025-10-08 16:41:15+00:00,https://www.zacks.com/stock/news/2764691/tigr-vs-jpm-which-stock-is-the-better-value-option?cid=CS-STOCKNEWSAPI-FT-tale_of_the_tape|yseop_template_3-2764691,Financial Services,Positive,"['JPM', 'TIGR']",2025-10-29 22:12:51.414869
JPM,JPMorgan Likely To Report Higher Q3 Earnings; These Most Accurate Analysts Revise Forecasts Ahead Of Earnings Call,"JPMorgan Chase & Co. (NYSE:JPM) will release earnings results for the third quarter, before the opening bell on Tuesday, Oct. 14.",Benzinga,2025-10-08 15:39:07+00:00,https://www.benzinga.com/analyst-stock-ratings/price-target/25/10/48104603/jpmorgan-likely-to-report-higher-q3-earnings-these-most-accurate-analysts-revise-forecasts-ahead-of-earnings-call?utm_source=snapi,Financial Services,Positive,['JPM'],2025-10-29 22:12:51.414870
JPM,JPM or MS: Which IB Stock to Buy Amid Optimistic Industry Prospects?,"When it comes to Wall Street heavyweights, few names wield more influence than JPMorgan JPM and Morgan Stanley MS. These financial powerhouses stand as cornerstones of global finance, boasting deep expertise in investment banking, from advising on multibillion-dollar mergers and underwriting marquee IPOs to steering clients through the intricacies of global capital markets.",Zacks Investment Research,2025-10-08 14:11:08+00:00,https://www.zacks.com/stock/news/2764367/jpm-or-ms-which-ib-stock-to-buy-amid-optimistic-industry-prospects?cid=CS-STOCKNEWSAPI-FT-analyst_blog|most_popular_stocks-2764367,Financial Services,Neutral,"['JPM', 'MS']",2025-10-29 22:12:51.414871
JPM,JPMorgan's Jamie Dimon Says AI Is Going to Eliminate Some Jobs,"JPMorgan Chase Chair and CEO Jamie Dimon says the company spends $2 billion a year on developing artificial intelligence technology, and saves about the same amount annually from the investment. He speaks during an interview with Tom Mackenzie on ""Bloomberg Tech.",Bloomberg Markets and Finance,2025-10-08 12:43:28+00:00,https://www.youtube.com/watch?v=BrBd9XXlp-E,Financial Services,Neutral,['JPM'],2025-10-29 22:12:51.414872
JPM,JPMorgan Q3 Earnings Preview: Time To Find Out The Pulse Of The Consumer,"JPMorgan Chase & Co. is set to report Q3 earnings, with expectations for continued outperformance and a strong track record of beating estimates. JPM's investment thesis centers on robust credit card growth, resilient investment banking momentum, and management's guidance for higher net interest income in FY25. Despite strong fundamentals and a projected 21.3% upside to a $375 price target, JPM trades near 52-week highs with only moderate short-term momentum.",Seeking Alpha,2025-10-08 11:45:04+00:00,https://seekingalpha.com/article/4828460-jpmorgan-q3-earnings-preview-time-to-find-out-the-pulse-of-consumer-maintain-buy,Financial Services,Positive,['JPM'],2025-10-29 22:12:51.414873
JPM,Jamie Dimon says JPMorgan's $2 billion AI investment is already paying off,"Jamie Dimon said JPMorgan's $2 billion AI investment has already matched its cost in savings. ""It's the tip of the iceberg,"" Dimon said of JPMorgan's AI gains.",Business Insider,2025-10-08 07:45:43+00:00,https://www.businessinsider.com/jamie-dimon-jpmorgan-2-billion-ai-investment-paying-off-2025-10,Financial Services,Positive,['JPM'],2025-10-29 22:12:51.414875
JPM,JPMorganChase Announces Major Investments in its Bournemouth Campus and the Community,"BOURNEMOUTH, England--(BUSINESS WIRE)--JPMorganChase today announces two major investments to strengthen Bournemouth's workforce and community. The firm will invest £300-350 million to modernise and expand on the Bournemouth campus for its 5,300 local employees, and provide £3.5 million over five years to support local non-profit organisations dedicated to helping young people in the South West develop skills and access career opportunities. These investments underscore JPMorganChase's commitme.",Business Wire,2025-10-08 07:00:00+00:00,https://www.businesswire.com/news/home/20251008136240/en/JPMorganChase-Announces-Major-Investments-in-its-Bournemouth-Campus-and-the-Community/,Financial Services,Neutral,['JPM'],2025-10-29 22:12:51.414876
JPM,Jamie Dimon says JPMorgan spends $2B a year on AI – and still breaks even,"“We know that it's got to billions of cost savings and I think it's the tip of the iceberg,” Dimon said during a Bloomberg TV interview Tuesday.",New York Post,2025-10-07 20:21:36+00:00,https://nypost.com/2025/10/07/business/jamie-dimon-says-jpmorgan-spends-2b-a-year-on-ai-and-breaks-even-with-savings/,Financial Services,Positive,['JPM'],2025-10-29 22:12:51.414877
JPM,JPMorgan Chase Stock Cools Off Ahead of Earnings,"JPMorgan & Chase Co (NYSE:JPM) will be one of the first big names to kick off earnings season next week, announcing its third-quarter earnings report on Tuesday, October 14.",Schaeffers Research,2025-10-07 19:45:38+00:00,https://www.schaeffersresearch.com/content/analysis/2025/10/07/jpmorgan-chase-stock-cools-off-ahead-of-earnings,Financial Services,Neutral,['JPM'],2025-10-29 22:12:51.414878
JPM,"JPMorgan CEO Dimon on Growth of AI, Jobs, Government Shutdown",JPMorgan Chase & Co. Chief Executive Officer Jamie Dimon talks about the growth of AI and how it's being used at the bank. Dimon shares his thoughts on the US government shutdown and the problems with reporting quarterly earnings.,Bloomberg Markets and Finance,2025-10-07 18:29:21+00:00,https://www.youtube.com/watch?v=aK6P7VIlRag,Financial Services,Neutral,['JPM'],2025-10-29 22:12:51.414879
JPM,Union Bancaire Privee Buys $81 Million in JPMorgan Stock Ahead of Next Week's Earnings,"Union Bancaire Privee disclosed the purchase of 272,830 shares of JPMorgan Chase & Co. (JPM -0.67%) worth an estimated $81 million in the third quarter, according to its SEC filing for the period ended September 30.",The Motley Fool,2025-10-07 17:38:44+00:00,https://www.fool.com/coverage/filings/2025/10/07/union-bancaire-privee-buys-usd81-million-in-jpmorgan-stock-ahead-of-next-week-s-earnings/,Financial Services,Positive,['JPM'],2025-10-29 22:12:51.414880
JPM,JPM Stock Before Q3 Earnings: Should You Buy Now or Wait for Results?,"JPMorgan's Q3 earnings on Oct. 14 could show strength in trading and IB, but rising expenses and asset quality trends may test investors' resolve.",Zacks Investment Research,2025-10-07 15:26:11+00:00,https://www.zacks.com/stock/news/2763668/jpm-stock-before-q3-earnings-should-you-buy-now-or-wait-for-results?cid=CS-STOCKNEWSAPI-FT-analyst_blog|most_popular_stocks-2763668,Financial Services,Positive,['JPM'],2025-10-29 22:12:51.414881
JPM,JPMorgan Chase & Co. (JPM) Reports Next Week: Wall Street Expects Earnings Growth,JPMorgan Chase & Co. (JPM) doesn't possess the right combination of the two key ingredients for a likely earnings beat in its upcoming report. Get prepared with the key expectations.,Zacks Investment Research,2025-10-07 15:01:10+00:00,https://www.zacks.com/stock/news/2763640/jpmorgan-chase-co-jpm-reports-next-week-wall-street-expects-earnings-growth?cid=CS-STOCKNEWSAPI-FT-tale_of_the_tape|yseop_template_9-2763640,Financial Services,Positive,['JPM'],2025-10-29 22:12:51.414882
JPM,JP Morgan backs Lion Finance as a quiet emerging markets success,"Lion Finance Group PLC (LSE:BGEO) may not yet roar on UK screens, but JP Morgan thinks it deserves a louder following. The US bank has begun coverage with an “overweight” rating and a December 2026 price target of £92, calling it a “structural emerging markets growth story” and an “Apex compounder”.",Proactive Investors,2025-10-07 13:24:19+00:00,https://www.proactiveinvestors.co.uk/companies/news/1079842?SNAPI,Financial Services,Positive,['JPM'],2025-10-29 22:12:51.414883
JPM,My Top 10 High-Yield Dividend Stocks For October 2025: One Yields 11%-Plus,"This article highlights 10 high-yield dividend stocks, selected for October 2025 based on strong financial health, attractive valuations, and competitive advantages. The chosen companies, including MO, BCH, BBSEY, CVX, EPD, VZ, BNS, USB, DPSTF/DHLGY, and ARCC, offer yields above 4% and market caps over $10B. Many picks, such as VZ, MO, and EPD, provide both robust dividend income and potential for dividend growth, enhancing portfolio stability and income.",Seeking Alpha,2025-10-06 22:00:00+00:00,https://seekingalpha.com/article/4827776-my-top-10-high-yield-dividend-stocks-for-october-2025-one-yields-11-percent-plus,Financial Services,Positive,"['ARCC', 'BAC', 'BBSEY', 'BCH', 'BNS', 'CVX', 'DHLGY', 'DPSTF', 'EPD', 'JPM', 'MO', 'T', 'USB', 'VZ', 'XOM']",2025-10-29 22:12:51.414884
JPM,"JPMorgan names Hillery, Wiltz as EMEA co-CEOs, memo says","JPMorgan Chase on Monday named Conor Hillery and Matthieu Wiltz as co-chief executive officers for Europe, the Middle East and Africa, according to an internal memo seen by Reuters.",Reuters,2025-10-06 14:38:17+00:00,https://www.reuters.com/business/finance/jpmorgan-names-hillery-wiltz-emea-co-ceos-memo-says-2025-10-06/,Financial Services,Neutral,['JPM'],2025-10-29 22:12:51.414886
JPM,Martin Capital Sells $3.6 Million in JPMorgan Stock — What to Know Ahead of Q3 Earnings,"On Friday, Martin Capital Partners, LLC disclosed selling 12,035 shares of JPMorgan Chase & Co. (JPM 0.40%) worth an estimated $3.6 million based on averages in the third quarter.",The Motley Fool,2025-10-06 14:33:59+00:00,https://www.fool.com/coverage/filings/2025/10/06/martin-capital-sells-usd3-6-million-in-jpmorgan-stock-what-to-know-ahead-of-q3-earnings/,Financial Services,Negative,['JPM'],2025-10-29 22:12:51.414887
JPM,Oracle vs JPMorgan Chase: Which Will Be the Next $1 Trillion Stock?,"Once upon a time, investors didn't think it was possible for stocks to reach a $1 trillion market cap. Even today, the club is pretty exclusive.",The Motley Fool,2025-10-06 13:05:00+00:00,https://www.fool.com/investing/2025/10/06/oracle-vs-jpmorgan-chase-which-will-be-the-next-1/,Financial Services,Neutral,"['JPM', 'ORCL']",2025-10-29 22:12:51.414888
JPM,"5 Relatively Secure And Cheap Dividend Stocks, Yields Up To 8% (Oct. 2025)","This article is part of our monthly series where we highlight five large-cap, relatively safe, dividend-paying companies offering significant discounts to their historical norms. We go over our filtering process to select just five conservative DGI stocks from more than 7,500 companies that are traded on U.S. exchanges, including OTC networks. In addition to the primary list that yields 3.56%, we present two other groups of five DGI stocks each, from moderate to high yields of up to 8%.",Seeking Alpha,2025-10-04 12:15:00+00:00,https://seekingalpha.com/article/4827004-5-relatively-secure-and-cheap-dividend-stocks-yields-8-percent-oct-2025,Financial Services,Positive,"['ADP', 'AMH', 'APH', 'ARCC', 'AVGO', 'BTI', 'CAG', 'CARR', 'CSL', 'CTRA', 'DKS', 'GLPI', 'JPM', 'LEN', 'LYB', 'MPLX', 'MRK', 'MS', 'PFE', 'PG', 'SCCO', 'TGT', 'TS', 'TU', 'UPS']",2025-10-29 22:12:51.414889
JPM,Largest U.S. Banks Lead Sector Market Performance In September,"Although most of the US banking sector traded down in September, the Big Four banks bucked the trend, propping up the market-cap weighted index. Each of the four US banks with more than $1 trillion in total assets as of June 30 posted positive total returns in September.",Seeking Alpha,2025-10-04 05:50:00+00:00,https://seekingalpha.com/article/4827822-largest-us-banks-lead-sector-market-performance-in-september,Financial Services,Positive,"['BAC', 'C', 'CBU', 'CFG', 'FFWM', 'INBK', 'JPM', 'NIC', 'OCFC', 'TBBK', 'TFIN', 'USB', 'VLY', 'WFC']",2025-10-29 22:12:51.414891
JPM,"Final Trades: Archer Aviation, JPMorgan Chase, Shell and Capital One",CNBC's “Halftime Report” team details their top stocks and final trades.,CNBC Television,2025-10-03 18:07:28+00:00,https://www.youtube.com/watch?v=Md35PXERlDM,Financial Services,Neutral,"['ACHR', 'COF', 'SHEL', 'JPM']",2025-10-29 22:12:51.414892
JPM,JPMorgan Chase & Co. (JPM) is Attracting Investor Attention: Here is What You Should Know,"JPMorgan Chase & Co. (JPM) has been one of the stocks most watched by Zacks.com users lately. So, it is worth exploring what lies ahead for the stock.",Zacks Investment Research,2025-10-03 14:00:44+00:00,https://www.zacks.com/stock/news/2761369/jpmorgan-chase-co-jpm-is-attracting-investor-attention-here-is-what-you-should-know?cid=CS-STOCKNEWSAPI-FT-tale_of_the_tape|most_searched_stocks-2761369,Financial Services,Positive,['JPM'],2025-10-29 22:12:51.414893
JPM,Bank Earnings in Focus as Q3 Earnings Season Takes Center Stage,"There is justifiable optimism about the big banks' business prospects. Loan demand is expected to accelerate, the peak in delinquencies is now behind us, deal pipelines are seen as steadily getting stronger, and trading activities remain robust.",Zacks Investment Research,2025-10-03 00:41:04+00:00,https://www.zacks.com/commentary/2761116/bank-earnings-in-focus-as-q3-earnings-season-takes-center-stage?cid=CS-STOCKNEWSAPI-FT-earnings_trends-2761116,Financial Services,Positive,"['C', 'JPM', 'WFC']",2025-10-29 22:12:51.414894
JPM,JPMorgan Chase & Co. (JPM) Stock Falls Amid Market Uptick: What Investors Need to Know,"JPMorgan Chase & Co. (JPM) reached $310.71 at the closing of the latest trading day, reflecting a -1.5% change compared to its last close.",Zacks Investment Research,2025-10-01 22:46:29+00:00,https://www.zacks.com/stock/news/2760461/jpmorgan-chase-co-jpm-stock-falls-amid-market-uptick-what-investors-need-to-know?cid=CS-STOCKNEWSAPI-FT-tale_of_the_tape|yseop_template_6-2760461,Financial Services,Negative,['JPM'],2025-10-29 22:12:51.414895
JPM,Why JPMorgan Chase & Co. (JPM) is Poised to Beat Earnings Estimates Again,JPMorgan Chase & Co. (JPM) has an impressive earnings surprise history and currently possesses the right combination of the two key ingredients for a likely beat in its next quarterly report.,Zacks Investment Research,2025-10-01 17:11:22+00:00,https://www.zacks.com/stock/news/2760388/why-jpmorgan-chase-co-jpm-is-poised-to-beat-earnings-estimates-again?cid=CS-STOCKNEWSAPI-FT-tale_of_the_tape|yseop_template_7-2760388,Financial Services,Positive,['JPM'],2025-10-29 22:12:51.414896
JPM,Cramer's Banking Bet: Why JPMorgan And Goldman Still Look Cheap,"Jim Cramer just tossed another log on the bank-stock fire. Fresh off the buzz around Electronic Arts Inc's (NASDAQ: EA) deal, the Mad Money host says JPMorgan Chase & Co (NYSE: JPM) and Goldman Sachs Group Inc (NYSE: GS) are ""still cheap on a P/E basis"" — a contrarian take when many investors think financials are tapped out.",Benzinga,2025-09-29 20:00:36+00:00,https://www.benzinga.com/trading-ideas/long-ideas/25/09/47928344/cramers-banking-bet-why-jpmorgan-and-goldman-still-look-cheap?utm_source=snapi,Financial Services,Positive,"['GS', 'JPM']",2025-10-29 22:12:51.414897
JPM,Startup founder Charlie Javice to be sentenced for defrauding JPMorgan Chase,"Charlie Javice, founder of a startup acquired by JPMorgan Chase in 2021 for $175 million, is facing sentencing Monday for defrauding the bank by overstating how many customers the fintech firm had. A jury found Javice and her chief growth officer Olivier Amar guilty on three counts of fraud and one count of conspiracy to commit fraud.",CNBC,2025-09-29 17:58:15+00:00,https://www.cnbc.com/2025/09/29/jpmorgan-chase-frank-charlie-javice-sentencing.html,Financial Services,Negative,['JPM'],2025-10-29 22:12:53.003292
JPM,‘Banks at risk most since 2008': Market expert's stark alert,"Bear Traps Report founder and NYT bestselling author Larry McDonald joined ‘Mornings with Maria' to warn that Wall Street faces its biggest risks since 2008, with rising defaults, shaky banks and looming economic turmoil.",Fox Business,2025-09-29 16:45:00+00:00,https://www.youtube.com/watch?v=EPl4v_PjqhA,Financial Services,Negative,"['BAC', 'C', 'GS', 'JPM', 'MS', 'WFC', 'XLF']",2025-10-29 22:12:53.003306
JPM,ON SALE: TICKETS FOR THE HIGHLY ANTICIPATED 17th ANNUAL RITZ-CARLTON CAYMAN COOKOUT AVAILABLE OCTOBER 1,"Award-winning Chefs Eric Ripert, José Andrés, Emeril Lagasse, Stephanie Izard, Carla Hall and more Gather for this Premier Event, January 14 – 19, 2026 as the Legendary Resort Celebrates its 20th Anniversary High-Res Images of The Ritz-Carlton, Grand Cayman's 16th Annual Cayman Cookout Here GRAND CAYMAN, Cayman Islands , Sept. 29, 2025 /PRNewswire/ -- The first and only Forbes Triple Five-Star hotel in the Caribbean – The Ritz-Carlton, Grand Cayman – announced that tickets will officially go on sale for the 17th annual Ritz-Carlton Cayman Cookout on Wednesday, October 1.",PRNewsWire,2025-09-29 12:45:00+00:00,https://www.prnewswire.com/news-releases/on-sale-tickets-for-the-highly-anticipated-17th-annual-ritz-carlton-cayman-cookout-available-october-1-302568603.html,Financial Services,Neutral,"['JPM', 'MAR']",2025-10-29 22:12:53.003310
JPM,5 Dividend Powerhouses Every Investor Should Own,Forget chasing the next hype-fueled stock. Real wealth comes from companies that dominate essential industries and return cash to shareholders year after year.,The Motley Fool,2025-09-28 14:30:00+00:00,https://www.fool.com/investing/2025/09/28/5-dividend-powerhouses-every-investor-should-own/,Financial Services,Positive,"['JPM', 'LMT', 'NVDA', 'PG', 'XOM']",2025-10-29 22:12:53.003314
JPM,"JPMorgan names Suni new head of ECM international, memo says","JPMorgan has appointed Sunil Dhupelia as the new head of equity capital markets international, according to an internal memo seen by Reuters on Friday.",Reuters,2025-09-26 18:15:54+00:00,https://www.reuters.com/business/finance/jpmorgan-names-suni-new-head-ecm-international-memo-says-2025-09-26/,Financial Services,Neutral,['JPM'],2025-10-29 22:12:53.003317
JPM,Global Dividend Growth Accelerates As The Bull Market Turns 3,"Company payouts are stronger compared to previous years, despite brewing macro risks. A weaker dollar and resilient consumer spending support record earnings and stock prices, even amid cautious CEO sentiment. We spot key events as the calendar flips to October, along with happenings at the biggest U.S. bank.",Seeking Alpha,2025-09-26 07:25:00+00:00,https://seekingalpha.com/article/4826097-global-dividend-growth-accelerates-bull-market-turns-3,Financial Services,Positive,"['ACWX', 'JPM', 'SPY']",2025-10-29 22:12:53.003320
