ticker,title,content,source,published_at,url,category,sentiment,tickers,collected_at
AAPL,Apple Crushed by Other Tech Stocks,Apple Inc. (NASDAQ: AAPL) stock trades near its all-time high.,24/7 Wall Street,2025-10-29 13:15:13+00:00,https://247wallst.com/technology-3/2025/10/29/apple-crushed-by-other-tech-stocks/?utm_source=snapi,Technology,Positive,['AAPL'],2025-10-29 22:12:40.892482
AAPL,Delevska on Mag 7: Positive Setup Into Earnings Season,Ivana Delevska joins Diane King Hall at the NYSE to preview the megacap tech stocks reporting earnings this week. She says A.I.,Schwab Network,2025-10-29 12:58:27+00:00,https://www.youtube.com/watch?v=7_y1kX4zj-U,Technology,Positive,"['AAPL', 'AMZN', 'GOOG', 'GOOGL', 'META', 'MSFT', 'NVDA', 'TSLA']",2025-10-29 22:12:40.892489
AAPL,"Apple suppliers Qorvo and Skyworks to merge, creating a $22 billion chip giant",Apple suppliers Skyworks Solutions and Qorvo will merge in a cash-and-stock deal to create a radio chip company with an enterprise value of $22 billion.,Fast Company,2025-10-29 12:40:55+00:00,https://www.fastcompany.com/91430496/apple-skyworks-qorvo-merge-radio-chip-giant,Technology,Positive,"['AAPL', 'QRVO', 'SWKS']",2025-10-29 22:12:40.892491
AAPL,Banking giant sets Street-high price target for Apple stock,"Apple (NASDAQ: AAPL) received a major boost from Bank of America, which raised its price target for the tech giant to $320 from $270, marking a new high among Wall Street forecasts.",Finbold,2025-10-29 12:35:53+00:00,https://finbold.com/banking-giant-sets-street-high-price-target-for-apple-stock/?utm_source=snapi,Technology,Positive,['AAPL'],2025-10-29 22:12:40.892492
AAPL,"SellYourMac Expands to Canada, Offering Canadians a Trusted Way to Sell, Reuse, and Recycle Apple Devices","MISSISSAUGA, Ontario & CINCINNATI--(BUSINESS WIRE)--SellYourMac.com (SYM), a reCommerce and IT asset transition service company committed to reusing, repurposing, and recycling used Apple products, today announced the launch of SellYourMac Canada, now available at www.sellyourmac.ca. Canadian customers can now easily and securely sell their used Apple devices for top value while contributing to sustainability and responsible e-waste management. Part of the Other World Computing (OWC) family of.",Business Wire,2025-10-29 12:30:00+00:00,https://www.businesswire.com/news/home/20251029957413/en/SellYourMac-Expands-to-Canada-Offering-Canadians-a-Trusted-Way-to-Sell-Reuse-and-Recycle-Apple-Devices/,Technology,Neutral,['AAPL'],2025-10-29 22:12:40.892493
AAPL,Apple's iPhone Air doesn't look like a best-seller. It might not matter.,"Apple's earnings report this Thursday is critical for investors because it includes the first official sales for the iPhone 17. Third-party estimates from analysts and industry researchers have found that iPhone sales are up this cycle, especially for the entry-level iPhone 17, and the iPhone 17 Pro models.",CNBC,2025-10-29 11:00:01+00:00,https://www.cnbc.com/2025/10/29/apples-iphone-air-sales-in-focus-at-q4-earnings.html,Technology,Neutral,['AAPL'],2025-10-29 22:12:40.892495
AAPL,"Apple earnings are coming up, with the stock's move dependent on one key debate","Apple's iPhone business exceeded expectations in the June quarter, and early iPhone 17 indications have been encouraging. But is that demand sustainable?",Market Watch,2025-10-29 11:00:00+00:00,https://www.marketwatch.com/story/apple-earnings-are-coming-up-with-the-stocks-move-dependent-on-one-key-debate-6795a98a,Technology,Positive,['AAPL'],2025-10-29 22:12:40.892496
AAPL,I Think Apple Stock Has Become a Hold for These 3 Reasons,The company has become more of a follower than an innovator. The days of double-digit revenue growth appear to be over.,The Motley Fool,2025-10-29 11:00:00+00:00,https://www.fool.com/investing/2025/10/29/i-think-apple-stock-become-hold-for-3-reasons/,Technology,Neutral,['AAPL'],2025-10-29 22:12:40.892497
AAPL,Apple poised for iPhone sales boost on strong Pro demand,"Apple's quarterly results on Thursday are expected to show the company can spark a strong iPhone upgrade cycle even without the flashy artificial intelligence tools it has been slow to release, a delay that has dulled its appeal on Wall Street.",Reuters,2025-10-29 10:05:36+00:00,https://www.reuters.com/business/apple-poised-iphone-sales-boost-strong-pro-demand-2025-10-29/,Technology,Positive,['AAPL'],2025-10-29 22:12:40.892498
AAPL,"Apple, Microsoft: $4 trillion club signals boom times, but this week's numbers will test the story","Three names now sit in the $4 trillion club: Nvidia, Microsoft and, briefly on Tuesday, Apple. It is the headline of an AI-fuelled rally that has pushed technology shares to record highs and filled many UK portfolios, through ISAs, SIPPs and pension funds, with exposure to these US giants.",Proactive Investors,2025-10-29 08:18:08+00:00,https://www.proactiveinvestors.co.uk/companies/news/1081316?SNAPI,Technology,Positive,"['AAPL', 'MSFT']",2025-10-29 22:12:40.892498
AAPL,"The Stock Market Faces Make-or-Break Tests: The Fed's Interest-Rate Decision and Earnings From Alphabet, Amazon, Apple, Meta, and Microsoft","The S&P 500 has been in a bull market for more than three years, but the stock market could stumble, depending on the outcome of several important events this week. The Federal Reserve will announce its interest-rate decision on Wednesday, and five big technology companies will report earnings on Wednesday and Thursday.",The Motley Fool,2025-10-29 07:30:00+00:00,https://www.fool.com/investing/2025/10/29/stock-market-make-break-test-fed-big-tech-earnings/,Technology,Neutral,"['AAPL', 'AMZN', 'GOOG', 'GOOGL', 'META', 'MSFT']",2025-10-29 22:12:40.892499
AAPL,"Tech Giants Power Market: MSFT, GOOGL, AMZN, AAPL & AMD Lead Charge","Technology stocks are on fire, with the SPX, NDX and $DJI hitting record highs. Olivier Blanchard attributes this surge to A.I.",Schwab Network,2025-10-29 00:00:06+00:00,https://www.youtube.com/watch?v=5Yw-kzkOdZo,Technology,Positive,"['AAPL', 'AMD', 'AMZN', 'GOOG', 'GOOGL', 'MSFT']",2025-10-29 22:12:40.892500
AAPL,Apple Asks Judge to Dismiss Fintiv's Racketeering Lawsuit Focused on Apple Pay,Apple reportedly asked a judge Monday (Oct. 27) to dismiss a racketeering lawsuit brought by Fintiv.,PYMNTS,2025-10-28 21:59:14+00:00,https://www.pymnts.com/apple/2025/apple-asks-judge-dismiss-fintiv-racketeering-lawsuit/?utm_source=snapi,Technology,Neutral,['AAPL'],2025-10-29 22:12:40.892501
AAPL,"Buy the Mag 7 Laggards as Earnings Approach?: AMZN, AAPL","Set to release their quarterly reports after-market hours on Thursday, October 30, Amazon and Apple stock have been the laggards of the Mag 7 this year.",Zacks Investment Research,2025-10-28 21:46:06+00:00,https://www.zacks.com/commentary/2779449/buy-the-mag-7-laggards-as-earnings-approach-amzn-aapl?cid=CS-STOCKNEWSAPI-FT-investment_ideas-2779449,Technology,Negative,"['AAPL', 'AMZN']",2025-10-29 22:12:40.892502
AAPL,The ‘Magnificent Seven' have never been this important to the stock market — and a big test lies ahead,"The stock market is getting ever-more reliant on the “Magnificent Seven,” raising the stakes for a jam-packed week of technology earnings that could decide whether Wall Street's momentum has more room to run.",Market Watch,2025-10-28 20:46:00+00:00,https://www.marketwatch.com/story/the-magnificent-seven-have-never-been-this-important-to-the-stock-market-and-a-big-test-lies-ahead-87db8caf,Technology,Neutral,"['AAPL', 'AMZN', 'GOOG', 'GOOGL', 'META', 'MSFT']",2025-10-29 22:12:40.892503
AAPL,Apple ordered to pay French operators 39 mn euros over iPhone sales,A French court has ordered Apple to pay around 39 million euros ($45 million) to mobile network operators over accusations it imposed unfair contract conditions to allow them to sell iPhones.,TechXplore,2025-10-28 20:40:02+00:00,https://techxplore.com/news/2025-10-apple-pay-french-mn-euros.html,Technology,Negative,['AAPL'],2025-10-29 22:12:40.892504
AAPL,"How Will Services, Mac and iPad Fare in Apple's Q4 Earnings?","AAPL's fiscal Q4 results are set to shine on strong Services and Mac growth, even as iPad sales face a modest decline.",Zacks Investment Research,2025-10-28 19:16:07+00:00,https://www.zacks.com/stock/news/2779402/how-will-services-mac-and-ipad-fare-in-apple-s-q4-earnings?cid=CS-STOCKNEWSAPI-FT-analyst_blog|earnings_preview-2779402,Technology,Positive,['AAPL'],2025-10-29 22:12:40.892504
AAPL,Why Stocks Are Set to Melt Up Despite Investor Fear,"Despite investor fears, US stocks are primed to melt up into the historically strong fourth quarter. Easing trade fears, a Dovish Fed, and robust earnings are bullish tailwinds for stocks into year-end.",Zacks Investment Research,2025-10-28 19:01:13+00:00,https://www.zacks.com/commentary/2779374/why-stocks-are-set-to-melt-up-despite-investor-fear?cid=CS-STOCKNEWSAPI-FT-investment_ideas-2779374,Technology,Neutral,"['AAPL', 'AMD', 'ARM', 'CRWV', 'META']",2025-10-29 22:12:40.892505
AAPL,Big Tech earnings this week: What investors should expect,"With five of the Big Tech giants reporting this week, Jessica Inskip weighs in on what the numbers could mean for AI demand and the market rally. Transcript: Caroline Woods: In terms of tech earnings, we have five of the big 7 on deck this week.",The Street,2025-10-28 19:00:47+00:00,https://www.youtube.com/watch?v=YU02j175-7A,Technology,Neutral,"['AAPL', 'AMZN', 'GOOG', 'GOOGL', 'META', 'MSFT']",2025-10-29 22:12:40.892506
AAPL,3 'Magnificent 7' Stocks With Cheap Options Prices,"Tim Cook's Apple Inc (NASDAQ:AAPL) was last seen trading up 0.3% at $269.67, earlier surpassing the $4 trillion market cap level.",Schaeffers Research,2025-10-28 18:37:45+00:00,https://www.schaeffersresearch.com/content/analysis/2025/10/28/3-magnificent-7-stocks-with-cheap-options-prices,Technology,Positive,"['AAPL', 'MSFT', 'NVDA']",2025-10-29 22:12:40.892507
AAPL,Here's How Much Traders Expect Apple Stock To Move After Earnings This Week,"Apple is scheduled to report its fiscal fourth-quarter earnings after the closing bell Thursday, with traders betting on a move in the iPhone maker's stock that could take it to new highs after the results.",Investopedia,2025-10-28 18:36:09+00:00,https://www.investopedia.com/here-is-how-much-traders-expect-apple-stock-to-move-after-earnings-this-week-q4-fy2025-11837302,Technology,Positive,['AAPL'],2025-10-29 22:12:40.892508
AAPL,"The 'Big 3' Tech Playbook: Why Apple, Amazon And Microsoft Keep Winning","Amazon.com Inc. (NASDAQ:AMZN) is expected to post steady third-quarter gains powered by strong cloud, advertising, and retail performance.",Benzinga,2025-10-28 18:19:36+00:00,https://www.benzinga.com/analyst-stock-ratings/reiteration/25/10/48473849/the-big-3-tech-playbook-why-apple-amazon-and-microsoft-keep-winning?utm_source=snapi,Technology,Positive,"['AAPL', 'AMZN', 'MSFT']",2025-10-29 22:12:40.892509
AAPL,Apple Achieves $4 Trillion Market Cap Amid Strong Demand for New iPhone,"Stronger-than-expected demand for the new iPhone 17 series reportedly helped drive Apple's market capitalization above $4 trillion on Tuesday (Oct. 28). Apple became the third public company to reach that milestone, following Nvidia and Microsoft, which both reached it in July, Bloomberg reported Tuesday.",PYMNTS,2025-10-28 17:30:41+00:00,https://www.pymnts.com/apple/2025/apple-achieves-4-trillion-market-cap-amid-strong-demand-for-new-iphone/?utm_source=snapi,Technology,Positive,['AAPL'],2025-10-29 22:12:40.892510
AAPL,High Implied Volatility Sets Up This Premium Grab For Apple Stock Earnings,Apple earnings are coming and with a higher implied volatility. Here's how to take advantage.,Investors Business Daily,2025-10-28 17:18:08+00:00,https://www.investors.com/research/options/high-implied-volatility-sets-up-this-premium-grab-for-apple-stock-earnings/,Technology,Neutral,['AAPL'],2025-10-29 22:12:40.892510
AAPL,"Mian: GOOGL to Show A.I. Resiliency, AAPL A.I. Woes, AMZN ""Not Caring"" for Street","Sheraz Mian turns to the slate of Mag 7 earnings on the docket this week, noting four of the five serving as leaders in the A.I. race. The one he doesn't see leading: Apple (AAPL).",Schwab Network,2025-10-28 17:07:36+00:00,https://www.youtube.com/watch?v=kVj-eb44b80,Technology,Neutral,"['AAPL', 'GOOG', 'GOOGL']",2025-10-29 22:12:40.892511
AAPL,"Apple may seem expensive, but Jim Cramer says it could actually be undervalued","Apple may seem expensive, but Jim Cramer says it could actually be undervalued. Here's why: #apple #stock #jimcramer Subscribe | http://t.st/TheStreetTV Earn.",The Street,2025-10-28 17:01:32+00:00,https://www.youtube.com/shorts/mqWNMwxe3XE,Technology,Positive,['AAPL'],2025-10-29 22:12:40.892513
AAPL,Apple vs Microsoft stock as both hit $4.0 trillion market cap,"Apple Inc (NASDAQ: AAPL) and Microsoft Corp (NASDAQ: MSFT) have officially joined the $4 trillion club – marking a historic moment in the tech sector's valuation race. Fuelled by solid iPhone 17 sales and surging demand for cloud-based AI infrastructure, both stocks have delivered impressive returns in recent months.",Invezz,2025-10-28 17:00:22+00:00,https://invezz.com/news/2025/10/28/apple-vs-microsoft-stock-as-both-hit-4-0-trillion-market-cap/?utm_source=snapi,Technology,Positive,"['AAPL', 'MSFT']",2025-10-29 22:12:40.892513
AAPL,Apple seeks to end Apple Pay trade secrets lawsuit,Apple urged a federal judge to dismiss a racketeering lawsuit by a company that accused the iPhone maker of stealing its technology to create the lucrative mobile wallet Apple Pay.,Reuters,2025-10-28 16:40:04+00:00,https://www.reuters.com/legal/government/apple-seeks-end-apple-pay-trade-secrets-lawsuit-2025-10-28/,Technology,Negative,['AAPL'],2025-10-29 22:12:40.892514
AAPL,Apple tops $4T market value milestone for first time as shares surge on new iPhones,"Apple's shares have gained about 13% since the new launches on Sept. 9, in a remarkable turnaround that pushed the stock into positive territory for the first time this year.",New York Post,2025-10-28 16:24:01+00:00,https://nypost.com/2025/10/28/business/apple-tops-4t-market-value-3rd-company-after-nvidia-microsoft/,Technology,Positive,['AAPL'],2025-10-29 22:12:40.892515
AAPL,Apple Passes $4 Trillion Market Value—Joining Microsoft And Nvidia,"Apple became the third company in history to be valued at $4 trillion, joining AI giant Nvidia and Microsoft as the only firms to reach the milestone, with Apple's shares surging in recent weeks since unveiling its latest line of iPhones.",Forbes,2025-10-28 15:55:04+00:00,https://www.forbes.com/sites/tylerroush/2025/10/28/apple-passes-4-trillion-market-value-joining-microsoft-and-nvidia/,Technology,Positive,['AAPL'],2025-10-29 22:12:40.892516
AAPL,Apple hits $4tn market value as new iPhone models revitalize sales,Tech company's stock enters positive territory for first time this year after gaining about 13% since new iPhone launches,The Guardian,2025-10-28 15:46:43+00:00,https://www.theguardian.com/technology/2025/oct/28/apple-market-value-iphone,Technology,Positive,['AAPL'],2025-10-29 22:12:40.892517
AAPL,Apple Stock Ripe For Picking As This Fund Adds 8 Million Shares. Broadcom Is Also A Favorite.,Apple stock is in a buy zone as the company's earnings loom. Mutual funds are boosting their holdings of Broadcom.,Investors Business Daily,2025-10-28 15:26:20+00:00,https://www.investors.com/research/apple-stock-aapl-broadcom-avgo-datadog-ddog-air/,Technology,Positive,['AAPL'],2025-10-29 22:12:40.892518
AAPL,"Apple hits $4T market cap, UPS beats Q3 estimates as it lays off 48,000 workers in 2025 so far","Yahoo Finance executive editor Brian Sozzi breaks down the latest financial news for October 28, 2025. Apple hits $4 trillion market cap.",Yahoo Finance,2025-10-28 15:24:45+00:00,https://www.youtube.com/watch?v=DS1amTiihqs,Technology,Neutral,"['AAPL', 'UPS']",2025-10-29 22:12:40.892519
AAPL,S&P500: Bulls in Control as Apple Crosses $4T and Fed Signals Awaited,"S&P500 hits fresh highs as traders respond to strong earnings, Apple's $4T milestone, and rising expectations for a December Fed rate cut.",FXEmpire,2025-10-28 15:16:46+00:00,https://www.fxempire.com/forecasts/article/sp500-bulls-in-control-as-apple-crosses-4t-and-fed-signals-awaited-1557842,Technology,Positive,['AAPL'],2025-10-29 22:12:40.892520
AAPL,"The $4 trillion club: how Nvidia, Microsoft, and Apple are rewriting capitalism","The balance of global corporate power has entered a new age. For the first time in history, three companies, Nvidia, Microsoft, and Apple, each hover around or beyond the $4 trillion valuation mark, a milestone that redefines not only scale but the very mechanics of value creation.",Invezz,2025-10-28 15:14:02+00:00,https://invezz.com/news/2025/10/28/the-4-trillion-club-how-nvidia-microsoft-and-apple-are-rewriting-capitalism/?utm_source=snapi,Technology,Positive,"['AAPL', 'MSFT', 'NVDA']",2025-10-29 22:12:40.892521
AAPL,Apple and Microsoft are now both worth more than $4T,Apple and Microsoft are now both worth more than $4 trillion each.,TechCrunch,2025-10-28 14:59:52+00:00,https://techcrunch.com/2025/10/28/apple-and-microsoft-are-now-both-worth-more-than-4t/,Technology,Positive,"['AAPL', 'MSFT']",2025-10-29 22:12:40.892522
AAPL,"Wall Street is Pounding the Table Over AAPL, AMZN, QCOM, GFI, MSFT",The image featured for this article is © ene / Shutterstock.com,24/7 Wall Street,2025-10-28 14:03:50+00:00,https://247wallst.com/investing/2025/10/28/wall-street-is-pounding-the-table-over-aapl-amzn-qcom-gfi-msft/?utm_source=snapi,Technology,Neutral,"['AAPL', 'AMZN', 'GFI', 'MSFT', 'QCOM']",2025-10-29 22:12:40.892522
AAPL,Apple Q4 earnings preview: Analyst says that there's 'a lot of good news built into the shares',Apple will release its fourth quarter earnings results on Thursday. Maxim Group managing director and senior consumer internet analyst Tom Forte joins Market Domination to discuss his expectations for the iPhone maker's earnings report.,Yahoo Finance,2025-10-28 13:42:52+00:00,https://www.youtube.com/watch?v=2ZW7cX3fqZY,Technology,Positive,['AAPL'],2025-10-29 22:12:40.892524
AAPL,"Apple, Microsoft cross $4 trillion market cap for the first time",Apple passed a market cap of $4 trillion for the first time. Microsoft also reached the benchmark.,CNBC,2025-10-28 13:39:26+00:00,https://www.cnbc.com/2025/10/28/apple-microsoft-4-trillion-market-cap.html,Technology,Positive,"['AAPL', 'MSFT']",2025-10-29 22:12:40.892524
AAPL,Apple races past $4 trillion market value as latest models revitalize iPhone sales,"Apple topped $4 trillion in market value for the first time on Tuesday, the third Big Tech company to hit the milestone, as robust demand for its latest iPhone models allayed fears over its slow progress in the AI race.",Reuters,2025-10-28 13:33:40+00:00,https://www.reuters.com/world/china/apple-races-past-4-trillion-market-value-latest-models-revitalize-iphone-sales-2025-10-28/,Technology,Positive,['AAPL'],2025-10-29 22:12:40.892525
AAPL,Top 3 Stocks Powering Through Trump's Tariff Policies,"Since President Trump entered office, tariffs have become among the most discussed topics in financial markets. April 2, which became known as “Liberation Day.",MarketBeat,2025-10-28 13:18:54+00:00,https://www.marketbeat.com/stock-ideas/top-3-stocks-powering-through-trumps-tariff-policies/?utm_source=snapi,Technology,Neutral,"['AAPL', 'GM', 'ISRG']",2025-10-29 22:12:40.892526
AAPL,Should You Buy Apple Stock Before Big Investor Update?,Apple (AAPL +2.28%) will provide an investor update that will elaborate on the impact of tariffs and its progress on AI.,The Motley Fool,2025-10-28 10:30:00+00:00,https://www.fool.com/investing/2025/10/28/should-you-buy-apple-stock-before-big-investor-upd/,Technology,Neutral,['AAPL'],2025-10-29 22:12:40.892527
AAPL,Why Cash Flow From Operations Isn't My First Screen - And Where It Wins Big,"I start with the Dividend Triangle—multi-year trends in revenue, EPS, and dividends—to find steady compounders across cycles. Working capital timing, inventory builds, and one-offs can make great businesses look weak for a quarter or two. If you lead with CFO, you risk throwing out winners because of normal timing quirks. Keep it as a second-step check, where it can confirm—not prematurely exclude.",Seeking Alpha,2025-10-28 10:14:00+00:00,https://seekingalpha.com/article/4833907-why-cash-flow-operations-isnt-first-screen-where-wins-big,Technology,Neutral,"['AAPL', 'BCE', 'CHD', 'CNI', 'LMT', 'PG', 'RY', 'TU']",2025-10-29 22:12:40.892528
AAPL,Apple Stock Is Soaring on iPhone Sales. Is It Time to Reconsider This Warren Buffett Stock?,"iPhone sales are maintaining momentum, according to a new research report. Apple reports fourth-quarter earnings later this week.",The Motley Fool,2025-10-28 08:56:00+00:00,https://www.fool.com/investing/2025/10/28/apple-stock-is-soaring-on-iphone-sales-is-it-time/,Technology,Positive,['AAPL'],2025-10-29 22:12:40.892529
AAPL,"Warren Buffett Sells Apple Stock and Buys a Brand New Stock Up 5,600% in 30 Years","Warren Buffett's Berkshire Hathaway in the second quarter soldApple stock but started a new position in UnitedHealth Group. Apple benefits from immense consumer loyalty and pricing power, but its sputtering innovation engine and lofty valuation are cause for concern.",The Motley Fool,2025-10-28 07:55:00+00:00,https://www.fool.com/investing/2025/10/28/warren-buffett-sell-apple-stock-buy-stock-up-5600/,Technology,Neutral,"['AAPL', 'UNH']",2025-10-29 22:12:40.892530
AAPL,US judge decertifies Apple app store class action,"A federal judge on Monday decertified a class action by tens of millions of Apple customers who accused the company of monopolizing the market for iPhone apps by banning purchases outside its App Store, leading to higher prices.",Reuters,2025-10-27 20:54:38+00:00,https://www.reuters.com/sustainability/boards-policy-regulation/us-judge-decertifies-apple-app-store-class-action-2025-10-27/,Technology,Positive,['AAPL'],2025-10-29 22:12:40.892531
AAPL,Apple Turns to Vapor Chamber to Cool iPad Pro,Apple is working on a vapor chamber to improve cooling and performance on the iPad Pro. Bloomberg's Mark Gurman discusses the effort on “Bloomberg Tech.,Bloomberg Technology,2025-10-27 20:48:29+00:00,https://www.youtube.com/watch?v=nS1aChcteEM,Technology,Positive,['AAPL'],2025-10-29 22:12:40.892532
AAPL,"Previewing the ""Fab Five"" from Mag 7 Earnings",Stephanie Walter and Mark Gibbens join The Watch List panel to help preview this week's slate of Mag 7 earnings names. Stephanie points to the A.I.,Schwab Network,2025-10-27 19:41:03+00:00,https://www.youtube.com/watch?v=g5gBuYndyz8,Technology,Neutral,"['AAPL', 'AMZN', 'GOOG', 'GOOGL', 'META', 'MSFT']",2025-10-29 22:12:40.892533
AAPL,Apple Q4 Preview: iPhone Expectations Start To Move Higher,"Apple Inc.'s (AAPL) total revenues expected for fiscal Q4 have ticked up since spring but are down slightly from last quarter, from $96.8 billion to $101.5 billion. Sentiment seems to reflect a view that iPhone buying is solid with improvements in China and users beginning to upgrade in the US. Overall, large looming questions remain about the impact of tariffs on both their customer base and supply chain.",Seeking Alpha,2025-10-27 19:20:00+00:00,https://seekingalpha.com/article/4833762-apple-q4-preview-iphone-expectations-start-to-move-higher,Technology,Positive,['AAPL'],2025-10-29 22:12:40.892533
AAPL,"Apple Set to Report Q4 Earnings: Buy, Sell or Hold the AAPL Stock?","AAPL's fiscal Q4 results hinge on steady iPhone and Services growth, boosted by AI-powered devices and resilient Mac demand.",Zacks Investment Research,2025-10-27 18:51:12+00:00,https://www.zacks.com/stock/news/2778189/apple-set-to-report-q4-earnings-buy-sell-or-hold-the-aapl-stock?cid=CS-STOCKNEWSAPI-FT-analyst_blog|most_popular_stocks-2778189,Technology,Positive,['AAPL'],2025-10-29 22:12:40.892534
AAPL,Apple and Microsoft are racing to join Nvidia in an elite club,Nvidia became a $4 trillion company in July. Now Apple and Microsoft are within a hair of the milestone.,Market Watch,2025-10-27 18:13:00+00:00,https://www.marketwatch.com/story/apple-and-microsoft-are-racing-to-join-nvidia-in-an-elite-club-6a9dc8ff,Technology,Positive,"['AAPL', 'MSFT', 'NVDA']",2025-10-29 22:12:42.674073
AAPL,Apple's iPhone 17 shows cooling momentum amid robust China sales,"Apple Inc (NASDAQ:AAPL, ETR:APC) is showing signs of cooling demand for its latest iPhone 17 models, though growth in China continues to outpace other markets, according to Jefferies analysts. Jefferies highlighted that delivery lead times for iPhone 17 models are generally declining.",Proactive Investors,2025-10-27 17:36:57+00:00,https://www.proactiveinvestors.com/companies/news/1081178?SNAPI,Technology,Neutral,['AAPL'],2025-10-29 22:12:42.674086
AAPL,Apple's Upcoming Foldable iPhone Model Will Drive Major Upside: Analyst,Growing enthusiasm around Apple Inc‘s (NASDAQ:AAPL) iPhone 17 demand and anticipation for next year's foldable iPhone 18 has analysts optimistic about the company's multi-year growth outlook.,Benzinga,2025-10-27 16:15:46+00:00,https://www.benzinga.com/analyst-stock-ratings/reiteration/25/10/48439252/apple-iphone-17-foldable-will-be-the-real-game-changer-analyst?utm_source=snapi,Technology,Positive,['AAPL'],2025-10-29 22:12:42.674090
AAPL,Apple nears $4 trillion valuation,CNBC's Steve Kovach reports on Apple as the iPhone maker is en route to hit a $4 trillion market cap.,CNBC Television,2025-10-27 15:36:36+00:00,https://www.youtube.com/watch?v=OUwzeT4mgi4,Technology,Positive,['AAPL'],2025-10-29 22:12:42.674094
AAPL,2 Top Tech Stocks to Buy for 2026,Advanced Micro Devices is positioning itself for accelerating growth in its data center chip business. Better-than-expected demand for the iPhone 17 says a lot about Apple's competitive advantage.,The Motley Fool,2025-10-27 15:19:00+00:00,https://www.fool.com/investing/2025/10/27/2-top-tech-stocks-to-buy-for-2026/,Technology,Positive,"['AAPL', 'AMD']",2025-10-29 22:12:42.674097
